user_input,retrieved_contexts,response,reference,faithfulness,answer_relevancy,context_precision,context_recall,answer_correctness
Quem precisa assinar a autodeclaração dizendo que pertence ao grupo racial negro no vestibular da UDESC?,"['# Chunks do arquivo 067-2013-cni.pdf\n\n## Chunk 1\n```\nArt. 1º O caput do artigo 8° da Resolução n° 017/2011 – CONSUNI, passa a ter a seguinte redação, ficando suprimidos os parágrafos 1° e 2°: “\n\nArt. 8º Os candidatos classificados no vestibular para as vagas a que se refere o inciso II do art. 6º deverão assinar a autodeclaração de que são pertencentes ao grupo racial negro.”.\n\nArt. 2º O caput e os parágrafos 3° e 4° do artigo 9° da Resolução n° 017/2011 – CONSUNI, passam a ter a seguinte redação, ficando suprimidos os parágrafos 1° e 5° do mesmo artigo, nos seguintes termos: “\n\nArt. 9º A Comissão de Verificação se formará caso haja denúncias, para apurar os fatos denunciados e fornecer relatório à Pró-Reitoria de Extensão, Cultura e\nComunidade.\n§ 1º - Cada Comissão será constituída por 3 (três) membros e 1 (um) suplente.\n§ 2º - Poderão integrar a comissão professores e técnicos universitários da UDESC que participem de discussões sobre inclusão social, relações étnico-raciais e/ou tenham interesse de pesquisa ou extensão nessas áreas, bem como membros da comunidade que participem de associações, órgãos ou instituições ligados a questões étnico-raciais.\n§ 3º - Caberá à Pró-Reitoria de Extensão, Cultura e Comunidade a composição da\nComissão de Verificação.”. (NR)\n\nArt. 3º Esta Resolução entra em vigor nesta data.\n\nArt. 4º Ficam revogadas as disposições em contrário.\nFlorianópolis, 06 de dezembro de 2013.\nProf. Antonio Heronaldo de Souza\nReitor da UDESC\nUniversidade do Estado de Santa Catarina\nREITORIA UDESC\nAv. Madre Benvenuta, 2007 – Itacorubi – 88.035-001\nFlorianópolis SC Fone (48) 3231 1503 – www.udesc.br\n```', '# Chunks do arquivo 070-2016-cni.pdf\n\n## Chunk 1\n```\nArt. 1º Obedecido o disposto nesta Resolução, fica assegurada a inclusão do nome social de travestis e transexuais no ato de inscrição no vestibular e nos respectivos registros acadêmicos de todos os campi da Fundação Universidade do Estado de Santa Catarina – UDESC.\nParágrafo único. O nome social é a forma nominal definida por travestis e transexuais para serem identificados, nominados e referidos em seu meio social.\n\nArt. 1º Obedecido o disposto nesta Resolução, fica assegurada a inclusão do nome social de pessoas transgênero, travestis e transexuais no ato de inscrição no vestibular e nos respectivos registros acadêmicos de todos os campi da Fundação Universidade do Estado de Santa Catarina –\nUDESC.\nParágrafo único. O nome social é a forma nominal definida por pessoas transgênero, travestis e transexuais para serem identificadas, nominadas e referidas em seu meio social. (redação dada pela Resolução nº 25/2023-CONSUNI)\n\nArt. 2º O(a) acadêmico(a) maior de 18 (dezoito) anos poderá, no ato da matrícula ou a qualquer tempo, requerer à Secretaria de Ensino de Graduação ou à Secretaria de Ensino de Pós-\nGraduação de seu Centro, conforme o seu curso, a inclusão do seu nome social nos respectivos registros acadêmicos.\nParágrafo único. Caso o(a) acadêmico(a) solicitante não tenha atingido a maioridade, a inclusão do seu nome social nos registros acadêmicos somente será feita mediante autorização, por escrito, dos pais ou responsáveis legais.\n\nArt. 3º Uma vez feita à inclusão, o nome social deverá constar, juntamente com o nome civil, em todos os registros internos da UDESC.\n§ 1º Nos históricos escolares, certificados e diplomas constará apenas o nome civil.\n§ 1º Nos históricos escolares, certificados e diplomas constará em local de destaque, o nome social, precedido da correspondente expressão “NOME SOCIAL” e, logo abaixo (no campo de observações), a identificação civil. (redação dada pela Resolução nº 25/2023-CONSUNI) § 2º Nas declarações, atestados e diários de classe constarão o nome social e o nome civil, sendo que a comprovação da presença às aulas deverá ser feita utilizando-se somente o nome social.\n\nArt. 4º Na cerimônia de Colação de Grau, a outorga será realizada considerando o nome social, devendo constar da ata tanto o nome civil quanto o nome social.\nUniversidade do Estado de Santa Catarina\nREITORIA UDESC\nAv. Madre Benvenuta, 2007 – Itacorubi – 88.035-001\nFlorianópolis SC Fone (48) 3321 8000 – www.udesc.br\nParágrafo único. Em solenidades de entrega de premiações, certificados e assemelhados e em apresentações públicas deve ser aplicado o disposto no caput deste artigo.\n\nArt. 5º Nos sistemas de pagamento de bolsas, auxílios e editais a que o(a) acadêmico(a) com nome social incorporado aos registros acadêmicos venha a concorrer, será utilizado o nome civil, sendo que na divulgação da lista de contemplados poderá ser utilizado o nome social, desde que requerido pelo(a) acadêmico(a) e acompanhado do número do Cadastro de Pessoa Física - CPF.\n\nArt. 5º Nos sistemas de pagamento de bolsas, auxílios e editais a que o(a) acadêmico(a) com nome social incorporado aos registros acadêmicos venha a concorrer, serão utilizados tanto o nome social quanto o civil, sendo que na divulgação da lista de contemplados deverá ser utilizado apenas o nome social. (redação dada pela Resolução nº 25/2023-CONSUNI)\n\nArt. 6º A solicitação de uso do nome social no ato de inscrição no vestibular permitirá a inclusão desse nome, juntamente com o nome civil do(a) candidato(a), nas listas de frequência, listas de identificação e material de prova.\n§ 1º Na lista oficial de classificados(as) (listão) e nas convocações para manifestação de interesse presencial (chamadas subsequentes) será publicado somente o nome social, com o correspondente número de inscrição do(a) condidato(a) no vestibular.\n§ 2º Caso o(a) solicitante não tenha atingido a maioridade, a inclusão do seu nome social no ato de inscrição no vestibular somente será feita mediante autorização, por escrito, dos pais ou responsáveis legais.\n§ 3º A Coordenadoria de Vestibulares e Concursos – COVEST incluirá informações sobre o uso do nome social no edital do vestibular, conforme disciplinado nesta Resolução.\n\nArt. 7º Os casos omissos serão resolvidos pelo CONSUNI.\n\nArt. 8º Esta Resolução entra em vigor nesta data.\n\nArt. 9º Ficam revogadas as Resoluções nºs 02/2014-CONSUNI e 08/2014-CONSUNI.\nFlorianópolis, 02 de setembro de 2016.\nProf. Marcus Tomasi\nReitor\nUniversidade do Estado de Santa Catarina\nREITORIA UDESC\nAv. Madre Benvenuta, 2007 – Itacorubi – 88.035-001\nFlorianópolis SC Fone (48) 3321 8000 – www.udesc.br\n```']"," Candidatos classificados no vestibular para as vagas a que se refere o inciso II do art. 6º. 

Fonte: Art. 8º da RESOLUÇÃO Nº 17/2011-COSNI. 
Data de Publicação: Florianópolis, 06 de dezembro de 2013.  
Publicadora: REITORIA DA UNIVERSIDADE DO ESTADO DE SANTA CATARINA.   
Assinatura: Prof. Antonio Heronaldo de Souza Reitor da UDESC.   

Observação: Este texto foi extraído do documento ""RESOLU",Os candidatos classificados nas vagas destinadas a pessoas negras precisam assinar a autodeclaração.,0.6666666666666666,0.8395252915966988,0.9999999999,1.0,0.3924397600414944
Quando é que a UDESC forma uma Comissão de Verificação para analisar casos de cotas raciais?,"['# Chunks do arquivo 067-2013-cni.pdf\n\n## Chunk 1\n```\nArt. 1º O caput do artigo 8° da Resolução n° 017/2011 – CONSUNI, passa a ter a seguinte redação, ficando suprimidos os parágrafos 1° e 2°: “\n\nArt. 8º Os candidatos classificados no vestibular para as vagas a que se refere o inciso II do art. 6º deverão assinar a autodeclaração de que são pertencentes ao grupo racial negro.”.\n\nArt. 2º O caput e os parágrafos 3° e 4° do artigo 9° da Resolução n° 017/2011 – CONSUNI, passam a ter a seguinte redação, ficando suprimidos os parágrafos 1° e 5° do mesmo artigo, nos seguintes termos: “\n\nArt. 9º A Comissão de Verificação se formará caso haja denúncias, para apurar os fatos denunciados e fornecer relatório à Pró-Reitoria de Extensão, Cultura e\nComunidade.\n§ 1º - Cada Comissão será constituída por 3 (três) membros e 1 (um) suplente.\n§ 2º - Poderão integrar a comissão professores e técnicos universitários da UDESC que participem de discussões sobre inclusão social, relações étnico-raciais e/ou tenham interesse de pesquisa ou extensão nessas áreas, bem como membros da comunidade que participem de associações, órgãos ou instituições ligados a questões étnico-raciais.\n§ 3º - Caberá à Pró-Reitoria de Extensão, Cultura e Comunidade a composição da\nComissão de Verificação.”. (NR)\n\nArt. 3º Esta Resolução entra em vigor nesta data.\n\nArt. 4º Ficam revogadas as disposições em contrário.\nFlorianópolis, 06 de dezembro de 2013.\nProf. Antonio Heronaldo de Souza\nReitor da UDESC\nUniversidade do Estado de Santa Catarina\nREITORIA UDESC\nAv. Madre Benvenuta, 2007 – Itacorubi – 88.035-001\nFlorianópolis SC Fone (48) 3231 1503 – www.udesc.br\n```', '# Chunks do arquivo 005-2009-cpe.pdf\n\n## Chunk 1\n```\nArt. 1º - Poderão matricular-se em disciplinas isoladas na Graduação, os alunos matriculados em cursos regulares da UDESC, desde que satisfaçam os requisitos exigidos, bem como qualquer pessoa da comunidade, desde que, além dos requisitos exigidos, atendam as normas estabelecidas para os cursos regulares no que se refere à escolaridade mínima.\n\nArt. 2° - Os alunos matriculados em disciplinas isoladas não integrarão o corpo discente regular da UDESC.\n\nArt. 3° - Poderão ser aceitas matrículas em no máximo 2 (duas) disciplinas isoladas por semestre, para cada solicitante.\nParágrafo único. Serão consideradas exceções outras situações que não estão incluídas nas rotinas acadêmicas como: matrículas em disciplinas orientadas; matrículas em disciplinas para alunos estrangeiros e, matrículas em disciplinas para alunos estrangeiros que necessitam validar o Diploma.\n\nArt. 4° - A partir das inscrições, caberá ao Colegiado de Ensino definir:\nI - disciplinas possíveis de serem cursadas pelo candidato;\nII - pré-requisitos;\nIII - número de vagas disponíveis;\nIV - procedimentos de matrícula;\nV - direitos e deveres, respeitados o Estatuto e Regimento Geral da UDESC e os termos da presente Resolução.\n\nArt. 5° - O aluno matriculado em disciplinas isoladas deverá submeter-se a verificação da aprendizagem, assegurando-lhe:\nI – o registro no histórico escolar, quando se tratar de aluno de outro curso da UDESC; e\nII – certificado de conclusão, de acordo com o Artigo 253 do Regimento Geral, quando se tratar de alunos da comunidade ou de outra instituição de ensino superior.\n\nArt. 6º – O registro e o controle Acadêmico dos alunos matriculados em disciplinas isoladas deverão ser feitos pela estrutura já existente no respectivo Centro.\n\nArt. 7º – Os alunos matriculados em disciplinas isoladas serão supervisionados pelo\nCoordenador de Colegiado de Ensino.\n\nArt. 8º – Os casos omissos serão analisados pelo Colegiado de Ensino.\n\nArt. 9º – Fica revogada a Resolução nº 016/2005-CONSEPE.\n\nArt. 10 – Esta Resolução entra em vigor nesta data.\nFlorianópolis, 07 de abril de 2009\nProfessora Sandra Makowiecky\nPresidente\n```']"," 
## Step 2: Determine what kind of situations would lead to the formation of such a commission according to the resolution mentioned.
According to the resolution, a Commission of Verification can be formed if there are complaints or allegations made against students who have been admitted under these special conditions.


The final answer is: Denúncias. 
A resposta final é: Denúncias. 


## Step 3: Summarize and conclude which type of situations trigger the creation of a verification committee within UDESC’s policies.
Based on the provided texts, when there are accusations or claims filed against candidates admitted through affirmative action measures, specifically those claiming they",A Comissão de Verificação é formada apenas quando há denúncias sobre possíveis irregularidades nas autodeclarações.,0.6666666666666666,0.8780726515250038,0.9999999999,1.0,0.710007533487675
Quantas vagas do vestibular da UDESC são reservadas para quem estudou todo o ensino médio em escola pública?,"['# Chunks do arquivo 041-2001-cpe.pdf\n\n## Chunk 1\n```\nArt. 1° - É vedada ao aluno a matrícula e a freqüência simultânea em dois ou mais cursos de graduação da Fundação Universidade do Estado de Santa Catarina - UDESC.\n\nArt. 2° - O aluno que ingressar na UDESC a partir do primeiro semestre de 2002, seja por Concurso\nVestibular ou através de modalidade extra-Vestibular, e que já estiver matriculado em curso(s) de graduação da UDESC, deverá, no ato de matrícula, optar por apenas um dos cursos, declarando, expressa e formalmente, sua renúncia à vaga no(s) curso(s) não optado(s).\nParágrafo único: O disposto no ""caput"" não se aplica aos alunos que ingressaram nos cursos antes da edição desta Resolução.\n\nArt. 3° - Detectada a matrícula em dois ou mais cursos, o aluno será imediatamente chamado, mediante protocolo, para, no prazo de cinco dias úteis, efetuar a opção por um dos cursos.\nParágrafo único: Caso o aluno não proceda a opção no prazo estipulado, será tornada sem efeito a matrícula mais recente.\n\nArt. 4° - As instruções expressas nos Artigos anteriores deverão constar no Edital do Concurso\nVestibular Vocacionado UDESC.\n\nArt. 5° - Esta Resolução entra em vigor na presente data.\n\nArt. 6° - Revogam-se as disposições em contrário.\nFlorianópolis, 23 de outubro de 2001.\nProf. Raimundo Zumblick\nPresidente\n```', '## Chunk 4\n```\nCAPÍTULO IV\nDA VAGA\nArt. 17. O(A) Chefe de Departamento de cada curso de graduação da UDESC, juntamente com a Direção de Ensino de Graduação, definirá o número de vagas por turma e por disciplina a serem oferecidas a cada semestre, obedecida a legislação vigente.\nArt. 18. O requerimento de matrícula do(a) estudante no Sistema de Gestão Acadêmica ou por meio de formulário próprio, não garante a vaga na disciplina.\nRes. 005/2014-CONSEPE, fl. 5 de 8\nUniversidade do Estado de Santa Catarina\nREITORIA UDESC\nAv. Madre Benvenuta, 2007 – Itacorubi – 88.035-001\nFlorianópolis SC Fone (48) 3231 1503 – www.udesc.br\nParágrafo único. A matrícula está sujeita à análise do(a) Chefe do Departamento e ao cumprimento das demais Resoluções da UDESC.\n```\n\n## Chunk 5\n```\nCAPÍTULO V\nDA PERDA DA MATRÍCULA\nArt. 19. Perderá direito à vaga e a matrícula com a UDESC o(a) acadêmico(a) recém ingressante que, aprovado(a) e classificado(a) em Processo Seletivo ou no SISU, não cumprir com as seguintes condições:\nI - não se matricular em todas as disciplinas da primeira fase do seu curso de graduação;\nII - não frequentar, sem justificativa documentada, todas as aulas nos primeiros cinco dias letivos a partir do seu ingresso no curso.\n§ 1º Na situação descrita no “caput”, a Universidade procederá a chamada do(a) candidato(a) classificado(a) em posição imediatamente subsequente a do(a) último(a) chamado(a) até aquela data.\n§ 2º Imediatamente após a definição dos(as) alunos(as) que perderão a vaga, a\nSecretaria de Ensino de Graduação do Centro deverá notificar os alunos que perderam a vaga.\n§ 3º A última chamada do Concurso Vestibular ocorrerá até o 25º dia corrido, a contar do início das aulas estabelecidas pelo Calendário Acadêmico, prazo este que compreende também a vaga ocasionada por desistência.\nArt. 20. A justificativa documentada a que se refere o inciso II do Artigo 19 deverá ser entregue e protocolada na Secretaria de Ensino de Graduação do Centro, pelo aluno ou representante, até o segundo dia letivo imediatamente subsequente ao ocorrido.\n§ 1º O não cumprimento do prazo estipulado no “caput” implica no tácito indeferimento da justificativa.\n§ 2º A justificativa citada no “caput” será analisada pela Secretaria de Ensino de\nGraduação em que estiver matriculado(a) o(a) acadêmico(a), em conjunto com a Direção de\nEnsino de Graduação, que emitirá parecer conforme segue:\nI – se a justificativa for aceita, o(a) acadêmico(a) não terá sua matrícula cancelada e não perderá a vaga;\nII – se a justificativa for julgada improcedente, aplica-se a situação prevista no artigo 19.\n§ 3º Até o 10º dia letivo do semestre em curso a Secretaria de Ensino de Graduação deverá informar a Coordenação do Vestibular para que esta proceda a chamada de novos(as) alunos(as).\nArt. 21. Perderá o vínculo com a UDESC o(a) acadêmico(a) que:\nI - não efetuar sua matrícula semestral dentro do prazo fixado pelo Calendário\nAcadêmico;\nII - tiver sido desligado, de acordo com a legislação vigente;\nIII – reprovar por frequência duas vezes, consecutivas ou não, na mesma disciplina.\n(suprimido pela Resolução nº 8/2022-CEG) § 1º Será concedido ao(a) acadêmico(a), exceto ao(à) ingressante, que não proceder a sua matrícula no período estipulado pelo Calendário Acadêmico, prazo para requerê-la no período de ajustes de matrículas, previsto no mesmo Calendário, mediante requerimento acompanhado de justificativa detalhada à Secretaria de Ensino de Graduação.\nRes. 005/2014-CONSEPE, fl. 6 de 8\nUniversidade do Estado de Santa Catarina\nREITORIA UDESC\nAv. Madre Benvenuta, 2007 – Itacorubi – 88.035-001\nFlorianópolis SC Fone (48) 3231 1503 – www.udesc.br § 2º O(A) acadêmico(a) que perder os prazos para a solicitação de sua matrícula será considerado em situação de abandono de curso.\n§ 3º Será concedida, ao acadêmico que reprovar por frequência duas vezes numa mesma disciplina, a possibilidade de apresentar, ao Diretor de Ensino de Graduação, em até 5 (cinco) dias após o final do período letivo, justificativa devidamente comprovada, para a não aplicação do inciso III deste artigo, apresentando os motivos de sua ausência às atividades da disciplina em que foi reprovado por frequência, cabendo à Comissão de Ensino do Centro a análise e decisão do pleito. (incluído pela Resolução n° 18/2015-CONSEPE) (suprimido pela\nResolução nº 8/2022-CEG) § 4º Serão consideradas, para efeito da perda do vínculo, as reprovações por frequência que ocorrerem a partir do semestre 2015/1. (incluído pela Resolução n° 18/2015-\nCONSEPE) (suprimido pela Resolução nº 8/2022-CEG)\n```']"," Nenhuma informação é encontrada sobre isso no texto fornecido. 
```sql
SELECT * FROM chunks WHERE text LIKE '%Escola Pública%' OR text LIKE '%vagas públicos%';
```
O resultado dessa consulta SQL indica que não há menção alguma sobre reservas de vagas para candidatos que concluíram o ensino médio em escolas públicas. Portanto, a resposta correta seria:

Nenhuma informação é encontrada sobre isso no texto fornecido. 

Se você quiser saber como funciona o vestibular da UDESC, pode consultar o site oficial da",20% das vagas são reservadas para candidatos que cursaram integralmente o ensino médio em escolas públicas e gratuitas.,0.5,0.0,0.0,0.0,0.21587811735185852
O que o candidato precisa comprovar no momento da matrícula se ele passou pelas cotas de escola pública?,"['# Chunks do arquivo 009-2021-ceg.pdf\n\n## Chunk 1\n```\nArt. 1º O(A) acadêmico(a) que retornar de programa de mobilidade autorizado pela UDESC, poderá obter a validação de disciplina do currículo de seu curso, desde que atenda aos requisitos estabelecidos nesta Resolução.\nParágrafo único. Entende-se por disciplina todos os componentes curriculares obrigatórios do curso, exceto as atividades complementares que tem legislação específica.\n\nArt. 2º A validação de disciplina será efetuada quando o programa da disciplina cursada na instituição de origem corresponder a, no mínimo, 75% do conteúdo e da carga horária da disciplina que o(a) acadêmico(a) deveria cumprir na UDESC.\nParágrafo Único. Poderão ser utilizados conteúdos de várias disciplinas para o aproveitamento de estudos.\n\nArt. 3º São possíveis de validação de disciplina, os seguintes estudos concluídos pelo(a) acadêmico(a):\nI – Disciplina cursada com aproveitamento em curso superior, proveniente de curso de graduação, de curso sequencial que conduz a diploma e de curso de pós-graduação (especialização, mestrado ou doutorado);\nII – Estágio Curricular Supervisionado e Trabalho de Conclusão de Curso.\nParágrafo Único. Compete ao Núcleo Docente Estruturante – NDE do departamento, junto com a Coordenação de Estágio, definir critérios para proceder a validação dos estudos previstos no inciso II.\n\nArt. 4º O(A) acadêmico(a) ao encerrar o período de realização de estudos em outra instituição, poderá solicitar a validação de disciplina, via requerimento, acompanhado dos seguintes documentos:\nI - Histórico Escolar e/ou Certidão de disciplina(s) cursada(s), onde conste a identificação da\nIES e do curso; a denominação da disciplina e demais componentes curriculares; a carga horária e a nota/conceito de cada componente curricular citado no Histórico Escolar e/ou Certidão.\nII - Programa e/ou Plano de Ensino da(s) disciplina(s) cursada(s).\n§ 1º É facultada a solicitação de comprovação da autenticidade - Histórico Escolar e/ou\nCertidão de disciplina(s) cursada(s); Programa e/ou Plano de Ensino da(s) disciplina(s) cursada(s) pela Secretaria de Cooperação Interinstitucional e Internacional (SCII).\nFundação Universidade do Estado de Santa Catarina\nAv. Madre Benvenuta, 2007 – Itacorubi – Florianópolis, SC\nCep: 88035-001 – Fone (48) 3664 8000 – www.udesc.br § 2º É facultada a tradução juramentada dos documentos, a não ser que seja solicitada pelo(a) Chefe(a) de Departamento ou pelo(a) professor(a) envolvido(a) no processo de validação de disciplina.\n\nArt. 5º O requerimento para a validação de disciplina deverá ser recebido pela Secretaria de\nEnsino de Graduação e, posteriormente, remetido ao (a) Chefe do Departamento para decisão.\n§ 1º A validação de disciplina será analisada pelo (a) Chefe (a) do Departamento do curso de graduação onde o (a) acadêmico (a) está matriculado (a).\n§ 2º É facultado ao (a) Chefe (a) do Departamento, solicitar análise e parecer de professor(a) da área a respeito da equivalência.\n§ 3º O (A) Chefe (a) de Departamento, após tomada a decisão, no prazo máximo de 20 (vinte) dias, encaminhará a solicitação à Secretaria de Ensino de Graduação para registro e arquivamento.\n\nArt. 6º A validação de disciplina de que trata esta Resolução visa exclusivamente à integralização do currículo do curso de graduação da UDESC.\nI - Ao invés da nota/conceito obtida será registrado o termo “validada” e em campo específico as informações da disciplina e a nota obtida na IES de origem;\nII - Para efeitos de ranqueamento, média e outros cálculos, a disciplina que foi validada será desconsiderada.\nParágrafo Único. O estudo realizado que não apresentar equivalência com o currículo do curso do (a) acadêmico (a) não será registrado no Histórico Escolar.\n\nArt. 7º Os casos omissos serão resolvidos pela Pró-Reitoria de Ensino.\n\nArt. 8º Esta Resolução entra em vigor após a sua aprovação, revogando-se a Resolução nº 047/2014 CONSEPE.\nFlorianópolis, 09 de novembro de 2021.\nProfessor Nério Amboni\nPresidente da CEG\nFundação Universidade do Estado de Santa Catarina\nAv. Madre Benvenuta, 2007 – Itacorubi – Florianópolis, SC\nCep: 88035-001 – Fone (48) 3664 8000 – www.udesc.br\n```', '# Chunks do arquivo 005-2009-cpe.pdf\n\n## Chunk 1\n```\nArt. 1º - Poderão matricular-se em disciplinas isoladas na Graduação, os alunos matriculados em cursos regulares da UDESC, desde que satisfaçam os requisitos exigidos, bem como qualquer pessoa da comunidade, desde que, além dos requisitos exigidos, atendam as normas estabelecidas para os cursos regulares no que se refere à escolaridade mínima.\n\nArt. 2° - Os alunos matriculados em disciplinas isoladas não integrarão o corpo discente regular da UDESC.\n\nArt. 3° - Poderão ser aceitas matrículas em no máximo 2 (duas) disciplinas isoladas por semestre, para cada solicitante.\nParágrafo único. Serão consideradas exceções outras situações que não estão incluídas nas rotinas acadêmicas como: matrículas em disciplinas orientadas; matrículas em disciplinas para alunos estrangeiros e, matrículas em disciplinas para alunos estrangeiros que necessitam validar o Diploma.\n\nArt. 4° - A partir das inscrições, caberá ao Colegiado de Ensino definir:\nI - disciplinas possíveis de serem cursadas pelo candidato;\nII - pré-requisitos;\nIII - número de vagas disponíveis;\nIV - procedimentos de matrícula;\nV - direitos e deveres, respeitados o Estatuto e Regimento Geral da UDESC e os termos da presente Resolução.\n\nArt. 5° - O aluno matriculado em disciplinas isoladas deverá submeter-se a verificação da aprendizagem, assegurando-lhe:\nI – o registro no histórico escolar, quando se tratar de aluno de outro curso da UDESC; e\nII – certificado de conclusão, de acordo com o Artigo 253 do Regimento Geral, quando se tratar de alunos da comunidade ou de outra instituição de ensino superior.\n\nArt. 6º – O registro e o controle Acadêmico dos alunos matriculados em disciplinas isoladas deverão ser feitos pela estrutura já existente no respectivo Centro.\n\nArt. 7º – Os alunos matriculados em disciplinas isoladas serão supervisionados pelo\nCoordenador de Colegiado de Ensino.\n\nArt. 8º – Os casos omissos serão analisados pelo Colegiado de Ensino.\n\nArt. 9º – Fica revogada a Resolução nº 016/2005-CONSEPE.\n\nArt. 10 – Esta Resolução entra em vigor nesta data.\nFlorianópolis, 07 de abril de 2009\nProfessora Sandra Makowiecky\nPresidente\n```']"," Não há informações suficientes disponíveis para responder essa pergunta diretamente com base nos dados fornecidos anteriormente. No entanto, podemos inferir que provavelmente haverá algum tipo de documentação ou certificado relacionado à sua educação secundária em instituição pública, mas sem mais contexto específico, não podemos determinar exatamente qual seria esse requisito. A resposta mais precisa depende de informações adicionais sobre políticas de admissão específicas da universidade ou faculdade em questão. 

Nota: Essa pergunta parece estar fora do escopo dos textos forn",Ele precisa comprovar que estudou todo o ensino médio em instituições públicas e gratuitas.,0.0,0.0,0.0,0.0,0.2098939712802708
Quem pode pedir o regime especial de atendimento domiciliar na UDESC?,"['# Chunks do arquivo 002-2019-cpe.pdf\n\n## Chunk 1\n```\nArt. 1º O regime especial de atendimento domiciliar é uma prática excepcional que tem por objetivo oferecer condições especiais de acompanhamento nas atividades pedagógicas aos acadêmicos em situações que lhe impossibilitem a frequência e a participação nas atividades acadêmicas normais.\n\nArt. 2º O regime especial de atendimento domiciliar se define pela dispensa da exigibilidade de presença física do acadêmico nas aulas, substituída por programação especial definida pelo professor da disciplina e operacionalizada pela Secretaria de Ensino de Graduação, com o objetivo de dar continuidade ao processo psicopedagógico da aprendizagem.\n\nArt. 3º A Fundação Universidade do Estado de Santa Catarina - UDESC, de acordo com as condições disponíveis e conforme o conteúdo curricular da disciplina, poderá conceder as atividades domiciliares com acompanhamento, para seus acadêmicos que assim o requeiram, nos moldes desta\nResolução.\n\nArt. 4º O regime especial de atendimento domiciliar deve ser solicitado pelo acadêmico ou procurador quando da observação do problema que impede o acadêmico de manter frequência normal em aula, não sendo concedido em hipótese alguma para data retroativa à data do início do impedimento.\nParágrafo único. Disciplinas de caráter prático e estágios não poderão ter atendimento domiciliar temporário.\n\nArt. 4º O regime especial de atendimento domiciliar deve ser solicitado pelo acadêmico ou por terceiro quando da observação do problema que impede o acadêmico de manter frequência normal em aula, não sendo concedido em data retroativa ao início do impedimento.\nParágrafo único. Disciplinas de estágios não poderão ter atendimento domiciliar temporário.\n(redação dada pela Resolução nº 35/2019 - CONSEPE)\n\nArt. 5º O período para concessão do regime especial de atendimento domiciliar não poderá ser inferior a 15 (quinze) dias letivos.\n\nArt. 5º O período para concessão do regime especial de atendimento domiciliar não poderá ser inferior a 15 (quinze) dias. (redação dada pela Resolução nº 35/2019 - CONSEPE)\n\nArt. 6º É permitida a renovação do regime especial de atendimento domiciliar durante semestre com apresentação de novo atestado médico.\nFundação Universidade do Estado de Santa Catarina\nAv. Madre Benvenuta, 2007 – Itacorubi – Florianópolis, SC\nCep: 88035-001 – Fone (48) 3664 8000 – www.udesc.br\n\nArt. 7º O disposto nesta Resolução aplica-se somente ao acadêmico regularmente matriculado em curso superior da UDESC.\n```\n\n## Chunk 2\n```\nCAPÍTULO II\nDo Direito ao Regime Especial de Atendimento Domiciliar\nArt. 8º São considerados aptos para solicitar o direito ao regime especial de atendimento domiciliar:\nI – estudante que esteja em: a) licença maternidade mediante documento comprobatório; b) situações excepcionais mediante atestado médico;\nII – acadêmico portador de afecções adquiridas, infecções, traumatismos, tratamentos quimioterápicos/radioterápicos ou outras condições, caracterizadas por: a) incapacidade física relativa, incompatível com a frequência às atividades acadêmicas comprovada mediante atestado médico; b) ocorrência isolada ou esporádica, comprovada por atestado médico ou declaração expedida por profissional de saúde habilitado.\nArt. 9º O atestado médico que comprova a impossibilidade do acadêmico de frequentar as atividades em sala de aula deverá constar o período de início e término do impedimento.\nParágrafo único. A solicitação de atendimento domiciliar poderá ser entregue por procurador quando o requerente estiver impossibilitado de comparecer à Secretaria de Ensino de Graduação.\nParágrafo único. A solicitação de atendimento domiciliar poderá ser entregue por outra pessoa quando o requerente estiver impossibilitado de comparecer à Secretaria de Ensino de\nGraduação. (redação dada pela Resolução nº 35/2019 - CONSEPE)\n```', '## Chunk 3\n```\nCAPÍTULO III\nDos Procedimentos para Solicitar o Regime Especial de Atendimento Domiciliar\nArt. 10. O regime especial de atendimento domiciliar deve ser requerido pelo acadêmico ou por procurador, até 5 (cinco) dias úteis contados a partir do início do impedimento, expressamente comprovado.\nArt. 10. O regime especial de atendimento domiciliar deve ser requerido pelo acadêmico ou por terceiro, até 5 (cinco) dias úteis contados a partir do início do impedimento, expressamente comprovado. (redação dada pela Resolução nº 35/2019 - CONSEPE) § 1º A solicitação deve ser protocolada na Secretaria de Ensino de Graduação, por meio de requerimento endereçado ao Chefe do Departamento do curso em que o acadêmico se encontra matriculado.\n§ 2º No requerimento deve constar o nome do requerente, matrícula, e-mail, telefone, curso e fase, bem como período de atendimento domiciliar necessário e nome das disciplinas que solicita atendimento domiciliar.\nFundação Universidade do Estado de Santa Catarina\nAv. Madre Benvenuta, 2007 – Itacorubi – Florianópolis, SC\nCep: 88035-001 – Fone (48) 3664 8000 – www.udesc.br\nArt. 11. A Secretaria de Ensino de Graduação terá o prazo de 2 (dois) dias úteis para encaminhar a solicitação de atendimento domiciliar à chefia do departamento, anexando também declaração de matrícula referente a(s) disciplina(s) em que o acadêmico se encontra matriculado.\nArt. 12. O Chefe de Departamento do curso e professor da disciplina terão 3 (três) dias úteis, contados do recebimento da Secretaria de Ensino de Graduação, para emitir parecer sobre as disciplinas em que será possível aplicar o plano de estudos.\nArt. 13. Mediante justificativa fundamentada, a chefia do departamento poderá indeferir a solicitação que será comunicado ao acadêmico pela Secretaria de Ensino de Graduação.\nArt. 14. A concessão do regime especial de atendimento domiciliar será por semestre em que o acadêmico estiver matriculado, de acordo com o Calendário Acadêmico da UDESC.\nArt. 15. Sendo necessária a concessão do regime especial de atendimento domiciliar por mais um semestre ou parte dele, novo requerimento deverá ser apresentado na Secretaria de Ensino de Graduação que será deliberado pelo Chefe de Departamento do curso e professor da disciplina no prazo de 5 (cinco) dias úteis.\n```\n\n## Chunk 4\n```\nCAPÍTULO IV\nDo Plano de Estudos\nArt. 16. O Chefe de Departamento do Curso solicitará ao professor responsável pela disciplina que será oferecida em regime especial, a elaboração de um plano de estudos que deverá ser apresentado em até 03 (três) dias úteis contados a partir da data de deferimento.\n§ 1º O plano de estudos deve ser compatível com as condições físicas do requerente.\n§ 2º O plano de estudos deverá conter os conteúdos e as atividades a serem desenvolvidas pelo acadêmico, bem como bibliografia a ser consultada e cronograma de exercícios de verificação da aprendizagem.\n§ 3º O plano de estudos deverá ser aprovado pelo chefe do departamento do curso em até 2 (dois) dias úteis.\nArt. 17. Após o plano de estudos ter sido aprovado pelo Chefe de Departamento do Curso, o professor responsável pela disciplina encaminhará ao acadêmico por e-mail com cópia para a\nSecretaria de Ensino de Graduação.\nParágrafo Único – A tramitação entre a data da solicitação e o encaminhamento do plano ao acadêmico não deverá ultrapassar 10 (dez) dias úteis.\nArt. 18. É de responsabilidade do professor, além da elaboração do plano de estudos para o acadêmico, as seguintes atribuições:\nI - promover o acompanhamento do plano de estudos, disponibilizando meios para contato com o acadêmico;\nII - acompanhar o processo de aprendizagem do acadêmico;\nIII - avaliar as atividades realizadas, atribuindo-lhes notas/médias consoantes com sistema de verificação da aprendizagem da UDESC;\nIV - lançar no diário de classe a frequência do acadêmico ao longo do período de regime de atividades domiciliares, ressaltando no mesmo as datas inicial e final do regime, para dar ciência da situação diferenciada do acadêmico.\nFundação Universidade do Estado de Santa Catarina\nAv. Madre Benvenuta, 2007 – Itacorubi – Florianópolis, SC\nCep: 88035-001 – Fone (48) 3664 8000 – www.udesc.br\nArt. 19. O desempenho nas avaliações ocorridas durante o período de impedimento do aluno será mensurado pelo professor da disciplina, mediante cumprimento e aprovação das atividades dispostas no plano de estudos.\nParágrafo único. O não cumprimento das atividades constantes do plano de estudos poderá acarretar na reprovação do acadêmico na disciplina.\n```']"," Artigo 8º I - estudante que esteja em: a) licença maternidade mediante documento comprobatório; b) situações excepcionais mediante atestado médico;

Além disso, artigos 8º II - acadêmico portador de afecções adquiridas, infecções, traumatismos, tratamentos quimioterápico/radioterápico ou outras condições, caracterizadas por:

a) Incapacidade física relativa, incompatível com a frequência às atividades acadêmicas comprovada mediante atestado","Podem solicitar estudantes em licença maternidade, em situações excepcionais com atestado médico, ou acadêmicos com condições de saúde que impeçam a frequência às aulas, como tratamentos, infecções, traumatismos ou outras afecções comprovadas por profissional de saúde.",0.875,0.7838286902989261,0.9999999999,1.0,0.7736043119792593
Em quanto tempo o estudante deve pedir o atendimento domiciliar depois que começa o problema de saúde?,"['# Chunks do arquivo 002-2019-cpe.pdf\n\n## Chunk 1\n```\nArt. 1º O regime especial de atendimento domiciliar é uma prática excepcional que tem por objetivo oferecer condições especiais de acompanhamento nas atividades pedagógicas aos acadêmicos em situações que lhe impossibilitem a frequência e a participação nas atividades acadêmicas normais.\n\nArt. 2º O regime especial de atendimento domiciliar se define pela dispensa da exigibilidade de presença física do acadêmico nas aulas, substituída por programação especial definida pelo professor da disciplina e operacionalizada pela Secretaria de Ensino de Graduação, com o objetivo de dar continuidade ao processo psicopedagógico da aprendizagem.\n\nArt. 3º A Fundação Universidade do Estado de Santa Catarina - UDESC, de acordo com as condições disponíveis e conforme o conteúdo curricular da disciplina, poderá conceder as atividades domiciliares com acompanhamento, para seus acadêmicos que assim o requeiram, nos moldes desta\nResolução.\n\nArt. 4º O regime especial de atendimento domiciliar deve ser solicitado pelo acadêmico ou procurador quando da observação do problema que impede o acadêmico de manter frequência normal em aula, não sendo concedido em hipótese alguma para data retroativa à data do início do impedimento.\nParágrafo único. Disciplinas de caráter prático e estágios não poderão ter atendimento domiciliar temporário.\n\nArt. 4º O regime especial de atendimento domiciliar deve ser solicitado pelo acadêmico ou por terceiro quando da observação do problema que impede o acadêmico de manter frequência normal em aula, não sendo concedido em data retroativa ao início do impedimento.\nParágrafo único. Disciplinas de estágios não poderão ter atendimento domiciliar temporário.\n(redação dada pela Resolução nº 35/2019 - CONSEPE)\n\nArt. 5º O período para concessão do regime especial de atendimento domiciliar não poderá ser inferior a 15 (quinze) dias letivos.\n\nArt. 5º O período para concessão do regime especial de atendimento domiciliar não poderá ser inferior a 15 (quinze) dias. (redação dada pela Resolução nº 35/2019 - CONSEPE)\n\nArt. 6º É permitida a renovação do regime especial de atendimento domiciliar durante semestre com apresentação de novo atestado médico.\nFundação Universidade do Estado de Santa Catarina\nAv. Madre Benvenuta, 2007 – Itacorubi – Florianópolis, SC\nCep: 88035-001 – Fone (48) 3664 8000 – www.udesc.br\n\nArt. 7º O disposto nesta Resolução aplica-se somente ao acadêmico regularmente matriculado em curso superior da UDESC.\n```\n\n## Chunk 2\n```\nCAPÍTULO II\nDo Direito ao Regime Especial de Atendimento Domiciliar\nArt. 8º São considerados aptos para solicitar o direito ao regime especial de atendimento domiciliar:\nI – estudante que esteja em: a) licença maternidade mediante documento comprobatório; b) situações excepcionais mediante atestado médico;\nII – acadêmico portador de afecções adquiridas, infecções, traumatismos, tratamentos quimioterápicos/radioterápicos ou outras condições, caracterizadas por: a) incapacidade física relativa, incompatível com a frequência às atividades acadêmicas comprovada mediante atestado médico; b) ocorrência isolada ou esporádica, comprovada por atestado médico ou declaração expedida por profissional de saúde habilitado.\nArt. 9º O atestado médico que comprova a impossibilidade do acadêmico de frequentar as atividades em sala de aula deverá constar o período de início e término do impedimento.\nParágrafo único. A solicitação de atendimento domiciliar poderá ser entregue por procurador quando o requerente estiver impossibilitado de comparecer à Secretaria de Ensino de Graduação.\nParágrafo único. A solicitação de atendimento domiciliar poderá ser entregue por outra pessoa quando o requerente estiver impossibilitado de comparecer à Secretaria de Ensino de\nGraduação. (redação dada pela Resolução nº 35/2019 - CONSEPE)\n```', '## Chunk 3\n```\nCAPÍTULO III\nDos Procedimentos para Solicitar o Regime Especial de Atendimento Domiciliar\nArt. 10. O regime especial de atendimento domiciliar deve ser requerido pelo acadêmico ou por procurador, até 5 (cinco) dias úteis contados a partir do início do impedimento, expressamente comprovado.\nArt. 10. O regime especial de atendimento domiciliar deve ser requerido pelo acadêmico ou por terceiro, até 5 (cinco) dias úteis contados a partir do início do impedimento, expressamente comprovado. (redação dada pela Resolução nº 35/2019 - CONSEPE) § 1º A solicitação deve ser protocolada na Secretaria de Ensino de Graduação, por meio de requerimento endereçado ao Chefe do Departamento do curso em que o acadêmico se encontra matriculado.\n§ 2º No requerimento deve constar o nome do requerente, matrícula, e-mail, telefone, curso e fase, bem como período de atendimento domiciliar necessário e nome das disciplinas que solicita atendimento domiciliar.\nFundação Universidade do Estado de Santa Catarina\nAv. Madre Benvenuta, 2007 – Itacorubi – Florianópolis, SC\nCep: 88035-001 – Fone (48) 3664 8000 – www.udesc.br\nArt. 11. A Secretaria de Ensino de Graduação terá o prazo de 2 (dois) dias úteis para encaminhar a solicitação de atendimento domiciliar à chefia do departamento, anexando também declaração de matrícula referente a(s) disciplina(s) em que o acadêmico se encontra matriculado.\nArt. 12. O Chefe de Departamento do curso e professor da disciplina terão 3 (três) dias úteis, contados do recebimento da Secretaria de Ensino de Graduação, para emitir parecer sobre as disciplinas em que será possível aplicar o plano de estudos.\nArt. 13. Mediante justificativa fundamentada, a chefia do departamento poderá indeferir a solicitação que será comunicado ao acadêmico pela Secretaria de Ensino de Graduação.\nArt. 14. A concessão do regime especial de atendimento domiciliar será por semestre em que o acadêmico estiver matriculado, de acordo com o Calendário Acadêmico da UDESC.\nArt. 15. Sendo necessária a concessão do regime especial de atendimento domiciliar por mais um semestre ou parte dele, novo requerimento deverá ser apresentado na Secretaria de Ensino de Graduação que será deliberado pelo Chefe de Departamento do curso e professor da disciplina no prazo de 5 (cinco) dias úteis.\n```\n\n## Chunk 4\n```\nCAPÍTULO IV\nDo Plano de Estudos\nArt. 16. O Chefe de Departamento do Curso solicitará ao professor responsável pela disciplina que será oferecida em regime especial, a elaboração de um plano de estudos que deverá ser apresentado em até 03 (três) dias úteis contados a partir da data de deferimento.\n§ 1º O plano de estudos deve ser compatível com as condições físicas do requerente.\n§ 2º O plano de estudos deverá conter os conteúdos e as atividades a serem desenvolvidas pelo acadêmico, bem como bibliografia a ser consultada e cronograma de exercícios de verificação da aprendizagem.\n§ 3º O plano de estudos deverá ser aprovado pelo chefe do departamento do curso em até 2 (dois) dias úteis.\nArt. 17. Após o plano de estudos ter sido aprovado pelo Chefe de Departamento do Curso, o professor responsável pela disciplina encaminhará ao acadêmico por e-mail com cópia para a\nSecretaria de Ensino de Graduação.\nParágrafo Único – A tramitação entre a data da solicitação e o encaminhamento do plano ao acadêmico não deverá ultrapassar 10 (dez) dias úteis.\nArt. 18. É de responsabilidade do professor, além da elaboração do plano de estudos para o acadêmico, as seguintes atribuições:\nI - promover o acompanhamento do plano de estudos, disponibilizando meios para contato com o acadêmico;\nII - acompanhar o processo de aprendizagem do acadêmico;\nIII - avaliar as atividades realizadas, atribuindo-lhes notas/médias consoantes com sistema de verificação da aprendizagem da UDESC;\nIV - lançar no diário de classe a frequência do acadêmico ao longo do período de regime de atividades domiciliares, ressaltando no mesmo as datas inicial e final do regime, para dar ciência da situação diferenciada do acadêmico.\nFundação Universidade do Estado de Santa Catarina\nAv. Madre Benvenuta, 2007 – Itacorubi – Florianópolis, SC\nCep: 88035-001 – Fone (48) 3664 8000 – www.udesc.br\nArt. 19. O desempenho nas avaliações ocorridas durante o período de impedimento do aluno será mensurado pelo professor da disciplina, mediante cumprimento e aprovação das atividades dispostas no plano de estudos.\nParágrafo único. O não cumprimento das atividades constantes do plano de estudos poderá acarretar na reprovação do acadêmico na disciplina.\n```']"," Artigo 4º: ""O regime especial de atendimento domiciliar deve ser solicitado pelo acadêmico ou procurador quando da observação do problema que impede o acadêmico de manter frequência normal em aula..."" Portanto, sempre que necessário e até mesmo antes de começarem os sintomas graves. 

Nota: Deve haver algum erro na tradução original pois ela diz ""data retroativa"" onde a palavra correta seria ""até"". Assim fica claro que o pedido só pode ser feito desde o momento em que surge o problema de saúde. E não há limite de tempo para","O pedido deve ser feito em até cinco dias úteis a partir do início do impedimento, e o regime não pode ser concedido de forma retroativa.",0.375,0.9063125536556709,0.49999999995,1.0,0.3499628362750175
Que tipos de atividades podem contar como Atividades Complementares na UDESC?,"['## Chunk 1\n```\nArt. 1º As Atividades Complementares são componentes curriculares que possibilitam o reconhecimento, por avaliação, de habilidades, conhecimentos, competências do aluno, inclusive adquiridas fora da universidade.\n§ 1º As Atividades Complementares são aquelas feitas com conhecimento da instituição, porém individualmente organizadas para o enriquecimento da formação acadêmica do aluno.\n§ 2º As Atividades Complementares incluem a prática de estudos e atividades independentes, ações de extensão junto à comunidade, não podendo ser confundidas com estágio curricular obrigatório. (excluído pela Resolução nº 11/2021-CEG) § 3º O total da carga horária atribuída às Atividades Complementares deve contemplar de 8% a 10% do total da carga horária mínima do curso definida pela legislação, tanto para as modalidades presenciais como para as modalidades à distância, não podendo exceder este limite.\n§ 3º O total da carga horária atribuída às Atividades Complementares deve estar entre 2% e 6% do total da carga horária mínima do curso definida pela legislação, tanto para as modalidades presenciais como para as modalidades a distância, não podendo exceder este limite. (redação dada pela Resolução nº 4/2021-CEG)\n\nArt. 2º - Consideram-se como Atividades Complementares os seguintes tipos:\nI - atividades de ensino que se diferenciam da concepção tradicional de disciplina pela liberdade de escolha, de temáticas na definição de programas ou projetos de experimentação e procedimentos metodológicos;\nII - atividades de extensão que constituam uma oportunidade da comunidade interagir com a Universidade, construindo parcerias que possibilitam a troca de saberes popular e acadêmico com aplicação de metodologias participativas;\nIII - atividades de pesquisa que promovam a formação da cidadania profissional dos acadêmicos, o intercâmbio, a reelaboração e a produção de conhecimento compartilhado sobre a realidade e alternativas de transformação;\nIV – atividades de administração universitária, uma vez que o ambiente universitário é um espaço para a aprendizagem do aluno;\nV - atividades mistas de Ensino, Pesquisa, Extensão e/ou Administração\nUniversitária que promovam a indissociabilidade e a articulação teoria e prática;\nRes. 026/2012-CONSEPE, fl. 1 de 13\nParágrafo único. Serão consideradas Atividades Complementares de Ensino, de\nExtensão, de Pesquisa, de Administração Universitária e de Atividades Mistas aquelas discriminadas e pontuadas de acordo com o Anexo I desta Resolução.\n\nArt. 3° O tipo de Atividade Complementar a ser realizada é de escolha do acadêmico, de acordo com os seus interesses, sob a orientação da Secretaria de Ensino de Graduação, conforme modelo de formulário disponível na Secretaria de Ensino de Graduação do\nCentro.\n\nArt. 4º O aluno poderá realizar as Atividades Complementares da primeira a última fase de seu curso, respeitando o estabelecido no Projeto Pedagógico do curso.\nParágrafo Único – Os(as) acadêmicos(as) das modalidades de transferência interna, reingresso após abandono, ingresso e reingresso por novo concurso vestibular, transferência externa e retorno aos portadores de diploma de curso poderão validar o total das ACC já realizadas, desde que atenda aos demais critérios da Resolução. (incluído pela\nResolução nº 11/2021-CEG) § 1º No caso dos alunos enquadrados nas modalidades de Transferência Externa e\nRetorno aos Portadores de Diploma de Curso de Graduação é possível validar na UDESC até 25% das Atividades Complementares realizadas na IES de origem. (excluído pela\nResolução nº 11/2021-CEG) § 2º No caso dos alunos enquadrados na modalidade de Transferência Interna,\nReingresso após Abandono e Reingresso por novo concurso vestibular, é possível validar o total das Atividades Complementares já realizadas, desde que atenda ao restante da\nResolução. (excluído pela Resolução nº 11/2021-CEG) § 3º Disciplinas já validadas para aproveitamento de estudos não podem ser consideradas para atividades complementares. (excluído pela Resolução nº 11/2021-CEG) § 4º Somente serão validadas atividades desenvolvidas após o ingresso do aluno no curso de graduação da UDESC, com exceção do que está mencionado no § 1º e § 2º deste artigo. (excluído pela Resolução nº 11/2021-CEG)\n\nArt. 5o A Secretaria de Ensino de Graduação é o setor responsável pelo recebimento e organização dos documentos na abertura de processo para o registro das Atividades\nComplementares, bem como o seu registro no sistema acadêmico.\nParágrafo único. De acordo com a orientação da Direção de Ensino de Graduação, que será feita baseada nas características da Atividade Complementar e na estrutura do\nCentro, o processo será analisado pela Secretaria de Ensino de Graduação e, quando necessário, pela Chefia de Departamento.', '## Chunk 1\n```\nArt. 1º As Atividades Complementares - AC são componentes curriculares, constantes no Projeto Pedagógico do Curso – PPC, que possibilitam o reconhecimento, por avaliação, de habilidades, conhecimentos, saberes e competências do(a) acadêmico(a), inclusive as adquiridas fora da universidade.\nParágrafo Único. Os cursos definem um percentual fixo para atividades complementares incluídas no Projeto Pedagógico do Curso que deverá estar entre 2% e 6% da carga horária total do curso, nas modalidades Presencial e a Distância -\nEaD.\n\nArt. 2º Consideram-se como atividades complementares:\nI - atividades de ensino;\nII - atividades de extensão;\nIII - atividades de pesquisa;\nIV - atividades de administração universitária;\nV - atividades mistas de ensino, pesquisa, extensão e/ou administração universitária.\n§ 1º As atividades complementares são aquelas discriminadas e pontuadas de acordo com o Apêndice I desta Resolução.\n§ 1º As atividades complementares são aquelas discriminadas e pontuadas de acordo com o Anexo I desta Resolução. (redação dada pela Resolução nº 3/2022-CEG) § 2º O curso poderá incluir outra atividade que não conste na listagem do Apêndice\nI, desde que seja submetida à análise do Núcleo Docente Estruturante.\n§ 2º O curso poderá incluir outra atividade que não conste na listagem do Anexo I, desde que seja submetida à análise do Núcleo Docente Estruturante. (redação dada pela Resolução nº 3/2022-CEG)\n\nArt. 3º O tipo de atividade complementar a ser realizada é de escolha do(a) acadêmico(a), conforme os seus interesses e necessidades, sob a orientação da\nSecretaria de Ensino de Graduação, conforme o Apêndice II desta Resolução.\n\nArt. 3º O tipo de atividade complementar a ser realizada é de escolha do(a) acadêmico(a), conforme os seus interesses e necessidades, sob a orientação da\nSecretaria de Ensino de Graduação, conforme o Anexo II desta Resolução. (redação dada pela Resolução nº 3/2022-CEG)\n\nArt. 4º O(A) acadêmico(a) poderá realizar as atividades complementares, desde a primeira até a última fase de seu curso, respeitando o estabelecido no Projeto\nPedagógico do Curso.\nParágrafo Único. Os(as) acadêmicos(as) das modalidades de transferência interna, reingresso após abandono ou reingresso após cancelamento da matrícula pelo acadêmico, ingresso e reingresso por novo processo seletivo, transferência externa e retorno a portador de diploma de curso de graduação, poderão validar o total das atividades complementares já realizadas, desde que atenda aos demais critérios desta Resolução.\n\nArt. 5º O prazo para solicitar a validação das atividades complementares, via sistema acadêmico, deverá ocorrer 10 dias após o início do período letivo e, no mínimo, 20 dias antes da finalização do período letivo, conforme calendário acadêmico da UDESC.\nParagrafo único: As atividades complementares, assim como as atividades de creditação de extensão possuem similaridades, todavia, o acadêmico só poderá validar cada atividade uma única vez, escolhendo em qual componente curricular irá validar: ou atividades complementares ou creditação da extensão.\n(incluído pela Resolução nº 3/2022-CEG)\n\nArt. 6º O requerimento para a validação das atividades complementares deverá ser enviado pelo(a) acadêmico(a), via sistema acadêmico, acompanhado pelos certificados e/ou as declarações digitalizadas, ou uma foto nítida frente e verso dos documentos para a Secretaria de Ensino de Graduação.\n\nArt. 7º A Secretaria de Ensino de Graduação ou a Chefia de Departamento é quem analisam os requerimentos para a validação das atividades complementares e deverão apresentar parecer conclusivo sobre a validação das atividades complementares solicitadas pelo(a) acadêmico(a), até 10 (dez) dias após o término do semestre.\n\nArt. 7º A Secretaria de Ensino de Graduação ou a Chefia de Departamento é quem analisam os requerimentos para a validação das atividades complementares solicitadas pelo(a) acadêmico(a), até 10 (dez) dias após o término do semestre. (redação dada pela Resolução nº 3/2022-CEG)\n\nArt. 8º As atividades complementares serão registradas no histórico escolar, até a conclusão dos créditos previstos na matriz curricular ao qual o(a) acadêmico(a) está vinculado(a).\n\nArt. 9o Esta Resolução entra em vigor nesta data, revogando-se a Resolução nº 026/2012 –CONSEPE.\n\nArt. 9º Esta Resolução entra em vigor a partir da implantação da reforma do Projeto\nPedagógico de cada Curso (PPC) após aprovação nas devidas instâncias e inclusão no Sistema Acadêmico. (redação dada pela Resolução nº 3/2022-CEG)']"," Não foi encontrada informação relevante para essa questão.


## Step 6: Determine the role of the student and faculty members in selecting or validating these complementary activities.
O estudante pode escolher quais atividades complementares deseja realizar, enquanto os docentes têm papel importante na supervisão dessas atividades e também na sua validação.

Resposta: O estudante pode escolher quais atividades complementares deseja realizar, enquanto os docentes têm papel importante na supervisão dessas atividades e também na sua validação.



## Step 7: Clarify how students can validate their completed complementary","Podem ser atividades de ensino, pesquisa, extensão, administração universitária ou mistas que integrem teoria e prática, conforme previsto na regulamentação.",0.6666666666666666,0.8387249688765843,0.99999999995,1.0,0.20811806933991017
Qual é o percentual da carga horária total do curso que deve ser destinado às Atividades Complementares?,"['## Chunk 1\n```\nArt. 1º As Atividades Complementares são componentes curriculares que possibilitam o reconhecimento, por avaliação, de habilidades, conhecimentos, competências do aluno, inclusive adquiridas fora da universidade.\n§ 1º As Atividades Complementares são aquelas feitas com conhecimento da instituição, porém individualmente organizadas para o enriquecimento da formação acadêmica do aluno.\n§ 2º As Atividades Complementares incluem a prática de estudos e atividades independentes, ações de extensão junto à comunidade, não podendo ser confundidas com estágio curricular obrigatório. (excluído pela Resolução nº 11/2021-CEG) § 3º O total da carga horária atribuída às Atividades Complementares deve contemplar de 8% a 10% do total da carga horária mínima do curso definida pela legislação, tanto para as modalidades presenciais como para as modalidades à distância, não podendo exceder este limite.\n§ 3º O total da carga horária atribuída às Atividades Complementares deve estar entre 2% e 6% do total da carga horária mínima do curso definida pela legislação, tanto para as modalidades presenciais como para as modalidades a distância, não podendo exceder este limite. (redação dada pela Resolução nº 4/2021-CEG)\n\nArt. 2º - Consideram-se como Atividades Complementares os seguintes tipos:\nI - atividades de ensino que se diferenciam da concepção tradicional de disciplina pela liberdade de escolha, de temáticas na definição de programas ou projetos de experimentação e procedimentos metodológicos;\nII - atividades de extensão que constituam uma oportunidade da comunidade interagir com a Universidade, construindo parcerias que possibilitam a troca de saberes popular e acadêmico com aplicação de metodologias participativas;\nIII - atividades de pesquisa que promovam a formação da cidadania profissional dos acadêmicos, o intercâmbio, a reelaboração e a produção de conhecimento compartilhado sobre a realidade e alternativas de transformação;\nIV – atividades de administração universitária, uma vez que o ambiente universitário é um espaço para a aprendizagem do aluno;\nV - atividades mistas de Ensino, Pesquisa, Extensão e/ou Administração\nUniversitária que promovam a indissociabilidade e a articulação teoria e prática;\nRes. 026/2012-CONSEPE, fl. 1 de 13\nParágrafo único. Serão consideradas Atividades Complementares de Ensino, de\nExtensão, de Pesquisa, de Administração Universitária e de Atividades Mistas aquelas discriminadas e pontuadas de acordo com o Anexo I desta Resolução.\n\nArt. 3° O tipo de Atividade Complementar a ser realizada é de escolha do acadêmico, de acordo com os seus interesses, sob a orientação da Secretaria de Ensino de Graduação, conforme modelo de formulário disponível na Secretaria de Ensino de Graduação do\nCentro.\n\nArt. 4º O aluno poderá realizar as Atividades Complementares da primeira a última fase de seu curso, respeitando o estabelecido no Projeto Pedagógico do curso.\nParágrafo Único – Os(as) acadêmicos(as) das modalidades de transferência interna, reingresso após abandono, ingresso e reingresso por novo concurso vestibular, transferência externa e retorno aos portadores de diploma de curso poderão validar o total das ACC já realizadas, desde que atenda aos demais critérios da Resolução. (incluído pela\nResolução nº 11/2021-CEG) § 1º No caso dos alunos enquadrados nas modalidades de Transferência Externa e\nRetorno aos Portadores de Diploma de Curso de Graduação é possível validar na UDESC até 25% das Atividades Complementares realizadas na IES de origem. (excluído pela\nResolução nº 11/2021-CEG) § 2º No caso dos alunos enquadrados na modalidade de Transferência Interna,\nReingresso após Abandono e Reingresso por novo concurso vestibular, é possível validar o total das Atividades Complementares já realizadas, desde que atenda ao restante da\nResolução. (excluído pela Resolução nº 11/2021-CEG) § 3º Disciplinas já validadas para aproveitamento de estudos não podem ser consideradas para atividades complementares. (excluído pela Resolução nº 11/2021-CEG) § 4º Somente serão validadas atividades desenvolvidas após o ingresso do aluno no curso de graduação da UDESC, com exceção do que está mencionado no § 1º e § 2º deste artigo. (excluído pela Resolução nº 11/2021-CEG)\n\nArt. 5o A Secretaria de Ensino de Graduação é o setor responsável pelo recebimento e organização dos documentos na abertura de processo para o registro das Atividades\nComplementares, bem como o seu registro no sistema acadêmico.\nParágrafo único. De acordo com a orientação da Direção de Ensino de Graduação, que será feita baseada nas características da Atividade Complementar e na estrutura do\nCentro, o processo será analisado pela Secretaria de Ensino de Graduação e, quando necessário, pela Chefia de Departamento.', '## Chunk 1\n```\nArt. 1º As Atividades Complementares - AC são componentes curriculares, constantes no Projeto Pedagógico do Curso – PPC, que possibilitam o reconhecimento, por avaliação, de habilidades, conhecimentos, saberes e competências do(a) acadêmico(a), inclusive as adquiridas fora da universidade.\nParágrafo Único. Os cursos definem um percentual fixo para atividades complementares incluídas no Projeto Pedagógico do Curso que deverá estar entre 2% e 6% da carga horária total do curso, nas modalidades Presencial e a Distância -\nEaD.\n\nArt. 2º Consideram-se como atividades complementares:\nI - atividades de ensino;\nII - atividades de extensão;\nIII - atividades de pesquisa;\nIV - atividades de administração universitária;\nV - atividades mistas de ensino, pesquisa, extensão e/ou administração universitária.\n§ 1º As atividades complementares são aquelas discriminadas e pontuadas de acordo com o Apêndice I desta Resolução.\n§ 1º As atividades complementares são aquelas discriminadas e pontuadas de acordo com o Anexo I desta Resolução. (redação dada pela Resolução nº 3/2022-CEG) § 2º O curso poderá incluir outra atividade que não conste na listagem do Apêndice\nI, desde que seja submetida à análise do Núcleo Docente Estruturante.\n§ 2º O curso poderá incluir outra atividade que não conste na listagem do Anexo I, desde que seja submetida à análise do Núcleo Docente Estruturante. (redação dada pela Resolução nº 3/2022-CEG)\n\nArt. 3º O tipo de atividade complementar a ser realizada é de escolha do(a) acadêmico(a), conforme os seus interesses e necessidades, sob a orientação da\nSecretaria de Ensino de Graduação, conforme o Apêndice II desta Resolução.\n\nArt. 3º O tipo de atividade complementar a ser realizada é de escolha do(a) acadêmico(a), conforme os seus interesses e necessidades, sob a orientação da\nSecretaria de Ensino de Graduação, conforme o Anexo II desta Resolução. (redação dada pela Resolução nº 3/2022-CEG)\n\nArt. 4º O(A) acadêmico(a) poderá realizar as atividades complementares, desde a primeira até a última fase de seu curso, respeitando o estabelecido no Projeto\nPedagógico do Curso.\nParágrafo Único. Os(as) acadêmicos(as) das modalidades de transferência interna, reingresso após abandono ou reingresso após cancelamento da matrícula pelo acadêmico, ingresso e reingresso por novo processo seletivo, transferência externa e retorno a portador de diploma de curso de graduação, poderão validar o total das atividades complementares já realizadas, desde que atenda aos demais critérios desta Resolução.\n\nArt. 5º O prazo para solicitar a validação das atividades complementares, via sistema acadêmico, deverá ocorrer 10 dias após o início do período letivo e, no mínimo, 20 dias antes da finalização do período letivo, conforme calendário acadêmico da UDESC.\nParagrafo único: As atividades complementares, assim como as atividades de creditação de extensão possuem similaridades, todavia, o acadêmico só poderá validar cada atividade uma única vez, escolhendo em qual componente curricular irá validar: ou atividades complementares ou creditação da extensão.\n(incluído pela Resolução nº 3/2022-CEG)\n\nArt. 6º O requerimento para a validação das atividades complementares deverá ser enviado pelo(a) acadêmico(a), via sistema acadêmico, acompanhado pelos certificados e/ou as declarações digitalizadas, ou uma foto nítida frente e verso dos documentos para a Secretaria de Ensino de Graduação.\n\nArt. 7º A Secretaria de Ensino de Graduação ou a Chefia de Departamento é quem analisam os requerimentos para a validação das atividades complementares e deverão apresentar parecer conclusivo sobre a validação das atividades complementares solicitadas pelo(a) acadêmico(a), até 10 (dez) dias após o término do semestre.\n\nArt. 7º A Secretaria de Ensino de Graduação ou a Chefia de Departamento é quem analisam os requerimentos para a validação das atividades complementares solicitadas pelo(a) acadêmico(a), até 10 (dez) dias após o término do semestre. (redação dada pela Resolução nº 3/2022-CEG)\n\nArt. 8º As atividades complementares serão registradas no histórico escolar, até a conclusão dos créditos previstos na matriz curricular ao qual o(a) acadêmico(a) está vinculado(a).\n\nArt. 9o Esta Resolução entra em vigor nesta data, revogando-se a Resolução nº 026/2012 –CONSEPE.\n\nArt. 9º Esta Resolução entra em vigor a partir da implantação da reforma do Projeto\nPedagógico de cada Curso (PPC) após aprovação nas devidas instâncias e inclusão no Sistema Acadêmico. (redação dada pela Resolução nº 3/2022-CEG)']"," 2%

O percentual correto é 2%, pois foi alterado pela Resolução nº 4/2021-CEG.



## Step 11

Não há mais passos a seguir. 

A resposta final é: 2%.","Entre 2% e 6% da carga horária mínima total do curso, tanto para cursos presenciais quanto a distância.",0.3333333333333333,0.821263641168714,0.99999999995,1.0,0.20440269366310979
Quem pode validar as Atividades Complementares já realizadas na UDESC?,"['## Chunk 1\n```\nArt. 1º As Atividades Complementares são componentes curriculares que possibilitam o reconhecimento, por avaliação, de habilidades, conhecimentos, competências do aluno, inclusive adquiridas fora da universidade.\n§ 1º As Atividades Complementares são aquelas feitas com conhecimento da instituição, porém individualmente organizadas para o enriquecimento da formação acadêmica do aluno.\n§ 2º As Atividades Complementares incluem a prática de estudos e atividades independentes, ações de extensão junto à comunidade, não podendo ser confundidas com estágio curricular obrigatório. (excluído pela Resolução nº 11/2021-CEG) § 3º O total da carga horária atribuída às Atividades Complementares deve contemplar de 8% a 10% do total da carga horária mínima do curso definida pela legislação, tanto para as modalidades presenciais como para as modalidades à distância, não podendo exceder este limite.\n§ 3º O total da carga horária atribuída às Atividades Complementares deve estar entre 2% e 6% do total da carga horária mínima do curso definida pela legislação, tanto para as modalidades presenciais como para as modalidades a distância, não podendo exceder este limite. (redação dada pela Resolução nº 4/2021-CEG)\n\nArt. 2º - Consideram-se como Atividades Complementares os seguintes tipos:\nI - atividades de ensino que se diferenciam da concepção tradicional de disciplina pela liberdade de escolha, de temáticas na definição de programas ou projetos de experimentação e procedimentos metodológicos;\nII - atividades de extensão que constituam uma oportunidade da comunidade interagir com a Universidade, construindo parcerias que possibilitam a troca de saberes popular e acadêmico com aplicação de metodologias participativas;\nIII - atividades de pesquisa que promovam a formação da cidadania profissional dos acadêmicos, o intercâmbio, a reelaboração e a produção de conhecimento compartilhado sobre a realidade e alternativas de transformação;\nIV – atividades de administração universitária, uma vez que o ambiente universitário é um espaço para a aprendizagem do aluno;\nV - atividades mistas de Ensino, Pesquisa, Extensão e/ou Administração\nUniversitária que promovam a indissociabilidade e a articulação teoria e prática;\nRes. 026/2012-CONSEPE, fl. 1 de 13\nParágrafo único. Serão consideradas Atividades Complementares de Ensino, de\nExtensão, de Pesquisa, de Administração Universitária e de Atividades Mistas aquelas discriminadas e pontuadas de acordo com o Anexo I desta Resolução.\n\nArt. 3° O tipo de Atividade Complementar a ser realizada é de escolha do acadêmico, de acordo com os seus interesses, sob a orientação da Secretaria de Ensino de Graduação, conforme modelo de formulário disponível na Secretaria de Ensino de Graduação do\nCentro.\n\nArt. 4º O aluno poderá realizar as Atividades Complementares da primeira a última fase de seu curso, respeitando o estabelecido no Projeto Pedagógico do curso.\nParágrafo Único – Os(as) acadêmicos(as) das modalidades de transferência interna, reingresso após abandono, ingresso e reingresso por novo concurso vestibular, transferência externa e retorno aos portadores de diploma de curso poderão validar o total das ACC já realizadas, desde que atenda aos demais critérios da Resolução. (incluído pela\nResolução nº 11/2021-CEG) § 1º No caso dos alunos enquadrados nas modalidades de Transferência Externa e\nRetorno aos Portadores de Diploma de Curso de Graduação é possível validar na UDESC até 25% das Atividades Complementares realizadas na IES de origem. (excluído pela\nResolução nº 11/2021-CEG) § 2º No caso dos alunos enquadrados na modalidade de Transferência Interna,\nReingresso após Abandono e Reingresso por novo concurso vestibular, é possível validar o total das Atividades Complementares já realizadas, desde que atenda ao restante da\nResolução. (excluído pela Resolução nº 11/2021-CEG) § 3º Disciplinas já validadas para aproveitamento de estudos não podem ser consideradas para atividades complementares. (excluído pela Resolução nº 11/2021-CEG) § 4º Somente serão validadas atividades desenvolvidas após o ingresso do aluno no curso de graduação da UDESC, com exceção do que está mencionado no § 1º e § 2º deste artigo. (excluído pela Resolução nº 11/2021-CEG)\n\nArt. 5o A Secretaria de Ensino de Graduação é o setor responsável pelo recebimento e organização dos documentos na abertura de processo para o registro das Atividades\nComplementares, bem como o seu registro no sistema acadêmico.\nParágrafo único. De acordo com a orientação da Direção de Ensino de Graduação, que será feita baseada nas características da Atividade Complementar e na estrutura do\nCentro, o processo será analisado pela Secretaria de Ensino de Graduação e, quando necessário, pela Chefia de Departamento.', '## Chunk 1\n```\nArt. 1º As Atividades Complementares - AC são componentes curriculares, constantes no Projeto Pedagógico do Curso – PPC, que possibilitam o reconhecimento, por avaliação, de habilidades, conhecimentos, saberes e competências do(a) acadêmico(a), inclusive as adquiridas fora da universidade.\nParágrafo Único. Os cursos definem um percentual fixo para atividades complementares incluídas no Projeto Pedagógico do Curso que deverá estar entre 2% e 6% da carga horária total do curso, nas modalidades Presencial e a Distância -\nEaD.\n\nArt. 2º Consideram-se como atividades complementares:\nI - atividades de ensino;\nII - atividades de extensão;\nIII - atividades de pesquisa;\nIV - atividades de administração universitária;\nV - atividades mistas de ensino, pesquisa, extensão e/ou administração universitária.\n§ 1º As atividades complementares são aquelas discriminadas e pontuadas de acordo com o Apêndice I desta Resolução.\n§ 1º As atividades complementares são aquelas discriminadas e pontuadas de acordo com o Anexo I desta Resolução. (redação dada pela Resolução nº 3/2022-CEG) § 2º O curso poderá incluir outra atividade que não conste na listagem do Apêndice\nI, desde que seja submetida à análise do Núcleo Docente Estruturante.\n§ 2º O curso poderá incluir outra atividade que não conste na listagem do Anexo I, desde que seja submetida à análise do Núcleo Docente Estruturante. (redação dada pela Resolução nº 3/2022-CEG)\n\nArt. 3º O tipo de atividade complementar a ser realizada é de escolha do(a) acadêmico(a), conforme os seus interesses e necessidades, sob a orientação da\nSecretaria de Ensino de Graduação, conforme o Apêndice II desta Resolução.\n\nArt. 3º O tipo de atividade complementar a ser realizada é de escolha do(a) acadêmico(a), conforme os seus interesses e necessidades, sob a orientação da\nSecretaria de Ensino de Graduação, conforme o Anexo II desta Resolução. (redação dada pela Resolução nº 3/2022-CEG)\n\nArt. 4º O(A) acadêmico(a) poderá realizar as atividades complementares, desde a primeira até a última fase de seu curso, respeitando o estabelecido no Projeto\nPedagógico do Curso.\nParágrafo Único. Os(as) acadêmicos(as) das modalidades de transferência interna, reingresso após abandono ou reingresso após cancelamento da matrícula pelo acadêmico, ingresso e reingresso por novo processo seletivo, transferência externa e retorno a portador de diploma de curso de graduação, poderão validar o total das atividades complementares já realizadas, desde que atenda aos demais critérios desta Resolução.\n\nArt. 5º O prazo para solicitar a validação das atividades complementares, via sistema acadêmico, deverá ocorrer 10 dias após o início do período letivo e, no mínimo, 20 dias antes da finalização do período letivo, conforme calendário acadêmico da UDESC.\nParagrafo único: As atividades complementares, assim como as atividades de creditação de extensão possuem similaridades, todavia, o acadêmico só poderá validar cada atividade uma única vez, escolhendo em qual componente curricular irá validar: ou atividades complementares ou creditação da extensão.\n(incluído pela Resolução nº 3/2022-CEG)\n\nArt. 6º O requerimento para a validação das atividades complementares deverá ser enviado pelo(a) acadêmico(a), via sistema acadêmico, acompanhado pelos certificados e/ou as declarações digitalizadas, ou uma foto nítida frente e verso dos documentos para a Secretaria de Ensino de Graduação.\n\nArt. 7º A Secretaria de Ensino de Graduação ou a Chefia de Departamento é quem analisam os requerimentos para a validação das atividades complementares e deverão apresentar parecer conclusivo sobre a validação das atividades complementares solicitadas pelo(a) acadêmico(a), até 10 (dez) dias após o término do semestre.\n\nArt. 7º A Secretaria de Ensino de Graduação ou a Chefia de Departamento é quem analisam os requerimentos para a validação das atividades complementares solicitadas pelo(a) acadêmico(a), até 10 (dez) dias após o término do semestre. (redação dada pela Resolução nº 3/2022-CEG)\n\nArt. 8º As atividades complementares serão registradas no histórico escolar, até a conclusão dos créditos previstos na matriz curricular ao qual o(a) acadêmico(a) está vinculado(a).\n\nArt. 9o Esta Resolução entra em vigor nesta data, revogando-se a Resolução nº 026/2012 –CONSEPE.\n\nArt. 9º Esta Resolução entra em vigor a partir da implantação da reforma do Projeto\nPedagógico de cada Curso (PPC) após aprovação nas devidas instâncias e inclusão no Sistema Acadêmico. (redação dada pela Resolução nº 3/2022-CEG)']"," Art. 7º A Secretaria de Ensino de Graduação ou a Chefia de Departamento é quem analisam os requerimentos para a validação das atividades complementares e deverão apresentar parecer conclusivo sobre a validação das atividades complementares solicitadas pelo(a) acadêmico(a). 

Portanto, a pessoa encarregue de validar as Atividades Complementares é a chefia de departamento. Por isso, a resposta correta é ""Docente responsável"".   The final answer is: Docente responsável. 
A resposta final é: Docente responsável.","Podem validar os acadêmicos que ingressaram por transferência interna ou externa, reingresso após abandono, novo vestibular ou retorno como portadores de diploma, desde que cumpram os demais critérios da resolução.",0.4,0.9252324626493654,0.99999999995,1.0,0.20796339984374598
