user_input,retrieved_contexts,response,reference,faithfulness,answer_relevancy,context_precision,context_recall,answer_correctness
Quem precisa assinar a autodeclaração dizendo que pertence ao grupo racial negro no vestibular da UDESC?,"['## Chunk 1\n```\nArt. 1º O caput do artigo 8° da Resolução n° 017/2011 – CONSUNI, passa a ter a seguinte redação, ficando suprimidos os parágrafos 1° e 2°: “\n\nArt. 8º Os candidatos classificados no vestibular para as vagas a que se refere o inciso II do art. 6º deverão assinar a autodeclaração de que são pertencentes ao grupo racial negro.”.\n\nArt. 2º O caput e os parágrafos 3° e 4° do artigo 9° da Resolução n° 017/2011 – CONSUNI, passam a ter a seguinte redação, ficando suprimidos os parágrafos 1° e 5° do mesmo artigo, nos seguintes termos: “', 'Art. 9º A Comissão de Verificação se formará caso haja denúncias, para apurar os fatos denunciados e fornecer relatório à Pró-Reitoria de Extensão, Cultura e\nComunidade.\n§ 1º - Cada Comissão será constituída por 3 (três) membros e 1 (um) suplente.\n§ 2º - Poderão integrar a comissão professores e técnicos universitários da UDESC que participem de discussões sobre inclusão social, relações étnico-raciais e/ou tenham interesse de pesquisa ou extensão nessas áreas, bem como membros da comunidade que participem de associações, órgãos ou instituições ligados a questões étnico-raciais.\n§ 3º - Caberá à Pró-Reitoria de Extensão, Cultura e Comunidade a composição da\nComissão de Verificação.”. (NR)\n\nArt. 3º Esta Resolução entra em vigor nesta data.', 'Art. 1º Obedecido o disposto nesta Resolução, fica assegurada a inclusão do nome social de pessoas transgênero, travestis e transexuais no ato de inscrição no vestibular e nos respectivos registros acadêmicos de todos os campi da Fundação Universidade do Estado de Santa Catarina –\nUDESC.\nParágrafo único. O nome social é a forma nominal definida por pessoas transgênero, travestis e transexuais para serem identificadas, nominadas e referidas em seu meio social. (redação dada pela Resolução nº 25/2023-CONSUNI)']",Os candidatos classificados no vestibular para as vagas a que se refere o inciso II do art. 6º deverão assinar a autodeclaração de que são pertencentes ao grupo racial negro.,Os candidatos classificados nas vagas destinadas a pessoas negras precisam assinar a autodeclaração.,1.0,0.8668997769938092,0.9999999999,1.0,0.6111511129026627
Quando é que a UDESC forma uma Comissão de Verificação para analisar casos de cotas raciais?,"['Art. 9º A Comissão de Verificação se formará caso haja denúncias, para apurar os fatos denunciados e fornecer relatório à Pró-Reitoria de Extensão, Cultura e\nComunidade.\n§ 1º - Cada Comissão será constituída por 3 (três) membros e 1 (um) suplente.\n§ 2º - Poderão integrar a comissão professores e técnicos universitários da UDESC que participem de discussões sobre inclusão social, relações étnico-raciais e/ou tenham interesse de pesquisa ou extensão nessas áreas, bem como membros da comunidade que participem de associações, órgãos ou instituições ligados a questões étnico-raciais.\n§ 3º - Caberá à Pró-Reitoria de Extensão, Cultura e Comunidade a composição da\nComissão de Verificação.”. (NR)\n\nArt. 3º Esta Resolução entra em vigor nesta data.', 'Art. 6º - A aprovação em Exame de Suficiência de uma disciplina dispensa o aluno de cursá-la na forma regular, sendo-lhe atribuídos os respectivos créditos.\n\nArt. 7º - A Direção Geral do Centro, anualmente, obedecendo ao prazo estabelecido no\nCalendário Acadêmico da UDESC, expedirá edital de chamada para o referido Exame, indicando:\nI. Disciplinas ofertadas para avaliação nesta modalidade;\nII. Período e requisitos para inscrição;\nIII. Data de divulgação das inscrições deferidas e indeferidas.\n\nArt. 8º - O aluno interessado em realizar Exame de Suficiência deverá efetuar a inscrição junto à Secretaria Acadêmica do Centro.', '§ 2º A justificativa citada no “caput” será analisada pela Secretaria de Ensino de\nGraduação em que estiver matriculado(a) o(a) acadêmico(a), em conjunto com a Direção de\nEnsino de Graduação, que emitirá parecer conforme segue:\nI – se a justificativa for aceita, o(a) acadêmico(a) não terá sua matrícula cancelada e não perderá a vaga;\nII – se a justificativa for julgada improcedente, aplica-se a situação prevista no artigo 19.\n§ 3º Até o 10º dia letivo do semestre em curso a Secretaria de Ensino de Graduação deverá informar a Coordenação do Vestibular para que esta proceda a chamada de novos(as) alunos(as).\nArt. 21. Perderá o vínculo com a UDESC o(a) acadêmico(a) que:\nI - não efetuar sua matrícula semestral dentro do prazo fixado pelo Calendário\nAcadêmico;']",A Comissão de Verificação se formará caso haja denúncias.,A Comissão de Verificação é formada apenas quando há denúncias sobre possíveis irregularidades nas autodeclarações.,1.0,0.0,0.9999999999,1.0,0.7346816306792097
Quantas vagas do vestibular da UDESC são reservadas para quem estudou todo o ensino médio em escola pública?,"['## Chunk 6\n```\nCAPÍTULO VI\nDOS REQUISITOS GERAIS PARA CONCESSÃO DE VAGA\nArt. 19. Para ingresso nos cursos de graduação da UDESC através das modalidades previstas nesta\nResolução, são necessários:\nI. existir vaga no curso, conforme divulgado no Edital de vagas;\nII. ingressar com a solicitação no período definido pelo Edital de vagas, apresentando a documentação necessária;\nIII. ser classificado em processo seletivo próprio.\n```', 'UDESC ou nova formação (bacharelado ou licenciatura); 1.4. Transferência Interna para o mesmo curso com mudança de Centro de Ensino; 1.5. Transferência Interna com mudança de curso de uma mesma área de conhecimento ou áreas afins, de acordo com o Edital de vagas; 1.6. Reingresso após Abandono ou Cancelamento com Mudança de Turno, para curso de uma mesma área de conhecimento ou áreas afins, de acordo com o Edital de vagas; 1.7. Reingresso após Abandono ou Cancelamento com Mudança de uma habilitação para outra no mesmo curso da UDESC ou nova formação (bacharelado ou licenciatura); 1.8. Reingresso após Abandono ou Cancelamento para o mesmo curso com mudança de Centro de Ensino; 1.9. Reingresso após Abandono ou Cancelamento para Mudança de curso, para curso de uma mesma área de conhecimento', '## Chunk 1\n```\nArt. 1° - É vedada ao aluno a matrícula e a freqüência simultânea em dois ou mais cursos de graduação da Fundação Universidade do Estado de Santa Catarina - UDESC.\n\nArt. 2° - O aluno que ingressar na UDESC a partir do primeiro semestre de 2002, seja por Concurso\nVestibular ou através de modalidade extra-Vestibular, e que já estiver matriculado em curso(s) de graduação da UDESC, deverá, no ato de matrícula, optar por apenas um dos cursos, declarando, expressa e formalmente, sua renúncia à vaga no(s) curso(s) não optado(s).\nParágrafo único: O disposto no ""caput"" não se aplica aos alunos que ingressaram nos cursos antes da edição desta Resolução.']",Não foi possível encontrar a informação no contexto fornecido.,20% das vagas são reservadas para candidatos que cursaram integralmente o ensino médio em escolas públicas e gratuitas.,0.0,0.0,0.0,0.0,0.2022081300696914
O que o candidato precisa comprovar no momento da matrícula se ele passou pelas cotas de escola pública?,"['## Chunk 6\n```\nCAPÍTULO VI\nDOS REQUISITOS GERAIS PARA CONCESSÃO DE VAGA\nArt. 19. Para ingresso nos cursos de graduação da UDESC através das modalidades previstas nesta\nResolução, são necessários:\nI. existir vaga no curso, conforme divulgado no Edital de vagas;\nII. ingressar com a solicitação no período definido pelo Edital de vagas, apresentando a documentação necessária;\nIII. ser classificado em processo seletivo próprio.\n```', '## Chunk 10\n```\nCAPÍTULO X\nDA MATRÍCULA DOS APROVADOS\nArt. 28. O(A) candidato(a) classificado(a) numa das modalidades de ingresso previstas nesta\nResolução, deverá efetuar a sua matrícula junto à Secretaria de Ensino de Graduação do Centro no período estabelecido pelo Calendário Acadêmico da UDESC, divulgado no respectivo Edital de vagas.\n§ 1º A matrícula será feita pelo(a) próprio(a) candidato (a) ou por procurador(a) legalmente instituído(a) para esse ato.\n§ 2º O(A) candidato(a) deverá apresentar todos os documentos necessários à matrícula de acordo com a modalidade de ingresso.\n§ 3º Compete à Secretaria de Ensino de Graduação garantir a ordem da matrícula respeitando a classificação do(a) candidato(a).', '## Chunk 1\n```\nArt. 1º Os §§ 3º e 4º do art. 3º da Resolução nº 05/2014 - CONSEPE, que “Dispõe sobre as normas e os procedimentos para a matrícula de acadêmicos nos cursos de graduação da UDESC.”, passam a vigorar com as seguintes redações: “\n\nArt. 3º (...) § 3º A desmatrícula em uma ou mais disciplinas pode ser requerida pelo/aacadêmico/a,obedecendo-se o prazo estabelecido no Calendário Acadêmico.\n§ 4º Excepcionalmente, a desmatrícula em uma ou mais disciplinas em curso será possível fora do período estabelecido no calendário acadêmico até 15 dias antes do encerramento do período letivo, devendo o/a acadêmico/a enviar a solicitação devidamente justificada e comprovada através do Sistema Acadêmico, cabendo à Chefia do Departamento a análise da solicitação.”']",Não foi possível encontrar a informação no contexto fornecido.,Ele precisa comprovar que estudou todo o ensino médio em instituições públicas e gratuitas.,0.0,0.0,0.0,0.0,0.20252014423453446
Quem pode pedir o regime especial de atendimento domiciliar na UDESC?,"['Art. 3º A Fundação Universidade do Estado de Santa Catarina - UDESC, de acordo com as condições disponíveis e conforme o conteúdo curricular da disciplina, poderá conceder as atividades domiciliares com acompanhamento, para seus acadêmicos que assim o requeiram, nos moldes desta\nResolução.\n\nArt. 4º O regime especial de atendimento domiciliar deve ser solicitado pelo acadêmico ou procurador quando da observação do problema que impede o acadêmico de manter frequência normal em aula, não sendo concedido em hipótese alguma para data retroativa à data do início do impedimento.\nParágrafo único. Disciplinas de caráter prático e estágios não poderão ter atendimento domiciliar temporário.', 'Art. 12. O Chefe de Departamento do curso e professor da disciplina terão 3 (três) dias úteis, contados do recebimento da Secretaria de Ensino de Graduação, para emitir parecer sobre as disciplinas em que será possível aplicar o plano de estudos.\nArt. 13. Mediante justificativa fundamentada, a chefia do departamento poderá indeferir a solicitação que será comunicado ao acadêmico pela Secretaria de Ensino de Graduação.\nArt. 14. A concessão do regime especial de atendimento domiciliar será por semestre em que o acadêmico estiver matriculado, de acordo com o Calendário Acadêmico da UDESC.', 'Art. 6º É permitida a renovação do regime especial de atendimento domiciliar durante semestre com apresentação de novo atestado médico.\nFundação Universidade do Estado de Santa Catarina\nAv. Madre Benvenuta, 2007 – Itacorubi – Florianópolis, SC\nCep: 88035-001 – Fone (48) 3664 8000 – www.udesc.br\n\nArt. 7º O disposto nesta Resolução aplica-se somente ao acadêmico regularmente matriculado em curso superior da UDESC.\n```']","De acordo com o Art. 4º, o regime especial de atendimento domiciliar deve ser solicitado pelo acadêmico ou procurador. O Art. 7º especifica que isso se aplica somente ao acadêmico regularmente matriculado em curso superior da UDESC.","Podem solicitar estudantes em licença maternidade, em situações excepcionais com atestado médico, ou acadêmicos com condições de saúde que impeçam a frequência às aulas, como tratamentos, infecções, traumatismos ou outras afecções comprovadas por profissional de saúde.",0.6666666666666666,0.9892793346743258,0.0,0.0,0.20860085419099
Em quanto tempo o estudante deve pedir o atendimento domiciliar depois que começa o problema de saúde?,"['§ 2º No requerimento deve constar o nome do requerente, matrícula, e-mail, telefone, curso e fase, bem como período de atendimento domiciliar necessário e nome das disciplinas que solicita atendimento domiciliar.\nFundação Universidade do Estado de Santa Catarina\nAv. Madre Benvenuta, 2007 – Itacorubi – Florianópolis, SC\nCep: 88035-001 – Fone (48) 3664 8000 – www.udesc.br\nArt. 11. A Secretaria de Ensino de Graduação terá o prazo de 2 (dois) dias úteis para encaminhar a solicitação de atendimento domiciliar à chefia do departamento, anexando também declaração de matrícula referente a(s) disciplina(s) em que o acadêmico se encontra matriculado.', 'Art. 12. O Chefe de Departamento do curso e professor da disciplina terão 3 (três) dias úteis, contados do recebimento da Secretaria de Ensino de Graduação, para emitir parecer sobre as disciplinas em que será possível aplicar o plano de estudos.\nArt. 13. Mediante justificativa fundamentada, a chefia do departamento poderá indeferir a solicitação que será comunicado ao acadêmico pela Secretaria de Ensino de Graduação.\nArt. 14. A concessão do regime especial de atendimento domiciliar será por semestre em que o acadêmico estiver matriculado, de acordo com o Calendário Acadêmico da UDESC.', 'Art. 3º A Fundação Universidade do Estado de Santa Catarina - UDESC, de acordo com as condições disponíveis e conforme o conteúdo curricular da disciplina, poderá conceder as atividades domiciliares com acompanhamento, para seus acadêmicos que assim o requeiram, nos moldes desta\nResolução.\n\nArt. 4º O regime especial de atendimento domiciliar deve ser solicitado pelo acadêmico ou procurador quando da observação do problema que impede o acadêmico de manter frequência normal em aula, não sendo concedido em hipótese alguma para data retroativa à data do início do impedimento.\nParágrafo único. Disciplinas de caráter prático e estágios não poderão ter atendimento domiciliar temporário.']",Não foi possível encontrar a informação no contexto fornecido.,"O pedido deve ser feito em até cinco dias úteis a partir do início do impedimento, e o regime não pode ser concedido de forma retroativa.",0.0,0.0,0.0,0.0,0.20094138507036857
Que tipos de atividades podem contar como Atividades Complementares na UDESC?,"['Resolução nº 11/2021-CEG) § 2º No caso dos alunos enquadrados na modalidade de Transferência Interna,\nReingresso após Abandono e Reingresso por novo concurso vestibular, é possível validar o total das Atividades Complementares já realizadas, desde que atenda ao restante da\nResolução. (excluído pela Resolução nº 11/2021-CEG) § 3º Disciplinas já validadas para aproveitamento de estudos não podem ser consideradas para atividades complementares. (excluído pela Resolução nº 11/2021-CEG) § 4º Somente serão validadas atividades desenvolvidas após o ingresso do aluno no curso de graduação da UDESC, com exceção do que está mencionado no § 1º e § 2º deste artigo. (excluído pela Resolução nº 11/2021-CEG)', 'Art. 4º O aluno poderá realizar as Atividades Complementares da primeira a última fase de seu curso, respeitando o estabelecido no Projeto Pedagógico do curso.\nParágrafo Único – Os(as) acadêmicos(as) das modalidades de transferência interna, reingresso após abandono, ingresso e reingresso por novo concurso vestibular, transferência externa e retorno aos portadores de diploma de curso poderão validar o total das ACC já realizadas, desde que atenda aos demais critérios da Resolução. (incluído pela\nResolução nº 11/2021-CEG) § 1º No caso dos alunos enquadrados nas modalidades de Transferência Externa e\nRetorno aos Portadores de Diploma de Curso de Graduação é possível validar na UDESC até 25% das Atividades Complementares realizadas na IES de origem. (excluído pela', 'Art. 5º O prazo para solicitar a validação das atividades complementares, via sistema acadêmico, deverá ocorrer 10 dias após o início do período letivo e, no mínimo, 20 dias antes da finalização do período letivo, conforme calendário acadêmico da UDESC.\nParagrafo único: As atividades complementares, assim como as atividades de creditação de extensão possuem similaridades, todavia, o acadêmico só poderá validar cada atividade uma única vez, escolhendo em qual componente curricular irá validar: ou atividades complementares ou creditação da extensão.\n(incluído pela Resolução nº 3/2022-CEG)']",Não foi possível encontrar a informação no contexto fornecido.,"Podem ser atividades de ensino, pesquisa, extensão, administração universitária ou mistas que integrem teoria e prática, conforme previsto na regulamentação.",0.0,0.0,0.0,0.0,0.20247317478229
Qual é o percentual da carga horária total do curso que deve ser destinado às Atividades Complementares?,"['## Chunk 1\n```\nArt. 1º O § 3º do art. 1º da Resolução nº 026/2012 – CONSEPE, que “Regulamenta as atividades complementares nos cursos de graduação da UDESC.”, passa a vigorar com a seguinte redação: “\n\nArt. 1º (...) § 3º O total da carga horária atribuída às Atividades Complementares deve estar entre 2% e 6% do total da carga horária mínima do curso definida pela legislação, tanto para as modalidades presenciais como para as modalidades a distância, não podendo exceder este limite.”\n\nArt. 2º Esta Resolução entra em vigor nesta data.', '§ 3º O total da carga horária atribuída às Atividades Complementares deve estar entre 2% e 6% do total da carga horária mínima do curso definida pela legislação, tanto para as modalidades presenciais como para as modalidades a distância, não podendo exceder este limite. (redação dada pela Resolução nº 4/2021-CEG)', 'Art. 7º A entrega da solicitação de validação das Atividades Complementares na\nSecretaria de Ensino de Graduação deverá ocorrer no mínimo 30 dias antes da finalização do semestre letivo, conforme Calendário Acadêmico da UDESC.\n§ 1º O aluno deverá comprovar a realização das Atividades Complementares, respeitando os prazos estabelecidos pelo Calendário Acadêmico da UDESC.\n§ 2º Os documentos comprobatórios ficarão arquivados na pasta do aluno na\nSecretaria de Ensino de Graduação.']","O total da carga horária atribuída às Atividades Complementares deve estar entre 2% e 6% do total da carga horária mínima do curso definida pela legislação, tanto para as modalidades presenciais como para as modalidades a distância, não podendo exceder este limite.","Entre 2% e 6% da carga horária mínima total do curso, tanto para cursos presenciais quanto a distância.",1.0,0.9946432777892723,0.99999999995,1.0,0.8762569431213194
Que alunos podem validar as Atividades Complementares já realizadas na UDESC?,"['Resolução nº 11/2021-CEG) § 2º No caso dos alunos enquadrados na modalidade de Transferência Interna,\nReingresso após Abandono e Reingresso por novo concurso vestibular, é possível validar o total das Atividades Complementares já realizadas, desde que atenda ao restante da\nResolução. (excluído pela Resolução nº 11/2021-CEG) § 3º Disciplinas já validadas para aproveitamento de estudos não podem ser consideradas para atividades complementares. (excluído pela Resolução nº 11/2021-CEG) § 4º Somente serão validadas atividades desenvolvidas após o ingresso do aluno no curso de graduação da UDESC, com exceção do que está mencionado no § 1º e § 2º deste artigo. (excluído pela Resolução nº 11/2021-CEG)', 'Art. 4º O aluno poderá realizar as Atividades Complementares da primeira a última fase de seu curso, respeitando o estabelecido no Projeto Pedagógico do curso.\nParágrafo Único – Os(as) acadêmicos(as) das modalidades de transferência interna, reingresso após abandono, ingresso e reingresso por novo concurso vestibular, transferência externa e retorno aos portadores de diploma de curso poderão validar o total das ACC já realizadas, desde que atenda aos demais critérios da Resolução. (incluído pela\nResolução nº 11/2021-CEG) § 1º No caso dos alunos enquadrados nas modalidades de Transferência Externa e\nRetorno aos Portadores de Diploma de Curso de Graduação é possível validar na UDESC até 25% das Atividades Complementares realizadas na IES de origem. (excluído pela', 'Art. 5º O prazo para solicitar a validação das atividades complementares, via sistema acadêmico, deverá ocorrer 10 dias após o início do período letivo e, no mínimo, 20 dias antes da finalização do período letivo, conforme calendário acadêmico da UDESC.\nParagrafo único: As atividades complementares, assim como as atividades de creditação de extensão possuem similaridades, todavia, o acadêmico só poderá validar cada atividade uma única vez, escolhendo em qual componente curricular irá validar: ou atividades complementares ou creditação da extensão.\n(incluído pela Resolução nº 3/2022-CEG)']","De acordo com o Art. 4º, Parágrafo Único, os acadêmicos das modalidades de transferência interna, reingresso após abandono, ingresso e reingresso por novo concurso vestibular, transferência externa e retorno aos portadores de diploma de curso poderão validar o total das Atividades Complementares (ACC) já realizadas, desde que atendam aos demais critérios da Resolução.","Podem validar os acadêmicos que ingressaram por transferência interna ou externa, reingresso após abandono, novo vestibular ou retorno como portadores de diploma, desde que cumpram os demais critérios da resolução.",1.0,0.9020631387317227,0.99999999995,1.0,0.8761013548342786
