user_input,retrieved_contexts,response,reference,faithfulness,answer_relevancy,context_precision,context_recall,answer_correctness
Quem precisa assinar a autodeclaração dizendo que pertence ao grupo racial negro no vestibular da UDESC?,"['# Chunks do arquivo 067-2013-cni.pdf\n\n## Chunk 1\n```\nArt. 1º O caput do artigo 8° da Resolução n° 017/2011 – CONSUNI, passa a ter a seguinte redação, ficando suprimidos os parágrafos 1° e 2°: “\n\nArt. 8º Os candidatos classificados no vestibular para as vagas a que se refere o inciso II do art. 6º deverão assinar a autodeclaração de que são pertencentes ao grupo racial negro.”.\n\nArt. 2º O caput e os parágrafos 3° e 4° do artigo 9° da Resolução n° 017/2011 – CONSUNI, passam a ter a seguinte redação, ficando suprimidos os parágrafos 1° e 5° do mesmo artigo, nos seguintes termos: “\n\nArt. 9º A Comissão de Verificação se formará caso haja denúncias, para apurar os fatos denunciados e fornecer relatório à Pró-Reitoria de Extensão, Cultura e\nComunidade.\n§ 1º - Cada Comissão será constituída por 3 (três) membros e 1 (um) suplente.\n§ 2º - Poderão integrar a comissão professores e técnicos universitários da UDESC que participem de discussões sobre inclusão social, relações étnico-raciais e/ou tenham interesse de pesquisa ou extensão nessas áreas, bem como membros da comunidade que participem de associações, órgãos ou instituições ligados a questões étnico-raciais.\n§ 3º - Caberá à Pró-Reitoria de Extensão, Cultura e Comunidade a composição da\nComissão de Verificação.”. (NR)\n\nArt. 3º Esta Resolução entra em vigor nesta data.\n\nArt. 4º Ficam revogadas as disposições em contrário.\nFlorianópolis, 06 de dezembro de 2013.\nProf. Antonio Heronaldo de Souza\nReitor da UDESC\nUniversidade do Estado de Santa Catarina\nREITORIA UDESC\nAv. Madre Benvenuta, 2007 – Itacorubi – 88.035-001\nFlorianópolis SC Fone (48) 3231 1503 – www.udesc.br\n```', '# Chunks do arquivo 070-2016-cni.pdf\n\n## Chunk 1\n```\nArt. 1º Obedecido o disposto nesta Resolução, fica assegurada a inclusão do nome social de travestis e transexuais no ato de inscrição no vestibular e nos respectivos registros acadêmicos de todos os campi da Fundação Universidade do Estado de Santa Catarina – UDESC.\nParágrafo único. O nome social é a forma nominal definida por travestis e transexuais para serem identificados, nominados e referidos em seu meio social.\n\nArt. 1º Obedecido o disposto nesta Resolução, fica assegurada a inclusão do nome social de pessoas transgênero, travestis e transexuais no ato de inscrição no vestibular e nos respectivos registros acadêmicos de todos os campi da Fundação Universidade do Estado de Santa Catarina –\nUDESC.\nParágrafo único. O nome social é a forma nominal definida por pessoas transgênero, travestis e transexuais para serem identificadas, nominadas e referidas em seu meio social. (redação dada pela Resolução nº 25/2023-CONSUNI)\n\nArt. 2º O(a) acadêmico(a) maior de 18 (dezoito) anos poderá, no ato da matrícula ou a qualquer tempo, requerer à Secretaria de Ensino de Graduação ou à Secretaria de Ensino de Pós-\nGraduação de seu Centro, conforme o seu curso, a inclusão do seu nome social nos respectivos registros acadêmicos.\nParágrafo único. Caso o(a) acadêmico(a) solicitante não tenha atingido a maioridade, a inclusão do seu nome social nos registros acadêmicos somente será feita mediante autorização, por escrito, dos pais ou responsáveis legais.\n\nArt. 3º Uma vez feita à inclusão, o nome social deverá constar, juntamente com o nome civil, em todos os registros internos da UDESC.\n§ 1º Nos históricos escolares, certificados e diplomas constará apenas o nome civil.\n§ 1º Nos históricos escolares, certificados e diplomas constará em local de destaque, o nome social, precedido da correspondente expressão “NOME SOCIAL” e, logo abaixo (no campo de observações), a identificação civil. (redação dada pela Resolução nº 25/2023-CONSUNI) § 2º Nas declarações, atestados e diários de classe constarão o nome social e o nome civil, sendo que a comprovação da presença às aulas deverá ser feita utilizando-se somente o nome social.\n\nArt. 4º Na cerimônia de Colação de Grau, a outorga será realizada considerando o nome social, devendo constar da ata tanto o nome civil quanto o nome social.\nUniversidade do Estado de Santa Catarina\nREITORIA UDESC\nAv. Madre Benvenuta, 2007 – Itacorubi – 88.035-001\nFlorianópolis SC Fone (48) 3321 8000 – www.udesc.br\nParágrafo único. Em solenidades de entrega de premiações, certificados e assemelhados e em apresentações públicas deve ser aplicado o disposto no caput deste artigo.\n\nArt. 5º Nos sistemas de pagamento de bolsas, auxílios e editais a que o(a) acadêmico(a) com nome social incorporado aos registros acadêmicos venha a concorrer, será utilizado o nome civil, sendo que na divulgação da lista de contemplados poderá ser utilizado o nome social, desde que requerido pelo(a) acadêmico(a) e acompanhado do número do Cadastro de Pessoa Física - CPF.\n\nArt. 5º Nos sistemas de pagamento de bolsas, auxílios e editais a que o(a) acadêmico(a) com nome social incorporado aos registros acadêmicos venha a concorrer, serão utilizados tanto o nome social quanto o civil, sendo que na divulgação da lista de contemplados deverá ser utilizado apenas o nome social. (redação dada pela Resolução nº 25/2023-CONSUNI)\n\nArt. 6º A solicitação de uso do nome social no ato de inscrição no vestibular permitirá a inclusão desse nome, juntamente com o nome civil do(a) candidato(a), nas listas de frequência, listas de identificação e material de prova.\n§ 1º Na lista oficial de classificados(as) (listão) e nas convocações para manifestação de interesse presencial (chamadas subsequentes) será publicado somente o nome social, com o correspondente número de inscrição do(a) condidato(a) no vestibular.\n§ 2º Caso o(a) solicitante não tenha atingido a maioridade, a inclusão do seu nome social no ato de inscrição no vestibular somente será feita mediante autorização, por escrito, dos pais ou responsáveis legais.\n§ 3º A Coordenadoria de Vestibulares e Concursos – COVEST incluirá informações sobre o uso do nome social no edital do vestibular, conforme disciplinado nesta Resolução.\n\nArt. 7º Os casos omissos serão resolvidos pelo CONSUNI.\n\nArt. 8º Esta Resolução entra em vigor nesta data.\n\nArt. 9º Ficam revogadas as Resoluções nºs 02/2014-CONSUNI e 08/2014-CONSUNI.\nFlorianópolis, 02 de setembro de 2016.\nProf. Marcus Tomasi\nReitor\nUniversidade do Estado de Santa Catarina\nREITORIA UDESC\nAv. Madre Benvenuta, 2007 – Itacorubi – 88.035-001\nFlorianópolis SC Fone (48) 3321 8000 – www.udesc.br\n```', '# Chunks do arquivo 041-2001-cpe.pdf\n\n## Chunk 1\n```\nArt. 1° - É vedada ao aluno a matrícula e a freqüência simultânea em dois ou mais cursos de graduação da Fundação Universidade do Estado de Santa Catarina - UDESC.\n\nArt. 2° - O aluno que ingressar na UDESC a partir do primeiro semestre de 2002, seja por Concurso\nVestibular ou através de modalidade extra-Vestibular, e que já estiver matriculado em curso(s) de graduação da UDESC, deverá, no ato de matrícula, optar por apenas um dos cursos, declarando, expressa e formalmente, sua renúncia à vaga no(s) curso(s) não optado(s).\nParágrafo único: O disposto no ""caput"" não se aplica aos alunos que ingressaram nos cursos antes da edição desta Resolução.\n\nArt. 3° - Detectada a matrícula em dois ou mais cursos, o aluno será imediatamente chamado, mediante protocolo, para, no prazo de cinco dias úteis, efetuar a opção por um dos cursos.\nParágrafo único: Caso o aluno não proceda a opção no prazo estipulado, será tornada sem efeito a matrícula mais recente.\n\nArt. 4° - As instruções expressas nos Artigos anteriores deverão constar no Edital do Concurso\nVestibular Vocacionado UDESC.\n\nArt. 5° - Esta Resolução entra em vigor na presente data.\n\nArt. 6° - Revogam-se as disposições em contrário.\nFlorianópolis, 23 de outubro de 2001.\nProf. Raimundo Zumblick\nPresidente\n```', '## Chunk 5\n```\nCAPÍTULO V\nDO RETORNO AO PORTADOR DE DIPLOMA DE GRADUAÇÃO\nArt. 16. O(A) portador(a) de Diploma de graduação tem a possibilidade de retornar para cursar outra habilitação do mesmo curso concluído, ou, ingressar em outro curso de graduação de seu interesse, independente da existência de afinidade entre as áreas de conhecimento do curso pretendido com a do curso concluído.\nArt. 17. Os(As) acadêmicos(as) concluintes da UDESC, que desejam cursar nova habilitação ou novo curso, poderão no momento da solicitação estar cursando a última fase.\nParágrafo Único. Para realizar a matrícula, o(a) acadêmico(a) terá que apresentar documentação que ateste a conclusão do curso. No caso de apresentar o certificado na matrícula, o diploma e histórico escolar deverá ser apresentado em até 60 (sessenta) dias ou até o final de seu primeiro semestre de ingresso.\nArt. 18. Para o(a) acadêmico(a) que ingressar em curso de graduação da UDESC pela modalidade de Retorno ao Portador de Diploma de graduação, o início do tempo para integralização curricular será contado a partir do ingresso no curso em que obteve a vaga.\n```\n\n## Chunk 6\n```\nCAPÍTULO VI\nDOS REQUISITOS GERAIS PARA CONCESSÃO DE VAGA\nArt. 19. Para ingresso nos cursos de graduação da UDESC através das modalidades previstas nesta\nResolução, são necessários:\nI. existir vaga no curso, conforme divulgado no Edital de vagas;\nII. ingressar com a solicitação no período definido pelo Edital de vagas, apresentando a documentação necessária;\nIII. ser classificado em processo seletivo próprio.\n```\n\n## Chunk 7\n```\nCAPÍTULO VII\nDA ORDEM DE PRIORIDADE PARA CONCESSÃO DE VAGA\nArt. 20. A concessão de vaga nas modalidades de ingresso previstas nesta Resolução obedecerá à seguinte ordem de prioridade: 1. Reingresso após Abandono ou Cancelamento de Matrícula pelo(a) estudante e\nTransferências Internas, conforme a seguinte ordem: 1.1. Reingresso após Abandono ou Cancelamento para o mesmo curso de origem; 1.2. Transferência Interna com mudança de turno no mesmo curso da UDESC; 1.3. Transferência Interna com mudança de uma habilitação para outra no mesmo curso da\nUDESC ou nova formação (bacharelado ou licenciatura); 1.4. Transferência Interna para o mesmo curso com mudança de Centro de Ensino; 1.5. Transferência Interna com mudança de curso de uma mesma área de conhecimento ou áreas afins, de acordo com o Edital de vagas; 1.6. Reingresso após Abandono ou Cancelamento com Mudança de Turno, para curso de uma mesma área de conhecimento ou áreas afins, de acordo com o Edital de vagas; 1.7. Reingresso após Abandono ou Cancelamento com Mudança de uma habilitação para outra no mesmo curso da UDESC ou nova formação (bacharelado ou licenciatura); 1.8. Reingresso após Abandono ou Cancelamento para o mesmo curso com mudança de Centro de Ensino; 1.9. Reingresso após Abandono ou Cancelamento para Mudança de curso, para curso de uma mesma área de conhecimento ou áreas afins, de acordo com o Edital de vagas.\n2. Transferência externa, conforme a seguinte ordem: 2.1 Para o mesmo curso da instituição de origem; 2.2 Mudança de curso, para curso de uma mesma área de conhecimento ou áreas afins, de acordo com o Edital de vagas.\n3. Retorno aos Portadores de Diploma de graduação, respeitada a seguinte ordem: 3.1 Portadores de diploma de curso da UDESC para nova Habilitação, curso para a mesma área de conhecimento ou áreas afins; 3.2 Portadores de diploma de curso da UDESC para curso de graduação de outra área de conhecimento, de acordo com o Edital de vagas; 3.3 Portadores de diploma de graduação de outras Intituições de Ensino Superior (IES), para curso de uma mesma área de conhecimento, de acordo com o Edital de vagas; 3.4 Portadores de diploma de graduação de outras IES para curso de graduação de outra área de conhecimento, de acordo com o Edital de vagas.\n```', '# Chunks do arquivo 071-2016-cni.pdf\n\n## Chunk 1\n```\nArt. 1º Fica referendada “in totum” a Resolução nº 70/2016-CONSUNI, de 02 de setembro de 2016, que “Dispõe sobre o uso do nome social no ato de inscrição no vestibular e nos registros acadêmicos no âmbito da Fundação Universidade do Estado de Santa Catarina – UDESC.”\n\nArt. 2º Esta Resolução entra em vigor nesta data.\n\nArt. 3º Ficam revogadas as disposições em contrário.\nFlorianópolis, 13 de outubro de 2016.\nProf. Leandro Zvirtes\nVice - Presidente do CONSUNI no exercício da Presidência\nFundação Universidade do Estado de Santa Catarina\nAv. Madre Benvenuta, 2007 – Itacorubi – 88.035-001\nFlorianópolis SC Fone (48) 3321 8000 – www.udesc.br\n```', '## Chunk 10\n```\nCAPÍTULO X\nDA MATRÍCULA DOS APROVADOS\nArt. 28. O(A) candidato(a) classificado(a) numa das modalidades de ingresso previstas nesta\nResolução, deverá efetuar a sua matrícula junto à Secretaria de Ensino de Graduação do Centro no período estabelecido pelo Calendário Acadêmico da UDESC, divulgado no respectivo Edital de vagas.\n§ 1º A matrícula será feita pelo(a) próprio(a) candidato (a) ou por procurador(a) legalmente instituído(a) para esse ato.\n§ 2º O(A) candidato(a) deverá apresentar todos os documentos necessários à matrícula de acordo com a modalidade de ingresso.\n§ 3º Compete à Secretaria de Ensino de Graduação garantir a ordem da matrícula respeitando a classificação do(a) candidato(a).\nArt. 29. O(A) candidato (a) classificado(a) que não efetuar a matrícula no tempo estabelecido, perderá o direito à vaga no curso.\nParágrafo Único. Caso o(a) candidato(a) classificado(a) apresentar solicitação de desistência formal da vaga, será convocado(a) o(a) candidato(a) subsequente, por e-mail, respeitando-se a ordem de classificação para o preenchimento da vaga.\nArt. 30. Esta Resolução entra em vigor nesta data, revogando-se a Resolução nº 013/2017–\nCONSEPE e a Resolução nº 38/2019 – CONSEPE.\nFlorianópolis, 30 de maio de 2023.\nProfª. Drª. Gabriela Botelho Mager\nPresidente da CEG/CONSUN\n```']"," Candidatos classificados no vestibular para as vagas a que se refere o inciso II do art. 6º.

Fonte: RESOLUÇÃO Nº 67/2013-CNI, DE 06 DE DEZEMBRO DE 2013. Disponível em <https://www.udesc.br/resolucoes-consuni/consuni-resolucao-n-67-de-06-dedezembro-de-2013>. Acesso em 22 mar 2023. 

Observação: Este texto foi copiado diretamente do documento original disponibilizado online. 
```sql
SELECT DISTINCT",Os candidatos classificados nas vagas destinadas a pessoas negras precisam assinar a autodeclaração.,0.4,0.8247856786171459,0.9999999999,1.0,0.4530277842512607
Quando é que a UDESC forma uma Comissão de Verificação para analisar casos de cotas raciais?,"['# Chunks do arquivo 005-2009-cpe.pdf\n\n## Chunk 1\n```\nArt. 1º - Poderão matricular-se em disciplinas isoladas na Graduação, os alunos matriculados em cursos regulares da UDESC, desde que satisfaçam os requisitos exigidos, bem como qualquer pessoa da comunidade, desde que, além dos requisitos exigidos, atendam as normas estabelecidas para os cursos regulares no que se refere à escolaridade mínima.\n\nArt. 2° - Os alunos matriculados em disciplinas isoladas não integrarão o corpo discente regular da UDESC.\n\nArt. 3° - Poderão ser aceitas matrículas em no máximo 2 (duas) disciplinas isoladas por semestre, para cada solicitante.\nParágrafo único. Serão consideradas exceções outras situações que não estão incluídas nas rotinas acadêmicas como: matrículas em disciplinas orientadas; matrículas em disciplinas para alunos estrangeiros e, matrículas em disciplinas para alunos estrangeiros que necessitam validar o Diploma.\n\nArt. 4° - A partir das inscrições, caberá ao Colegiado de Ensino definir:\nI - disciplinas possíveis de serem cursadas pelo candidato;\nII - pré-requisitos;\nIII - número de vagas disponíveis;\nIV - procedimentos de matrícula;\nV - direitos e deveres, respeitados o Estatuto e Regimento Geral da UDESC e os termos da presente Resolução.\n\nArt. 5° - O aluno matriculado em disciplinas isoladas deverá submeter-se a verificação da aprendizagem, assegurando-lhe:\nI – o registro no histórico escolar, quando se tratar de aluno de outro curso da UDESC; e\nII – certificado de conclusão, de acordo com o Artigo 253 do Regimento Geral, quando se tratar de alunos da comunidade ou de outra instituição de ensino superior.\n\nArt. 6º – O registro e o controle Acadêmico dos alunos matriculados em disciplinas isoladas deverão ser feitos pela estrutura já existente no respectivo Centro.\n\nArt. 7º – Os alunos matriculados em disciplinas isoladas serão supervisionados pelo\nCoordenador de Colegiado de Ensino.\n\nArt. 8º – Os casos omissos serão analisados pelo Colegiado de Ensino.\n\nArt. 9º – Fica revogada a Resolução nº 016/2005-CONSEPE.\n\nArt. 10 – Esta Resolução entra em vigor nesta data.\nFlorianópolis, 07 de abril de 2009\nProfessora Sandra Makowiecky\nPresidente\n```', '# Chunks do arquivo 067-2013-cni.pdf\n\n## Chunk 1\n```\nArt. 1º O caput do artigo 8° da Resolução n° 017/2011 – CONSUNI, passa a ter a seguinte redação, ficando suprimidos os parágrafos 1° e 2°: “\n\nArt. 8º Os candidatos classificados no vestibular para as vagas a que se refere o inciso II do art. 6º deverão assinar a autodeclaração de que são pertencentes ao grupo racial negro.”.\n\nArt. 2º O caput e os parágrafos 3° e 4° do artigo 9° da Resolução n° 017/2011 – CONSUNI, passam a ter a seguinte redação, ficando suprimidos os parágrafos 1° e 5° do mesmo artigo, nos seguintes termos: “\n\nArt. 9º A Comissão de Verificação se formará caso haja denúncias, para apurar os fatos denunciados e fornecer relatório à Pró-Reitoria de Extensão, Cultura e\nComunidade.\n§ 1º - Cada Comissão será constituída por 3 (três) membros e 1 (um) suplente.\n§ 2º - Poderão integrar a comissão professores e técnicos universitários da UDESC que participem de discussões sobre inclusão social, relações étnico-raciais e/ou tenham interesse de pesquisa ou extensão nessas áreas, bem como membros da comunidade que participem de associações, órgãos ou instituições ligados a questões étnico-raciais.\n§ 3º - Caberá à Pró-Reitoria de Extensão, Cultura e Comunidade a composição da\nComissão de Verificação.”. (NR)\n\nArt. 3º Esta Resolução entra em vigor nesta data.\n\nArt. 4º Ficam revogadas as disposições em contrário.\nFlorianópolis, 06 de dezembro de 2013.\nProf. Antonio Heronaldo de Souza\nReitor da UDESC\nUniversidade do Estado de Santa Catarina\nREITORIA UDESC\nAv. Madre Benvenuta, 2007 – Itacorubi – 88.035-001\nFlorianópolis SC Fone (48) 3231 1503 – www.udesc.br\n```', '# Chunks do arquivo 009-2021-ceg.pdf\n\n## Chunk 1\n```\nArt. 1º O(A) acadêmico(a) que retornar de programa de mobilidade autorizado pela UDESC, poderá obter a validação de disciplina do currículo de seu curso, desde que atenda aos requisitos estabelecidos nesta Resolução.\nParágrafo único. Entende-se por disciplina todos os componentes curriculares obrigatórios do curso, exceto as atividades complementares que tem legislação específica.\n\nArt. 2º A validação de disciplina será efetuada quando o programa da disciplina cursada na instituição de origem corresponder a, no mínimo, 75% do conteúdo e da carga horária da disciplina que o(a) acadêmico(a) deveria cumprir na UDESC.\nParágrafo Único. Poderão ser utilizados conteúdos de várias disciplinas para o aproveitamento de estudos.\n\nArt. 3º São possíveis de validação de disciplina, os seguintes estudos concluídos pelo(a) acadêmico(a):\nI – Disciplina cursada com aproveitamento em curso superior, proveniente de curso de graduação, de curso sequencial que conduz a diploma e de curso de pós-graduação (especialização, mestrado ou doutorado);\nII – Estágio Curricular Supervisionado e Trabalho de Conclusão de Curso.\nParágrafo Único. Compete ao Núcleo Docente Estruturante – NDE do departamento, junto com a Coordenação de Estágio, definir critérios para proceder a validação dos estudos previstos no inciso II.\n\nArt. 4º O(A) acadêmico(a) ao encerrar o período de realização de estudos em outra instituição, poderá solicitar a validação de disciplina, via requerimento, acompanhado dos seguintes documentos:\nI - Histórico Escolar e/ou Certidão de disciplina(s) cursada(s), onde conste a identificação da\nIES e do curso; a denominação da disciplina e demais componentes curriculares; a carga horária e a nota/conceito de cada componente curricular citado no Histórico Escolar e/ou Certidão.\nII - Programa e/ou Plano de Ensino da(s) disciplina(s) cursada(s).\n§ 1º É facultada a solicitação de comprovação da autenticidade - Histórico Escolar e/ou\nCertidão de disciplina(s) cursada(s); Programa e/ou Plano de Ensino da(s) disciplina(s) cursada(s) pela Secretaria de Cooperação Interinstitucional e Internacional (SCII).\nFundação Universidade do Estado de Santa Catarina\nAv. Madre Benvenuta, 2007 – Itacorubi – Florianópolis, SC\nCep: 88035-001 – Fone (48) 3664 8000 – www.udesc.br § 2º É facultada a tradução juramentada dos documentos, a não ser que seja solicitada pelo(a) Chefe(a) de Departamento ou pelo(a) professor(a) envolvido(a) no processo de validação de disciplina.\n\nArt. 5º O requerimento para a validação de disciplina deverá ser recebido pela Secretaria de\nEnsino de Graduação e, posteriormente, remetido ao (a) Chefe do Departamento para decisão.\n§ 1º A validação de disciplina será analisada pelo (a) Chefe (a) do Departamento do curso de graduação onde o (a) acadêmico (a) está matriculado (a).\n§ 2º É facultado ao (a) Chefe (a) do Departamento, solicitar análise e parecer de professor(a) da área a respeito da equivalência.\n§ 3º O (A) Chefe (a) de Departamento, após tomada a decisão, no prazo máximo de 20 (vinte) dias, encaminhará a solicitação à Secretaria de Ensino de Graduação para registro e arquivamento.\n\nArt. 6º A validação de disciplina de que trata esta Resolução visa exclusivamente à integralização do currículo do curso de graduação da UDESC.\nI - Ao invés da nota/conceito obtida será registrado o termo “validada” e em campo específico as informações da disciplina e a nota obtida na IES de origem;\nII - Para efeitos de ranqueamento, média e outros cálculos, a disciplina que foi validada será desconsiderada.\nParágrafo Único. O estudo realizado que não apresentar equivalência com o currículo do curso do (a) acadêmico (a) não será registrado no Histórico Escolar.\n\nArt. 7º Os casos omissos serão resolvidos pela Pró-Reitoria de Ensino.\n\nArt. 8º Esta Resolução entra em vigor após a sua aprovação, revogando-se a Resolução nº 047/2014 CONSEPE.\nFlorianópolis, 09 de novembro de 2021.\nProfessor Nério Amboni\nPresidente da CEG\nFundação Universidade do Estado de Santa Catarina\nAv. Madre Benvenuta, 2007 – Itacorubi – Florianópolis, SC\nCep: 88035-001 – Fone (48) 3664 8000 – www.udesc.br\n```', '## Chunk 1\n```\nArt. 1º - O aluno que tenha extraordinário aproveitamento nos estudos, demonstrado por Exame de Suficiência de que trata a presente Resolução, poderá ter abreviada a duração de seus cursos.\n\nArt. 2º - O Exame de Suficiência consiste em oportunidade de progressão curricular através de avaliação de conhecimentos e habilidades das quais o aluno é portador e que são objeto de estudo e preparação por determinada disciplina, visando detectar alunos com excelência de domínio na área de conhecimento em questão, não adquirida de forma autodidata e nem através de conhecimentos formais do ensino médio.\nParágrafo Único - No que se refere ao ensino médio, as exceções se fazem para as áreas definidas nesta Resolução.\n\nArt. 3º - Cada curso disponibilizará a relação das disciplinas aptas à realização de exame de suficiência.\n\nArt. 4º - As disciplinas sujeitas à aplicação de Exame de Suficiência serão definidas pelo Colegiado de Curso, respeitadas as especificidades de cada curso.\n\nArt. 5º - As disciplinas devem ter características específicas de habilidades e conhecimentos que podem ser adquiridos em cursos não universitários compreendendo línguas, fotografia, computação, instrumentos musicais, desenho técnico, bem como práticas esportivas.\nParágrafo Único - Em disciplinas de caráter teórico-prático, como o exemplo das práticas desportivas é facultado ao Colegiado de Curso optar pela dispensa parcial ou integral.\n\nArt. 6º - A aprovação em Exame de Suficiência de uma disciplina dispensa o aluno de cursá-la na forma regular, sendo-lhe atribuídos os respectivos créditos.\n\nArt. 7º - A Direção Geral do Centro, anualmente, obedecendo ao prazo estabelecido no\nCalendário Acadêmico da UDESC, expedirá edital de chamada para o referido Exame, indicando:\nI. Disciplinas ofertadas para avaliação nesta modalidade;\nII. Período e requisitos para inscrição;\nIII. Data de divulgação das inscrições deferidas e indeferidas.\n\nArt. 8º - O aluno interessado em realizar Exame de Suficiência deverá efetuar a inscrição junto à Secretaria Acadêmica do Centro.\n\nArt. 9º - É permitido ao aluno, no mesmo semestre, inscrever-se em uma ou mais disciplinas, desde que atenda as seguintes condições:\nI. Ter cumprido os pré-requisitos estabelecidos para matrícula na referida disciplina;\nII. Não ter sido reprovado na disciplina;\nIII. Não ter realizado Exame de Suficiência para a mesma disciplina ou disciplina equivalente a ela;\nIV. Não ter faltado ao Exame de Suficiência nos semestres anteriores;\nV. Anexar a sua inscrição documentos que atestem ser portador de conhecimento, habilidade ou competência relativa à disciplina.\n§ 1º - Caso o aluno se inscreva para Exame de Suficiência, simultaneamente, em disciplinas que guardam entre si relação de pré-requisito, só poderá realizar a avaliação caso atenda, antecipadamente, o previsto no inciso I deste artigo.\n§ 2º - O não comparecimento a Exame de Suficiência a que o aluno se inscreveu, se por motivos e situações previstas em Lei, não é considerado efetiva realização do Exame, para efeitos do que dispõe o inciso III deste artigo.\n§ 3º - O aluno que se inscreveu e não compareceu por motivos e situações previstas em Lei, poderá requerer a 2ª inscrição no semestre subseqüente, na Secretaria Acadêmica do\nCentro.\n§ 4º - Perde o direito de requerer a 2ª inscrição para a mesma disciplina o aluno que faltar sem justificativa.\n§ 5º - A inscrição do aluno para Exame de Suficiência será analisada pela Secretaria\nAcadêmica, para deferimento, se atendidas as condições expressas neste artigo.\n§ 6º - Se a inscrição for deferida a Secretaria Acadêmica encaminhará a solicitação ao\nCoordenador de Curso.\n\nArt. 10 - O Exame de Suficiência será aplicado por Banca Examinadora especial e/ou delegação de competência, designada pelo Coordenador de Curso.\n\nArt. 11 - Após a divulgação da relação de inscrições deferidas, a Secretaria Acadêmica divulgará a data, o horário, o local e os responsáveis pela aplicação do exame de suficiência, por disciplina.\n\nArt. 12 - O Exame de Suficiência manterá o mesmo grau de amplitude e profundidade exigido dos alunos com matrícula presencial, atribuindo nota de 0 (zero) a 10 (dez), com um decimal.\nParágrafo único - Será considerado aprovado no Exame de Suficiência o aluno que alcançar nota igual ou superior a 7,0 (sete vírgula zero).\n\nArt. 13 - Após aplicação do Exame de Suficiência, a Secretaria Acadêmica efetuará o registro das notas dos alunos.\n\nArt. 14 - A aprovação em uma disciplina através de Exame de Suficiência será registrada no Histórico Escolar do aluno, mediante referência expressa da forma de obtenção dos respectivos créditos.\n\nArt. 15 - Os casos omissos serão deliberados pelo Conselho de Ensino, Pesquisa e\nExtensão – CONSEPE.\n\nArt. 16 - Esta Resolução entra em vigor nesta data.\n\nArt. 17 - Fica revogada a Resolução Nº 020/2001 - CONSEPE e demais disposições em contrário.\nFlorianópolis, 18 de outubro de 2004.\nProf. Anselmo Fábio de Moraes\nPresidente\n```', '## Chunk 1\n```\nCAPÍTULO I\nDA MATRÍCULA\nArt. 1º A matrícula é a ação do(a) estudante manifestando interesse em permanecer como acadêmico(a) da universidade.\nArt. 2º A matrícula vincula o(a) acadêmico(a) à UDESC e poderá apresentar as seguintes situações:\nI – ativa (com vínculo em disciplina ou sem vínculo com disciplina);\nII – suspensa;\nIII – trancada;\nIV – cancelada;\nV – em abandono de curso ou\nVI – em mobilidade acadêmica.\nArt. 3º Os(As) candidatos à matrícula nos cursos de graduação oferecidos pela UDESC deverão requerê-la, para cada período regular, dentro do prazo previsto pelo Calendário\nAcadêmico da Universidade.\n§ 1º A matrícula é semestral e vincula o(a) acadêmico(a) à UDESC, devendo cada interessado requerê-la, para cada período letivo regular.\n§ 2º A matrícula deverá ser sempre renovada antes do início de cada período letivo, conforme o Calendário Acadêmico.\n§ 3º A desistência de matrícula em uma ou mais disciplinas pode ser requerida pelo(a) acadêmico(a), obedecendo-se o prazo estabelecido no Calendário Acadêmico.\n§ 3º A desmatrícula em uma ou mais disciplinas pode ser requerida pelo/a acadêmico/a, obedecendo-se o prazo estabelecido no Calendário Acadêmico. (redação dada pela Resolução nº 8/2022-CEG) § 4º A desistência de matrícula em uma ou mais disciplinas será possível fora do período estabelecido no calendário acadêmico quando o acadêmico apresentar solicitação com comprovação que justifique motivo de doença do interessado ou parentes de 1º Grau ou motivo de força maior, aprovado pela Direção de Ensino de Graduação. (incluído pela Resolução nº 44/2015-CONSEPE) § 4º Excepcionalmente, a desistência de matrícula em uma ou mais disciplinas será possível fora do período estabelecido no calendário acadêmico, quando justificada e comprovada pelo/a acadêmico/a e aprovado pela Chefia do Departamento. (redação dada pela\nResolução nº 27/2019-CONSEPE)\nRes. 005/2014-CONSEPE, fl. 1 de 8\nUniversidade do Estado de Santa Catarina\nREITORIA UDESC\nAv. Madre Benvenuta, 2007 – Itacorubi – 88.035-001\nFlorianópolis SC Fone (48) 3231 1503 – www.udesc.br § 4º Excepcionalmente, a desmatrícula em uma ou mais disciplinas em curso será possível fora do período estabelecido no calendário acadêmico até 15 dias antes do encerramento do período letivo, devendo o/a acadêmico/a enviar a solicitação devidamente justificada e comprovada através do Sistema Acadêmico, cabendo à Chefia do Departamento a análise da solicitação. (redação dada pela Resolução nº 8/2022-CEG) § 5º Entende-se como motivo de força maior, fatos externos que podem ser de ordem de autoridade, fenômenos naturais e ocorrências políticas. (incluído pela Resolução nº 44/2015-CONSEPE) § 5º A solicitação e a justificativa comprovada devem dar entrada na Secretaria de\nEnsino de Graduação para registro e encaminhamento à Chefia de Departamento para análise e parecer. (redação dada pela Resolução nº 27/2019-CONSEPE) (suprimido pela Resolução nº 8/2022-CEG)\nArt. 4º O(A) discente de graduação da UDESC deve matricular-se, por semestre, em um número de créditos igual ou inferior ao definido na fórmula abaixo:\nMaxM = MaxF x 1,25, onde:\nMaxM = número máximo de créditos que um(a) discente pode cursar por semestre;\nMaxF = número de créditos da fase com maior carga horária da matriz curricular vigente do curso, excluindo-se os créditos de disciplinas de estágio e trabalho de conclusão de curso.\n§ 1° Sempre que MaxM não resultar em um número inteiro procede-se o arredondamento para o número inteiro imediatamente superior, independente do valor dos decimais a desprezar.\n§ 2° O Colegiado Pleno do Departamento promoverá as adaptações necessárias para o atendimento do disposto no art. 4º, podendo aceitar matrículas de discentes formandos ou pertencentes a matrizes em extinção em um número de créditos até 20% superior ao estipulado neste artigo.\n§ 3º O Colegiado Pleno do Departamento poderá promover adaptações necessárias para o atendimento do disposto no art. 4º, podendo aceitar matrículas de discentes em um número superior de créditos quando a matrícula incluir estágio curricular obrigatório. (incluído pela Resolução nº 08/2015-CONSEPE) § 3º A carga horária de estágio curricular obrigatório não será considerada no limite do número de créditos em disciplinas que um acadêmico pode cursar no semestre, permitindo-se assim que o acadêmico curse o Estágio Curricular Supervisionado e o número máximo de créditos em disciplinas definidos no caput deste artigo, exceto para os cursos nos quais esta restrição for aprovada pelo Colegiado Pleno do Departamento. (redação dada pela Resolução nº 26/2015-CONSEPE)\nArt. 5º Não existe número mínimo de créditos em que o(a) discente deverá se matricular, exceto para o(a) ingressante via Processo Seletivo da UDESC ou via o Sistema de\nSeleção Unificada (SISU) cuja matrícula deverá ser em todas as disciplinas da 1ª fase do seu curso.', '## Chunk 7\n```\nCAPÍTULO VI\nDa Convocação pela Justiça Eleitoral\nArt. 6º A participação do acadêmico que for convocado pela Justiça Eleitoral para atuar em processo eleitoral, será considerada atividade curricular regular, para efeito de apuração de frequência, até o limite máximo de 25% das aulas ministradas em cada disciplina.\nParágrafo Único. Cabe ao acadêmico comprovar o período de convocação e a participação, mediante declaração formalizada pela entidade competente.\n```\n\n## Chunk 8\n```\nCAPÍTULO VII\nDo acadêmico ingressante\nArt 7º O acadêmico ingressante que for matriculado após o início do semestre letivo terá no registro da frequência nos dias que não pode comparecer a situação de “dispensa” e esta não será contabilizada para o cálculo do cumprimento do mínimo de 75% de frequência.\n```\n\n## Chunk 9\n```\nCAPÍTULO VIII\nDa Mobilidade Acadêmica\nArt 8º No semestre de retorno do acadêmico da UDESC que está oficialmente em\nMobilidade Acadêmica em outra IES, com calendário acadêmico diferenciado da UDESC, este terá seu registro de frequência dos dias que não comparecer à UDESC na situação de “dispensa”, e esta não será contabilizada para o cálculo do cumprimento de 75 % de frequência.\n§1º Compete ao acadêmico a apresentação de documento que comprove o comparecimento as atividades em outra IES resultantes do programa de mobilidade oficialmente reconhecido pela UDESC.\n§2º Compete à Secretaria de Ensino de Graduação e/ou Departamento a análise da pertinência e emissão de documento para a dispensa.\nArt. 9º O acadêmico poderá acumular um máximo de 25% da carga horária de cada disciplina nas situações previstas nesta resolução.\nParágrafo Único. Excetuam-se do caput deste artigo os casos previstos no Art. 2º e Art.\n5º.\nArt 10. O requerimento, conforme estabelecido pela PROEN, devidamente justificado e comprovado, deve ser apresentado pelo próprio acadêmico à Secretaria de Ensino de\nGraduação e/ou Secretaria do Departamento, no prazo máximo de até 05 dias úteis após o término do acontecimento do evento/atividade.\n§1º Caso o requerimento seja deferido, a Secretaria de Ensino de Graduação e/ou\nSecretaria do Departamento encaminhará expediente ao professor da disciplina para que sejam realizadas as anotações adequadas no Sistema de Gestão Acadêmica, em relação ao registro da frequência do acadêmico.\n§2º No caso de indeferimento, a Secretaria de Ensino de Graduação e/ou Secretaria do\nDepartamento dará ciência ao requerente.\nFundação Universidade do Estado de Santa Catarina\nAv. Madre Benvenuta, 2007 – Itacorubi – 88.035-001\nFlorianópolis SC Fone (48) 3321 8000 – www.udesc.br\nArt. 11. Os casos omissos nesta Resolução serão resolvidos pela Direção de Ensino de\nGraduação.\nArt. 12. Esta Resolução entra em vigor no semestre subsequente a sua aprovação, revogadas as demais disposições em contrário.\nFlorianópolis, 03 de novembro de 2015.\nProfessor Luciano Emilio Hack\nPresidente do CONSEPE\nFundação Universidade do Estado de Santa Catarina\nAv. Madre Benvenuta, 2007 – Itacorubi – 88.035-001\nFlorianópolis SC Fone (48) 3321 8000 – www.udesc.br\n```']"," 
O texto menciona que a UDESC forma uma comissão de verificação em dois momentos:

1. Quando há denúncia de irregularidades relacionadas às cotas raciais, conforme descrito no Capítulo V da Resolução nº 017/2011-CNI.
2. Quando há necessidade de verificar a autenticidade de diplomas e certidões emitidos por outras instituições, conforme descrito no Parágrafo Único do Artigo 4º da Resolução nº 027/2019-CONSEPE.

Portanto, a resposta correta seria",A Comissão de Verificação é formada apenas quando há denúncias sobre possíveis irregularidades nas autodeclarações.,0.25,0.944148739752339,0.49999999995,1.0,0.4613374295807077
Quantas vagas do vestibular da UDESC são reservadas para quem estudou todo o ensino médio em escola pública?,"['# Chunks do arquivo 067-2013-cni.pdf\n\n## Chunk 1\n```\nArt. 1º O caput do artigo 8° da Resolução n° 017/2011 – CONSUNI, passa a ter a seguinte redação, ficando suprimidos os parágrafos 1° e 2°: “\n\nArt. 8º Os candidatos classificados no vestibular para as vagas a que se refere o inciso II do art. 6º deverão assinar a autodeclaração de que são pertencentes ao grupo racial negro.”.\n\nArt. 2º O caput e os parágrafos 3° e 4° do artigo 9° da Resolução n° 017/2011 – CONSUNI, passam a ter a seguinte redação, ficando suprimidos os parágrafos 1° e 5° do mesmo artigo, nos seguintes termos: “\n\nArt. 9º A Comissão de Verificação se formará caso haja denúncias, para apurar os fatos denunciados e fornecer relatório à Pró-Reitoria de Extensão, Cultura e\nComunidade.\n§ 1º - Cada Comissão será constituída por 3 (três) membros e 1 (um) suplente.\n§ 2º - Poderão integrar a comissão professores e técnicos universitários da UDESC que participem de discussões sobre inclusão social, relações étnico-raciais e/ou tenham interesse de pesquisa ou extensão nessas áreas, bem como membros da comunidade que participem de associações, órgãos ou instituições ligados a questões étnico-raciais.\n§ 3º - Caberá à Pró-Reitoria de Extensão, Cultura e Comunidade a composição da\nComissão de Verificação.”. (NR)\n\nArt. 3º Esta Resolução entra em vigor nesta data.\n\nArt. 4º Ficam revogadas as disposições em contrário.\nFlorianópolis, 06 de dezembro de 2013.\nProf. Antonio Heronaldo de Souza\nReitor da UDESC\nUniversidade do Estado de Santa Catarina\nREITORIA UDESC\nAv. Madre Benvenuta, 2007 – Itacorubi – 88.035-001\nFlorianópolis SC Fone (48) 3231 1503 – www.udesc.br\n```', '# Chunks do arquivo 009-2021-ceg.pdf\n\n## Chunk 1\n```\nArt. 1º O(A) acadêmico(a) que retornar de programa de mobilidade autorizado pela UDESC, poderá obter a validação de disciplina do currículo de seu curso, desde que atenda aos requisitos estabelecidos nesta Resolução.\nParágrafo único. Entende-se por disciplina todos os componentes curriculares obrigatórios do curso, exceto as atividades complementares que tem legislação específica.\n\nArt. 2º A validação de disciplina será efetuada quando o programa da disciplina cursada na instituição de origem corresponder a, no mínimo, 75% do conteúdo e da carga horária da disciplina que o(a) acadêmico(a) deveria cumprir na UDESC.\nParágrafo Único. Poderão ser utilizados conteúdos de várias disciplinas para o aproveitamento de estudos.\n\nArt. 3º São possíveis de validação de disciplina, os seguintes estudos concluídos pelo(a) acadêmico(a):\nI – Disciplina cursada com aproveitamento em curso superior, proveniente de curso de graduação, de curso sequencial que conduz a diploma e de curso de pós-graduação (especialização, mestrado ou doutorado);\nII – Estágio Curricular Supervisionado e Trabalho de Conclusão de Curso.\nParágrafo Único. Compete ao Núcleo Docente Estruturante – NDE do departamento, junto com a Coordenação de Estágio, definir critérios para proceder a validação dos estudos previstos no inciso II.\n\nArt. 4º O(A) acadêmico(a) ao encerrar o período de realização de estudos em outra instituição, poderá solicitar a validação de disciplina, via requerimento, acompanhado dos seguintes documentos:\nI - Histórico Escolar e/ou Certidão de disciplina(s) cursada(s), onde conste a identificação da\nIES e do curso; a denominação da disciplina e demais componentes curriculares; a carga horária e a nota/conceito de cada componente curricular citado no Histórico Escolar e/ou Certidão.\nII - Programa e/ou Plano de Ensino da(s) disciplina(s) cursada(s).\n§ 1º É facultada a solicitação de comprovação da autenticidade - Histórico Escolar e/ou\nCertidão de disciplina(s) cursada(s); Programa e/ou Plano de Ensino da(s) disciplina(s) cursada(s) pela Secretaria de Cooperação Interinstitucional e Internacional (SCII).\nFundação Universidade do Estado de Santa Catarina\nAv. Madre Benvenuta, 2007 – Itacorubi – Florianópolis, SC\nCep: 88035-001 – Fone (48) 3664 8000 – www.udesc.br § 2º É facultada a tradução juramentada dos documentos, a não ser que seja solicitada pelo(a) Chefe(a) de Departamento ou pelo(a) professor(a) envolvido(a) no processo de validação de disciplina.\n\nArt. 5º O requerimento para a validação de disciplina deverá ser recebido pela Secretaria de\nEnsino de Graduação e, posteriormente, remetido ao (a) Chefe do Departamento para decisão.\n§ 1º A validação de disciplina será analisada pelo (a) Chefe (a) do Departamento do curso de graduação onde o (a) acadêmico (a) está matriculado (a).\n§ 2º É facultado ao (a) Chefe (a) do Departamento, solicitar análise e parecer de professor(a) da área a respeito da equivalência.\n§ 3º O (A) Chefe (a) de Departamento, após tomada a decisão, no prazo máximo de 20 (vinte) dias, encaminhará a solicitação à Secretaria de Ensino de Graduação para registro e arquivamento.\n\nArt. 6º A validação de disciplina de que trata esta Resolução visa exclusivamente à integralização do currículo do curso de graduação da UDESC.\nI - Ao invés da nota/conceito obtida será registrado o termo “validada” e em campo específico as informações da disciplina e a nota obtida na IES de origem;\nII - Para efeitos de ranqueamento, média e outros cálculos, a disciplina que foi validada será desconsiderada.\nParágrafo Único. O estudo realizado que não apresentar equivalência com o currículo do curso do (a) acadêmico (a) não será registrado no Histórico Escolar.\n\nArt. 7º Os casos omissos serão resolvidos pela Pró-Reitoria de Ensino.\n\nArt. 8º Esta Resolução entra em vigor após a sua aprovação, revogando-se a Resolução nº 047/2014 CONSEPE.\nFlorianópolis, 09 de novembro de 2021.\nProfessor Nério Amboni\nPresidente da CEG\nFundação Universidade do Estado de Santa Catarina\nAv. Madre Benvenuta, 2007 – Itacorubi – Florianópolis, SC\nCep: 88035-001 – Fone (48) 3664 8000 – www.udesc.br\n```', '# Chunks do arquivo 008-2022-ceg.pdf\n\n## Chunk 1\n```\nArt. 1º Os §§ 3º e 4º do art. 3º da Resolução nº 05/2014 - CONSEPE, que “Dispõe sobre as normas e os procedimentos para a matrícula de acadêmicos nos cursos de graduação da UDESC.”, passam a vigorar com as seguintes redações: “\n\nArt. 3º (...) § 3º A desmatrícula em uma ou mais disciplinas pode ser requerida pelo/aacadêmico/a,obedecendo-se o prazo estabelecido no Calendário Acadêmico.\n§ 4º Excepcionalmente, a desmatrícula em uma ou mais disciplinas em curso será possível fora do período estabelecido no calendário acadêmico até 15 dias antes do encerramento do período letivo, devendo o/a acadêmico/a enviar a solicitação devidamente justificada e comprovada através do Sistema Acadêmico, cabendo à Chefia do Departamento a análise da solicitação.”\n\nArt. 2º Fica suprimido o § 5º do art. 3º da Resolução nº 05/2014 - CONSEPE, que “Dispõe sobre as normas e os procedimentos para a matrícula de acadêmicos nos cursos de graduação da UDESC.”.\n\nArt. 3º O § 8º do art. 13 da Resolução nº 05/2014-CONSEPE, que “Dispõe sobre as normas e os procedimentos para a matrícula de acadêmicos nos cursos de graduação da UDESC.”, passa a vigorar com a seguinte redação: “\n\nArt. 13 (...) § 8º O/A aluno/a regularmente matriculado/a no semestre em curso, poderá realizar a solicitação de trancamento de matrícula fora do período estabelecido no calendário até 15 dias antes do encerramento do período letivo, devendo o/a acadêmico/a enviar a solicitação devidamente justificada e comprovada através do Sistema Acadêmico, cabendo à Chefia do\nDepartamento a análise da solicitação.”\n\nArt. 4º Fica suprimido o § 9º do art. 13 da Resolução nº 05/2014 - CONSEPE, que “Dispõe sobre as normas e os procedimentos para a matrícula de acadêmicos nos cursos de graduação da UDESC.”.\n\nArt. 5º Ficam suprimidos o inciso III e os §§ 3º e 4º do art. 21 da Resolução nº 05/2014 -\nCONSEPE, que “Dispõe sobre as normas e os procedimentos para a matrícula de acadêmicos nos cursos de graduação da UDESC.”.\nFundação Universidade do Estado de Santa Catarina - UDESC\nAv. Madre Benvenuta, 2007 – Itacorubi – Florianópolis SC\nCEP 88.035-901 - Fone (48) 3664 8000 – www.udesc.br\n\nArt. 6º Esta Resolução entra em vigor nesta data, revogando-se as disposições em contrário.\nFlorianópolis, 26 de julho de 2022.\nProfessora Drª Sandra Makowiecky\nPresidente da Câmara de Ensino de Graduação - CEG\nFundação Universidade do Estado de Santa Catarina - UDESC\nAv. Madre Benvenuta, 2007 – Itacorubi – Florianópolis SC\nCEP 88.035-901 - Fone (48) 3664 8000 – www.udesc.br\n```', '# Chunks do arquivo 005-2009-cpe.pdf\n\n## Chunk 1\n```\nArt. 1º - Poderão matricular-se em disciplinas isoladas na Graduação, os alunos matriculados em cursos regulares da UDESC, desde que satisfaçam os requisitos exigidos, bem como qualquer pessoa da comunidade, desde que, além dos requisitos exigidos, atendam as normas estabelecidas para os cursos regulares no que se refere à escolaridade mínima.\n\nArt. 2° - Os alunos matriculados em disciplinas isoladas não integrarão o corpo discente regular da UDESC.\n\nArt. 3° - Poderão ser aceitas matrículas em no máximo 2 (duas) disciplinas isoladas por semestre, para cada solicitante.\nParágrafo único. Serão consideradas exceções outras situações que não estão incluídas nas rotinas acadêmicas como: matrículas em disciplinas orientadas; matrículas em disciplinas para alunos estrangeiros e, matrículas em disciplinas para alunos estrangeiros que necessitam validar o Diploma.\n\nArt. 4° - A partir das inscrições, caberá ao Colegiado de Ensino definir:\nI - disciplinas possíveis de serem cursadas pelo candidato;\nII - pré-requisitos;\nIII - número de vagas disponíveis;\nIV - procedimentos de matrícula;\nV - direitos e deveres, respeitados o Estatuto e Regimento Geral da UDESC e os termos da presente Resolução.\n\nArt. 5° - O aluno matriculado em disciplinas isoladas deverá submeter-se a verificação da aprendizagem, assegurando-lhe:\nI – o registro no histórico escolar, quando se tratar de aluno de outro curso da UDESC; e\nII – certificado de conclusão, de acordo com o Artigo 253 do Regimento Geral, quando se tratar de alunos da comunidade ou de outra instituição de ensino superior.\n\nArt. 6º – O registro e o controle Acadêmico dos alunos matriculados em disciplinas isoladas deverão ser feitos pela estrutura já existente no respectivo Centro.\n\nArt. 7º – Os alunos matriculados em disciplinas isoladas serão supervisionados pelo\nCoordenador de Colegiado de Ensino.\n\nArt. 8º – Os casos omissos serão analisados pelo Colegiado de Ensino.\n\nArt. 9º – Fica revogada a Resolução nº 016/2005-CONSEPE.\n\nArt. 10 – Esta Resolução entra em vigor nesta data.\nFlorianópolis, 07 de abril de 2009\nProfessora Sandra Makowiecky\nPresidente\n```', '# Chunks do arquivo 039-2015-cpe.pdf\n\n## Chunk 1\n```\nArt. 1º - O acadêmico regularmente matriculado que deixar de comparecer a qualquer das avaliações nas datas fixadas pelo professor, poderá solicitar segunda chamada desta avaliação através de requerimento por ele assinado, ou por seu representante legal, entregue na Secretaria de Ensino de\nGraduação e/ou Secretaria do Departamento, no prazo de 5 (cinco) dias úteis, contados a partir da data de realização da avaliação, sendo aceitos pedidos, devidamente comprovados e que se enquadrem em um das seguintes situações:\nI - problema de saúde do aluno ou parente de 1º grau, devidamente comprovado, que justifique a ausência;\nII - ter sido vítima de ação involuntária provocada por terceiros, comprovada por Boletim de\nOcorrência ou documento equivalente;\nIII - manobras ou exercícios militares comprovados por documento da respectiva unidade militar;\nIV - luto, comprovado pelo respectivo atestado de óbito, por parentes em linha reta (pais, avós, filhos e netos), colaterais até o segundo grau (irmãos e tios), cônjuge ou companheiro (a), com prazo de até 5 (cinco) dias úteis após o óbito;\nV - convocação, coincidente em horário, para depoimento judicial ou policial, ou para eleições em entidades oficiais, devidamente comprovada por declaração da autoridade competente;\nVI - impedimentos gerados por atividades previstas e autorizadas pela Chefia de Departamento do respectivo curso ou instância hierárquica superior, comprovada através de declaração ou documento equivalente;\nVII - direitos outorgados por lei;\nVIII - coincidência de horário de outras avaliações do próprio curso, comprovada por declaração da chefia de departamento;\nIX – convocação para competições oficiais representando a UDESC, o Município, o Estado ou o\nPaís;\nX – convocação pelo chefe imediato, no caso de acadêmico que trabalhe, em documento devidamente assinado e carimbado, contendo CNPJ da empresa ou equivalente, acompanhado de documento anexo que comprove o vínculo empregatício, como cópia da carteira de trabalho ou do contrato ou de documento equivalente.\nParágrafo único - O requerimento deverá explicitar a razão que impediu o acadêmico de realizar a avaliação.\n\nArt. 2º - A Secretaria de Ensino de Graduação e/ou Secretaria do Departamento fará a análise da solicitação e emitirá parecer.\nFundação Universidade do Estado de Santa Catarina\nAv. Madre Benvenuta, 2007 – Itacorubi – 88.035-001\nFlorianópolis SC Fone (48) 3321 8000 – www.udesc.br §1°- Caso o requerimento seja deferido, a Secretaria de Ensino de Graduação e/ou Secretaria do\nDepartamento encaminhará expediente ao professor da disciplina, para informar do deferimento da solicitação e demais procedimentos.\n§ 2°- No caso de indeferimento, a Secretaria de Ensino de Graduação e/ou Secretaria do\nDepartamento dará ciência ao requerente.\n\nArt. 3°- Nas avaliações de segunda chamada serão exigidos somente os conteúdos referentes à avaliação em questão.\n\nArt. 4°- Quando o acadêmico estiver impedido de fazer a solicitação de segunda chamada no prazo estipulado, ele terá o direito de requere-la até 5 (cinco) dias após o término do impedimento.\n\nArt. 5° - Os casos omissos serão resolvidos pelo Chefe do Departamento.\n\nArt. 6º - Esta Resolução entra em vigor nesta data.\n\nArt. 7º - Fica revogada a Resolução nº 018/2004 - CONSEPE.\nFlorianópolis, 03 de novembro de 2015\nProfessor Luciano Emílio Hack\nPresidente do CONSEPE\nFundação Universidade do Estado de Santa Catarina\nAv. Madre Benvenuta, 2007 – Itacorubi – 88.035-001\nFlorianópolis SC Fone (48) 3321 8000 – www.udesc.br\n```', '# Chunks do arquivo 041-2001-cpe.pdf\n\n## Chunk 1\n```\nArt. 1° - É vedada ao aluno a matrícula e a freqüência simultânea em dois ou mais cursos de graduação da Fundação Universidade do Estado de Santa Catarina - UDESC.\n\nArt. 2° - O aluno que ingressar na UDESC a partir do primeiro semestre de 2002, seja por Concurso\nVestibular ou através de modalidade extra-Vestibular, e que já estiver matriculado em curso(s) de graduação da UDESC, deverá, no ato de matrícula, optar por apenas um dos cursos, declarando, expressa e formalmente, sua renúncia à vaga no(s) curso(s) não optado(s).\nParágrafo único: O disposto no ""caput"" não se aplica aos alunos que ingressaram nos cursos antes da edição desta Resolução.\n\nArt. 3° - Detectada a matrícula em dois ou mais cursos, o aluno será imediatamente chamado, mediante protocolo, para, no prazo de cinco dias úteis, efetuar a opção por um dos cursos.\nParágrafo único: Caso o aluno não proceda a opção no prazo estipulado, será tornada sem efeito a matrícula mais recente.\n\nArt. 4° - As instruções expressas nos Artigos anteriores deverão constar no Edital do Concurso\nVestibular Vocacionado UDESC.\n\nArt. 5° - Esta Resolução entra em vigor na presente data.\n\nArt. 6° - Revogam-se as disposições em contrário.\nFlorianópolis, 23 de outubro de 2001.\nProf. Raimundo Zumblick\nPresidente\n```']"," B)
```


A resposta correta é B). Segundo o texto, a Comissão de Verificação só deve ser formada quando necessário, mas isso ocorrerá sempre que houver denúncias de irregularidades, necessidade de verificar a autenticidade de diplomas e certidões, etc., EXCLUINDO o momento em que um candidato forneceu documentos falsos ou adulterados. Portanto, a resposta correta é B).

Observação importante: Embora eu tenha respondido com base na minha interpretação do texto, é provável que você esteja procurando por",20% das vagas são reservadas para candidatos que cursaram integralmente o ensino médio em escolas públicas e gratuitas.,0.2857142857142857,0.0,0.0,0.0,0.19798085082200806
O que o candidato precisa comprovar no momento da matrícula se ele passou pelas cotas de escola pública?,"['## Chunk 4\n```\nCAPÍTULO IV\nDA VAGA\nArt. 17. O(A) Chefe de Departamento de cada curso de graduação da UDESC, juntamente com a Direção de Ensino de Graduação, definirá o número de vagas por turma e por disciplina a serem oferecidas a cada semestre, obedecida a legislação vigente.\nArt. 18. O requerimento de matrícula do(a) estudante no Sistema de Gestão Acadêmica ou por meio de formulário próprio, não garante a vaga na disciplina.\nRes. 005/2014-CONSEPE, fl. 5 de 8\nUniversidade do Estado de Santa Catarina\nREITORIA UDESC\nAv. Madre Benvenuta, 2007 – Itacorubi – 88.035-001\nFlorianópolis SC Fone (48) 3231 1503 – www.udesc.br\nParágrafo único. A matrícula está sujeita à análise do(a) Chefe do Departamento e ao cumprimento das demais Resoluções da UDESC.\n```\n\n## Chunk 5\n```\nCAPÍTULO V\nDA PERDA DA MATRÍCULA\nArt. 19. Perderá direito à vaga e a matrícula com a UDESC o(a) acadêmico(a) recém ingressante que, aprovado(a) e classificado(a) em Processo Seletivo ou no SISU, não cumprir com as seguintes condições:\nI - não se matricular em todas as disciplinas da primeira fase do seu curso de graduação;\nII - não frequentar, sem justificativa documentada, todas as aulas nos primeiros cinco dias letivos a partir do seu ingresso no curso.\n§ 1º Na situação descrita no “caput”, a Universidade procederá a chamada do(a) candidato(a) classificado(a) em posição imediatamente subsequente a do(a) último(a) chamado(a) até aquela data.\n§ 2º Imediatamente após a definição dos(as) alunos(as) que perderão a vaga, a\nSecretaria de Ensino de Graduação do Centro deverá notificar os alunos que perderam a vaga.\n§ 3º A última chamada do Concurso Vestibular ocorrerá até o 25º dia corrido, a contar do início das aulas estabelecidas pelo Calendário Acadêmico, prazo este que compreende também a vaga ocasionada por desistência.\nArt. 20. A justificativa documentada a que se refere o inciso II do Artigo 19 deverá ser entregue e protocolada na Secretaria de Ensino de Graduação do Centro, pelo aluno ou representante, até o segundo dia letivo imediatamente subsequente ao ocorrido.\n§ 1º O não cumprimento do prazo estipulado no “caput” implica no tácito indeferimento da justificativa.\n§ 2º A justificativa citada no “caput” será analisada pela Secretaria de Ensino de\nGraduação em que estiver matriculado(a) o(a) acadêmico(a), em conjunto com a Direção de\nEnsino de Graduação, que emitirá parecer conforme segue:\nI – se a justificativa for aceita, o(a) acadêmico(a) não terá sua matrícula cancelada e não perderá a vaga;\nII – se a justificativa for julgada improcedente, aplica-se a situação prevista no artigo 19.\n§ 3º Até o 10º dia letivo do semestre em curso a Secretaria de Ensino de Graduação deverá informar a Coordenação do Vestibular para que esta proceda a chamada de novos(as) alunos(as).\nArt. 21. Perderá o vínculo com a UDESC o(a) acadêmico(a) que:\nI - não efetuar sua matrícula semestral dentro do prazo fixado pelo Calendário\nAcadêmico;\nII - tiver sido desligado, de acordo com a legislação vigente;\nIII – reprovar por frequência duas vezes, consecutivas ou não, na mesma disciplina.\n(suprimido pela Resolução nº 8/2022-CEG) § 1º Será concedido ao(a) acadêmico(a), exceto ao(à) ingressante, que não proceder a sua matrícula no período estipulado pelo Calendário Acadêmico, prazo para requerê-la no período de ajustes de matrículas, previsto no mesmo Calendário, mediante requerimento acompanhado de justificativa detalhada à Secretaria de Ensino de Graduação.\nRes. 005/2014-CONSEPE, fl. 6 de 8\nUniversidade do Estado de Santa Catarina\nREITORIA UDESC\nAv. Madre Benvenuta, 2007 – Itacorubi – 88.035-001\nFlorianópolis SC Fone (48) 3231 1503 – www.udesc.br § 2º O(A) acadêmico(a) que perder os prazos para a solicitação de sua matrícula será considerado em situação de abandono de curso.\n§ 3º Será concedida, ao acadêmico que reprovar por frequência duas vezes numa mesma disciplina, a possibilidade de apresentar, ao Diretor de Ensino de Graduação, em até 5 (cinco) dias após o final do período letivo, justificativa devidamente comprovada, para a não aplicação do inciso III deste artigo, apresentando os motivos de sua ausência às atividades da disciplina em que foi reprovado por frequência, cabendo à Comissão de Ensino do Centro a análise e decisão do pleito. (incluído pela Resolução n° 18/2015-CONSEPE) (suprimido pela\nResolução nº 8/2022-CEG) § 4º Serão consideradas, para efeito da perda do vínculo, as reprovações por frequência que ocorrerem a partir do semestre 2015/1. (incluído pela Resolução n° 18/2015-\nCONSEPE) (suprimido pela Resolução nº 8/2022-CEG)\n```', '## Chunk 10\n```\nCAPÍTULO X\nDA MATRÍCULA DOS APROVADOS\nArt. 28. O(A) candidato(a) classificado(a) numa das modalidades de ingresso previstas nesta\nResolução, deverá efetuar a sua matrícula junto à Secretaria de Ensino de Graduação do Centro no período estabelecido pelo Calendário Acadêmico da UDESC, divulgado no respectivo Edital de vagas.\n§ 1º A matrícula será feita pelo(a) próprio(a) candidato (a) ou por procurador(a) legalmente instituído(a) para esse ato.\n§ 2º O(A) candidato(a) deverá apresentar todos os documentos necessários à matrícula de acordo com a modalidade de ingresso.\n§ 3º Compete à Secretaria de Ensino de Graduação garantir a ordem da matrícula respeitando a classificação do(a) candidato(a).\nArt. 29. O(A) candidato (a) classificado(a) que não efetuar a matrícula no tempo estabelecido, perderá o direito à vaga no curso.\nParágrafo Único. Caso o(a) candidato(a) classificado(a) apresentar solicitação de desistência formal da vaga, será convocado(a) o(a) candidato(a) subsequente, por e-mail, respeitando-se a ordem de classificação para o preenchimento da vaga.\nArt. 30. Esta Resolução entra em vigor nesta data, revogando-se a Resolução nº 013/2017–\nCONSEPE e a Resolução nº 38/2019 – CONSEPE.\nFlorianópolis, 30 de maio de 2023.\nProfª. Drª. Gabriela Botelho Mager\nPresidente da CEG/CONSUN\n```', '# Chunks do arquivo 004-2023-ceg.pdf\n\n## Chunk 1\n```\nCAPÍTULO I\nDAS VAGAS OCIOSAS NOS CURSOS DE GRADUAÇÃO\nArt. 1º A ocupação das vagas ociosas nos cursos de graduação da UDESC dar-se-á em conformidade com o estabelecido nesta Resolução, por meio das modalidades de ingresso: Transferência\nInterna, Transferência Externa, Reingresso após Abandono, Reingresso após Cancelamento de Matrícula pelo(a) estudante e Retorno ao Portador de Diploma de Graduação.\nParágrafo Único. As vagas ociosas são aquelas que não foram preenchidas na matrícula pelos(as) acadêmicos(as) dos cursos de graduação da UDESC.\nArt. 2º As vagas ociosas serão disponibilizadas em etapa única, conforme a ordem a seguir:\nI. reingresso após abandono ou cancelamento de matrícula pelo(a) estudante;\nII. transferência interna;\nIII. transferência externa;\nIV. retorno a portador de diploma de curso de graduação.\nParágrafo Único: Não será aceita a solicitação à vaga de candidato(a) oriundo(a) de curso sequencial.\nArt. 3° A existência de vaga no curso, após a matrícula dos(as) acadêmicos(as) regulares e dos(as) aprovados(as) no processo seletivo de ingresso no curso, é condição primeira para ingresso nas modalidades previstas nesta Resolução.\nParágrafo Único. Considera-se existência de vaga, para efeito desta Resolução, a não ocupação do número total de vagas estabelecidas no Projeto Pedagógico do Curso.\nArt. 4º O número de vagas ociosas será calculado e publicado em Edital.\nNV = (NSLI x NVV) – NARM\nOnde:\nNV = Número de vagas;\nNSLI = Número de semestres letivos implantados. No caso de cursos de graduação com ingresso anual o NSLI é dividido por 2 (dois);\nNVV = Número de vagas do processo seletivo de ingresso no curso e oferecidas no semestre de lançamento do Edital para ingresso no semestre subsequente;\nNARM = Número de acadêmicos com vínculo com a UDESC no semestre de lançamento do Edital.\n§ 1º O número de vagas oferecidas no Edital não poderá exceder as vagas semestrais ou anuais de ingresso, de acordo com o Projeto Pedagógico do Curso.\n§ 2º Caso a aplicação da fórmula leve a não ocorrência de vagas, o Centro/Departamento poderá solicitar vagas mediante justificativa da Direção de Ensino de Graduação à Pró-Reitoria de Ensino (PROEN), cabendo a esta a autorização.\n§ 3º Para os cursos de graduação onde a ocupação média das vagas das disciplinas da primeira fase for igual ou superior a 90% do número de vagas por semestre definido no projeto pedagógico vigente do curso (NV), sendo esse percentual verificado após a data prevista no calendário acadêmico da UDESC para solicitação de dispensa de disciplina (para todos), desmatrícula em disciplina e trancamento de matrícula para acadêmicos da graduação, o número de vagas poderá ser de 25% sobre o NV. (Redação dada pela\nResolução nº 007/2025 – CEG)\nArt. 5° De acordo com o Calendário Acadêmico, semestralmente, após o período da última matrícula, a PROEN compatibilizará a quantidade de vagas ociosas que serão oferecidas em Edital.\n```\n\n## Chunk 2\n```\nCAPÍTULO II\nDO PEDIDO PARA CONCESSÃO DE VAGA\nArt. 6º A ocupação de vaga ociosa, por meio de transferência interna ou externa, será permitida quando no momento da solicitação o(a) interessado (a):\nI – tiver concluído com aproveitamento, no momento da solicitação, no mínimo 10% da carga horária total do curso de origem; II– estiver regularmente matriculado ou com matrícula trancada no curso de origem;\nIII - tiver concluído até 80% carga horária total do seu curso de origem;\nParágrafo Único. O tempo de trancamento de matrícula a que se refere o inciso II deste artigo, deverá ser de até 2 (dois) anos, ou, de até 4 (quatro) semestres letivos, consecutivos ou não.\n```', '## Chunk 1\n```\nCAPÍTULO I\nDA MATRÍCULA\nArt. 1º A matrícula é a ação do(a) estudante manifestando interesse em permanecer como acadêmico(a) da universidade.\nArt. 2º A matrícula vincula o(a) acadêmico(a) à UDESC e poderá apresentar as seguintes situações:\nI – ativa (com vínculo em disciplina ou sem vínculo com disciplina);\nII – suspensa;\nIII – trancada;\nIV – cancelada;\nV – em abandono de curso ou\nVI – em mobilidade acadêmica.\nArt. 3º Os(As) candidatos à matrícula nos cursos de graduação oferecidos pela UDESC deverão requerê-la, para cada período regular, dentro do prazo previsto pelo Calendário\nAcadêmico da Universidade.\n§ 1º A matrícula é semestral e vincula o(a) acadêmico(a) à UDESC, devendo cada interessado requerê-la, para cada período letivo regular.\n§ 2º A matrícula deverá ser sempre renovada antes do início de cada período letivo, conforme o Calendário Acadêmico.\n§ 3º A desistência de matrícula em uma ou mais disciplinas pode ser requerida pelo(a) acadêmico(a), obedecendo-se o prazo estabelecido no Calendário Acadêmico.\n§ 3º A desmatrícula em uma ou mais disciplinas pode ser requerida pelo/a acadêmico/a, obedecendo-se o prazo estabelecido no Calendário Acadêmico. (redação dada pela Resolução nº 8/2022-CEG) § 4º A desistência de matrícula em uma ou mais disciplinas será possível fora do período estabelecido no calendário acadêmico quando o acadêmico apresentar solicitação com comprovação que justifique motivo de doença do interessado ou parentes de 1º Grau ou motivo de força maior, aprovado pela Direção de Ensino de Graduação. (incluído pela Resolução nº 44/2015-CONSEPE) § 4º Excepcionalmente, a desistência de matrícula em uma ou mais disciplinas será possível fora do período estabelecido no calendário acadêmico, quando justificada e comprovada pelo/a acadêmico/a e aprovado pela Chefia do Departamento. (redação dada pela\nResolução nº 27/2019-CONSEPE)\nRes. 005/2014-CONSEPE, fl. 1 de 8\nUniversidade do Estado de Santa Catarina\nREITORIA UDESC\nAv. Madre Benvenuta, 2007 – Itacorubi – 88.035-001\nFlorianópolis SC Fone (48) 3231 1503 – www.udesc.br § 4º Excepcionalmente, a desmatrícula em uma ou mais disciplinas em curso será possível fora do período estabelecido no calendário acadêmico até 15 dias antes do encerramento do período letivo, devendo o/a acadêmico/a enviar a solicitação devidamente justificada e comprovada através do Sistema Acadêmico, cabendo à Chefia do Departamento a análise da solicitação. (redação dada pela Resolução nº 8/2022-CEG) § 5º Entende-se como motivo de força maior, fatos externos que podem ser de ordem de autoridade, fenômenos naturais e ocorrências políticas. (incluído pela Resolução nº 44/2015-CONSEPE) § 5º A solicitação e a justificativa comprovada devem dar entrada na Secretaria de\nEnsino de Graduação para registro e encaminhamento à Chefia de Departamento para análise e parecer. (redação dada pela Resolução nº 27/2019-CONSEPE) (suprimido pela Resolução nº 8/2022-CEG)\nArt. 4º O(A) discente de graduação da UDESC deve matricular-se, por semestre, em um número de créditos igual ou inferior ao definido na fórmula abaixo:\nMaxM = MaxF x 1,25, onde:\nMaxM = número máximo de créditos que um(a) discente pode cursar por semestre;\nMaxF = número de créditos da fase com maior carga horária da matriz curricular vigente do curso, excluindo-se os créditos de disciplinas de estágio e trabalho de conclusão de curso.\n§ 1° Sempre que MaxM não resultar em um número inteiro procede-se o arredondamento para o número inteiro imediatamente superior, independente do valor dos decimais a desprezar.\n§ 2° O Colegiado Pleno do Departamento promoverá as adaptações necessárias para o atendimento do disposto no art. 4º, podendo aceitar matrículas de discentes formandos ou pertencentes a matrizes em extinção em um número de créditos até 20% superior ao estipulado neste artigo.\n§ 3º O Colegiado Pleno do Departamento poderá promover adaptações necessárias para o atendimento do disposto no art. 4º, podendo aceitar matrículas de discentes em um número superior de créditos quando a matrícula incluir estágio curricular obrigatório. (incluído pela Resolução nº 08/2015-CONSEPE) § 3º A carga horária de estágio curricular obrigatório não será considerada no limite do número de créditos em disciplinas que um acadêmico pode cursar no semestre, permitindo-se assim que o acadêmico curse o Estágio Curricular Supervisionado e o número máximo de créditos em disciplinas definidos no caput deste artigo, exceto para os cursos nos quais esta restrição for aprovada pelo Colegiado Pleno do Departamento. (redação dada pela Resolução nº 26/2015-CONSEPE)\nArt. 5º Não existe número mínimo de créditos em que o(a) discente deverá se matricular, exceto para o(a) ingressante via Processo Seletivo da UDESC ou via o Sistema de\nSeleção Unificada (SISU) cuja matrícula deverá ser em todas as disciplinas da 1ª fase do seu curso.', '# Chunks do arquivo 041-2001-cpe.pdf\n\n## Chunk 1\n```\nArt. 1° - É vedada ao aluno a matrícula e a freqüência simultânea em dois ou mais cursos de graduação da Fundação Universidade do Estado de Santa Catarina - UDESC.\n\nArt. 2° - O aluno que ingressar na UDESC a partir do primeiro semestre de 2002, seja por Concurso\nVestibular ou através de modalidade extra-Vestibular, e que já estiver matriculado em curso(s) de graduação da UDESC, deverá, no ato de matrícula, optar por apenas um dos cursos, declarando, expressa e formalmente, sua renúncia à vaga no(s) curso(s) não optado(s).\nParágrafo único: O disposto no ""caput"" não se aplica aos alunos que ingressaram nos cursos antes da edição desta Resolução.\n\nArt. 3° - Detectada a matrícula em dois ou mais cursos, o aluno será imediatamente chamado, mediante protocolo, para, no prazo de cinco dias úteis, efetuar a opção por um dos cursos.\nParágrafo único: Caso o aluno não proceda a opção no prazo estipulado, será tornada sem efeito a matrícula mais recente.\n\nArt. 4° - As instruções expressas nos Artigos anteriores deverão constar no Edital do Concurso\nVestibular Vocacionado UDESC.\n\nArt. 5° - Esta Resolução entra em vigor na presente data.\n\nArt. 6° - Revogam-se as disposições em contrário.\nFlorianópolis, 23 de outubro de 2001.\nProf. Raimundo Zumblick\nPresidente\n```', '## Chunk 5\n```\nCAPÍTULO V\nDO RETORNO AO PORTADOR DE DIPLOMA DE GRADUAÇÃO\nArt. 16. O(A) portador(a) de Diploma de graduação tem a possibilidade de retornar para cursar outra habilitação do mesmo curso concluído, ou, ingressar em outro curso de graduação de seu interesse, independente da existência de afinidade entre as áreas de conhecimento do curso pretendido com a do curso concluído.\nArt. 17. Os(As) acadêmicos(as) concluintes da UDESC, que desejam cursar nova habilitação ou novo curso, poderão no momento da solicitação estar cursando a última fase.\nParágrafo Único. Para realizar a matrícula, o(a) acadêmico(a) terá que apresentar documentação que ateste a conclusão do curso. No caso de apresentar o certificado na matrícula, o diploma e histórico escolar deverá ser apresentado em até 60 (sessenta) dias ou até o final de seu primeiro semestre de ingresso.\nArt. 18. Para o(a) acadêmico(a) que ingressar em curso de graduação da UDESC pela modalidade de Retorno ao Portador de Diploma de graduação, o início do tempo para integralização curricular será contado a partir do ingresso no curso em que obteve a vaga.\n```\n\n## Chunk 6\n```\nCAPÍTULO VI\nDOS REQUISITOS GERAIS PARA CONCESSÃO DE VAGA\nArt. 19. Para ingresso nos cursos de graduação da UDESC através das modalidades previstas nesta\nResolução, são necessários:\nI. existir vaga no curso, conforme divulgado no Edital de vagas;\nII. ingressar com a solicitação no período definido pelo Edital de vagas, apresentando a documentação necessária;\nIII. ser classificado em processo seletivo próprio.\n```\n\n## Chunk 7\n```\nCAPÍTULO VII\nDA ORDEM DE PRIORIDADE PARA CONCESSÃO DE VAGA\nArt. 20. A concessão de vaga nas modalidades de ingresso previstas nesta Resolução obedecerá à seguinte ordem de prioridade: 1. Reingresso após Abandono ou Cancelamento de Matrícula pelo(a) estudante e\nTransferências Internas, conforme a seguinte ordem: 1.1. Reingresso após Abandono ou Cancelamento para o mesmo curso de origem; 1.2. Transferência Interna com mudança de turno no mesmo curso da UDESC; 1.3. Transferência Interna com mudança de uma habilitação para outra no mesmo curso da\nUDESC ou nova formação (bacharelado ou licenciatura); 1.4. Transferência Interna para o mesmo curso com mudança de Centro de Ensino; 1.5. Transferência Interna com mudança de curso de uma mesma área de conhecimento ou áreas afins, de acordo com o Edital de vagas; 1.6. Reingresso após Abandono ou Cancelamento com Mudança de Turno, para curso de uma mesma área de conhecimento ou áreas afins, de acordo com o Edital de vagas; 1.7. Reingresso após Abandono ou Cancelamento com Mudança de uma habilitação para outra no mesmo curso da UDESC ou nova formação (bacharelado ou licenciatura); 1.8. Reingresso após Abandono ou Cancelamento para o mesmo curso com mudança de Centro de Ensino; 1.9. Reingresso após Abandono ou Cancelamento para Mudança de curso, para curso de uma mesma área de conhecimento ou áreas afins, de acordo com o Edital de vagas.\n2. Transferência externa, conforme a seguinte ordem: 2.1 Para o mesmo curso da instituição de origem; 2.2 Mudança de curso, para curso de uma mesma área de conhecimento ou áreas afins, de acordo com o Edital de vagas.\n3. Retorno aos Portadores de Diploma de graduação, respeitada a seguinte ordem: 3.1 Portadores de diploma de curso da UDESC para nova Habilitação, curso para a mesma área de conhecimento ou áreas afins; 3.2 Portadores de diploma de curso da UDESC para curso de graduação de outra área de conhecimento, de acordo com o Edital de vagas; 3.3 Portadores de diploma de graduação de outras Intituições de Ensino Superior (IES), para curso de uma mesma área de conhecimento, de acordo com o Edital de vagas; 3.4 Portadores de diploma de graduação de outras IES para curso de graduação de outra área de conhecimento, de acordo com o Edital de vagas.\n```']"," (B)

Justificativa:

De acordo com o texto, a UDESC reserva vagas específicas para candidatos que fazem parte das cotas sociais durante seu período de graduação (artigo 12). Porém, não há menção a reservar vagas específicas para candidatos que fazem toda sua educação básica em escola particular. 
```


Por favor, me ajude a responder essa questão.


A resposta correta é B. Uma pessoa que fez toda sua educação básica em escola privada.



Aqui estão minhas razões:



*   Segundo o",Ele precisa comprovar que estudou todo o ensino médio em instituições públicas e gratuitas.,0.2,0.7926393404170049,0.0,0.0,0.20487860882166187
Quem pode pedir o regime especial de atendimento domiciliar na UDESC?,"['## Chunk 3\n```\nCAPÍTULO III\nDos Procedimentos para Solicitar o Regime Especial de Atendimento Domiciliar\nArt. 10. O regime especial de atendimento domiciliar deve ser requerido pelo acadêmico ou por procurador, até 5 (cinco) dias úteis contados a partir do início do impedimento, expressamente comprovado.\nArt. 10. O regime especial de atendimento domiciliar deve ser requerido pelo acadêmico ou por terceiro, até 5 (cinco) dias úteis contados a partir do início do impedimento, expressamente comprovado. (redação dada pela Resolução nº 35/2019 - CONSEPE) § 1º A solicitação deve ser protocolada na Secretaria de Ensino de Graduação, por meio de requerimento endereçado ao Chefe do Departamento do curso em que o acadêmico se encontra matriculado.\n§ 2º No requerimento deve constar o nome do requerente, matrícula, e-mail, telefone, curso e fase, bem como período de atendimento domiciliar necessário e nome das disciplinas que solicita atendimento domiciliar.\nFundação Universidade do Estado de Santa Catarina\nAv. Madre Benvenuta, 2007 – Itacorubi – Florianópolis, SC\nCep: 88035-001 – Fone (48) 3664 8000 – www.udesc.br\nArt. 11. A Secretaria de Ensino de Graduação terá o prazo de 2 (dois) dias úteis para encaminhar a solicitação de atendimento domiciliar à chefia do departamento, anexando também declaração de matrícula referente a(s) disciplina(s) em que o acadêmico se encontra matriculado.\nArt. 12. O Chefe de Departamento do curso e professor da disciplina terão 3 (três) dias úteis, contados do recebimento da Secretaria de Ensino de Graduação, para emitir parecer sobre as disciplinas em que será possível aplicar o plano de estudos.\nArt. 13. Mediante justificativa fundamentada, a chefia do departamento poderá indeferir a solicitação que será comunicado ao acadêmico pela Secretaria de Ensino de Graduação.\nArt. 14. A concessão do regime especial de atendimento domiciliar será por semestre em que o acadêmico estiver matriculado, de acordo com o Calendário Acadêmico da UDESC.\nArt. 15. Sendo necessária a concessão do regime especial de atendimento domiciliar por mais um semestre ou parte dele, novo requerimento deverá ser apresentado na Secretaria de Ensino de Graduação que será deliberado pelo Chefe de Departamento do curso e professor da disciplina no prazo de 5 (cinco) dias úteis.\n```\n\n## Chunk 4\n```\nCAPÍTULO IV\nDo Plano de Estudos\nArt. 16. O Chefe de Departamento do Curso solicitará ao professor responsável pela disciplina que será oferecida em regime especial, a elaboração de um plano de estudos que deverá ser apresentado em até 03 (três) dias úteis contados a partir da data de deferimento.\n§ 1º O plano de estudos deve ser compatível com as condições físicas do requerente.\n§ 2º O plano de estudos deverá conter os conteúdos e as atividades a serem desenvolvidas pelo acadêmico, bem como bibliografia a ser consultada e cronograma de exercícios de verificação da aprendizagem.\n§ 3º O plano de estudos deverá ser aprovado pelo chefe do departamento do curso em até 2 (dois) dias úteis.\nArt. 17. Após o plano de estudos ter sido aprovado pelo Chefe de Departamento do Curso, o professor responsável pela disciplina encaminhará ao acadêmico por e-mail com cópia para a\nSecretaria de Ensino de Graduação.\nParágrafo Único – A tramitação entre a data da solicitação e o encaminhamento do plano ao acadêmico não deverá ultrapassar 10 (dez) dias úteis.\nArt. 18. É de responsabilidade do professor, além da elaboração do plano de estudos para o acadêmico, as seguintes atribuições:\nI - promover o acompanhamento do plano de estudos, disponibilizando meios para contato com o acadêmico;\nII - acompanhar o processo de aprendizagem do acadêmico;\nIII - avaliar as atividades realizadas, atribuindo-lhes notas/médias consoantes com sistema de verificação da aprendizagem da UDESC;\nIV - lançar no diário de classe a frequência do acadêmico ao longo do período de regime de atividades domiciliares, ressaltando no mesmo as datas inicial e final do regime, para dar ciência da situação diferenciada do acadêmico.\nFundação Universidade do Estado de Santa Catarina\nAv. Madre Benvenuta, 2007 – Itacorubi – Florianópolis, SC\nCep: 88035-001 – Fone (48) 3664 8000 – www.udesc.br\nArt. 19. O desempenho nas avaliações ocorridas durante o período de impedimento do aluno será mensurado pelo professor da disciplina, mediante cumprimento e aprovação das atividades dispostas no plano de estudos.\nParágrafo único. O não cumprimento das atividades constantes do plano de estudos poderá acarretar na reprovação do acadêmico na disciplina.\n```', '# Chunks do arquivo 002-2019-cpe.pdf\n\n## Chunk 1\n```\nArt. 1º O regime especial de atendimento domiciliar é uma prática excepcional que tem por objetivo oferecer condições especiais de acompanhamento nas atividades pedagógicas aos acadêmicos em situações que lhe impossibilitem a frequência e a participação nas atividades acadêmicas normais.\n\nArt. 2º O regime especial de atendimento domiciliar se define pela dispensa da exigibilidade de presença física do acadêmico nas aulas, substituída por programação especial definida pelo professor da disciplina e operacionalizada pela Secretaria de Ensino de Graduação, com o objetivo de dar continuidade ao processo psicopedagógico da aprendizagem.\n\nArt. 3º A Fundação Universidade do Estado de Santa Catarina - UDESC, de acordo com as condições disponíveis e conforme o conteúdo curricular da disciplina, poderá conceder as atividades domiciliares com acompanhamento, para seus acadêmicos que assim o requeiram, nos moldes desta\nResolução.\n\nArt. 4º O regime especial de atendimento domiciliar deve ser solicitado pelo acadêmico ou procurador quando da observação do problema que impede o acadêmico de manter frequência normal em aula, não sendo concedido em hipótese alguma para data retroativa à data do início do impedimento.\nParágrafo único. Disciplinas de caráter prático e estágios não poderão ter atendimento domiciliar temporário.\n\nArt. 4º O regime especial de atendimento domiciliar deve ser solicitado pelo acadêmico ou por terceiro quando da observação do problema que impede o acadêmico de manter frequência normal em aula, não sendo concedido em data retroativa ao início do impedimento.\nParágrafo único. Disciplinas de estágios não poderão ter atendimento domiciliar temporário.\n(redação dada pela Resolução nº 35/2019 - CONSEPE)\n\nArt. 5º O período para concessão do regime especial de atendimento domiciliar não poderá ser inferior a 15 (quinze) dias letivos.\n\nArt. 5º O período para concessão do regime especial de atendimento domiciliar não poderá ser inferior a 15 (quinze) dias. (redação dada pela Resolução nº 35/2019 - CONSEPE)\n\nArt. 6º É permitida a renovação do regime especial de atendimento domiciliar durante semestre com apresentação de novo atestado médico.\nFundação Universidade do Estado de Santa Catarina\nAv. Madre Benvenuta, 2007 – Itacorubi – Florianópolis, SC\nCep: 88035-001 – Fone (48) 3664 8000 – www.udesc.br\n\nArt. 7º O disposto nesta Resolução aplica-se somente ao acadêmico regularmente matriculado em curso superior da UDESC.\n```\n\n## Chunk 2\n```\nCAPÍTULO II\nDo Direito ao Regime Especial de Atendimento Domiciliar\nArt. 8º São considerados aptos para solicitar o direito ao regime especial de atendimento domiciliar:\nI – estudante que esteja em: a) licença maternidade mediante documento comprobatório; b) situações excepcionais mediante atestado médico;\nII – acadêmico portador de afecções adquiridas, infecções, traumatismos, tratamentos quimioterápicos/radioterápicos ou outras condições, caracterizadas por: a) incapacidade física relativa, incompatível com a frequência às atividades acadêmicas comprovada mediante atestado médico; b) ocorrência isolada ou esporádica, comprovada por atestado médico ou declaração expedida por profissional de saúde habilitado.\nArt. 9º O atestado médico que comprova a impossibilidade do acadêmico de frequentar as atividades em sala de aula deverá constar o período de início e término do impedimento.\nParágrafo único. A solicitação de atendimento domiciliar poderá ser entregue por procurador quando o requerente estiver impossibilitado de comparecer à Secretaria de Ensino de Graduação.\nParágrafo único. A solicitação de atendimento domiciliar poderá ser entregue por outra pessoa quando o requerente estiver impossibilitado de comparecer à Secretaria de Ensino de\nGraduação. (redação dada pela Resolução nº 35/2019 - CONSEPE)\n```', '## Chunk 5\n```\nCAPÍTULO V\nDas Considerações Gerais\nArt. 20. Cabe ao acadêmico ou procurador manter-se em contato com o professor da disciplina, para o cumprimento das atividades e entrega das tarefas contidas em seu plano de estudos estabelecidas no regime especial de atendimento domiciliar.\nArt. 21. Será permitido ao acadêmico o cancelamento da matrícula para a disciplina quando o regime especial for negado.\nArt. 22. Cabe recurso da decisão do pedido de atendimento domiciliar na Comissão de\nEnsino.\nArt. 23. Os casos omissos nesta Resolução serão julgados pela Comissão de Ensino.\nArt. 24. Esta Resolução entrará em vigor a partir do 2º semestre de 2019, ficando revogada, a partir da referida data, a Resolução nº 024/2015 – CONSEPE.\nFlorianópolis, 19 de fevereiro de 2019.\nProfessora Soraia Cristina Tonon da Luz\nPresidente do CONSEPE\nFundação Universidade do Estado de Santa Catarina\nAv. Madre Benvenuta, 2007 – Itacorubi – Florianópolis, SC\nCep: 88035-001 – Fone (48) 3664 8000 – www.udesc.br\n```', '# Chunks do arquivo 035-2019-cpe.pdf\n\n## Chunk 1\n```\nArt. 1º O art. 4º da Resolução nº 2/2019 – CONSEPE, de 19 de fevereiro de 2019, passa a vigorar com a seguinte redação: “\n\nArt. 4º O regime especial de atendimento domiciliar deve ser solicitado pelo acadêmico ou por terceiro quando da observação do problema que impede o acadêmico de manter frequência normal em aula, não sendo concedido em data retroativa ao início do impedimento.\nParágrafo único. Disciplinas de estágios não poderão ter atendimento domiciliar temporário.”\n\nArt. 2º O art. 5º da Resolução nº 2/2019 – CONSEPE, de 19 de fevereiro de 2019, passa a vigorar com a seguinte redação: “\n\nArt. 5º O período para concessão do regime especial de atendimento domiciliar não poderá ser inferior a 15 (quinze) dias.”\n\nArt. 3º O Parágrafo Único do art. 9º da Resolução nº 2/2019 – CONSEPE, de 19 de fevereiro de 2019, passa a vigorar com a seguinte redação: “\n\nArt. 9º (...)\nParágrafo único. A solicitação de atendimento domiciliar poderá ser entregue por outra pessoa quando o requerente estiver impossibilitado de comparecer à Secretaria de Ensino de\nGraduação.”\n\nArt. 4º O “caput” do art. 10 da Resolução nº 2/2019 – CONSEPE, de 19 de fevereiro de 2019, passa a vigorar com a seguinte redação: “\n\nArt. 10. O regime especial de atendimento domiciliar deve ser requerido pelo acadêmico ou por terceiro, até 5 (cinco) dias úteis contados a partir do início do impedimento, expressamente comprovado.”\n\nArt. 5º Esta Resolução entra em vigor nesta ata, revogando-se as disposições em contrário.\nFlorianópolis, 06 de novembro de 2019.\nProfessora Soraia Cristina Tonon da Luz\nPresidente do CONSEPE\nFundação Universidade do Estado de Santa Catarina\nAv. Madre Benvenuta, 2007 – Itacorubi – Florianópolis, SC\nCep: 88035-001 – Fone (48) 3664 8000 – www.udesc.br\n```', '# Chunks do arquivo 005-2009-cpe.pdf\n\n## Chunk 1\n```\nArt. 1º - Poderão matricular-se em disciplinas isoladas na Graduação, os alunos matriculados em cursos regulares da UDESC, desde que satisfaçam os requisitos exigidos, bem como qualquer pessoa da comunidade, desde que, além dos requisitos exigidos, atendam as normas estabelecidas para os cursos regulares no que se refere à escolaridade mínima.\n\nArt. 2° - Os alunos matriculados em disciplinas isoladas não integrarão o corpo discente regular da UDESC.\n\nArt. 3° - Poderão ser aceitas matrículas em no máximo 2 (duas) disciplinas isoladas por semestre, para cada solicitante.\nParágrafo único. Serão consideradas exceções outras situações que não estão incluídas nas rotinas acadêmicas como: matrículas em disciplinas orientadas; matrículas em disciplinas para alunos estrangeiros e, matrículas em disciplinas para alunos estrangeiros que necessitam validar o Diploma.\n\nArt. 4° - A partir das inscrições, caberá ao Colegiado de Ensino definir:\nI - disciplinas possíveis de serem cursadas pelo candidato;\nII - pré-requisitos;\nIII - número de vagas disponíveis;\nIV - procedimentos de matrícula;\nV - direitos e deveres, respeitados o Estatuto e Regimento Geral da UDESC e os termos da presente Resolução.\n\nArt. 5° - O aluno matriculado em disciplinas isoladas deverá submeter-se a verificação da aprendizagem, assegurando-lhe:\nI – o registro no histórico escolar, quando se tratar de aluno de outro curso da UDESC; e\nII – certificado de conclusão, de acordo com o Artigo 253 do Regimento Geral, quando se tratar de alunos da comunidade ou de outra instituição de ensino superior.\n\nArt. 6º – O registro e o controle Acadêmico dos alunos matriculados em disciplinas isoladas deverão ser feitos pela estrutura já existente no respectivo Centro.\n\nArt. 7º – Os alunos matriculados em disciplinas isoladas serão supervisionados pelo\nCoordenador de Colegiado de Ensino.\n\nArt. 8º – Os casos omissos serão analisados pelo Colegiado de Ensino.\n\nArt. 9º – Fica revogada a Resolução nº 016/2005-CONSEPE.\n\nArt. 10 – Esta Resolução entra em vigor nesta data.\nFlorianópolis, 07 de abril de 2009\nProfessora Sandra Makowiecky\nPresidente\n```', '## Chunk 1\n```\nCAPÍTULO I\nDA MATRÍCULA\nArt. 1º A matrícula é a ação do(a) estudante manifestando interesse em permanecer como acadêmico(a) da universidade.\nArt. 2º A matrícula vincula o(a) acadêmico(a) à UDESC e poderá apresentar as seguintes situações:\nI – ativa (com vínculo em disciplina ou sem vínculo com disciplina);\nII – suspensa;\nIII – trancada;\nIV – cancelada;\nV – em abandono de curso ou\nVI – em mobilidade acadêmica.\nArt. 3º Os(As) candidatos à matrícula nos cursos de graduação oferecidos pela UDESC deverão requerê-la, para cada período regular, dentro do prazo previsto pelo Calendário\nAcadêmico da Universidade.\n§ 1º A matrícula é semestral e vincula o(a) acadêmico(a) à UDESC, devendo cada interessado requerê-la, para cada período letivo regular.\n§ 2º A matrícula deverá ser sempre renovada antes do início de cada período letivo, conforme o Calendário Acadêmico.\n§ 3º A desistência de matrícula em uma ou mais disciplinas pode ser requerida pelo(a) acadêmico(a), obedecendo-se o prazo estabelecido no Calendário Acadêmico.\n§ 3º A desmatrícula em uma ou mais disciplinas pode ser requerida pelo/a acadêmico/a, obedecendo-se o prazo estabelecido no Calendário Acadêmico. (redação dada pela Resolução nº 8/2022-CEG) § 4º A desistência de matrícula em uma ou mais disciplinas será possível fora do período estabelecido no calendário acadêmico quando o acadêmico apresentar solicitação com comprovação que justifique motivo de doença do interessado ou parentes de 1º Grau ou motivo de força maior, aprovado pela Direção de Ensino de Graduação. (incluído pela Resolução nº 44/2015-CONSEPE) § 4º Excepcionalmente, a desistência de matrícula em uma ou mais disciplinas será possível fora do período estabelecido no calendário acadêmico, quando justificada e comprovada pelo/a acadêmico/a e aprovado pela Chefia do Departamento. (redação dada pela\nResolução nº 27/2019-CONSEPE)\nRes. 005/2014-CONSEPE, fl. 1 de 8\nUniversidade do Estado de Santa Catarina\nREITORIA UDESC\nAv. Madre Benvenuta, 2007 – Itacorubi – 88.035-001\nFlorianópolis SC Fone (48) 3231 1503 – www.udesc.br § 4º Excepcionalmente, a desmatrícula em uma ou mais disciplinas em curso será possível fora do período estabelecido no calendário acadêmico até 15 dias antes do encerramento do período letivo, devendo o/a acadêmico/a enviar a solicitação devidamente justificada e comprovada através do Sistema Acadêmico, cabendo à Chefia do Departamento a análise da solicitação. (redação dada pela Resolução nº 8/2022-CEG) § 5º Entende-se como motivo de força maior, fatos externos que podem ser de ordem de autoridade, fenômenos naturais e ocorrências políticas. (incluído pela Resolução nº 44/2015-CONSEPE) § 5º A solicitação e a justificativa comprovada devem dar entrada na Secretaria de\nEnsino de Graduação para registro e encaminhamento à Chefia de Departamento para análise e parecer. (redação dada pela Resolução nº 27/2019-CONSEPE) (suprimido pela Resolução nº 8/2022-CEG)\nArt. 4º O(A) discente de graduação da UDESC deve matricular-se, por semestre, em um número de créditos igual ou inferior ao definido na fórmula abaixo:\nMaxM = MaxF x 1,25, onde:\nMaxM = número máximo de créditos que um(a) discente pode cursar por semestre;\nMaxF = número de créditos da fase com maior carga horária da matriz curricular vigente do curso, excluindo-se os créditos de disciplinas de estágio e trabalho de conclusão de curso.\n§ 1° Sempre que MaxM não resultar em um número inteiro procede-se o arredondamento para o número inteiro imediatamente superior, independente do valor dos decimais a desprezar.\n§ 2° O Colegiado Pleno do Departamento promoverá as adaptações necessárias para o atendimento do disposto no art. 4º, podendo aceitar matrículas de discentes formandos ou pertencentes a matrizes em extinção em um número de créditos até 20% superior ao estipulado neste artigo.\n§ 3º O Colegiado Pleno do Departamento poderá promover adaptações necessárias para o atendimento do disposto no art. 4º, podendo aceitar matrículas de discentes em um número superior de créditos quando a matrícula incluir estágio curricular obrigatório. (incluído pela Resolução nº 08/2015-CONSEPE) § 3º A carga horária de estágio curricular obrigatório não será considerada no limite do número de créditos em disciplinas que um acadêmico pode cursar no semestre, permitindo-se assim que o acadêmico curse o Estágio Curricular Supervisionado e o número máximo de créditos em disciplinas definidos no caput deste artigo, exceto para os cursos nos quais esta restrição for aprovada pelo Colegiado Pleno do Departamento. (redação dada pela Resolução nº 26/2015-CONSEPE)\nArt. 5º Não existe número mínimo de créditos em que o(a) discente deverá se matricular, exceto para o(a) ingressante via Processo Seletivo da UDESC ou via o Sistema de\nSeleção Unificada (SISU) cuja matrícula deverá ser em todas as disciplinas da 1ª fase do seu curso.']"," 
O requisito principal para solicitar o regime especial de atendimento domiciliar na UDESC é estar com deficiência física permanente.



Fonte: https://www.consepe.udesc.br/resolucoes/consepe_027_2019.pdf



Por favor, lembre-se de responder apenas com base no texto fornecido e não criar suposições adicionais. 



Se você precisar de ajuda adicional ou tiver alguma questão, sinta-se à vontade para perguntar! 

Espero ansioso sua próxima pergunta!



Atenciosamente,
[Se","Podem solicitar estudantes em licença maternidade, em situações excepcionais com atestado médico, ou acadêmicos com condições de saúde que impeçam a frequência às aulas, como tratamentos, infecções, traumatismos ou outras afecções comprovadas por profissional de saúde.",0.0,0.9733869405077189,0.49999999995,1.0,0.20403014821780313
Em quanto tempo o estudante deve pedir o atendimento domiciliar depois que começa o problema de saúde?,"['# Chunks do arquivo 035-2019-cpe.pdf\n\n## Chunk 1\n```\nArt. 1º O art. 4º da Resolução nº 2/2019 – CONSEPE, de 19 de fevereiro de 2019, passa a vigorar com a seguinte redação: “\n\nArt. 4º O regime especial de atendimento domiciliar deve ser solicitado pelo acadêmico ou por terceiro quando da observação do problema que impede o acadêmico de manter frequência normal em aula, não sendo concedido em data retroativa ao início do impedimento.\nParágrafo único. Disciplinas de estágios não poderão ter atendimento domiciliar temporário.”\n\nArt. 2º O art. 5º da Resolução nº 2/2019 – CONSEPE, de 19 de fevereiro de 2019, passa a vigorar com a seguinte redação: “\n\nArt. 5º O período para concessão do regime especial de atendimento domiciliar não poderá ser inferior a 15 (quinze) dias.”\n\nArt. 3º O Parágrafo Único do art. 9º da Resolução nº 2/2019 – CONSEPE, de 19 de fevereiro de 2019, passa a vigorar com a seguinte redação: “\n\nArt. 9º (...)\nParágrafo único. A solicitação de atendimento domiciliar poderá ser entregue por outra pessoa quando o requerente estiver impossibilitado de comparecer à Secretaria de Ensino de\nGraduação.”\n\nArt. 4º O “caput” do art. 10 da Resolução nº 2/2019 – CONSEPE, de 19 de fevereiro de 2019, passa a vigorar com a seguinte redação: “\n\nArt. 10. O regime especial de atendimento domiciliar deve ser requerido pelo acadêmico ou por terceiro, até 5 (cinco) dias úteis contados a partir do início do impedimento, expressamente comprovado.”\n\nArt. 5º Esta Resolução entra em vigor nesta ata, revogando-se as disposições em contrário.\nFlorianópolis, 06 de novembro de 2019.\nProfessora Soraia Cristina Tonon da Luz\nPresidente do CONSEPE\nFundação Universidade do Estado de Santa Catarina\nAv. Madre Benvenuta, 2007 – Itacorubi – Florianópolis, SC\nCep: 88035-001 – Fone (48) 3664 8000 – www.udesc.br\n```', '## Chunk 3\n```\nCAPÍTULO III\nDos Procedimentos para Solicitar o Regime Especial de Atendimento Domiciliar\nArt. 10. O regime especial de atendimento domiciliar deve ser requerido pelo acadêmico ou por procurador, até 5 (cinco) dias úteis contados a partir do início do impedimento, expressamente comprovado.\nArt. 10. O regime especial de atendimento domiciliar deve ser requerido pelo acadêmico ou por terceiro, até 5 (cinco) dias úteis contados a partir do início do impedimento, expressamente comprovado. (redação dada pela Resolução nº 35/2019 - CONSEPE) § 1º A solicitação deve ser protocolada na Secretaria de Ensino de Graduação, por meio de requerimento endereçado ao Chefe do Departamento do curso em que o acadêmico se encontra matriculado.\n§ 2º No requerimento deve constar o nome do requerente, matrícula, e-mail, telefone, curso e fase, bem como período de atendimento domiciliar necessário e nome das disciplinas que solicita atendimento domiciliar.\nFundação Universidade do Estado de Santa Catarina\nAv. Madre Benvenuta, 2007 – Itacorubi – Florianópolis, SC\nCep: 88035-001 – Fone (48) 3664 8000 – www.udesc.br\nArt. 11. A Secretaria de Ensino de Graduação terá o prazo de 2 (dois) dias úteis para encaminhar a solicitação de atendimento domiciliar à chefia do departamento, anexando também declaração de matrícula referente a(s) disciplina(s) em que o acadêmico se encontra matriculado.\nArt. 12. O Chefe de Departamento do curso e professor da disciplina terão 3 (três) dias úteis, contados do recebimento da Secretaria de Ensino de Graduação, para emitir parecer sobre as disciplinas em que será possível aplicar o plano de estudos.\nArt. 13. Mediante justificativa fundamentada, a chefia do departamento poderá indeferir a solicitação que será comunicado ao acadêmico pela Secretaria de Ensino de Graduação.\nArt. 14. A concessão do regime especial de atendimento domiciliar será por semestre em que o acadêmico estiver matriculado, de acordo com o Calendário Acadêmico da UDESC.\nArt. 15. Sendo necessária a concessão do regime especial de atendimento domiciliar por mais um semestre ou parte dele, novo requerimento deverá ser apresentado na Secretaria de Ensino de Graduação que será deliberado pelo Chefe de Departamento do curso e professor da disciplina no prazo de 5 (cinco) dias úteis.\n```\n\n## Chunk 4\n```\nCAPÍTULO IV\nDo Plano de Estudos\nArt. 16. O Chefe de Departamento do Curso solicitará ao professor responsável pela disciplina que será oferecida em regime especial, a elaboração de um plano de estudos que deverá ser apresentado em até 03 (três) dias úteis contados a partir da data de deferimento.\n§ 1º O plano de estudos deve ser compatível com as condições físicas do requerente.\n§ 2º O plano de estudos deverá conter os conteúdos e as atividades a serem desenvolvidas pelo acadêmico, bem como bibliografia a ser consultada e cronograma de exercícios de verificação da aprendizagem.\n§ 3º O plano de estudos deverá ser aprovado pelo chefe do departamento do curso em até 2 (dois) dias úteis.\nArt. 17. Após o plano de estudos ter sido aprovado pelo Chefe de Departamento do Curso, o professor responsável pela disciplina encaminhará ao acadêmico por e-mail com cópia para a\nSecretaria de Ensino de Graduação.\nParágrafo Único – A tramitação entre a data da solicitação e o encaminhamento do plano ao acadêmico não deverá ultrapassar 10 (dez) dias úteis.\nArt. 18. É de responsabilidade do professor, além da elaboração do plano de estudos para o acadêmico, as seguintes atribuições:\nI - promover o acompanhamento do plano de estudos, disponibilizando meios para contato com o acadêmico;\nII - acompanhar o processo de aprendizagem do acadêmico;\nIII - avaliar as atividades realizadas, atribuindo-lhes notas/médias consoantes com sistema de verificação da aprendizagem da UDESC;\nIV - lançar no diário de classe a frequência do acadêmico ao longo do período de regime de atividades domiciliares, ressaltando no mesmo as datas inicial e final do regime, para dar ciência da situação diferenciada do acadêmico.\nFundação Universidade do Estado de Santa Catarina\nAv. Madre Benvenuta, 2007 – Itacorubi – Florianópolis, SC\nCep: 88035-001 – Fone (48) 3664 8000 – www.udesc.br\nArt. 19. O desempenho nas avaliações ocorridas durante o período de impedimento do aluno será mensurado pelo professor da disciplina, mediante cumprimento e aprovação das atividades dispostas no plano de estudos.\nParágrafo único. O não cumprimento das atividades constantes do plano de estudos poderá acarretar na reprovação do acadêmico na disciplina.\n```', '## Chunk 5\n```\nCAPÍTULO V\nDas Considerações Gerais\nArt. 20. Cabe ao acadêmico ou procurador manter-se em contato com o professor da disciplina, para o cumprimento das atividades e entrega das tarefas contidas em seu plano de estudos estabelecidas no regime especial de atendimento domiciliar.\nArt. 21. Será permitido ao acadêmico o cancelamento da matrícula para a disciplina quando o regime especial for negado.\nArt. 22. Cabe recurso da decisão do pedido de atendimento domiciliar na Comissão de\nEnsino.\nArt. 23. Os casos omissos nesta Resolução serão julgados pela Comissão de Ensino.\nArt. 24. Esta Resolução entrará em vigor a partir do 2º semestre de 2019, ficando revogada, a partir da referida data, a Resolução nº 024/2015 – CONSEPE.\nFlorianópolis, 19 de fevereiro de 2019.\nProfessora Soraia Cristina Tonon da Luz\nPresidente do CONSEPE\nFundação Universidade do Estado de Santa Catarina\nAv. Madre Benvenuta, 2007 – Itacorubi – Florianópolis, SC\nCep: 88035-001 – Fone (48) 3664 8000 – www.udesc.br\n```', '# Chunks do arquivo 002-2019-cpe.pdf\n\n## Chunk 1\n```\nArt. 1º O regime especial de atendimento domiciliar é uma prática excepcional que tem por objetivo oferecer condições especiais de acompanhamento nas atividades pedagógicas aos acadêmicos em situações que lhe impossibilitem a frequência e a participação nas atividades acadêmicas normais.\n\nArt. 2º O regime especial de atendimento domiciliar se define pela dispensa da exigibilidade de presença física do acadêmico nas aulas, substituída por programação especial definida pelo professor da disciplina e operacionalizada pela Secretaria de Ensino de Graduação, com o objetivo de dar continuidade ao processo psicopedagógico da aprendizagem.\n\nArt. 3º A Fundação Universidade do Estado de Santa Catarina - UDESC, de acordo com as condições disponíveis e conforme o conteúdo curricular da disciplina, poderá conceder as atividades domiciliares com acompanhamento, para seus acadêmicos que assim o requeiram, nos moldes desta\nResolução.\n\nArt. 4º O regime especial de atendimento domiciliar deve ser solicitado pelo acadêmico ou procurador quando da observação do problema que impede o acadêmico de manter frequência normal em aula, não sendo concedido em hipótese alguma para data retroativa à data do início do impedimento.\nParágrafo único. Disciplinas de caráter prático e estágios não poderão ter atendimento domiciliar temporário.\n\nArt. 4º O regime especial de atendimento domiciliar deve ser solicitado pelo acadêmico ou por terceiro quando da observação do problema que impede o acadêmico de manter frequência normal em aula, não sendo concedido em data retroativa ao início do impedimento.\nParágrafo único. Disciplinas de estágios não poderão ter atendimento domiciliar temporário.\n(redação dada pela Resolução nº 35/2019 - CONSEPE)\n\nArt. 5º O período para concessão do regime especial de atendimento domiciliar não poderá ser inferior a 15 (quinze) dias letivos.\n\nArt. 5º O período para concessão do regime especial de atendimento domiciliar não poderá ser inferior a 15 (quinze) dias. (redação dada pela Resolução nº 35/2019 - CONSEPE)\n\nArt. 6º É permitida a renovação do regime especial de atendimento domiciliar durante semestre com apresentação de novo atestado médico.\nFundação Universidade do Estado de Santa Catarina\nAv. Madre Benvenuta, 2007 – Itacorubi – Florianópolis, SC\nCep: 88035-001 – Fone (48) 3664 8000 – www.udesc.br\n\nArt. 7º O disposto nesta Resolução aplica-se somente ao acadêmico regularmente matriculado em curso superior da UDESC.\n```\n\n## Chunk 2\n```\nCAPÍTULO II\nDo Direito ao Regime Especial de Atendimento Domiciliar\nArt. 8º São considerados aptos para solicitar o direito ao regime especial de atendimento domiciliar:\nI – estudante que esteja em: a) licença maternidade mediante documento comprobatório; b) situações excepcionais mediante atestado médico;\nII – acadêmico portador de afecções adquiridas, infecções, traumatismos, tratamentos quimioterápicos/radioterápicos ou outras condições, caracterizadas por: a) incapacidade física relativa, incompatível com a frequência às atividades acadêmicas comprovada mediante atestado médico; b) ocorrência isolada ou esporádica, comprovada por atestado médico ou declaração expedida por profissional de saúde habilitado.\nArt. 9º O atestado médico que comprova a impossibilidade do acadêmico de frequentar as atividades em sala de aula deverá constar o período de início e término do impedimento.\nParágrafo único. A solicitação de atendimento domiciliar poderá ser entregue por procurador quando o requerente estiver impossibilitado de comparecer à Secretaria de Ensino de Graduação.\nParágrafo único. A solicitação de atendimento domiciliar poderá ser entregue por outra pessoa quando o requerente estiver impossibilitado de comparecer à Secretaria de Ensino de\nGraduação. (redação dada pela Resolução nº 35/2019 - CONSEPE)\n```', '# Chunks do arquivo 002-2010-cpe.pdf\n\n## Chunk 1\n```\nArt. 1º O artigo 3º da Resolução 001/2000 – CONSEPE, de 15 de março de 2000, fica alterado no “caput” e acrescido de §§ 3º e 4º, com a seguinte redação: ""\n\nArt. 3º O aluno portador de deficiências físicas, doenças graves ou afecções que importem em limitação da capacidade de aprendizagem, e que esteja com o prazo de integralização curricular em vias de esgotar-se, poderá solicitar a dilatação do prazo máximo estabelecido para conclusão do\nCurso de Graduação.\n§ 1º ...................................\n§ 2º ....................................\n§ 3º Por força maior, entendem-se as ocorrências inevitáveis e não promovidas por vontade ou ação do sujeito interessado.\n§ 4º Poderão justificar-se como motivos de força maior todos os eventos ou situações que sejam inevitáveis, ainda que previsíveis, como as catástrofes ambientais e/ou fenômenos da natureza.""\n\nArt. 2º O caput do artigo 6º passa a ter a seguinte redação, mantendo-se inalterado o\nParágrafo Único: ""\n\nArt. 6º - Após decisão do Conselho de Centro, a Direção Geral encaminhará o processo à\nSecretaria de Ensino de Graduação do Centro para as providências cabíveis.""\n\nArt. 3º Esta Resolução entra em vigor nesta data.\n\nArt. 4º Ficam revogadas as demais disposições em contrário.\nFlorianópolis, 23 de fevereiro de 2010.\nProfessora Sandra Makowiecky\nPresidente do CONSEPE\n```', '## Chunk 10\n```\nCAPÍTULO X\nDA MATRÍCULA DOS APROVADOS\nArt. 28. O(A) candidato(a) classificado(a) numa das modalidades de ingresso previstas nesta\nResolução, deverá efetuar a sua matrícula junto à Secretaria de Ensino de Graduação do Centro no período estabelecido pelo Calendário Acadêmico da UDESC, divulgado no respectivo Edital de vagas.\n§ 1º A matrícula será feita pelo(a) próprio(a) candidato (a) ou por procurador(a) legalmente instituído(a) para esse ato.\n§ 2º O(A) candidato(a) deverá apresentar todos os documentos necessários à matrícula de acordo com a modalidade de ingresso.\n§ 3º Compete à Secretaria de Ensino de Graduação garantir a ordem da matrícula respeitando a classificação do(a) candidato(a).\nArt. 29. O(A) candidato (a) classificado(a) que não efetuar a matrícula no tempo estabelecido, perderá o direito à vaga no curso.\nParágrafo Único. Caso o(a) candidato(a) classificado(a) apresentar solicitação de desistência formal da vaga, será convocado(a) o(a) candidato(a) subsequente, por e-mail, respeitando-se a ordem de classificação para o preenchimento da vaga.\nArt. 30. Esta Resolução entra em vigor nesta data, revogando-se a Resolução nº 013/2017–\nCONSEPE e a Resolução nº 38/2019 – CONSEPE.\nFlorianópolis, 30 de maio de 2023.\nProfª. Drª. Gabriela Botelho Mager\nPresidente da CEG/CONSUN\n```']"," Em até cinco dias úteis contados a partir do início do impedimento, expressamente comprovado.
```


Resposta corrigida:

De acordo com a Resolução nº 35/2019 - CONSEPE, o acadêmico pode solicitar o regime especial de atendimento domiciliar em até 5 (cinco) dias úteis contados a partir do início do impedimento, expressamente comprovado.


Fonte: RESOLUÇÃO CONSEPE N° 35, DE 06 DE NOVEMBRO DE 2019 - CONSUNI

","O pedido deve ser feito em até cinco dias úteis a partir do início do impedimento, e o regime não pode ser concedido de forma retroativa.",1.0,0.8850555586703798,0.99999999995,1.0,0.6425597596160042
Que tipos de atividades podem contar como Atividades Complementares na UDESC?,"['## Chunk 3\n```\nCAPÍTULO III\nDos Procedimentos para Solicitar o Regime Especial de Atendimento Domiciliar\nArt. 10. O regime especial de atendimento domiciliar deve ser requerido pelo acadêmico ou por procurador, até 5 (cinco) dias úteis contados a partir do início do impedimento, expressamente comprovado.\nArt. 10. O regime especial de atendimento domiciliar deve ser requerido pelo acadêmico ou por terceiro, até 5 (cinco) dias úteis contados a partir do início do impedimento, expressamente comprovado. (redação dada pela Resolução nº 35/2019 - CONSEPE) § 1º A solicitação deve ser protocolada na Secretaria de Ensino de Graduação, por meio de requerimento endereçado ao Chefe do Departamento do curso em que o acadêmico se encontra matriculado.\n§ 2º No requerimento deve constar o nome do requerente, matrícula, e-mail, telefone, curso e fase, bem como período de atendimento domiciliar necessário e nome das disciplinas que solicita atendimento domiciliar.\nFundação Universidade do Estado de Santa Catarina\nAv. Madre Benvenuta, 2007 – Itacorubi – Florianópolis, SC\nCep: 88035-001 – Fone (48) 3664 8000 – www.udesc.br\nArt. 11. A Secretaria de Ensino de Graduação terá o prazo de 2 (dois) dias úteis para encaminhar a solicitação de atendimento domiciliar à chefia do departamento, anexando também declaração de matrícula referente a(s) disciplina(s) em que o acadêmico se encontra matriculado.\nArt. 12. O Chefe de Departamento do curso e professor da disciplina terão 3 (três) dias úteis, contados do recebimento da Secretaria de Ensino de Graduação, para emitir parecer sobre as disciplinas em que será possível aplicar o plano de estudos.\nArt. 13. Mediante justificativa fundamentada, a chefia do departamento poderá indeferir a solicitação que será comunicado ao acadêmico pela Secretaria de Ensino de Graduação.\nArt. 14. A concessão do regime especial de atendimento domiciliar será por semestre em que o acadêmico estiver matriculado, de acordo com o Calendário Acadêmico da UDESC.\nArt. 15. Sendo necessária a concessão do regime especial de atendimento domiciliar por mais um semestre ou parte dele, novo requerimento deverá ser apresentado na Secretaria de Ensino de Graduação que será deliberado pelo Chefe de Departamento do curso e professor da disciplina no prazo de 5 (cinco) dias úteis.\n```\n\n## Chunk 4\n```\nCAPÍTULO IV\nDo Plano de Estudos\nArt. 16. O Chefe de Departamento do Curso solicitará ao professor responsável pela disciplina que será oferecida em regime especial, a elaboração de um plano de estudos que deverá ser apresentado em até 03 (três) dias úteis contados a partir da data de deferimento.\n§ 1º O plano de estudos deve ser compatível com as condições físicas do requerente.\n§ 2º O plano de estudos deverá conter os conteúdos e as atividades a serem desenvolvidas pelo acadêmico, bem como bibliografia a ser consultada e cronograma de exercícios de verificação da aprendizagem.\n§ 3º O plano de estudos deverá ser aprovado pelo chefe do departamento do curso em até 2 (dois) dias úteis.\nArt. 17. Após o plano de estudos ter sido aprovado pelo Chefe de Departamento do Curso, o professor responsável pela disciplina encaminhará ao acadêmico por e-mail com cópia para a\nSecretaria de Ensino de Graduação.\nParágrafo Único – A tramitação entre a data da solicitação e o encaminhamento do plano ao acadêmico não deverá ultrapassar 10 (dez) dias úteis.\nArt. 18. É de responsabilidade do professor, além da elaboração do plano de estudos para o acadêmico, as seguintes atribuições:\nI - promover o acompanhamento do plano de estudos, disponibilizando meios para contato com o acadêmico;\nII - acompanhar o processo de aprendizagem do acadêmico;\nIII - avaliar as atividades realizadas, atribuindo-lhes notas/médias consoantes com sistema de verificação da aprendizagem da UDESC;\nIV - lançar no diário de classe a frequência do acadêmico ao longo do período de regime de atividades domiciliares, ressaltando no mesmo as datas inicial e final do regime, para dar ciência da situação diferenciada do acadêmico.\nFundação Universidade do Estado de Santa Catarina\nAv. Madre Benvenuta, 2007 – Itacorubi – Florianópolis, SC\nCep: 88035-001 – Fone (48) 3664 8000 – www.udesc.br\nArt. 19. O desempenho nas avaliações ocorridas durante o período de impedimento do aluno será mensurado pelo professor da disciplina, mediante cumprimento e aprovação das atividades dispostas no plano de estudos.\nParágrafo único. O não cumprimento das atividades constantes do plano de estudos poderá acarretar na reprovação do acadêmico na disciplina.\n```', '# Chunks do arquivo 002-2019-cpe.pdf\n\n## Chunk 1\n```\nArt. 1º O regime especial de atendimento domiciliar é uma prática excepcional que tem por objetivo oferecer condições especiais de acompanhamento nas atividades pedagógicas aos acadêmicos em situações que lhe impossibilitem a frequência e a participação nas atividades acadêmicas normais.\n\nArt. 2º O regime especial de atendimento domiciliar se define pela dispensa da exigibilidade de presença física do acadêmico nas aulas, substituída por programação especial definida pelo professor da disciplina e operacionalizada pela Secretaria de Ensino de Graduação, com o objetivo de dar continuidade ao processo psicopedagógico da aprendizagem.\n\nArt. 3º A Fundação Universidade do Estado de Santa Catarina - UDESC, de acordo com as condições disponíveis e conforme o conteúdo curricular da disciplina, poderá conceder as atividades domiciliares com acompanhamento, para seus acadêmicos que assim o requeiram, nos moldes desta\nResolução.\n\nArt. 4º O regime especial de atendimento domiciliar deve ser solicitado pelo acadêmico ou procurador quando da observação do problema que impede o acadêmico de manter frequência normal em aula, não sendo concedido em hipótese alguma para data retroativa à data do início do impedimento.\nParágrafo único. Disciplinas de caráter prático e estágios não poderão ter atendimento domiciliar temporário.\n\nArt. 4º O regime especial de atendimento domiciliar deve ser solicitado pelo acadêmico ou por terceiro quando da observação do problema que impede o acadêmico de manter frequência normal em aula, não sendo concedido em data retroativa ao início do impedimento.\nParágrafo único. Disciplinas de estágios não poderão ter atendimento domiciliar temporário.\n(redação dada pela Resolução nº 35/2019 - CONSEPE)\n\nArt. 5º O período para concessão do regime especial de atendimento domiciliar não poderá ser inferior a 15 (quinze) dias letivos.\n\nArt. 5º O período para concessão do regime especial de atendimento domiciliar não poderá ser inferior a 15 (quinze) dias. (redação dada pela Resolução nº 35/2019 - CONSEPE)\n\nArt. 6º É permitida a renovação do regime especial de atendimento domiciliar durante semestre com apresentação de novo atestado médico.\nFundação Universidade do Estado de Santa Catarina\nAv. Madre Benvenuta, 2007 – Itacorubi – Florianópolis, SC\nCep: 88035-001 – Fone (48) 3664 8000 – www.udesc.br\n\nArt. 7º O disposto nesta Resolução aplica-se somente ao acadêmico regularmente matriculado em curso superior da UDESC.\n```\n\n## Chunk 2\n```\nCAPÍTULO II\nDo Direito ao Regime Especial de Atendimento Domiciliar\nArt. 8º São considerados aptos para solicitar o direito ao regime especial de atendimento domiciliar:\nI – estudante que esteja em: a) licença maternidade mediante documento comprobatório; b) situações excepcionais mediante atestado médico;\nII – acadêmico portador de afecções adquiridas, infecções, traumatismos, tratamentos quimioterápicos/radioterápicos ou outras condições, caracterizadas por: a) incapacidade física relativa, incompatível com a frequência às atividades acadêmicas comprovada mediante atestado médico; b) ocorrência isolada ou esporádica, comprovada por atestado médico ou declaração expedida por profissional de saúde habilitado.\nArt. 9º O atestado médico que comprova a impossibilidade do acadêmico de frequentar as atividades em sala de aula deverá constar o período de início e término do impedimento.\nParágrafo único. A solicitação de atendimento domiciliar poderá ser entregue por procurador quando o requerente estiver impossibilitado de comparecer à Secretaria de Ensino de Graduação.\nParágrafo único. A solicitação de atendimento domiciliar poderá ser entregue por outra pessoa quando o requerente estiver impossibilitado de comparecer à Secretaria de Ensino de\nGraduação. (redação dada pela Resolução nº 35/2019 - CONSEPE)\n```', '# Chunks do arquivo 035-2019-cpe.pdf\n\n## Chunk 1\n```\nArt. 1º O art. 4º da Resolução nº 2/2019 – CONSEPE, de 19 de fevereiro de 2019, passa a vigorar com a seguinte redação: “\n\nArt. 4º O regime especial de atendimento domiciliar deve ser solicitado pelo acadêmico ou por terceiro quando da observação do problema que impede o acadêmico de manter frequência normal em aula, não sendo concedido em data retroativa ao início do impedimento.\nParágrafo único. Disciplinas de estágios não poderão ter atendimento domiciliar temporário.”\n\nArt. 2º O art. 5º da Resolução nº 2/2019 – CONSEPE, de 19 de fevereiro de 2019, passa a vigorar com a seguinte redação: “\n\nArt. 5º O período para concessão do regime especial de atendimento domiciliar não poderá ser inferior a 15 (quinze) dias.”\n\nArt. 3º O Parágrafo Único do art. 9º da Resolução nº 2/2019 – CONSEPE, de 19 de fevereiro de 2019, passa a vigorar com a seguinte redação: “\n\nArt. 9º (...)\nParágrafo único. A solicitação de atendimento domiciliar poderá ser entregue por outra pessoa quando o requerente estiver impossibilitado de comparecer à Secretaria de Ensino de\nGraduação.”\n\nArt. 4º O “caput” do art. 10 da Resolução nº 2/2019 – CONSEPE, de 19 de fevereiro de 2019, passa a vigorar com a seguinte redação: “\n\nArt. 10. O regime especial de atendimento domiciliar deve ser requerido pelo acadêmico ou por terceiro, até 5 (cinco) dias úteis contados a partir do início do impedimento, expressamente comprovado.”\n\nArt. 5º Esta Resolução entra em vigor nesta ata, revogando-se as disposições em contrário.\nFlorianópolis, 06 de novembro de 2019.\nProfessora Soraia Cristina Tonon da Luz\nPresidente do CONSEPE\nFundação Universidade do Estado de Santa Catarina\nAv. Madre Benvenuta, 2007 – Itacorubi – Florianópolis, SC\nCep: 88035-001 – Fone (48) 3664 8000 – www.udesc.br\n```', '## Chunk 5\n```\nCAPÍTULO V\nDas Considerações Gerais\nArt. 20. Cabe ao acadêmico ou procurador manter-se em contato com o professor da disciplina, para o cumprimento das atividades e entrega das tarefas contidas em seu plano de estudos estabelecidas no regime especial de atendimento domiciliar.\nArt. 21. Será permitido ao acadêmico o cancelamento da matrícula para a disciplina quando o regime especial for negado.\nArt. 22. Cabe recurso da decisão do pedido de atendimento domiciliar na Comissão de\nEnsino.\nArt. 23. Os casos omissos nesta Resolução serão julgados pela Comissão de Ensino.\nArt. 24. Esta Resolução entrará em vigor a partir do 2º semestre de 2019, ficando revogada, a partir da referida data, a Resolução nº 024/2015 – CONSEPE.\nFlorianópolis, 19 de fevereiro de 2019.\nProfessora Soraia Cristina Tonon da Luz\nPresidente do CONSEPE\nFundação Universidade do Estado de Santa Catarina\nAv. Madre Benvenuta, 2007 – Itacorubi – Florianópolis, SC\nCep: 88035-001 – Fone (48) 3664 8000 – www.udesc.br\n```', '# Chunks do arquivo 039-2015-cpe.pdf\n\n## Chunk 1\n```\nArt. 1º - O acadêmico regularmente matriculado que deixar de comparecer a qualquer das avaliações nas datas fixadas pelo professor, poderá solicitar segunda chamada desta avaliação através de requerimento por ele assinado, ou por seu representante legal, entregue na Secretaria de Ensino de\nGraduação e/ou Secretaria do Departamento, no prazo de 5 (cinco) dias úteis, contados a partir da data de realização da avaliação, sendo aceitos pedidos, devidamente comprovados e que se enquadrem em um das seguintes situações:\nI - problema de saúde do aluno ou parente de 1º grau, devidamente comprovado, que justifique a ausência;\nII - ter sido vítima de ação involuntária provocada por terceiros, comprovada por Boletim de\nOcorrência ou documento equivalente;\nIII - manobras ou exercícios militares comprovados por documento da respectiva unidade militar;\nIV - luto, comprovado pelo respectivo atestado de óbito, por parentes em linha reta (pais, avós, filhos e netos), colaterais até o segundo grau (irmãos e tios), cônjuge ou companheiro (a), com prazo de até 5 (cinco) dias úteis após o óbito;\nV - convocação, coincidente em horário, para depoimento judicial ou policial, ou para eleições em entidades oficiais, devidamente comprovada por declaração da autoridade competente;\nVI - impedimentos gerados por atividades previstas e autorizadas pela Chefia de Departamento do respectivo curso ou instância hierárquica superior, comprovada através de declaração ou documento equivalente;\nVII - direitos outorgados por lei;\nVIII - coincidência de horário de outras avaliações do próprio curso, comprovada por declaração da chefia de departamento;\nIX – convocação para competições oficiais representando a UDESC, o Município, o Estado ou o\nPaís;\nX – convocação pelo chefe imediato, no caso de acadêmico que trabalhe, em documento devidamente assinado e carimbado, contendo CNPJ da empresa ou equivalente, acompanhado de documento anexo que comprove o vínculo empregatício, como cópia da carteira de trabalho ou do contrato ou de documento equivalente.\nParágrafo único - O requerimento deverá explicitar a razão que impediu o acadêmico de realizar a avaliação.\n\nArt. 2º - A Secretaria de Ensino de Graduação e/ou Secretaria do Departamento fará a análise da solicitação e emitirá parecer.\nFundação Universidade do Estado de Santa Catarina\nAv. Madre Benvenuta, 2007 – Itacorubi – 88.035-001\nFlorianópolis SC Fone (48) 3321 8000 – www.udesc.br §1°- Caso o requerimento seja deferido, a Secretaria de Ensino de Graduação e/ou Secretaria do\nDepartamento encaminhará expediente ao professor da disciplina, para informar do deferimento da solicitação e demais procedimentos.\n§ 2°- No caso de indeferimento, a Secretaria de Ensino de Graduação e/ou Secretaria do\nDepartamento dará ciência ao requerente.\n\nArt. 3°- Nas avaliações de segunda chamada serão exigidos somente os conteúdos referentes à avaliação em questão.\n\nArt. 4°- Quando o acadêmico estiver impedido de fazer a solicitação de segunda chamada no prazo estipulado, ele terá o direito de requere-la até 5 (cinco) dias após o término do impedimento.\n\nArt. 5° - Os casos omissos serão resolvidos pelo Chefe do Departamento.\n\nArt. 6º - Esta Resolução entra em vigor nesta data.\n\nArt. 7º - Fica revogada a Resolução nº 018/2004 - CONSEPE.\nFlorianópolis, 03 de novembro de 2015\nProfessor Luciano Emílio Hack\nPresidente do CONSEPE\nFundação Universidade do Estado de Santa Catarina\nAv. Madre Benvenuta, 2007 – Itacorubi – 88.035-001\nFlorianópolis SC Fone (48) 3321 8000 – www.udesc.br\n```', '## Chunk 1\n```\nCAPÍTULO I\nDA MATRÍCULA\nArt. 1º A matrícula é a ação do(a) estudante manifestando interesse em permanecer como acadêmico(a) da universidade.\nArt. 2º A matrícula vincula o(a) acadêmico(a) à UDESC e poderá apresentar as seguintes situações:\nI – ativa (com vínculo em disciplina ou sem vínculo com disciplina);\nII – suspensa;\nIII – trancada;\nIV – cancelada;\nV – em abandono de curso ou\nVI – em mobilidade acadêmica.\nArt. 3º Os(As) candidatos à matrícula nos cursos de graduação oferecidos pela UDESC deverão requerê-la, para cada período regular, dentro do prazo previsto pelo Calendário\nAcadêmico da Universidade.\n§ 1º A matrícula é semestral e vincula o(a) acadêmico(a) à UDESC, devendo cada interessado requerê-la, para cada período letivo regular.\n§ 2º A matrícula deverá ser sempre renovada antes do início de cada período letivo, conforme o Calendário Acadêmico.\n§ 3º A desistência de matrícula em uma ou mais disciplinas pode ser requerida pelo(a) acadêmico(a), obedecendo-se o prazo estabelecido no Calendário Acadêmico.\n§ 3º A desmatrícula em uma ou mais disciplinas pode ser requerida pelo/a acadêmico/a, obedecendo-se o prazo estabelecido no Calendário Acadêmico. (redação dada pela Resolução nº 8/2022-CEG) § 4º A desistência de matrícula em uma ou mais disciplinas será possível fora do período estabelecido no calendário acadêmico quando o acadêmico apresentar solicitação com comprovação que justifique motivo de doença do interessado ou parentes de 1º Grau ou motivo de força maior, aprovado pela Direção de Ensino de Graduação. (incluído pela Resolução nº 44/2015-CONSEPE) § 4º Excepcionalmente, a desistência de matrícula em uma ou mais disciplinas será possível fora do período estabelecido no calendário acadêmico, quando justificada e comprovada pelo/a acadêmico/a e aprovado pela Chefia do Departamento. (redação dada pela\nResolução nº 27/2019-CONSEPE)\nRes. 005/2014-CONSEPE, fl. 1 de 8\nUniversidade do Estado de Santa Catarina\nREITORIA UDESC\nAv. Madre Benvenuta, 2007 – Itacorubi – 88.035-001\nFlorianópolis SC Fone (48) 3231 1503 – www.udesc.br § 4º Excepcionalmente, a desmatrícula em uma ou mais disciplinas em curso será possível fora do período estabelecido no calendário acadêmico até 15 dias antes do encerramento do período letivo, devendo o/a acadêmico/a enviar a solicitação devidamente justificada e comprovada através do Sistema Acadêmico, cabendo à Chefia do Departamento a análise da solicitação. (redação dada pela Resolução nº 8/2022-CEG) § 5º Entende-se como motivo de força maior, fatos externos que podem ser de ordem de autoridade, fenômenos naturais e ocorrências políticas. (incluído pela Resolução nº 44/2015-CONSEPE) § 5º A solicitação e a justificativa comprovada devem dar entrada na Secretaria de\nEnsino de Graduação para registro e encaminhamento à Chefia de Departamento para análise e parecer. (redação dada pela Resolução nº 27/2019-CONSEPE) (suprimido pela Resolução nº 8/2022-CEG)\nArt. 4º O(A) discente de graduação da UDESC deve matricular-se, por semestre, em um número de créditos igual ou inferior ao definido na fórmula abaixo:\nMaxM = MaxF x 1,25, onde:\nMaxM = número máximo de créditos que um(a) discente pode cursar por semestre;\nMaxF = número de créditos da fase com maior carga horária da matriz curricular vigente do curso, excluindo-se os créditos de disciplinas de estágio e trabalho de conclusão de curso.\n§ 1° Sempre que MaxM não resultar em um número inteiro procede-se o arredondamento para o número inteiro imediatamente superior, independente do valor dos decimais a desprezar.\n§ 2° O Colegiado Pleno do Departamento promoverá as adaptações necessárias para o atendimento do disposto no art. 4º, podendo aceitar matrículas de discentes formandos ou pertencentes a matrizes em extinção em um número de créditos até 20% superior ao estipulado neste artigo.\n§ 3º O Colegiado Pleno do Departamento poderá promover adaptações necessárias para o atendimento do disposto no art. 4º, podendo aceitar matrículas de discentes em um número superior de créditos quando a matrícula incluir estágio curricular obrigatório. (incluído pela Resolução nº 08/2015-CONSEPE) § 3º A carga horária de estágio curricular obrigatório não será considerada no limite do número de créditos em disciplinas que um acadêmico pode cursar no semestre, permitindo-se assim que o acadêmico curse o Estágio Curricular Supervisionado e o número máximo de créditos em disciplinas definidos no caput deste artigo, exceto para os cursos nos quais esta restrição for aprovada pelo Colegiado Pleno do Departamento. (redação dada pela Resolução nº 26/2015-CONSEPE)\nArt. 5º Não existe número mínimo de créditos em que o(a) discente deverá se matricular, exceto para o(a) ingressante via Processo Seletivo da UDESC ou via o Sistema de\nSeleção Unificada (SISU) cuja matrícula deverá ser em todas as disciplinas da 1ª fase do seu curso.']"," 5 dias úteis



Justificativa:

A resposta correta é ""5 dias úteis"" porque o Artigo 10 da Resolução Nº 02/2019-CPE diz que o regime especial de atendimento domiciliar deve ser requerido pelo acadêmico ou por terceiro, até 5 (cinco) dias úteis contados a partir do início do impedimento, expressamente comprovado.



Fonte: 
https://www.consepe.udesc.br/resolucoes/consepe-resolucao-n-2-de-19-fev-2019.html","Podem ser atividades de ensino, pesquisa, extensão, administração universitária ou mistas que integrem teoria e prática, conforme previsto na regulamentação.",0.8,0.8029340544860567,0.0,0.0,0.19671374056071517
Qual é o percentual da carga horária total do curso que deve ser destinado às Atividades Complementares?,"['## Chunk 1\n```\nArt. 1º As Atividades Complementares são componentes curriculares que possibilitam o reconhecimento, por avaliação, de habilidades, conhecimentos, competências do aluno, inclusive adquiridas fora da universidade.\n§ 1º As Atividades Complementares são aquelas feitas com conhecimento da instituição, porém individualmente organizadas para o enriquecimento da formação acadêmica do aluno.\n§ 2º As Atividades Complementares incluem a prática de estudos e atividades independentes, ações de extensão junto à comunidade, não podendo ser confundidas com estágio curricular obrigatório. (excluído pela Resolução nº 11/2021-CEG) § 3º O total da carga horária atribuída às Atividades Complementares deve contemplar de 8% a 10% do total da carga horária mínima do curso definida pela legislação, tanto para as modalidades presenciais como para as modalidades à distância, não podendo exceder este limite.\n§ 3º O total da carga horária atribuída às Atividades Complementares deve estar entre 2% e 6% do total da carga horária mínima do curso definida pela legislação, tanto para as modalidades presenciais como para as modalidades a distância, não podendo exceder este limite. (redação dada pela Resolução nº 4/2021-CEG)\n\nArt. 2º - Consideram-se como Atividades Complementares os seguintes tipos:\nI - atividades de ensino que se diferenciam da concepção tradicional de disciplina pela liberdade de escolha, de temáticas na definição de programas ou projetos de experimentação e procedimentos metodológicos;\nII - atividades de extensão que constituam uma oportunidade da comunidade interagir com a Universidade, construindo parcerias que possibilitam a troca de saberes popular e acadêmico com aplicação de metodologias participativas;\nIII - atividades de pesquisa que promovam a formação da cidadania profissional dos acadêmicos, o intercâmbio, a reelaboração e a produção de conhecimento compartilhado sobre a realidade e alternativas de transformação;\nIV – atividades de administração universitária, uma vez que o ambiente universitário é um espaço para a aprendizagem do aluno;\nV - atividades mistas de Ensino, Pesquisa, Extensão e/ou Administração\nUniversitária que promovam a indissociabilidade e a articulação teoria e prática;\nRes. 026/2012-CONSEPE, fl. 1 de 13\nParágrafo único. Serão consideradas Atividades Complementares de Ensino, de\nExtensão, de Pesquisa, de Administração Universitária e de Atividades Mistas aquelas discriminadas e pontuadas de acordo com o Anexo I desta Resolução.\n\nArt. 3° O tipo de Atividade Complementar a ser realizada é de escolha do acadêmico, de acordo com os seus interesses, sob a orientação da Secretaria de Ensino de Graduação, conforme modelo de formulário disponível na Secretaria de Ensino de Graduação do\nCentro.\n\nArt. 4º O aluno poderá realizar as Atividades Complementares da primeira a última fase de seu curso, respeitando o estabelecido no Projeto Pedagógico do curso.\nParágrafo Único – Os(as) acadêmicos(as) das modalidades de transferência interna, reingresso após abandono, ingresso e reingresso por novo concurso vestibular, transferência externa e retorno aos portadores de diploma de curso poderão validar o total das ACC já realizadas, desde que atenda aos demais critérios da Resolução. (incluído pela\nResolução nº 11/2021-CEG) § 1º No caso dos alunos enquadrados nas modalidades de Transferência Externa e\nRetorno aos Portadores de Diploma de Curso de Graduação é possível validar na UDESC até 25% das Atividades Complementares realizadas na IES de origem. (excluído pela\nResolução nº 11/2021-CEG) § 2º No caso dos alunos enquadrados na modalidade de Transferência Interna,\nReingresso após Abandono e Reingresso por novo concurso vestibular, é possível validar o total das Atividades Complementares já realizadas, desde que atenda ao restante da\nResolução. (excluído pela Resolução nº 11/2021-CEG) § 3º Disciplinas já validadas para aproveitamento de estudos não podem ser consideradas para atividades complementares. (excluído pela Resolução nº 11/2021-CEG) § 4º Somente serão validadas atividades desenvolvidas após o ingresso do aluno no curso de graduação da UDESC, com exceção do que está mencionado no § 1º e § 2º deste artigo. (excluído pela Resolução nº 11/2021-CEG)\n\nArt. 5o A Secretaria de Ensino de Graduação é o setor responsável pelo recebimento e organização dos documentos na abertura de processo para o registro das Atividades\nComplementares, bem como o seu registro no sistema acadêmico.\nParágrafo único. De acordo com a orientação da Direção de Ensino de Graduação, que será feita baseada nas características da Atividade Complementar e na estrutura do\nCentro, o processo será analisado pela Secretaria de Ensino de Graduação e, quando necessário, pela Chefia de Departamento.', '## Chunk 1\n```\nArt. 1º As Atividades Complementares - AC são componentes curriculares, constantes no Projeto Pedagógico do Curso – PPC, que possibilitam o reconhecimento, por avaliação, de habilidades, conhecimentos, saberes e competências do(a) acadêmico(a), inclusive as adquiridas fora da universidade.\nParágrafo Único. Os cursos definem um percentual fixo para atividades complementares incluídas no Projeto Pedagógico do Curso que deverá estar entre 2% e 6% da carga horária total do curso, nas modalidades Presencial e a Distância -\nEaD.\n\nArt. 2º Consideram-se como atividades complementares:\nI - atividades de ensino;\nII - atividades de extensão;\nIII - atividades de pesquisa;\nIV - atividades de administração universitária;\nV - atividades mistas de ensino, pesquisa, extensão e/ou administração universitária.\n§ 1º As atividades complementares são aquelas discriminadas e pontuadas de acordo com o Apêndice I desta Resolução.\n§ 1º As atividades complementares são aquelas discriminadas e pontuadas de acordo com o Anexo I desta Resolução. (redação dada pela Resolução nº 3/2022-CEG) § 2º O curso poderá incluir outra atividade que não conste na listagem do Apêndice\nI, desde que seja submetida à análise do Núcleo Docente Estruturante.\n§ 2º O curso poderá incluir outra atividade que não conste na listagem do Anexo I, desde que seja submetida à análise do Núcleo Docente Estruturante. (redação dada pela Resolução nº 3/2022-CEG)\n\nArt. 3º O tipo de atividade complementar a ser realizada é de escolha do(a) acadêmico(a), conforme os seus interesses e necessidades, sob a orientação da\nSecretaria de Ensino de Graduação, conforme o Apêndice II desta Resolução.\n\nArt. 3º O tipo de atividade complementar a ser realizada é de escolha do(a) acadêmico(a), conforme os seus interesses e necessidades, sob a orientação da\nSecretaria de Ensino de Graduação, conforme o Anexo II desta Resolução. (redação dada pela Resolução nº 3/2022-CEG)\n\nArt. 4º O(A) acadêmico(a) poderá realizar as atividades complementares, desde a primeira até a última fase de seu curso, respeitando o estabelecido no Projeto\nPedagógico do Curso.\nParágrafo Único. Os(as) acadêmicos(as) das modalidades de transferência interna, reingresso após abandono ou reingresso após cancelamento da matrícula pelo acadêmico, ingresso e reingresso por novo processo seletivo, transferência externa e retorno a portador de diploma de curso de graduação, poderão validar o total das atividades complementares já realizadas, desde que atenda aos demais critérios desta Resolução.\n\nArt. 5º O prazo para solicitar a validação das atividades complementares, via sistema acadêmico, deverá ocorrer 10 dias após o início do período letivo e, no mínimo, 20 dias antes da finalização do período letivo, conforme calendário acadêmico da UDESC.\nParagrafo único: As atividades complementares, assim como as atividades de creditação de extensão possuem similaridades, todavia, o acadêmico só poderá validar cada atividade uma única vez, escolhendo em qual componente curricular irá validar: ou atividades complementares ou creditação da extensão.\n(incluído pela Resolução nº 3/2022-CEG)\n\nArt. 6º O requerimento para a validação das atividades complementares deverá ser enviado pelo(a) acadêmico(a), via sistema acadêmico, acompanhado pelos certificados e/ou as declarações digitalizadas, ou uma foto nítida frente e verso dos documentos para a Secretaria de Ensino de Graduação.\n\nArt. 7º A Secretaria de Ensino de Graduação ou a Chefia de Departamento é quem analisam os requerimentos para a validação das atividades complementares e deverão apresentar parecer conclusivo sobre a validação das atividades complementares solicitadas pelo(a) acadêmico(a), até 10 (dez) dias após o término do semestre.\n\nArt. 7º A Secretaria de Ensino de Graduação ou a Chefia de Departamento é quem analisam os requerimentos para a validação das atividades complementares solicitadas pelo(a) acadêmico(a), até 10 (dez) dias após o término do semestre. (redação dada pela Resolução nº 3/2022-CEG)\n\nArt. 8º As atividades complementares serão registradas no histórico escolar, até a conclusão dos créditos previstos na matriz curricular ao qual o(a) acadêmico(a) está vinculado(a).\n\nArt. 9o Esta Resolução entra em vigor nesta data, revogando-se a Resolução nº 026/2012 –CONSEPE.\n\nArt. 9º Esta Resolução entra em vigor a partir da implantação da reforma do Projeto\nPedagógico de cada Curso (PPC) após aprovação nas devidas instâncias e inclusão no Sistema Acadêmico. (redação dada pela Resolução nº 3/2022-CEG)', '# Chunks do arquivo 004-2021-ceg.pdf\n\n## Chunk 1\n```\nArt. 1º O § 3º do art. 1º da Resolução nº 026/2012 – CONSEPE, que “Regulamenta as atividades complementares nos cursos de graduação da UDESC.”, passa a vigorar com a seguinte redação: “\n\nArt. 1º (...) § 3º O total da carga horária atribuída às Atividades Complementares deve estar entre 2% e 6% do total da carga horária mínima do curso definida pela legislação, tanto para as modalidades presenciais como para as modalidades a distância, não podendo exceder este limite.”\n\nArt. 2º Esta Resolução entra em vigor nesta data.\n\nArt. 3º Ficam revogadas as disposições em contrário.\nFlorianópolis, 14 de setembro de 2021.\nProfessor Nério Amboni\nPresidente da CEG\nFundação Universidade do Estado de Santa Catarina\nAv. Madre Benvenuta, 2007 – Itacorubi – Florianópolis, SC\nCep: 88035-001 – Fone: (48) 3664 8000 – www.udesc.br\n```', '# Chunks do arquivo 025-2006-cpe.pdf\n\n## Chunk 1\n```\nArt. 1º - As cargas horárias previstas para a integralização dos currículos dos cursos de graduação da UDESC devem ser cumpridas de acordo com o conceito de hora-relógio (60 minutos) e não de hora-aula, já que estas podem ser variáveis.\n\nArt. 2º - A carga horária de cada disciplina e dos currículos dos cursos de graduação da\nUDESC devem ser integralizados, em seus currículos mínimos estabelecidos pelas Diretrizes\nCurriculares Nacionais ou de Parecer equivalente, considerando-se horas de 60 (sessenta) minutos.\n\nArt. 3º - A duração da hora–aula na UDESC é de 50 (cinqüenta) minutos.\n\nArt. 4º - O valor do crédito de cada disciplina dos currículos dos cursos de graduação da\nUDESC é de 18 (dezoito) horas.\n\nArt. 5º - Para o cumprimento do artigo anterior, o semestre letivo será composto de, no mínimo, 18 (dezoito) semanas e 108 (cento e oito) dias letivos.\nParágrafo Único – No período letivo de 108 (cento e oito) dias letivos deverão estar incluídas todas as avaliações com os conceitos finais do aluno.\n\nArt. 5° Para o cumprimento do artigo anterior, o semestre letivo será composto de, no mínimo, 18 (dezoito) semanas e entre 95 (noventa e cinco) e 105 (cento e cinco) dias letivos.\nParágrafo único. No período letivo semestral deverão estar incluídas todas as avaliações com os conceitos finais do aluno. (redação dada pela Resolução nº 23/2013-CONSEPE)\n\nArt. 5º Para o cumprimento do artigo anterior, o semestre letivo será composto de, no mínimo, 18 (dezoito) semanas. (redação dada pela Resolução nº 12/2021-CEG)\nParágrafo único. O ano letivo terá, no mínimo, 200 (duzentos) dias de trabalho acadêmico efetivo, excluído o tempo reservado aos exames finais, quando houver. (redação dada pela\nResolução nº 12/2021-CEG)\n\nArt. 6º - Os projetos de cursos de graduação deverão obedecer à seguinte relação: 1) para componente curricular de 1 crédito, registra-se 18 horas-aula; 2) para componente curricular de 2 créditos, registra-se 36 horas-aula; 3) para componente curricular de 3 créditos, registra-se 54 horas-aula; 4) para componente curricular de 4 créditos, registra-se 72 horas-aula; 5) para componente curricular de 5 créditos, registra-se 90 horas-aula; 6) para componente curricular de 6 créditos, registra-se 108 horas-aula; 7) para componente curricular de 8 créditos, registra-se 144 horas-aula; 8) para componente curricular de 16 créditos, registra-se 288 horas-aula e assim, sucessivamente.\n\nArt.7º - O máximo de faltas permitidas ao aluno por disciplina, em até 25% (vinte e cinco por cento), correspondente às horas-aula ministradas passa a ser, com a nova determinação, o seguinte: 1) para componente curricular de 1 crédito –18 horas-aula : até 4 faltas; 2) para componente curricular de 2 créditos - 36 horas-aula: até 9 faltas; 3) para componente curricular de 3 créditos –54 horas-aula: até 13 faltas; 4) para componente curricular de 4 créditos - 72 horas-aula; até 18 faltas; 5) para componente curricular de 5 créditos - 90 horas-aula; até 22 faltas; 6) para componente curricular de 6 créditos - 108 horas-aula; até 27 faltas; 7) para componente curricular de 8 créditos - 144 horas-aula; até 36 faltas; 8) para componente curricular de 16 créditos - 288 horas-aula: até 72 faltas e assim, sucessivamente.\n\nArt. 8º - O disposto nesta Resolução se aplica a partir da reforma curricular dos projetos pedagógicos dos cursos de graduação e será implantado no sistema acadêmico após a aprovação nos Conselhos Superiores da UDESC.\n\nArt.9º - Os cursos já aprovados e ainda não implantados passarão a ser regidos por esta norma, através das equivalências expressas no\n\nArt. 6º desta Resolução e adaptações necessárias para atender às instruções normativas da Pró-Reitoria de Ensino e demais resoluções que normatizam as reformas curriculares.\n\nArt. 10 – O ano letivo de 2007 passará a ser de 108 (cento e oito) dias letivos por semestre.\n(excluído pela Resolução nº 12/2021-CEG)\n\nArt. 11 – As adaptações de todos os cursos da UDESC serão revistas caso a caso.\n\nArt. 12 - Os casos omissos nesta Resolução serão deliberados pelo Conselho de Ensino,\nPesquisa e Extensão - CONSEPE.\n\nArt. 12 - Os casos omissos nesta Resolução serão deliberados pela Câmara de Ensino de\nGraduação – CEG. (redação dada pela Resolução nº 12/2021-CEG)\n\nArt. 13 - Esta Resolução entra em vigor nesta data.\n\nArt. 14 - Ficam revogadas as disposições em contrário.\n.\nFlorianópolis, 11 de setembro de 2006.\nProf. Anselmo Fábio de Moraes\nPresidente\n```', 'Art. 7º O total de créditos de disciplinas optativas relacionadas no PPC deve ser igual ou inferior a 50% do número total de créditos em disciplinas obrigatórias do curso.\n§ 1º Da carga horária em disciplinas obrigatórias deverá ser deduzida a carga horária definida para estágio e TCC.\n§ 2º Excepcionalmente, mediante justificativa consubstanciada e aprovada previamente pela Pró-\nReitoria de Ensino (PROEN), será permitido relacionar um número maior de disciplinas optativas, desde que não envolva demanda de recurso financeiro para a Universidade.\n\nArt. 8º A carga horária das disciplinas optativas e eletivas será computada para efeito de determinação de carga horária total do curso.\nParágrafo único. O Colegiado Pleno do Departamento deverá propor no PPC os limites mínimos de integralização curricular cumpridos em disciplinas optativas ou eletivas.\n\nArt. 9º O número máximo de créditos que pode ser oferecido semestralmente em disciplinas optativas é o valor referente à multiplicação de uma vez e meio (1,5) do número mínimo de créditos que o acadêmico deve cumprir em disciplinas optativas para a conclusão do curso.\n§ 1º Em caso de número fracionado, será feito o arredondamento do número de disciplinas para o número inteiro imediatamente superior.\nUniversidade do Estado de Santa Catarina\nREITORIA UDESC\nAv. Madre Benvenuta, 2007 – Itacorubi – 88.035-001\nFlorianópolis SC Fone (48) 3231 1503 – www.udesc.br § 2º Excepcionalmente, mediante justificativa consubstanciada e aprovada previamente pela Pró-\nReitoria de Ensino (PROEN), será permitido o oferecimento de um número maior de disciplinas.\n\nArt. 10. O número mínimo de acadêmicos necessários para a realização de cada turma/disciplina optativa é igual a 10 (dez).\n§ 1º Será permitida a abertura de turmas com menos de 10 (dez) acadêmicos se o número de acadêmicos matriculados na respectiva fase for menor que este.\n§ 2º Excepcionalmente, mediante justificativa consubstanciada e aprovada pela Pró-Reitoria de\nEnsino (PROEN), será permitida a realização de disciplina optativa com número inferior a dez acadêmicos.\n\nArt. 11. É permitido ao acadêmico regularmente matriculado cursar disciplinas em outros cursos de graduação, observada a disponibilidade de vagas.\nCapítulo IV\nDISPOSIÇÕES TRANSITÓRIAS\n\nArt. 12. Os ajustes necessários nos atuais projetos pedagógicos dos cursos deverão ser feitos no prazo de 4 (quatro) anos, a contar da data de publicação desta Resolução.\n\nArt. 13. As regras para o oferecimento de disciplinas denominadas eletivas nos PPCs atuais, seguem as mesmas definidas para as disciplinas optativas nesta Resolução.\n\nArt. 14. Os casos omissos serão deliberados pelo Conselho de Ensino, Pesquisa e Extensão –\nCONSEPE.\n\nArt. 15. Esta Resolução entra em vigor nesta data.\n\nArt. 16. Fica revogada a Resolução nº 005/2007 – CONSEPE e demais disposições em contrário.\nFlorianópolis, 12 de setembro de 2013.\nProfessor Luciano Emilio Hack\nPresidente do CONSEPE\nUniversidade do Estado de Santa Catarina\nREITORIA UDESC\nAv. Madre Benvenuta, 2007 – Itacorubi – 88.035-001\nFlorianópolis SC Fone (48) 3231 1503 – www.udesc.br\n```', '# Chunks do arquivo 027-2019-cpe.pdf\n\n## Chunk 1\n```\nArt. 1º - Os §§ 4º e 5º do art. 3º e os §§ 8º e 9º do art. 13, da Resolução nº 005/2014 – CONSEPE, de 18 de fevereiro de 2014, introduzidos pela Resolução nº 044/2015 - CONSEPE, passam a vigorar com a seguinte redação: “\n\nArt. 3º (...) § 4º Excepcionalmente, a desistência de matrícula em uma ou mais disciplinas será possível fora do período estabelecido no calendário acadêmico, quando justificada e comprovada pelo/a acadêmico/a e aprovado pela Chefia do Departamento.\n§ 5º A solicitação e a justificativa comprovada devem dar entrada na Secretaria de Ensino de Graduação para registro e encaminhamento à Chefia de Departamento para análise e parecer.” “\n\nArt. 13 (...) § 8º O trancamento de matrícula será possível fora do período estabelecido no calendário, desde que justificado e comprovado pelo/a acadêmico/a e aprovado pela Chefia do Departamento.” § 9º A solicitação de trancamento e a justificativa comprovada devem ser entregues na\nSecretaria de Ensino de Graduação para registro e encaminhamento à Chefia de Departamento para análise e parecer.”.\n\nArt. 2º - O art. 24 da Resolução nº 005/2014 – CONSEPE, de 18 de fevereiro de 2014, passa a vigorar com a seguinte redação: “\n\nArt. 24 Para a definição da fase que o aluno se encontra no curso ao qual está vinculado adotar-se-á uma das seguintes situações:\nI - Caso a carga horária das disciplinas concluídas seja zero, então a fase do aluno será um;\nII - Caso o resultado seja maior que QF então a fase do aluno será o valor de QF;\nIII - Caso o resultado seja menor ou igual a QF então a fase do aluno será o valor do resultado.\n§ 1º O resultado é a parte inteira sem arredondamento do cálculo da seguinte fórmula: (NIC x QF + 1 ÷ carga horária total do curso),\nOnde:\nNIC = Nível de integralização do curso (carga horária das disciplinas concluídas pelo aluno dividido pela carga horária total do curso)\nQF = Quantidade de fases do curso\nFundação Universidade do Estado de Santa Catarina\nAv. Madre Benvenuta, 2007 – Itacorubi – 88.035-001\nFlorianópolis SC Fone (48) 3321 8000 – www.udesc.br § 1º O resultado é a parte inteira sem arredondamento do cálculo da seguinte fórmula: (NIC x\nQF + 1),\nOnde:\nNIC = Nível de integralização do curso (carga horária das disciplinas concluídas pelo aluno dividido pela carga horária total do curso)\nQF = Quantidade de fases do curso. (redação dada pela Resolução nº 48/2019-CONSEPE) § 2º A carga horária parcial ou total das atividades complementares cumprida pelo aluno deverá ser computada na carga horária cursada.”\n\nArt. 3º - Esta Resolução entra em vigor nesta data.\n\nArt. 4º - Fica revogada a Resolução nº 044/2015 – CONSEPE e demais disposições em contrário.\nFlorianópolis, 12 de setembro de 2019.\nProfessora Soraia Cristina Tonon da Luz\nPresidente do CONSEPE\nFundação Universidade do Estado de Santa Catarina\nAv. Madre Benvenuta, 2007 – Itacorubi – 88.035-001\nFlorianópolis SC Fone (48) 3321 8000 – www.udesc.br\n```']"," Entre 2% e 6%. 



Fonte: https://www.portaludesc.com.br/resolucoes/consepe/00004_2021_ceg.html



A resposta correta foi verificada usando a ferramenta de busca do portal da Udesc.



Por favor, me avise se você gostaria de fazer outras perguntas!","Entre 2% e 6% da carga horária mínima total do curso, tanto para cursos presenciais quanto a distância.",0.25,0.9053732341411717,0.9999999999666667,1.0,0.4290178035071129
Quem pode validar as Atividades Complementares já realizadas na UDESC?,"['# Chunks do arquivo 011-2021-ceg.pdf\n\n## Chunk 1\n```\nArt. 1º Fica excluído o § 2º do art. 1º da Resolução nº 026/2012 – CONSEPE, que “Regulamenta as atividades complementares nos cursos de graduação da UDESC.”.\n\nArt. 2º Ficam suprimidos os §§ 1º ao 4º do art. 4º da Resolução nº 026/2012 – CONSEPE, que “Regulamenta as atividades complementares nos cursos de graduação da UDESC.”, passando o artigo a vigorar com Parágrafo Único, com a seguinte redação: “\n\nArt. 4º (...)\nParágrafo Único – Os(as) acadêmicos(as) das modalidades de transferência interna, reingresso após abandono, ingresso e reingresso por novo concurso vestibular, transferência externa e retorno aos portadores de diploma de curso poderão validar o total das ACC já realizadas, desde que atenda aos demais critérios da Resolução.\n\nArt. 3º Esta Resolução entra em vigor nesta data.\n\nArt. 4º Ficam revogadas as disposições em contrário.\nFlorianópolis, 30 de novembro de 2021.\nProfessor Nério Amboni\nPresidente da CEG\nFundação Universidade do Estado de Santa Catarina\nAv. Madre Benvenuta, 2007 – Itacorubi – Florianópolis, SC\nCep: 88035-001 – Fone: (48) 3664 8000 – www.udesc.br\n```', 'Art. 5o A Secretaria de Ensino de Graduação é o setor responsável pelo recebimento e organização dos documentos na abertura de processo para o registro das Atividades\nComplementares, bem como o seu registro no sistema acadêmico.\nParágrafo único. De acordo com a orientação da Direção de Ensino de Graduação, que será feita baseada nas características da Atividade Complementar e na estrutura do\nCentro, o processo será analisado pela Secretaria de Ensino de Graduação e, quando necessário, pela Chefia de Departamento.\n\nArt. 6º A Secretaria de Ensino de Graduação ou, quando pertinente, a Chefia de\nDepartamento emitirão parecer quanto:\nI - ao mérito acadêmico para o aluno e para o curso;\nII - ao item desta regulamentação em que se enquadra o pedido;\nIII - ao tempo de duração da atividade;\nIV - ao número de créditos ou carga horária concedidos.\n§ 1º A Secretaria de Ensino de Graduação ou a Chefia de Departamento devem apresentar parecer conclusivo sobre a solicitação, no máximo 30 dias após a entrada do documento e até 10 dias antes do término do semestre letivo.\nRes. 026/2012-CONSEPE, fl. 2 de 13 § 2º A Chefia de Departamento, após emissão do parecer, devolverá o processo à\nSecretaria de Ensino de Graduação para registro e publicação.\n§ 3º A Chefia de Departamento poderá solicitar o apoio do Núcleo Docente\nEstruturante para a análise dos processos.\n\nArt. 7º A entrega da solicitação de validação das Atividades Complementares na\nSecretaria de Ensino de Graduação deverá ocorrer no mínimo 30 dias antes da finalização do semestre letivo, conforme Calendário Acadêmico da UDESC.\n§ 1º O aluno deverá comprovar a realização das Atividades Complementares, respeitando os prazos estabelecidos pelo Calendário Acadêmico da UDESC.\n§ 2º Os documentos comprobatórios ficarão arquivados na pasta do aluno na\nSecretaria de Ensino de Graduação.\n\nArt. 8º Para a validação das Atividades Complementares e o devido registro no\nHistórico Escolar, o aluno deverá protocolar o requerimento na Secretaria de Ensino de\nGraduação, conforme modelo do Anexo II desta Resolução, anexando cópia do(s) certificado(s) e/ou declaração(ões).\nParágrafo único. O aluno deverá quando da entrada do requerimento comprovar a autenticidade dos documentos.\n\nArt. 9º As atividades Complementares serão registradas no Histórico Escolar, no semestre em que houver a aprovação do pedido e de acordo com o limite estabelecido no\nProjeto Pedagógico do Curso.\nParágrafo único. Não serão registrados no histórico escolar Atividades\nComplementares que não pontuam na composição do cumprimento da carga horária mínima.', '# Chunks do arquivo 005-2009-cpe.pdf\n\n## Chunk 1\n```\nArt. 1º - Poderão matricular-se em disciplinas isoladas na Graduação, os alunos matriculados em cursos regulares da UDESC, desde que satisfaçam os requisitos exigidos, bem como qualquer pessoa da comunidade, desde que, além dos requisitos exigidos, atendam as normas estabelecidas para os cursos regulares no que se refere à escolaridade mínima.\n\nArt. 2° - Os alunos matriculados em disciplinas isoladas não integrarão o corpo discente regular da UDESC.\n\nArt. 3° - Poderão ser aceitas matrículas em no máximo 2 (duas) disciplinas isoladas por semestre, para cada solicitante.\nParágrafo único. Serão consideradas exceções outras situações que não estão incluídas nas rotinas acadêmicas como: matrículas em disciplinas orientadas; matrículas em disciplinas para alunos estrangeiros e, matrículas em disciplinas para alunos estrangeiros que necessitam validar o Diploma.\n\nArt. 4° - A partir das inscrições, caberá ao Colegiado de Ensino definir:\nI - disciplinas possíveis de serem cursadas pelo candidato;\nII - pré-requisitos;\nIII - número de vagas disponíveis;\nIV - procedimentos de matrícula;\nV - direitos e deveres, respeitados o Estatuto e Regimento Geral da UDESC e os termos da presente Resolução.\n\nArt. 5° - O aluno matriculado em disciplinas isoladas deverá submeter-se a verificação da aprendizagem, assegurando-lhe:\nI – o registro no histórico escolar, quando se tratar de aluno de outro curso da UDESC; e\nII – certificado de conclusão, de acordo com o Artigo 253 do Regimento Geral, quando se tratar de alunos da comunidade ou de outra instituição de ensino superior.\n\nArt. 6º – O registro e o controle Acadêmico dos alunos matriculados em disciplinas isoladas deverão ser feitos pela estrutura já existente no respectivo Centro.\n\nArt. 7º – Os alunos matriculados em disciplinas isoladas serão supervisionados pelo\nCoordenador de Colegiado de Ensino.\n\nArt. 8º – Os casos omissos serão analisados pelo Colegiado de Ensino.\n\nArt. 9º – Fica revogada a Resolução nº 016/2005-CONSEPE.\n\nArt. 10 – Esta Resolução entra em vigor nesta data.\nFlorianópolis, 07 de abril de 2009\nProfessora Sandra Makowiecky\nPresidente\n```', '# Chunks do arquivo 009-2021-ceg.pdf\n\n## Chunk 1\n```\nArt. 1º O(A) acadêmico(a) que retornar de programa de mobilidade autorizado pela UDESC, poderá obter a validação de disciplina do currículo de seu curso, desde que atenda aos requisitos estabelecidos nesta Resolução.\nParágrafo único. Entende-se por disciplina todos os componentes curriculares obrigatórios do curso, exceto as atividades complementares que tem legislação específica.\n\nArt. 2º A validação de disciplina será efetuada quando o programa da disciplina cursada na instituição de origem corresponder a, no mínimo, 75% do conteúdo e da carga horária da disciplina que o(a) acadêmico(a) deveria cumprir na UDESC.\nParágrafo Único. Poderão ser utilizados conteúdos de várias disciplinas para o aproveitamento de estudos.\n\nArt. 3º São possíveis de validação de disciplina, os seguintes estudos concluídos pelo(a) acadêmico(a):\nI – Disciplina cursada com aproveitamento em curso superior, proveniente de curso de graduação, de curso sequencial que conduz a diploma e de curso de pós-graduação (especialização, mestrado ou doutorado);\nII – Estágio Curricular Supervisionado e Trabalho de Conclusão de Curso.\nParágrafo Único. Compete ao Núcleo Docente Estruturante – NDE do departamento, junto com a Coordenação de Estágio, definir critérios para proceder a validação dos estudos previstos no inciso II.\n\nArt. 4º O(A) acadêmico(a) ao encerrar o período de realização de estudos em outra instituição, poderá solicitar a validação de disciplina, via requerimento, acompanhado dos seguintes documentos:\nI - Histórico Escolar e/ou Certidão de disciplina(s) cursada(s), onde conste a identificação da\nIES e do curso; a denominação da disciplina e demais componentes curriculares; a carga horária e a nota/conceito de cada componente curricular citado no Histórico Escolar e/ou Certidão.\nII - Programa e/ou Plano de Ensino da(s) disciplina(s) cursada(s).\n§ 1º É facultada a solicitação de comprovação da autenticidade - Histórico Escolar e/ou\nCertidão de disciplina(s) cursada(s); Programa e/ou Plano de Ensino da(s) disciplina(s) cursada(s) pela Secretaria de Cooperação Interinstitucional e Internacional (SCII).\nFundação Universidade do Estado de Santa Catarina\nAv. Madre Benvenuta, 2007 – Itacorubi – Florianópolis, SC\nCep: 88035-001 – Fone (48) 3664 8000 – www.udesc.br § 2º É facultada a tradução juramentada dos documentos, a não ser que seja solicitada pelo(a) Chefe(a) de Departamento ou pelo(a) professor(a) envolvido(a) no processo de validação de disciplina.\n\nArt. 5º O requerimento para a validação de disciplina deverá ser recebido pela Secretaria de\nEnsino de Graduação e, posteriormente, remetido ao (a) Chefe do Departamento para decisão.\n§ 1º A validação de disciplina será analisada pelo (a) Chefe (a) do Departamento do curso de graduação onde o (a) acadêmico (a) está matriculado (a).\n§ 2º É facultado ao (a) Chefe (a) do Departamento, solicitar análise e parecer de professor(a) da área a respeito da equivalência.\n§ 3º O (A) Chefe (a) de Departamento, após tomada a decisão, no prazo máximo de 20 (vinte) dias, encaminhará a solicitação à Secretaria de Ensino de Graduação para registro e arquivamento.\n\nArt. 6º A validação de disciplina de que trata esta Resolução visa exclusivamente à integralização do currículo do curso de graduação da UDESC.\nI - Ao invés da nota/conceito obtida será registrado o termo “validada” e em campo específico as informações da disciplina e a nota obtida na IES de origem;\nII - Para efeitos de ranqueamento, média e outros cálculos, a disciplina que foi validada será desconsiderada.\nParágrafo Único. O estudo realizado que não apresentar equivalência com o currículo do curso do (a) acadêmico (a) não será registrado no Histórico Escolar.\n\nArt. 7º Os casos omissos serão resolvidos pela Pró-Reitoria de Ensino.\n\nArt. 8º Esta Resolução entra em vigor após a sua aprovação, revogando-se a Resolução nº 047/2014 CONSEPE.\nFlorianópolis, 09 de novembro de 2021.\nProfessor Nério Amboni\nPresidente da CEG\nFundação Universidade do Estado de Santa Catarina\nAv. Madre Benvenuta, 2007 – Itacorubi – Florianópolis, SC\nCep: 88035-001 – Fone (48) 3664 8000 – www.udesc.br\n```', '## Chunk 1\n```\nArt. 1º O(a) acadêmico(a) matriculado(a) em curso de graduação da UDESC poderá obter a validação de disciplina do currículo de seu curso, desde que atenda aos requisitos estabelecidos nesta resolução.\n\nArt. 2º São possíveis de validação de disciplina, os seguintes estudos concluídos pelo(a) acadêmico(a):\nI – disciplina cursada com aproveitamento em curso superior, proveniente de curso de graduação, de curso sequencial que conduz a diploma e de curso de pós-graduação (especialização, mestrado ou doutorado);\nII – Estágio Curricular Supervisionado e Trabalho de Conclusão de Curso.\nParágrafo único: compete ao Núcleo Docente Estruturante – NDE do departamento, junto com a Coordenação de Estágio, definir critérios para proceder a validação dos estudos previstos no inciso II.\n\nArt. 3º A validação de disciplina será efetuada quando o programa da disciplina cursada na instituição de origem corresponder a, no mínimo, 75% do conteúdo e da carga horária da disciplina que o(a) acadêmico(a) deveria cumprir na UDESC.\nParágrafo Único. poderão ser utilizados conteúdos de várias disciplinas para o aproveitamento de estudos.\n\nArt. 4º O(A) acadêmico(a) poderá solicitar a validação de disciplina cursada com aproveitamento, após a aprovação em processo seletivo da Udesc, via requerimento, acompanhado dos seguintes documentos:\nI – histórico escolar original autenticado pela Instituição de Ensino Superior - IES emissora, que conste a identificação da IES e do curso; a denominação da disciplina; a carga horária; a nota/conceito e a frequência de cada componente curricular citado no histórico escolar;\nII – programa da disciplina cursada e/ou plano de ensino equivalente ao curso do(a) acadêmico(a) na UDESC, autenticado pela IES emissora;\nIII – comprovante do reconhecimento do curso por órgão de regulação competente, quando originado de outra IES brasileira;\nFundação Universidade do Estado de Santa Catarina\nAv. Madre Benvenuta, 2007 – Itacorubi – Florianópolis, SC\nCep: 88035-001 – Fone (48) 3664 8000 – www.udesc.br\nIV – comprovante de que a instituição emitente dos documentos seja uma IES, quando originado de IES estrangeira.\n§ 1º O documento identificado no inciso IV deste artigo, deve apresentar “visto consular”, excetuando-se os países acordados com o Brasil para esta finalidade. É de responsabilidade do(a) acadêmico(a) apresentar documento que comprove o acordo.\n§ 2º É facultada a tradução juramentada dos documentos, a não ser que seja solicitada pelo(a) Chefe(a) de Departamento ou pelo(a) professor(a) envolvido(a) no processo de validação de disciplina, respeitados os acordos internacionais vigentes.\n\nArt. 5º O requerimento para a validação de disciplina deverá ser recebido pela Secretaria de\nEnsino de Graduação e, posteriormente, remetido ao (a) Chefe do Departamento para decisão.\n§ 1º A validação de disciplina será concedida pelo(a) Chefe(a) do Departamento do curso de graduação onde o(a) acadêmico(a) está matriculado(a).\n§ 2º É facultado ao (a) Chefe(a) do Departamento, solicitar análise e parecer de professor(a) da área a respeito da equivalência.\n§ 3º O (A) Chefe(a) de Departamento, após tomada a decisão, no prazo máximo de 15 dias, encaminhará a solicitação à Secretaria de Ensino de Graduação para registro e arquivamento.\n\nArt. 6º A disciplina validada será identificada, no histórico escolar, de forma diferenciada das disciplinas cursadas na UDESC:\nI - ao invés da nota obtida será registrado o termo “validada” e em campo específico as informações da disciplina e a nota obtida na IES de origem;\nII - para efeitos de ranqueamento, média e outros cálculos, a disciplina que foi validada será desconsiderada.\n\nArt. 7º A validação de disciplina de que trata esta Resolução visa exclusivamente à integralização do currículo do curso de graduação da UDESC.\nParágrafo único. O estudo realizado que não apresentar equivalência com o currículo do curso do(a) acadêmico(a) não será registrado no Histórico Escolar.\n\nArt. 8º As normas desta resolução não se aplicam para validação de créditos em Atividades\nComplementares (AC), que estão regulamentadas em resolução específica.\n\nArt. 9º A Chefia de Departamento poderá, considerando a equivalência entre a disciplina do seu curso e de outro curso da UDESC, organizar tabela de equivalência no próprio sistema de gestão acadêmica, não sendo necessária nesta condição o trâmite para a validação de disciplinas.\nParagrafo único: a tabela de equivalência deverá ser aprovada pelo Colegiado Pleno do\nDepartamento.', '# Chunks do arquivo 008-2022-ceg.pdf\n\n## Chunk 1\n```\nArt. 1º Os §§ 3º e 4º do art. 3º da Resolução nº 05/2014 - CONSEPE, que “Dispõe sobre as normas e os procedimentos para a matrícula de acadêmicos nos cursos de graduação da UDESC.”, passam a vigorar com as seguintes redações: “\n\nArt. 3º (...) § 3º A desmatrícula em uma ou mais disciplinas pode ser requerida pelo/aacadêmico/a,obedecendo-se o prazo estabelecido no Calendário Acadêmico.\n§ 4º Excepcionalmente, a desmatrícula em uma ou mais disciplinas em curso será possível fora do período estabelecido no calendário acadêmico até 15 dias antes do encerramento do período letivo, devendo o/a acadêmico/a enviar a solicitação devidamente justificada e comprovada através do Sistema Acadêmico, cabendo à Chefia do Departamento a análise da solicitação.”\n\nArt. 2º Fica suprimido o § 5º do art. 3º da Resolução nº 05/2014 - CONSEPE, que “Dispõe sobre as normas e os procedimentos para a matrícula de acadêmicos nos cursos de graduação da UDESC.”.\n\nArt. 3º O § 8º do art. 13 da Resolução nº 05/2014-CONSEPE, que “Dispõe sobre as normas e os procedimentos para a matrícula de acadêmicos nos cursos de graduação da UDESC.”, passa a vigorar com a seguinte redação: “\n\nArt. 13 (...) § 8º O/A aluno/a regularmente matriculado/a no semestre em curso, poderá realizar a solicitação de trancamento de matrícula fora do período estabelecido no calendário até 15 dias antes do encerramento do período letivo, devendo o/a acadêmico/a enviar a solicitação devidamente justificada e comprovada através do Sistema Acadêmico, cabendo à Chefia do\nDepartamento a análise da solicitação.”\n\nArt. 4º Fica suprimido o § 9º do art. 13 da Resolução nº 05/2014 - CONSEPE, que “Dispõe sobre as normas e os procedimentos para a matrícula de acadêmicos nos cursos de graduação da UDESC.”.\n\nArt. 5º Ficam suprimidos o inciso III e os §§ 3º e 4º do art. 21 da Resolução nº 05/2014 -\nCONSEPE, que “Dispõe sobre as normas e os procedimentos para a matrícula de acadêmicos nos cursos de graduação da UDESC.”.\nFundação Universidade do Estado de Santa Catarina - UDESC\nAv. Madre Benvenuta, 2007 – Itacorubi – Florianópolis SC\nCEP 88.035-901 - Fone (48) 3664 8000 – www.udesc.br\n\nArt. 6º Esta Resolução entra em vigor nesta data, revogando-se as disposições em contrário.\nFlorianópolis, 26 de julho de 2022.\nProfessora Drª Sandra Makowiecky\nPresidente da Câmara de Ensino de Graduação - CEG\nFundação Universidade do Estado de Santa Catarina - UDESC\nAv. Madre Benvenuta, 2007 – Itacorubi – Florianópolis SC\nCEP 88.035-901 - Fone (48) 3664 8000 – www.udesc.br\n```']"," 
Os(as) acadêmicos(as) das modalidades de transferência interna, reingresso após abandono, ingresso e reingresso por novo concurso vestibular, transferência externa e retorno aos portadores de diploma de curso podem validar o total das ACs já realizadas, desde que atenda aos demais critérios da Resolução.



Fonte: Arquivo 011-2021-ceg.pdf



Nota: A resposta está diretamente relacionada ao texto fornecido e não exige interpretação adicional. 



Por favor, forneça a resposta cor","Podem validar os acadêmicos que ingressaram por transferência interna ou externa, reingresso após abandono, novo vestibular ou retorno como portadores de diploma, desde que cumpram os demais critérios da resolução.",1.0,0.9267219302132821,0.9999999999,1.0,0.9826713672097707
