user_input,retrieved_contexts,response,reference,faithfulness,answer_relevancy,context_precision,context_recall,answer_correctness
Quem precisa assinar a autodeclaração dizendo que pertence ao grupo racial negro no vestibular da UDESC?,"['Comunidade.\n§ 1º - Cada Comissão será constituída por 3 (três) membros e 1 (um) suplente.\n§ 2º - Poderão integrar a comissão professores e técnicos universitários da UDESC que participem de discussões sobre inclusão social, relações étnico-raciais e/ou tenham interesse de pesquisa ou extensão nessas áreas, bem como membros da comunidade que participem de associações, órgãos ou instituições ligados a questões étnico-raciais.', 'Centro, que terá 10 (dez) dias úteis para apresentar a decisão final.\nCAPÍTULO X\nDA MATRÍCULA DOS APROVADOS\nArt. 28. O(A) candidato(a) classificado(a) numa das modalidades de ingresso previstas nesta\nResolução, deverá efetuar a sua matrícula junto à Secretaria de Ensino de Graduação do Centro no período estabelecido pelo Calendário Acadêmico da UDESC, divulgado no respectivo Edital de vagas.', 'Processo n° 15143/2013, em tramitação nos Conselhos Superiores,\nR E S O L V E, “ad referendum” do CONSUNI:\nArt. 1º O caput do artigo 8° da Resolução n° 017/2011 – CONSUNI, passa a ter a seguinte redação, ficando suprimidos os parágrafos 1° e 2°: “Art. 8º Os candidatos classificados no vestibular para as vagas a que se refere o inciso II do art. 6º deverão assinar a autodeclaração de que são pertencentes ao grupo racial negro.”.']",Os candidatos classificados no vestibular para as vagas a que se refere o inciso II do art. 6º deverão assinar a autodeclaração de que são pertencentes ao grupo racial negro.,Os candidatos classificados nas vagas destinadas a pessoas negras precisam assinar a autodeclaração.,1.0,0.9174405858223791,0.3333333333,1.0,0.6111511129026627
Quando é que a UDESC forma uma Comissão de Verificação para analisar casos de cotas raciais?,"['Comunidade.\n§ 1º - Cada Comissão será constituída por 3 (três) membros e 1 (um) suplente.\n§ 2º - Poderão integrar a comissão professores e técnicos universitários da UDESC que participem de discussões sobre inclusão social, relações étnico-raciais e/ou tenham interesse de pesquisa ou extensão nessas áreas, bem como membros da comunidade que participem de associações, órgãos ou instituições ligados a questões étnico-raciais.', 'II – se a justificativa for julgada improcedente, aplica-se a situação prevista no artigo\n19.\n§ 3º Até o 10º dia letivo do semestre em curso a Secretaria de Ensino de Graduação deverá informar a Coordenação do Vestibular para que esta proceda a chamada de novos(as) alunos(as).\nArt. 21. Perderá o vínculo com a UDESC o(a) acadêmico(a) que:\nI - não efetuar sua matrícula semestral dentro do prazo fixado pelo Calendário\nAcadêmico;\nII - tiver sido desligado, de acordo com a legislação vigente;', '§ 3º Para os cursos de graduação onde a ocupação média das vagas das disciplinas da primeira fase for igual ou superior a 90% do número de vagas por semestre definido no projeto pedagógico vigente do curso (NV), sendo esse percentual verificado após a data prevista no calendário acadêmico da UDESC para solicitação de dispensa de disciplina (para todos), desmatrícula em disciplina e trancamento de matrícula para acadêmicos da graduação, o número de vagas poderá ser de 25% sobre o NV']",Não foi possível encontrar a informação no contexto fornecido.,A Comissão de Verificação é formada apenas quando há denúncias sobre possíveis irregularidades nas autodeclarações.,0.0,0.0,0.0,0.0,0.2028155768759185
Quantas vagas do vestibular da UDESC são reservadas para quem estudou todo o ensino médio em escola pública?,"['Centro, que terá 10 (dez) dias úteis para apresentar a decisão final.\nCAPÍTULO X\nDA MATRÍCULA DOS APROVADOS\nArt. 28. O(A) candidato(a) classificado(a) numa das modalidades de ingresso previstas nesta\nResolução, deverá efetuar a sua matrícula junto à Secretaria de Ensino de Graduação do Centro no período estabelecido pelo Calendário Acadêmico da UDESC, divulgado no respectivo Edital de vagas.', '§ 3º Para os cursos de graduação onde a ocupação média das vagas das disciplinas da primeira fase for igual ou superior a 90% do número de vagas por semestre definido no projeto pedagógico vigente do curso (NV), sendo esse percentual verificado após a data prevista no calendário acadêmico da UDESC para solicitação de dispensa de disciplina (para todos), desmatrícula em disciplina e trancamento de matrícula para acadêmicos da graduação, o número de vagas poderá ser de 25% sobre o NV', 'II - pré-requisitos;\nIII - número de vagas disponíveis;\nIV - procedimentos de matrícula;\nV - direitos e deveres, respeitados o Estatuto e Regimento Geral da UDESC e os termos da presente Resolução.\nArt. 5° - O aluno matriculado em disciplinas isoladas deverá submeter-se a verificação da aprendizagem, assegurando-lhe:\nI – o registro no histórico escolar, quando se tratar de aluno de outro curso da UDESC; e']",Não foi possível encontrar a informação no contexto fornecido.,20% das vagas são reservadas para candidatos que cursaram integralmente o ensino médio em escolas públicas e gratuitas.,0.0,0.0,0.0,0.0,0.2022081300696914
O que o candidato precisa comprovar no momento da matrícula se ele passou pelas cotas de escola pública?,"['Art. 3° - Detectada a matrícula em dois ou mais cursos, o aluno será imediatamente chamado, mediante protocolo, para, no prazo de cinco dias úteis, efetuar a opção por um dos cursos.\nParágrafo único: Caso o aluno não proceda a opção no prazo estipulado, será tornada sem efeito a matrícula mais recente.\nArt. 4° - As instruções expressas nos Artigos anteriores deverão constar no Edital do Concurso\nVestibular Vocacionado UDESC.\nArt. 5° - Esta Resolução entra em vigor na presente data.', '§ 1º O aluno deverá comprovar a realização das Atividades Complementares, respeitando os prazos estabelecidos pelo Calendário Acadêmico da UDESC.\n§ 2º Os documentos comprobatórios ficarão arquivados na pasta do aluno na\nSecretaria de Ensino de Graduação.\nArt. 8º Para a validação das Atividades Complementares e o devido registro no\nHistórico Escolar, o aluno deverá protocolar o requerimento na Secretaria de Ensino de', 'II - pré-requisitos;\nIII - número de vagas disponíveis;\nIV - procedimentos de matrícula;\nV - direitos e deveres, respeitados o Estatuto e Regimento Geral da UDESC e os termos da presente Resolução.\nArt. 5° - O aluno matriculado em disciplinas isoladas deverá submeter-se a verificação da aprendizagem, assegurando-lhe:\nI – o registro no histórico escolar, quando se tratar de aluno de outro curso da UDESC; e']",Não foi possível encontrar a informação no contexto fornecido.,Ele precisa comprovar que estudou todo o ensino médio em instituições públicas e gratuitas.,0.0,0.0,0.0,0.0,0.20252014423453446
Quem pode pedir o regime especial de atendimento domiciliar na UDESC?,"['Art. 14. A concessão do regime especial de atendimento domiciliar será por semestre em que o acadêmico estiver matriculado, de acordo com o Calendário Acadêmico da UDESC.\nArt. 15. Sendo necessária a concessão do regime especial de atendimento domiciliar por mais um semestre ou parte dele, novo requerimento deverá ser apresentado na Secretaria de Ensino de Graduação que será deliberado pelo Chefe de Departamento do curso e professor da disciplina no prazo de 5 (cinco) dias úteis.\nCAPÍTULO IV', 'Fundação Universidade do Estado de Santa Catarina\nAv. Madre Benvenuta, 2007 – Itacorubi – Florianópolis, SC\nCep: 88035-001 – Fone (48) 3664 8000 – www.udesc.br\nArt. 7º O disposto nesta Resolução aplica-se somente ao acadêmico regularmente matriculado em curso superior da UDESC.\nCAPÍTULO II\nDo Direito ao Regime Especial de Atendimento Domiciliar\nArt. 8º São considerados aptos para solicitar o direito ao regime especial de atendimento domiciliar:', 'RESOLUÇÃO Nº 002/2019 – CONSEPE\nRegulamenta o Regime Especial de Atendimento\nDomiciliar Temporário para acadêmicos dos Cursos\nSuperiores da UDESC.\nA Presidente do Conselho de Ensino, Pesquisa e Extensão – CONSEPE da Fundação Universidade do Estado de Santa Catarina – UDESC, no uso de suas atribuições, considerando a deliberação do\nPlenário relativa ao Processo n° 14866/2018, tomada em sessão de 19 de fevereiro de 2019,\nR E S O L V E:\nCapítulo I\nDa Conceituação']",Não foi possível encontrar a informação no contexto fornecido.,"Podem solicitar estudantes em licença maternidade, em situações excepcionais com atestado médico, ou acadêmicos com condições de saúde que impeçam a frequência às aulas, como tratamentos, infecções, traumatismos ou outras afecções comprovadas por profissional de saúde.",0.0,0.0,0.0,0.0,0.20419846576176465
Em quanto tempo o estudante deve pedir o atendimento domiciliar depois que começa o problema de saúde?,"['Cep: 88035-001 – Fone (48) 3664 8000 – www.udesc.br\nArt. 11. A Secretaria de Ensino de Graduação terá o prazo de 2 (dois) dias úteis para encaminhar a solicitação de atendimento domiciliar à chefia do departamento, anexando também declaração de matrícula referente a(s) disciplina(s) em que o acadêmico se encontra matriculado.', 'Art. 14. A concessão do regime especial de atendimento domiciliar será por semestre em que o acadêmico estiver matriculado, de acordo com o Calendário Acadêmico da UDESC.\nArt. 15. Sendo necessária a concessão do regime especial de atendimento domiciliar por mais um semestre ou parte dele, novo requerimento deverá ser apresentado na Secretaria de Ensino de Graduação que será deliberado pelo Chefe de Departamento do curso e professor da disciplina no prazo de 5 (cinco) dias úteis.\nCAPÍTULO IV', 'Art. 5º O prazo para solicitar a validação das atividades complementares, via sistema acadêmico, deverá ocorrer 10 dias após o início do período letivo e, no mínimo, 20 dias antes da finalização do período letivo, conforme calendário acadêmico da UDESC.']",Não foi possível encontrar a informação no contexto fornecido.,"O pedido deve ser feito em até cinco dias úteis a partir do início do impedimento, e o regime não pode ser concedido de forma retroativa.",0.0,0.0,0.0,0.0,0.20094138507036857
Que tipos de atividades podem contar como Atividades Complementares na UDESC?,"['§ 1º O aluno deverá comprovar a realização das Atividades Complementares, respeitando os prazos estabelecidos pelo Calendário Acadêmico da UDESC.\n§ 2º Os documentos comprobatórios ficarão arquivados na pasta do aluno na\nSecretaria de Ensino de Graduação.\nArt. 8º Para a validação das Atividades Complementares e o devido registro no\nHistórico Escolar, o aluno deverá protocolar o requerimento na Secretaria de Ensino de', 'Retorno aos Portadores de Diploma de Curso de Graduação é possível validar na UDESC até 25% das Atividades Complementares realizadas na IES de origem. (excluído pela\nResolução nº 11/2021-CEG) § 2º No caso dos alunos enquadrados na modalidade de Transferência Interna,\nReingresso após Abandono e Reingresso por novo concurso vestibular, é possível validar o total das Atividades Complementares já realizadas, desde que atenda ao restante da', 'Resolução. (excluído pela Resolução nº 11/2021-CEG) § 3º Disciplinas já validadas para aproveitamento de estudos não podem ser consideradas para atividades complementares. (excluído pela Resolução nº 11/2021-CEG) § 4º Somente serão validadas atividades desenvolvidas após o ingresso do aluno no curso de graduação da UDESC, com exceção do que está mencionado no § 1º e § 2º deste artigo. (excluído pela Resolução nº 11/2021-CEG)']",Não foi possível encontrar a informação no contexto fornecido.,"Podem ser atividades de ensino, pesquisa, extensão, administração universitária ou mistas que integrem teoria e prática, conforme previsto na regulamentação.",0.0,0.0,0.0,0.0,0.20247317478229
Qual é o percentual da carga horária total do curso que deve ser destinado às Atividades Complementares?,"['R E S O L V E:\nArt. 1º O § 3º do art. 1º da Resolução nº 026/2012 – CONSEPE, que “Regulamenta as atividades complementares nos cursos de graduação da UDESC.”, passa a vigorar com a seguinte redação: “Art. 1º (...) § 3º O total da carga horária atribuída às Atividades Complementares deve estar entre 2% e 6% do total da carga horária mínima do curso definida pela legislação, tanto para as modalidades presenciais como para as modalidades a distância, não podendo exceder este limite.”', '. (excluído pela Resolução nº 11/2021-CEG) § 3º O total da carga horária atribuída às Atividades Complementares deve contemplar de 8% a 10% do total da carga horária mínima do curso definida pela legislação, tanto para as modalidades presenciais como para as modalidades à distância, não podendo exceder este limite.', '§ 3º O total da carga horária atribuída às Atividades Complementares deve estar entre 2% e\n6% do total da carga horária mínima do curso definida pela legislação, tanto para as modalidades presenciais como para as modalidades a distância, não podendo exceder este limite. (redação dada pela Resolução nº 4/2021-CEG)\nArt. 2º - Consideram-se como Atividades Complementares os seguintes tipos:']","O total da carga horária atribuída às Atividades Complementares deve estar entre 2% e 6% do total da carga horária mínima do curso definida pela legislação, tanto para as modalidades presenciais como para as modalidades a distância, não podendo exceder este limite.","Entre 2% e 6% da carga horária mínima total do curso, tanto para cursos presenciais quanto a distância.",1.0,0.9885784579649936,0.8333333332916666,1.0,0.8762569431213194
Que alunos podem validar as Atividades Complementares já realizadas na UDESC?,"['§ 1º O aluno deverá comprovar a realização das Atividades Complementares, respeitando os prazos estabelecidos pelo Calendário Acadêmico da UDESC.\n§ 2º Os documentos comprobatórios ficarão arquivados na pasta do aluno na\nSecretaria de Ensino de Graduação.\nArt. 8º Para a validação das Atividades Complementares e o devido registro no\nHistórico Escolar, o aluno deverá protocolar o requerimento na Secretaria de Ensino de', 'Retorno aos Portadores de Diploma de Curso de Graduação é possível validar na UDESC até 25% das Atividades Complementares realizadas na IES de origem. (excluído pela\nResolução nº 11/2021-CEG) § 2º No caso dos alunos enquadrados na modalidade de Transferência Interna,\nReingresso após Abandono e Reingresso por novo concurso vestibular, é possível validar o total das Atividades Complementares já realizadas, desde que atenda ao restante da', 'Resolução. (excluído pela Resolução nº 11/2021-CEG) § 3º Disciplinas já validadas para aproveitamento de estudos não podem ser consideradas para atividades complementares. (excluído pela Resolução nº 11/2021-CEG) § 4º Somente serão validadas atividades desenvolvidas após o ingresso do aluno no curso de graduação da UDESC, com exceção do que está mencionado no § 1º e § 2º deste artigo. (excluído pela Resolução nº 11/2021-CEG)']",Não foi possível encontrar a informação no contexto fornecido.,"Podem validar os acadêmicos que ingressaram por transferência interna ou externa, reingresso após abandono, novo vestibular ou retorno como portadores de diploma, desde que cumpram os demais critérios da resolução.",0.0,0.0,0.49999999995,0.0,0.1942065826939086
