user_input,retrieved_contexts,response,reference,faithfulness,answer_relevancy,context_precision,context_recall,answer_correctness,document_id
Quem precisa assinar a autodeclaração dizendo que pertence ao grupo racial negro no vestibular da UDESC?,"['## Chunk 1\n```\nArt. 1º O caput do artigo 8° da Resolução n° 017/2011 – CONSUNI, passa a ter a seguinte redação, ficando suprimidos os parágrafos 1° e 2°: “\n\nArt. 8º Os candidatos classificados no vestibular para as vagas a que se refere o inciso II do art. 6º deverão assinar a autodeclaração de que são pertencentes ao grupo racial negro.”.\n\nArt. 2º O caput e os parágrafos 3° e 4° do artigo 9° da Resolução n° 017/2011 – CONSUNI, passam a ter a seguinte redação, ficando suprimidos os parágrafos 1° e 5° do mesmo artigo, nos seguintes termos: “', 'Art. 9º A Comissão de Verificação se formará caso haja denúncias, para apurar os fatos denunciados e fornecer relatório à Pró-Reitoria de Extensão, Cultura e\nComunidade.\n§ 1º - Cada Comissão será constituída por 3 (três) membros e 1 (um) suplente.\n§ 2º - Poderão integrar a comissão professores e técnicos universitários da UDESC que participem de discussões sobre inclusão social, relações étnico-raciais e/ou tenham interesse de pesquisa ou extensão nessas áreas, bem como membros da comunidade que participem de associações, órgãos ou instituições ligados a questões étnico-raciais.\n§ 3º - Caberá à Pró-Reitoria de Extensão, Cultura e Comunidade a composição da\nComissão de Verificação.”. (NR)\n\nArt. 3º Esta Resolução entra em vigor nesta data.']",Os candidatos classificados no vestibular para as vagas a que se refere o inciso II do art. 6º.,Os candidatos classificados nas vagas destinadas a pessoas negras precisam assinar a autodeclaração.,1.0,0.8384863199254299,0.9999999999,1.0,0.21728536732870896,067-2013-cni
Quando é que a UDESC forma uma Comissão de Verificação para analisar casos de cotas raciais?,"['Art. 9º A Comissão de Verificação se formará caso haja denúncias, para apurar os fatos denunciados e fornecer relatório à Pró-Reitoria de Extensão, Cultura e\nComunidade.\n§ 1º - Cada Comissão será constituída por 3 (três) membros e 1 (um) suplente.\n§ 2º - Poderão integrar a comissão professores e técnicos universitários da UDESC que participem de discussões sobre inclusão social, relações étnico-raciais e/ou tenham interesse de pesquisa ou extensão nessas áreas, bem como membros da comunidade que participem de associações, órgãos ou instituições ligados a questões étnico-raciais.\n§ 3º - Caberá à Pró-Reitoria de Extensão, Cultura e Comunidade a composição da\nComissão de Verificação.”. (NR)\n\nArt. 3º Esta Resolução entra em vigor nesta data.', 'Art. 6º A validação de disciplina de que trata esta Resolução visa exclusivamente à integralização do currículo do curso de graduação da UDESC.\nI - Ao invés da nota/conceito obtida será registrado o termo “validada” e em campo específico as informações da disciplina e a nota obtida na IES de origem;\nII - Para efeitos de ranqueamento, média e outros cálculos, a disciplina que foi validada será desconsiderada.\nParágrafo Único. O estudo realizado que não apresentar equivalência com o currículo do curso do (a) acadêmico (a) não será registrado no Histórico Escolar.\n\nArt. 7º Os casos omissos serão resolvidos pela Pró-Reitoria de Ensino.']","A Comissão de Verificação se formará caso haja denúncias, para apurar os fatos denunciados.",A Comissão de Verificação é formada apenas quando há denúncias sobre possíveis irregularidades nas autodeclarações.,1.0,0.9084335271633052,0.9999999999,1.0,0.8337521637729808,"067-2013-cni, 009-2021-ceg"
Quantas vagas do vestibular da UDESC são reservadas para quem estudou todo o ensino médio em escola pública?,"['## Chunk 6\n```\nCAPÍTULO VI\nDOS REQUISITOS GERAIS PARA CONCESSÃO DE VAGA\nArt. 19. Para ingresso nos cursos de graduação da UDESC através das modalidades previstas nesta\nResolução, são necessários:\nI. existir vaga no curso, conforme divulgado no Edital de vagas;\nII. ingressar com a solicitação no período definido pelo Edital de vagas, apresentando a documentação necessária;\nIII. ser classificado em processo seletivo próprio.\n```', 'UDESC ou nova formação (bacharelado ou licenciatura); 1.4. Transferência Interna para o mesmo curso com mudança de Centro de Ensino; 1.5. Transferência Interna com mudança de curso de uma mesma área de conhecimento ou áreas afins, de acordo com o Edital de vagas; 1.6. Reingresso após Abandono ou Cancelamento com Mudança de Turno, para curso de uma mesma área de conhecimento ou áreas afins, de acordo com o Edital de vagas; 1.7. Reingresso após Abandono ou Cancelamento com Mudança de uma habilitação para outra no mesmo curso da UDESC ou nova formação (bacharelado ou licenciatura); 1.8. Reingresso após Abandono ou Cancelamento para o mesmo curso com mudança de Centro de Ensino; 1.9. Reingresso após Abandono ou Cancelamento para Mudança de curso, para curso de uma mesma área de conhecimento']",Não foi possível encontrar a informação no contexto fornecido.,20% das vagas são reservadas para candidatos que cursaram integralmente o ensino médio em escolas públicas e gratuitas.,0.0,0.0,0.0,0.0,0.2022081300696914,004-2023-ceg
O que o candidato precisa comprovar no momento da matrícula se ele passou pelas cotas de escola pública?,"['I – para matrícula em Curso de Pós-Graduação de Mestrado e/ou Doutorado;\nII – para posse em cargo de empresa pública ou de empresa privada;\nIII – mudança de residência da família para outro Estado da Federação ou outro País.\nIV – servidor público transferido ex-officio, seu cônjuge e filhos, inclusive.\n§ 4º Pode a Outorga de Grau em Gabinete ser requerida após a data estabelecida para a\nOutorga de Grau Oficial do curso do acadêmico, em prazo não inferior a 15 dias após a solenidade oficial, sendo deferidos os requerimentos que apresentarem como justificativa:\nI – problemas na saúde do interessado, com apresentação de Atestado/Declaração de profissional (médico), constando o CID;', 'II - doença de caráter infecto-contagiosa, com apresentação de Atestado/Declaração de profissional (médico), constando o CID;\nIII - ter sido vítima de ação involuntária provocada por terceiros;\nIV – Convocado para manobras ou exercícios militares;\nV - luto por parentes em linha reta (pais, avós, filhos e netos), colaterais (irmãos e tios), cônjuge ou companheiro(a), mediante respectivo atestado de óbito;\nVI – convocação para depoimento judicial ou policial, em data e horário coincidente com a solenidade oficial de Outorga de Grau do curso;\nVII – convocado para participar de eleições em entidades oficiais, em data e horário coincidente com a solenidade oficial de Outorga de Grau do curso;\nVIII – para recebimento de novo grau acadêmico do mesmo curso (Licenciado ou Bacharel);']",Não foi possível encontrar a informação no contexto fornecido.,Ele precisa comprovar que estudou todo o ensino médio em instituições públicas e gratuitas.,0.0,0.0,0.0,0.0,0.20252014423453446,145-2005-cni
Quem pode pedir o regime especial de atendimento domiciliar na UDESC?,"['Art. 3º A Fundação Universidade do Estado de Santa Catarina - UDESC, de acordo com as condições disponíveis e conforme o conteúdo curricular da disciplina, poderá conceder as atividades domiciliares com acompanhamento, para seus acadêmicos que assim o requeiram, nos moldes desta\nResolução.\n\nArt. 4º O regime especial de atendimento domiciliar deve ser solicitado pelo acadêmico ou procurador quando da observação do problema que impede o acadêmico de manter frequência normal em aula, não sendo concedido em hipótese alguma para data retroativa à data do início do impedimento.\nParágrafo único. Disciplinas de caráter prático e estágios não poderão ter atendimento domiciliar temporário.', 'Art. 12. O Chefe de Departamento do curso e professor da disciplina terão 3 (três) dias úteis, contados do recebimento da Secretaria de Ensino de Graduação, para emitir parecer sobre as disciplinas em que será possível aplicar o plano de estudos.\nArt. 13. Mediante justificativa fundamentada, a chefia do departamento poderá indeferir a solicitação que será comunicado ao acadêmico pela Secretaria de Ensino de Graduação.\nArt. 14. A concessão do regime especial de atendimento domiciliar será por semestre em que o acadêmico estiver matriculado, de acordo com o Calendário Acadêmico da UDESC.']",O regime especial de atendimento domiciliar deve ser solicitado pelo acadêmico ou procurador.,"Podem solicitar estudantes em licença maternidade, em situações excepcionais com atestado médico, ou acadêmicos com condições de saúde que impeçam a frequência às aulas, como tratamentos, infecções, traumatismos ou outras afecções comprovadas por profissional de saúde.",1.0,0.9496577616383204,0.0,0.0,0.4281817240213928,002-2019-cpe
Em quanto tempo o estudante deve pedir o atendimento domiciliar depois que começa o problema de saúde?,"['## Chunk 3\n```\nCAPÍTULO III\nDos Procedimentos para Solicitar o Regime Especial de Atendimento Domiciliar\nArt. 10. O regime especial de atendimento domiciliar deve ser requerido pelo acadêmico ou por procurador, até 5 (cinco) dias úteis contados a partir do início do impedimento, expressamente comprovado.\nArt. 10. O regime especial de atendimento domiciliar deve ser requerido pelo acadêmico ou por terceiro, até 5 (cinco) dias úteis contados a partir do início do impedimento, expressamente comprovado. (redação dada pela Resolução nº 35/2019 - CONSEPE) § 1º A solicitação deve ser protocolada na Secretaria de Ensino de Graduação, por meio de requerimento endereçado ao Chefe do Departamento do curso em que o acadêmico se encontra matriculado.', '## Chunk 1\n```\nArt. 1º O art. 4º da Resolução nº 2/2019 – CONSEPE, de 19 de fevereiro de 2019, passa a vigorar com a seguinte redação: “\n\nArt. 4º O regime especial de atendimento domiciliar deve ser solicitado pelo acadêmico ou por terceiro quando da observação do problema que impede o acadêmico de manter frequência normal em aula, não sendo concedido em data retroativa ao início do impedimento.\nParágrafo único. Disciplinas de estágios não poderão ter atendimento domiciliar temporário.”\n\nArt. 2º O art. 5º da Resolução nº 2/2019 – CONSEPE, de 19 de fevereiro de 2019, passa a vigorar com a seguinte redação: “\n\nArt. 5º O período para concessão do regime especial de atendimento domiciliar não poderá ser inferior a 15 (quinze) dias.”']",O regime especial de atendimento domiciliar deve ser requerido em até 5 (cinco) dias úteis contados a partir do início do impedimento.,"O pedido deve ser feito em até cinco dias úteis a partir do início do impedimento, e o regime não pode ser concedido de forma retroativa.",1.0,0.9069175850713437,0.9999999999,1.0,0.8371967639473962,"002-2019-cpe, 035-2019-cpe"
Que tipos de atividades podem contar como Atividades Complementares na UDESC?,"['Resolução nº 11/2021-CEG) § 2º No caso dos alunos enquadrados na modalidade de Transferência Interna,\nReingresso após Abandono e Reingresso por novo concurso vestibular, é possível validar o total das Atividades Complementares já realizadas, desde que atenda ao restante da\nResolução. (excluído pela Resolução nº 11/2021-CEG) § 3º Disciplinas já validadas para aproveitamento de estudos não podem ser consideradas para atividades complementares. (excluído pela Resolução nº 11/2021-CEG) § 4º Somente serão validadas atividades desenvolvidas após o ingresso do aluno no curso de graduação da UDESC, com exceção do que está mencionado no § 1º e § 2º deste artigo. (excluído pela Resolução nº 11/2021-CEG)', 'Art. 4º O aluno poderá realizar as Atividades Complementares da primeira a última fase de seu curso, respeitando o estabelecido no Projeto Pedagógico do curso.\nParágrafo Único – Os(as) acadêmicos(as) das modalidades de transferência interna, reingresso após abandono, ingresso e reingresso por novo concurso vestibular, transferência externa e retorno aos portadores de diploma de curso poderão validar o total das ACC já realizadas, desde que atenda aos demais critérios da Resolução. (incluído pela\nResolução nº 11/2021-CEG) § 1º No caso dos alunos enquadrados nas modalidades de Transferência Externa e\nRetorno aos Portadores de Diploma de Curso de Graduação é possível validar na UDESC até 25% das Atividades Complementares realizadas na IES de origem. (excluído pela']",Não foi possível encontrar a informação no contexto fornecido.,"Podem ser atividades de ensino, pesquisa, extensão, administração universitária ou mistas que integrem teoria e prática, conforme previsto na regulamentação.",0.0,0.0,0.0,0.0,0.20247317478229,026-2012-cpe
Qual é o percentual da carga horária total do curso que deve ser destinado às Atividades Complementares?,"['§ 3º O total da carga horária atribuída às Atividades Complementares deve estar entre 2% e 6% do total da carga horária mínima do curso definida pela legislação, tanto para as modalidades presenciais como para as modalidades a distância, não podendo exceder este limite. (redação dada pela Resolução nº 4/2021-CEG)', '§ 2º As Atividades Complementares incluem a prática de estudos e atividades independentes, ações de extensão junto à comunidade, não podendo ser confundidas com estágio curricular obrigatório. (excluído pela Resolução nº 11/2021-CEG) § 3º O total da carga horária atribuída às Atividades Complementares deve contemplar de 8% a 10% do total da carga horária mínima do curso definida pela legislação, tanto para as modalidades presenciais como para as modalidades à distância, não podendo exceder este limite.']","De acordo com a redação dada pela Resolução nº 4/2021-CEG, o total da carga horária atribuída às Atividades Complementares deve estar entre 2% e 6% do total da carga horária mínima do curso definida pela legislação.","Entre 2% e 6% da carga horária mínima total do curso, tanto para cursos presenciais quanto a distância.",1.0,0.9811785749519167,0.9999999999,1.0,0.47422853853778785,026-2012-cpe
Que alunos podem validar as Atividades Complementares já realizadas na UDESC?,"['Resolução nº 11/2021-CEG) § 2º No caso dos alunos enquadrados na modalidade de Transferência Interna,\nReingresso após Abandono e Reingresso por novo concurso vestibular, é possível validar o total das Atividades Complementares já realizadas, desde que atenda ao restante da\nResolução. (excluído pela Resolução nº 11/2021-CEG) § 3º Disciplinas já validadas para aproveitamento de estudos não podem ser consideradas para atividades complementares. (excluído pela Resolução nº 11/2021-CEG) § 4º Somente serão validadas atividades desenvolvidas após o ingresso do aluno no curso de graduação da UDESC, com exceção do que está mencionado no § 1º e § 2º deste artigo. (excluído pela Resolução nº 11/2021-CEG)', 'Art. 4º O aluno poderá realizar as Atividades Complementares da primeira a última fase de seu curso, respeitando o estabelecido no Projeto Pedagógico do curso.\nParágrafo Único – Os(as) acadêmicos(as) das modalidades de transferência interna, reingresso após abandono, ingresso e reingresso por novo concurso vestibular, transferência externa e retorno aos portadores de diploma de curso poderão validar o total das ACC já realizadas, desde que atenda aos demais critérios da Resolução. (incluído pela\nResolução nº 11/2021-CEG) § 1º No caso dos alunos enquadrados nas modalidades de Transferência Externa e\nRetorno aos Portadores de Diploma de Curso de Graduação é possível validar na UDESC até 25% das Atividades Complementares realizadas na IES de origem. (excluído pela']","Os acadêmicos das modalidades de transferência interna, reingresso após abandono, ingresso e reingresso por novo concurso vestibular, transferência externa e retorno aos portadores de diploma de curso poderão validar o total das ACC já realizadas, desde que atendam aos demais critérios da Resolução.","Podem validar os acadêmicos que ingressaram por transferência interna ou externa, reingresso após abandono, novo vestibular ou retorno como portadores de diploma, desde que cumpram os demais critérios da resolução.",1.0,0.9345350151035285,0.99999999995,1.0,0.9902859600808402,026-2012-cpe
