user_input,retrieved_contexts,response,reference,faithfulness,answer_relevancy,context_precision,context_recall,answer_correctness,document_id
Quem precisa assinar a autodeclaração dizendo que pertence ao grupo racial negro no vestibular da UDESC?,"['## Chunk 1\n```\nArt. 1º O caput do artigo 8° da Resolução n° 017/2011 – CONSUNI, passa a ter a seguinte redação, ficando suprimidos os parágrafos 1° e 2°: “\n\nArt. 8º Os candidatos classificados no vestibular para as vagas a que se refere o inciso II do art. 6º deverão assinar a autodeclaração de que são pertencentes ao grupo racial negro.”.\n\nArt. 2º O caput e os parágrafos 3° e 4° do artigo 9° da Resolução n° 017/2011 – CONSUNI, passam a ter a seguinte redação, ficando suprimidos os parágrafos 1° e 5° do mesmo artigo, nos seguintes termos: “', 'Art. 9º A Comissão de Verificação se formará caso haja denúncias, para apurar os fatos denunciados e fornecer relatório à Pró-Reitoria de Extensão, Cultura e\nComunidade.\n§ 1º - Cada Comissão será constituída por 3 (três) membros e 1 (um) suplente.\n§ 2º - Poderão integrar a comissão professores e técnicos universitários da UDESC que participem de discussões sobre inclusão social, relações étnico-raciais e/ou tenham interesse de pesquisa ou extensão nessas áreas, bem como membros da comunidade que participem de associações, órgãos ou instituições ligados a questões étnico-raciais.\n§ 3º - Caberá à Pró-Reitoria de Extensão, Cultura e Comunidade a composição da\nComissão de Verificação.”. (NR)\n\nArt. 3º Esta Resolução entra em vigor nesta data.', '## Chunk 10\n```\nCAPÍTULO X\nDA MATRÍCULA DOS APROVADOS\nArt. 28. O(A) candidato(a) classificado(a) numa das modalidades de ingresso previstas nesta\nResolução, deverá efetuar a sua matrícula junto à Secretaria de Ensino de Graduação do Centro no período estabelecido pelo Calendário Acadêmico da UDESC, divulgado no respectivo Edital de vagas.\n§ 1º A matrícula será feita pelo(a) próprio(a) candidato (a) ou por procurador(a) legalmente instituído(a) para esse ato.\n§ 2º O(A) candidato(a) deverá apresentar todos os documentos necessários à matrícula de acordo com a modalidade de ingresso.\n§ 3º Compete à Secretaria de Ensino de Graduação garantir a ordem da matrícula respeitando a classificação do(a) candidato(a).', '## Chunk 6\n```\nCAPÍTULO VI\nDOS REQUISITOS GERAIS PARA CONCESSÃO DE VAGA\nArt. 19. Para ingresso nos cursos de graduação da UDESC através das modalidades previstas nesta\nResolução, são necessários:\nI. existir vaga no curso, conforme divulgado no Edital de vagas;\nII. ingressar com a solicitação no período definido pelo Edital de vagas, apresentando a documentação necessária;\nIII. ser classificado em processo seletivo próprio.\n```', 'Art. 7º A entrega da solicitação de validação das Atividades Complementares na\nSecretaria de Ensino de Graduação deverá ocorrer no mínimo 30 dias antes da finalização do semestre letivo, conforme Calendário Acadêmico da UDESC.\n§ 1º O aluno deverá comprovar a realização das Atividades Complementares, respeitando os prazos estabelecidos pelo Calendário Acadêmico da UDESC.\n§ 2º Os documentos comprobatórios ficarão arquivados na pasta do aluno na\nSecretaria de Ensino de Graduação.', 'Art. 1º Obedecido o disposto nesta Resolução, fica assegurada a inclusão do nome social de pessoas transgênero, travestis e transexuais no ato de inscrição no vestibular e nos respectivos registros acadêmicos de todos os campi da Fundação Universidade do Estado de Santa Catarina –\nUDESC.\nParágrafo único. O nome social é a forma nominal definida por pessoas transgênero, travestis e transexuais para serem identificadas, nominadas e referidas em seu meio social. (redação dada pela )', 'Art. 3º Uma vez feita à inclusão, o nome social deverá constar, juntamente com o nome civil, em todos os registros internos da UDESC.\n§ 1º Nos históricos escolares, certificados e diplomas constará apenas o nome civil.\n§ 1º Nos históricos escolares, certificados e diplomas constará em local de destaque, o nome social, precedido da correspondente expressão “NOME SOCIAL” e, logo abaixo (no campo de observações), a identificação civil. (redação dada pela ) § 2º Nas declarações, atestados e diários de classe constarão o nome social e o nome civil, sendo que a comprovação da presença às aulas deverá ser feita utilizando-se somente o nome social.', '## Chunk 1\n```\nArt. 1º Os §§ 3º e 4º do art. 3º da Resolução nº 05/2014 - CONSEPE, que “Dispõe sobre as normas e os procedimentos para a matrícula de acadêmicos nos cursos de graduação da UDESC.”, passam a vigorar com as seguintes redações: “\n\nArt. 3º (...) § 3º A desmatrícula em uma ou mais disciplinas pode ser requerida pelo/aacadêmico/a,obedecendo-se o prazo estabelecido no Calendário Acadêmico.\n§ 4º Excepcionalmente, a desmatrícula em uma ou mais disciplinas em curso será possível fora do período estabelecido no calendário acadêmico até 15 dias antes do encerramento do período letivo, devendo o/a acadêmico/a enviar a solicitação devidamente justificada e comprovada através do Sistema Acadêmico, cabendo à Chefia do Departamento a análise da solicitação.”']",Os candidatos classificados no vestibular para as vagas a que se refere o inciso II do art. 6º deverão assinar a autodeclaração de que são pertencentes ao grupo racial negro.,Os candidatos classificados nas vagas destinadas a pessoas negras precisam assinar a autodeclaração.,1.0,0.8628094521114097,0.9999999999,1.0,0.6111511129026627,"067-2013-cni, 004-2023-ceg, 026-2012-cpe, 070-2016-cni, 008-2022-ceg"
Quem pode pedir o regime especial de atendimento domiciliar na UDESC?,"['Art. 3º A Fundação Universidade do Estado de Santa Catarina - UDESC, de acordo com as condições disponíveis e conforme o conteúdo curricular da disciplina, poderá conceder as atividades domiciliares com acompanhamento, para seus acadêmicos que assim o requeiram, nos moldes desta\nResolução.\n\nArt. 4º O regime especial de atendimento domiciliar deve ser solicitado pelo acadêmico ou procurador quando da observação do problema que impede o acadêmico de manter frequência normal em aula, não sendo concedido em hipótese alguma para data retroativa à data do início do impedimento.\nParágrafo único. Disciplinas de caráter prático e estágios não poderão ter atendimento domiciliar temporário.', 'Art. 12. O Chefe de Departamento do curso e professor da disciplina terão 3 (três) dias úteis, contados do recebimento da Secretaria de Ensino de Graduação, para emitir parecer sobre as disciplinas em que será possível aplicar o plano de estudos.\nArt. 13. Mediante justificativa fundamentada, a chefia do departamento poderá indeferir a solicitação que será comunicado ao acadêmico pela Secretaria de Ensino de Graduação.\nArt. 14. A concessão do regime especial de atendimento domiciliar será por semestre em que o acadêmico estiver matriculado, de acordo com o Calendário Acadêmico da UDESC.', 'Art. 6º É permitida a renovação do regime especial de atendimento domiciliar durante semestre com apresentação de novo atestado médico.\nFundação Universidade do Estado de Santa Catarina\nAv. Madre Benvenuta, 2007 – Itacorubi – Florianópolis, SC\nCep: 88035-001 – Fone (48) 3664 8000 – www.udesc.br\n\nArt. 7º O disposto nesta Resolução aplica-se somente ao acadêmico regularmente matriculado em curso superior da UDESC.\n```', 'Art. 15. Sendo necessária a concessão do regime especial de atendimento domiciliar por mais um semestre ou parte dele, novo requerimento deverá ser apresentado na Secretaria de Ensino de Graduação que será deliberado pelo Chefe de Departamento do curso e professor da disciplina no prazo de 5 (cinco) dias úteis.\n```', '## Chunk 2\n```\nCAPÍTULO II\nDo Direito ao Regime Especial de Atendimento Domiciliar\nArt. 8º São considerados aptos para solicitar o direito ao regime especial de atendimento domiciliar:\nI – estudante que esteja em: a) licença maternidade mediante documento comprobatório; b) situações excepcionais mediante atestado médico;\nII – acadêmico portador de afecções adquiridas, infecções, traumatismos, tratamentos quimioterápicos/radioterápicos ou outras condições, caracterizadas por: a) incapacidade física relativa, incompatível com a frequência às atividades acadêmicas comprovada mediante atestado médico; b) ocorrência isolada ou esporádica, comprovada por atestado médico ou declaração expedida por profissional de saúde habilitado.', '## Chunk 1\n```\nArt. 1º O regime especial de atendimento domiciliar é uma prática excepcional que tem por objetivo oferecer condições especiais de acompanhamento nas atividades pedagógicas aos acadêmicos em situações que lhe impossibilitem a frequência e a participação nas atividades acadêmicas normais.\n\nArt. 2º O regime especial de atendimento domiciliar se define pela dispensa da exigibilidade de presença física do acadêmico nas aulas, substituída por programação especial definida pelo professor da disciplina e operacionalizada pela Secretaria de Ensino de Graduação, com o objetivo de dar continuidade ao processo psicopedagógico da aprendizagem.', '§ 2º No requerimento deve constar o nome do requerente, matrícula, e-mail, telefone, curso e fase, bem como período de atendimento domiciliar necessário e nome das disciplinas que solicita atendimento domiciliar.\nFundação Universidade do Estado de Santa Catarina\nAv. Madre Benvenuta, 2007 – Itacorubi – Florianópolis, SC\nCep: 88035-001 – Fone (48) 3664 8000 – www.udesc.br\nArt. 11. A Secretaria de Ensino de Graduação terá o prazo de 2 (dois) dias úteis para encaminhar a solicitação de atendimento domiciliar à chefia do departamento, anexando também declaração de matrícula referente a(s) disciplina(s) em que o acadêmico se encontra matriculado.', '## Chunk 3\n```\nCAPÍTULO III\nDos Procedimentos para Solicitar o Regime Especial de Atendimento Domiciliar\nArt. 10. O regime especial de atendimento domiciliar deve ser requerido pelo acadêmico ou por procurador, até 5 (cinco) dias úteis contados a partir do início do impedimento, expressamente comprovado.\nArt. 10. O regime especial de atendimento domiciliar deve ser requerido pelo acadêmico ou por terceiro, até 5 (cinco) dias úteis contados a partir do início do impedimento, expressamente comprovado. (redação dada pela ) § 1º A solicitação deve ser protocolada na Secretaria de Ensino de Graduação, por meio de requerimento endereçado ao Chefe do Departamento do curso em que o acadêmico se encontra matriculado.']","De acordo com o Art. 4º, o regime especial de atendimento domiciliar deve ser solicitado pelo acadêmico ou procurador. O Art. 10º também menciona que o regime deve ser requerido pelo acadêmico, por procurador ou por terceiro.","Podem solicitar estudantes em licença maternidade, em situações excepcionais com atestado médico, ou acadêmicos com condições de saúde que impeçam a frequência às aulas, como tratamentos, infecções, traumatismos ou outras afecções comprovadas por profissional de saúde.",1.0,0.9306509842936705,0.19999999998,1.0,0.43899594911207374,002-2019-cpe
Que tipos de atividades podem contar como Atividades Complementares na UDESC?,"['Art. 5º O prazo para solicitar a validação das atividades complementares, via sistema acadêmico, deverá ocorrer 10 dias após o início do período letivo e, no mínimo, 20 dias antes da finalização do período letivo, conforme calendário acadêmico da UDESC.\nParagrafo único: As atividades complementares, assim como as atividades de creditação de extensão possuem similaridades, todavia, o acadêmico só poderá validar cada atividade uma única vez, escolhendo em qual componente curricular irá validar: ou atividades complementares ou creditação da extensão.\n(incluído pela )', '## Chunk 1\n```\nArt. 1º O § 3º do art. 1º da Resolução nº 026/2012 – CONSEPE, que “Regulamenta as atividades complementares nos cursos de graduação da UDESC.”, passa a vigorar com a seguinte redação: “\n\nArt. 1º (...) § 3º O total da carga horária atribuída às Atividades Complementares deve estar entre 2% e 6% do total da carga horária mínima do curso definida pela legislação, tanto para as modalidades presenciais como para as modalidades a distância, não podendo exceder este limite.”\n\nArt. 2º Esta Resolução entra em vigor nesta data.', '## Chunk 1\n```\nArt. 1º Fica excluído o § 2º do art. 1º da Resolução nº 026/2012 – CONSEPE, que “Regulamenta as atividades complementares nos cursos de graduação da UDESC.”.\n\nArt. 2º Ficam suprimidos os §§ 1º ao 4º do art. 4º da Resolução nº 026/2012 – CONSEPE, que “Regulamenta as atividades complementares nos cursos de graduação da UDESC.”, passando o artigo a vigorar com Parágrafo Único, com a seguinte redação: “\n\nArt. 4º (...)\nParágrafo Único – Os(as) acadêmicos(as) das modalidades de transferência interna, reingresso após abandono, ingresso e reingresso por novo concurso vestibular, transferência externa e retorno aos portadores de diploma de curso poderão validar o total das ACC já realizadas, desde que atenda aos demais critérios da Resolução.', 'Art. 7º A entrega da solicitação de validação das Atividades Complementares na\nSecretaria de Ensino de Graduação deverá ocorrer no mínimo 30 dias antes da finalização do semestre letivo, conforme Calendário Acadêmico da UDESC.\n§ 1º O aluno deverá comprovar a realização das Atividades Complementares, respeitando os prazos estabelecidos pelo Calendário Acadêmico da UDESC.\n§ 2º Os documentos comprobatórios ficarão arquivados na pasta do aluno na\nSecretaria de Ensino de Graduação.', '## Chunk 1\n```\nArt. 1º As Atividades Complementares - AC são componentes curriculares, constantes no Projeto Pedagógico do Curso – PPC, que possibilitam o reconhecimento, por avaliação, de habilidades, conhecimentos, saberes e competências do(a) acadêmico(a), inclusive as adquiridas fora da universidade.\nParágrafo Único. Os cursos definem um percentual fixo para atividades complementares incluídas no Projeto Pedagógico do Curso que deverá estar entre 2% e 6% da carga horária total do curso, nas modalidades Presencial e a Distância -\nEaD.', 'Art. 2º Consideram-se como atividades complementares:\nI - atividades de ensino;\nII - atividades de extensão;\nIII - atividades de pesquisa;\nIV - atividades de administração universitária;\nV - atividades mistas de ensino, pesquisa, extensão e/ou administração universitária.\n§ 1º As atividades complementares são aquelas discriminadas e pontuadas de acordo com o Anexo I desta Resolução. (redação dada pela ) .\n§ 2º O curso poderá incluir outra atividade que não conste na listagem do Anexo I, desde que seja submetida à análise do Núcleo Docente Estruturante. (redação dada pela ) .', '## Chunk 1\n```\nArt. 1º As Atividades Complementares são componentes curriculares que possibilitam o reconhecimento, por avaliação, de habilidades, conhecimentos, competências do aluno, inclusive adquiridas fora da universidade.\n§ 1º As Atividades Complementares são aquelas feitas com conhecimento da instituição, porém individualmente organizadas para o enriquecimento da formação acadêmica do aluno.\n. (excluído pela ) e 8% a 10% do total da carga horária mínima do curso definida pela legislação, tanto para as modalidades presenciais como para as modalidades à distância, não podendo exceder este limite.', '§ 2º As atividades de extensão deverão fazer parte da matriz curricular do curso e do histórico escolar do discente.\n§ 3º O discente poderá realizar e/ou validar as atividades previstas nas modalidades de extensão desenvolvidas em outros Centros da UDESC, bem como, em outras instituições de ensino superior, respeitados os preceitos do artigo 4º e seus incisos.\nFundação Universidade do Estado de Santa Catarina - UDESC\nAv. Madre Benvenuta, 2007 – Itacorubi – Florianópolis SC\nCEP 88.035-901 - Fone (48) 3664 8000 – www.udesc.br']","De acordo com o contexto fornecido, consideram-se como atividades complementares:
I - atividades de ensino;
II - atividades de extensão;
III - atividades de pesquisa;
IV - atividades de administração universitária;
V - atividades mistas de ensino, pesquisa, extensão e/ou administração universitária.","Podem ser atividades de ensino, pesquisa, extensão, administração universitária ou mistas que integrem teoria e prática, conforme previsto na regulamentação.",1.0,0.9181112105927974,0.16666666665,1.0,0.8545483823784941,"001-2022-ceg, 004-2021-ceg, 011-2021-ceg, 026-2012-cpe, 006-2025-ceg"
Como o aluno valida uma atividade de extensão na UDESC?,"['Art. 5º O prazo para solicitar a validação das atividades complementares, via sistema acadêmico, deverá ocorrer 10 dias após o início do período letivo e, no mínimo, 20 dias antes da finalização do período letivo, conforme calendário acadêmico da UDESC.\nParagrafo único: As atividades complementares, assim como as atividades de creditação de extensão possuem similaridades, todavia, o acadêmico só poderá validar cada atividade uma única vez, escolhendo em qual componente curricular irá validar: ou atividades complementares ou creditação da extensão.\n(incluído pela )', 'Art. 8º Para validar as atividades de extensão como Unidades de Creditação de Extensão é necessário que o discente comprove sua participação. Para fins de validação, os seguintes procedimentos devem ser realizados:\nI – Ao término de sua participação na atividade o aluno deve apresentar à Coordenação de\nUCE o formulário em que o Coordenador da ação de extensão descreverá o tipo de ação, sua duração, a carga horária total executada e as atividades desenvolvidas (vide Anexo I)\nII – O discente receberá a declaração do Coordenador da ação ao finalizar o plano de atividades proposto;\nIII – A carga horária total será convertida em créditos, sendo que cada 18 horas correspondem a 1 crédito;\nIV – Os créditos serão lançados no Sistema de Gestão Acadêmica pelo Coordenador de UCE.', '§ 2º As atividades de extensão deverão fazer parte da matriz curricular do curso e do histórico escolar do discente.\n§ 3º O discente poderá realizar e/ou validar as atividades previstas nas modalidades de extensão desenvolvidas em outros Centros da UDESC, bem como, em outras instituições de ensino superior, respeitados os preceitos do artigo 4º e seus incisos.\nFundação Universidade do Estado de Santa Catarina - UDESC\nAv. Madre Benvenuta, 2007 – Itacorubi – Florianópolis SC\nCEP 88.035-901 - Fone (48) 3664 8000 – www.udesc.br', '## Chunk 1\n```\nArt. 1º O(a) acadêmico(a) matriculado(a) em curso de graduação da UDESC poderá obter a validação de disciplina do currículo de seu curso, desde que atenda aos requisitos estabelecidos nesta resolução.\n\nArt. 2º São possíveis de validação de disciplina, os seguintes estudos concluídos pelo(a) acadêmico(a):\nI – disciplina cursada com aproveitamento em curso superior, proveniente de curso de graduação, de curso sequencial que conduz a diploma e de curso de pós-graduação (especialização, mestrado ou doutorado);\nII – Estágio Curricular Supervisionado e Trabalho de Conclusão de Curso.\nParágrafo único: compete ao Núcleo Docente Estruturante – NDE do departamento, junto com a Coordenação de Estágio, definir critérios para proceder a validação dos estudos previstos no inciso II.', 'Art. 3º A validação de disciplina será efetuada quando o programa da disciplina cursada na instituição de origem corresponder a, no mínimo, 75% do conteúdo e da carga horária da disciplina que o(a) acadêmico(a) deveria cumprir na UDESC.\nParágrafo Único. poderão ser utilizados conteúdos de várias disciplinas para o aproveitamento de estudos.', 'Art. 6º As Unidades Curriculares de Extensão Vinculadas e não Vinculadas (UCE-V e UCE-\nNV), Disciplinas Mistas (DM) e Componente Curricular Extensionista (CCE) – possuem naturezas distintas nos seguintes aspectos:\nI – Entende-se por Unidade Curricular de Extensão Vinculada (UCE-V) as atividades que correspondem às ações de extensão vinculadas ao departamento de origem do acadêmico, atreladas ao Projeto Pedagógico do Curso.\nII – Entende-se por Unidade Curricular de Extensão Não Vinculada (UCE-NV) as atividades extensionistas realizadas na UDESC, não vinculadas ao departamento de origem do acadêmico ou em outras instituições.', '## Chunk 1\n```\nArt. 1º O(A) acadêmico(a) que retornar de programa de mobilidade autorizado pela UDESC, poderá obter a validação de disciplina do currículo de seu curso, desde que atenda aos requisitos estabelecidos nesta Resolução.\nParágrafo único. Entende-se por disciplina todos os componentes curriculares obrigatórios do curso, exceto as atividades complementares que tem legislação específica.\n\nArt. 2º A validação de disciplina será efetuada quando o programa da disciplina cursada na instituição de origem corresponder a, no mínimo, 75% do conteúdo e da carga horária da disciplina que o(a) acadêmico(a) deveria cumprir na UDESC.\nParágrafo Único. Poderão ser utilizados conteúdos de várias disciplinas para o aproveitamento de estudos.', 'Art. 10. Esta Resolução entra em vigor na data de sua publicação.\nFlorianópolis, 08 de abril de 2025.\nProfessora Julice Dias\nPresidente da Câmara de Ensino de Graduação - CEG\nFundação Universidade do Estado de Santa Catarina - UDESC\nAv. Madre Benvenuta, 2007 – Itacorubi – Florianópolis SC\nCEP 88.035-901 - Fone (48) 3664 8000 – www.udesc.br\nAnexo I – Formulário de Participação Discente em Ação de Extensão\nNome do(a) discente:\nCurso:\nTítulo da ação de extensão:\nCoordenador(a):\nTipo de ação: • Programa • Projeto • Ações isoladas • Curso / Oficina • Evento • Prestação de Serviços (p. ex. Empresa Júnior)\nDuração da ação (data de início e término): Carga horária total executada pelo(a) discente: Atividades desenvolvidas pelo(a) discente:\nLocal e data.\nAssinatura do Coordenador da Ação']","Para validar as atividades de extensão como Unidades de Creditação de Extensão, o discente deve comprovar sua participação seguindo estes procedimentos:

I – Ao final de sua participação na atividade, o aluno deve apresentar à Coordenação de UCE o formulário (Anexo I) no qual o Coordenador da ação de extensão descreverá o tipo de ação, sua duração, a carga horária total executada e as atividades desenvolvidas.
II – O discente receberá a declaração do Coordenador da ação ao finalizar o plano de atividades proposto.
III – A carga horária total será convertida em créditos, sendo que cada 18 horas correspondem a 1 crédito.
IV – Os créditos serão lançados no Sistema de Gestão Acadêmica pelo Coordenador de UCE.","Entregando o formulário assinado pelo coordenador da ação à Coordenação de UCE, que registra os créditos.",1.0,0.9270375286497402,0.49999999995,1.0,0.5176393525387222,"001-2022-ceg, 006-2025-ceg, 007-2021-ceg, 009-2021-ceg"
Qual é a média mínima para um aluno ser aprovado na UDESC?,"['Art. 6º - A aprovação em Exame de Suficiência de uma disciplina dispensa o aluno de cursá-la na forma regular, sendo-lhe atribuídos os respectivos créditos.\n\nArt. 7º - A Direção Geral do Centro, anualmente, obedecendo ao prazo estabelecido no\nCalendário Acadêmico da UDESC, expedirá edital de chamada para o referido Exame, indicando:\nI. Disciplinas ofertadas para avaliação nesta modalidade;\nII. Período e requisitos para inscrição;\nIII. Data de divulgação das inscrições deferidas e indeferidas.\n\nArt. 8º - O aluno interessado em realizar Exame de Suficiência deverá efetuar a inscrição junto à Secretaria Acadêmica do Centro.', '§ 2º Caso a aplicação da fórmula leve a não ocorrência de vagas, o Centro/Departamento poderá solicitar vagas mediante justificativa da Direção de Ensino de Graduação à Pró-Reitoria de Ensino (PROEN), cabendo a esta a autorização.\n§ 3º Para os cursos de graduação onde a ocupação média das vagas das disciplinas da primeira fase for igual ou superior a 90% do número de vagas por semestre definido no projeto pedagógico vigente do curso (NV), sendo esse percentual verificado após a data prevista no calendário acadêmico da UDESC para solicitação de dispensa de disciplina (para todos), desmatrícula em disciplina e trancamento de matrícula para acadêmicos da graduação, o número de vagas poderá ser de 25% sobre o NV. (Redação dada pela )', 'Parágrafo Único. Para realizar a matrícula, o(a) acadêmico(a) terá que apresentar documentação que ateste a conclusão do curso. No caso de apresentar o certificado na matrícula, o diploma e histórico escolar deverá ser apresentado em até 60 (sessenta) dias ou até o final de seu primeiro semestre de ingresso.\nArt. 18. Para o(a) acadêmico(a) que ingressar em curso de graduação da UDESC pela modalidade de Retorno ao Portador de Diploma de graduação, o início do tempo para integralização curricular será contado a partir do ingresso no curso em que obteve a vaga.\n```', 'Art. 5° - O aluno matriculado em disciplinas isoladas deverá submeter-se a verificação da aprendizagem, assegurando-lhe:\nI – o registro no histórico escolar, quando se tratar de aluno de outro curso da UDESC; e\nII – certificado de conclusão, de acordo com o Artigo 253 do Regimento Geral, quando se tratar de alunos da comunidade ou de outra instituição de ensino superior.\n\nArt. 6º – O registro e o controle Acadêmico dos alunos matriculados em disciplinas isoladas deverão ser feitos pela estrutura já existente no respectivo Centro.\n\nArt. 7º – Os alunos matriculados em disciplinas isoladas serão supervisionados pelo\nCoordenador de Colegiado de Ensino.\n\nArt. 8º – Os casos omissos serão analisados pelo Colegiado de Ensino.\n\nArt. 9º – Fica revogada a Resolução nº 016/2005-CONSEPE.', 'UDESC ou nova formação (bacharelado ou licenciatura); 1.4. Transferência Interna para o mesmo curso com mudança de Centro de Ensino; 1.5. Transferência Interna com mudança de curso de uma mesma área de conhecimento ou áreas afins, de acordo com o Edital de vagas; 1.6. Reingresso após Abandono ou Cancelamento com Mudança de Turno, para curso de uma mesma área de conhecimento ou áreas afins, de acordo com o Edital de vagas; 1.7. Reingresso após Abandono ou Cancelamento com Mudança de uma habilitação para outra no mesmo curso da UDESC ou nova formação (bacharelado ou licenciatura); 1.8. Reingresso após Abandono ou Cancelamento para o mesmo curso com mudança de Centro de Ensino; 1.9. Reingresso após Abandono ou Cancelamento para Mudança de curso, para curso de uma mesma área de conhecimento', 'Ensino de Graduação para registro e encaminhamento à Chefia de Departamento para análise e parecer. (redação dada pela ) (suprimido pela\nArt. 4º O(A) discente de graduação da UDESC deve matricular-se, por semestre, em um número de créditos igual ou inferior ao definido na fórmula abaixo:\nMaxM = MaxF x 1,25, onde:\nMaxM = número máximo de créditos que um(a) discente pode cursar por semestre;\nMaxF = número de créditos da fase com maior carga horária da matriz curricular vigente do curso, excluindo-se os créditos de disciplinas de estágio e trabalho de conclusão de curso.\n§ 1° Sempre que MaxM não resultar em um número inteiro procede-se o arredondamento para o número inteiro imediatamente superior, independente do valor dos decimais a desprezar.', 'APROV =\nNúmero de créditos em que o acadêmico se matriculou.\nII – Ponderação:\nESCORE = (AQ x 0,60) + (NOTA x 0,25) + (APROV x 0,15) § 2° A ordem de matrícula obedecerá o ranqueamento pelo ESCORE de forma decrescente, desta forma quanto maior o ESCORE, melhor será a colocação do acadêmico, e mais antecipada será a sua matrícula.\n§ 3º Para efeitos da ordenação referida neste artigo, considerar-se-ão as informações sobre o aproveitamento e desempenho do(a) discente acumuladas desde o seu ingresso no curso de graduação da UDESC.\n§ 4º Todas as médias e padrões deverão utilizar cinco casas decimais, sendo possível multiplicar o Escore acima estabelecido por 100 (cem), para que a faixa de variação dos resultados seja de 0 (zero) a 100 (cem).', '## Chunk 1\n```\nArt. 1º - Poderão matricular-se em disciplinas isoladas na Graduação, os alunos matriculados em cursos regulares da UDESC, desde que satisfaçam os requisitos exigidos, bem como qualquer pessoa da comunidade, desde que, além dos requisitos exigidos, atendam as normas estabelecidas para os cursos regulares no que se refere à escolaridade mínima.\n\nArt. 2° - Os alunos matriculados em disciplinas isoladas não integrarão o corpo discente regular da UDESC.']",Não foi possível encontrar a informação no contexto fornecido.,"Média 7,0 e frequência mínima de 75%.",0.0,0.0,0.0,0.0,0.200939958794074,"032-2004-cpe, 004-2023-ceg, 005-2009-cpe, 005-2014-cpe"
Qual é o valor de um crédito nas disciplinas da graduação?,"['disciplinas curricular\nENS 10\nParticipação em organização de eventos de Cada evento equivale a 1,5 créditos (máximo de 06 créditos no curso).\nEnsino.\nENS 11\nApresentação de trabalhos em congressos, Cada apresentação equivale a 02 créditos jornadas, simpósios, fóruns, seminários, cursos, (máximo de 06 créditos no curso).\npalestras, encontros, festivais e similares, com Obs.: 01 crédito por trabalho.\nrelatório de participação e certificado de aproveitamento e/ou frequência.\nENS 12\nPublicação de artigo em jornal, revista Cada artigo equivale a 02 créditos especializada e/ou científica da área com corpo (máximo de 06 créditos no curso).\neditorial.\nENS 13\nPublicação de Livro/Coletâneas relacionadas ao Cada livro ou coletânea equivale a 08\nEnsino créditos (máximo de 08 créditos no curso)\nENS 14', 'Ensino créditos (máximo de 08 créditos no curso)\nENS 14\nPublicação de capítulo em livros dedicados ao Cada capítulo equivale a 02 créditos\nEnsino. (máximo de 06 créditos no curso)\nENS 15\nATIVIDADES COMPLEMENTARES DE EXTENSÃO\nAtividades Créditos da Disciplina\nParticipação em Cursos de extensão, presencial ou a Cada 18 horas de participação distância, que tenham relação com o curso, equivale a 01 crédito (máximo de 04 créditos no curso)\nEXT 01\nParticipação em eventos culturais, técnicos, científicos, Cada participação em evento artísticos, esportivos e recreativos, que não sejam equivale a 01 crédito ou 18 h/a oriundas de atividades de disciplinas curriculares. (máximo de 04 créditos no curso)\nEXT 02', 'Projeto de Ensino. (bolsista ou voluntário 10 horas) ou 5,0\nENS 06 créditos (bolsista ou voluntário 20 horas).\nMáximo de 10 créditos no curso.\nExcesso de créditos em Disciplinas Máximo de 06 créditos no curso\nEletivas/Optativas.\nENS 07\nCurso de idiomas Cada 18 horas equivale a 01 crédito (máximo de 06 créditos no curso)\nENS 08\nDisciplinas não previstas no currículo pleno que Cada 18 horas de participação equivale a tenham relação com o curso, realizadas no 01 crédito (máximo de 06 créditos no exterior. curso)\nENS 09\nParticipação em eventos de ensino de graduação Cada evento equivale a 01 crédito e que não sejam oriundas de atividades de (máximo de 04 créditos no curso).\ndisciplinas curricular\nENS 10', 'ENS 06\nExcesso de créditos em Disciplinas Os créditos da disciplina (máximo de 08\nEletivas/Optativas. créditos no curso)\nENS 07\nCurso de Línguas. Cada 30 horas equivale a 01 crédito (máximo de 06 créditos no curso)\nENS 08\nDisciplinas não previstas no currículo pleno que Cada 15 horas de participação equivale a tenham relação com o curso, realizadas no exterior. 01 crédito (máximo de 08 créditos, no curso)\nENS 09\nRes. 026/2012-CONSEPE, fl. 4 de 13\nParticipação em eventos de monitoria e outros que Cada evento equivale a 01 crédito tenham relação com o ensino de graduação, e que (máximo de 04 créditos no curso) não sejam oriundas de atividades de disciplinas curriculares. Com comprovante de participação expedido pela organização do evento.\nENS 10', 'Art. 6º - Os projetos de cursos de graduação deverão obedecer à seguinte relação: 1) para componente curricular de 1 crédito, registra-se 18 horas-aula; 2) para componente curricular de 2 créditos, registra-se 36 horas-aula; 3) para componente curricular de 3 créditos, registra-se 54 horas-aula; 4) para componente curricular de 4 créditos, registra-se 72 horas-aula; 5) para componente curricular de 5 créditos, registra-se 90 horas-aula; 6) para componente curricular de 6 créditos, registra-se 108 horas-aula; 7) para componente curricular de 8 créditos, registra-se 144 horas-aula; 8) para componente curricular de 16 créditos, registra-se 288 horas-aula e assim, sucessivamente.', 'Art. 8º A matrícula em disciplina oferecida na modalidade de Estudo Dirigido será feita através de requerimento específico na Secretaria Acadêmica do Centro de Ensino, apreciada e deferida pela Coordenação de Colegiado de Curso e encaminhada ao Setor de Registro e Controle\nAcadêmico.\n```', 'Art.7º - O máximo de faltas permitidas ao aluno por disciplina, em até 25% (vinte e cinco por cento), correspondente às horas-aula ministradas passa a ser, com a nova determinação, o seguinte: 1) para componente curricular de 1 crédito –18 horas-aula : até 4 faltas; 2) para componente curricular de 2 créditos - 36 horas-aula: até 9 faltas; 3) para componente curricular de 3 créditos –54 horas-aula: até 13 faltas; 4) para componente curricular de 4 créditos - 72 horas-aula; até 18 faltas; 5) para componente curricular de 5 créditos - 90 horas-aula; até 22 faltas; 6) para componente curricular de 6 créditos - 108 horas-aula; até 27 faltas; 7) para componente curricular de 8 créditos - 144 horas-aula; até 36 faltas; 8) para componente curricular de 16 créditos - 288 horas-aula: até 72 faltas', 'Art. 4º A disciplina eletiva é aquela que suplementa a formação acadêmica, podendo ser cursada pelos interessados, dentre aquelas oferecidas em outro curso de Graduação da UDESC ou outra IES reconhecida pelo órgão competente.\n§1º O acadêmico é obrigado a cumprir o número de créditos em disciplinas eletivas estabelecido no\nPPC.\n§2º A disciplina eletiva é de livre escolha do acadêmico para fins de enriquecimento cultural, de aprofundamento e/ou atualização de conhecimentos específicos que complementem a formação acadêmica.\n§3º A disciplina eletiva não é parte integrante da matriz curricular, mas é integrante do currículo do curso.\nCapítulo III\nDAS DISCIPLINAS OPTATIVAS E ELETIVAS']","De acordo com o Art. 6º, para um componente curricular de 1 crédito, registram-se 18 horas-aula.",Cada crédito corresponde a 18 horas de atividades.,1.0,0.8789727593612989,0.5845238095091964,1.0,0.9746100881080172,"001-2022-ceg, 026-2012-cpe, 025-2006-cpe, 034-2009-cpe, 034-2013-cpe"
Quantas disciplinas isoladas podem ser cursadas por semestre na UDESC?,"['Art. 3° - Poderão ser aceitas matrículas em no máximo 2 (duas) disciplinas isoladas por semestre, para cada solicitante.\nParágrafo único. Serão consideradas exceções outras situações que não estão incluídas nas rotinas acadêmicas como: matrículas em disciplinas orientadas; matrículas em disciplinas para alunos estrangeiros e, matrículas em disciplinas para alunos estrangeiros que necessitam validar o Diploma.\n\nArt. 4° - A partir das inscrições, caberá ao Colegiado de Ensino definir:\nI - disciplinas possíveis de serem cursadas pelo candidato;\nII - pré-requisitos;\nIII - número de vagas disponíveis;\nIV - procedimentos de matrícula;\nV - direitos e deveres, respeitados o Estatuto e Regimento Geral da UDESC e os termos da presente Resolução.', 'Art. 5° - O aluno matriculado em disciplinas isoladas deverá submeter-se a verificação da aprendizagem, assegurando-lhe:\nI – o registro no histórico escolar, quando se tratar de aluno de outro curso da UDESC; e\nII – certificado de conclusão, de acordo com o Artigo 253 do Regimento Geral, quando se tratar de alunos da comunidade ou de outra instituição de ensino superior.\n\nArt. 6º – O registro e o controle Acadêmico dos alunos matriculados em disciplinas isoladas deverão ser feitos pela estrutura já existente no respectivo Centro.\n\nArt. 7º – Os alunos matriculados em disciplinas isoladas serão supervisionados pelo\nCoordenador de Colegiado de Ensino.\n\nArt. 8º – Os casos omissos serão analisados pelo Colegiado de Ensino.\n\nArt. 9º – Fica revogada a Resolução nº 016/2005-CONSEPE.', '## Chunk 1\n```\nArt. 1º - Poderão matricular-se em disciplinas isoladas na Graduação, os alunos matriculados em cursos regulares da UDESC, desde que satisfaçam os requisitos exigidos, bem como qualquer pessoa da comunidade, desde que, além dos requisitos exigidos, atendam as normas estabelecidas para os cursos regulares no que se refere à escolaridade mínima.\n\nArt. 2° - Os alunos matriculados em disciplinas isoladas não integrarão o corpo discente regular da UDESC.', 'Art. 3º A validação de disciplina será efetuada quando o programa da disciplina cursada na instituição de origem corresponder a, no mínimo, 75% do conteúdo e da carga horária da disciplina que o(a) acadêmico(a) deveria cumprir na UDESC.\nParágrafo Único. poderão ser utilizados conteúdos de várias disciplinas para o aproveitamento de estudos.', '§ 3º O tempo relativo ao trancamento de matrícula não será computado para efeito de integralização curricular dentro do prazo máximo fixado para o curso respectivo.\n§ 4º O trancamento de matrícula só será permitido após a conclusão pelo(a) acadêmico(a) do primeiro semestre de ingresso no curso.\n§ 5º O trancamento de matrícula não será permitido por mais de 4 (quatro) semestres, consecutivos ou não, devendo o(a) acadêmico(a) solicitá-lo a cada semestre.\n§ 6º Para solicitar o trancamento de sua matrícula, o(a) acadêmico(a) deverá estar com vínculo com a UDESC.\n§ 7º Não será permitido o trancamento para cursos oferecidos por meio de projetos externos e/ou convênios.', '## Chunk 3\n```\nCAPÍTULO III\nDA SITUAÇÃO DA MATRÍCULA\nArt. 10. A matrícula será ativa quando o(a) acadêmico(a) estiver matriculado(a) em no mínimo uma disciplina ou quando houver manifestação de interesse em manter vínculo como estudante da UDESC sem cursar nenhuma disciplina.\n§ 1º Será permitida a matrícula sem vínculo a disciplina por no máximo 2(dois) semestres consecutivos ou não.\n§ 2º Não será permitida a matrícula sem vínculo a disciplina ao(a) acadêmico(a) que pertencer a programas conveniados com a UDESC.\nArt. 11. A matrícula será suspensa nos casos em que não seja disponibilizada para o(a) acadêmico(a) a possibilidade de matrícula em ao menos uma disciplina.\n§ 1º O semestre com matrícula suspensa deve ser desconsiderado para fins de tempo máximo para integralização.', 'Art. 6º - A aprovação em Exame de Suficiência de uma disciplina dispensa o aluno de cursá-la na forma regular, sendo-lhe atribuídos os respectivos créditos.\n\nArt. 7º - A Direção Geral do Centro, anualmente, obedecendo ao prazo estabelecido no\nCalendário Acadêmico da UDESC, expedirá edital de chamada para o referido Exame, indicando:\nI. Disciplinas ofertadas para avaliação nesta modalidade;\nII. Período e requisitos para inscrição;\nIII. Data de divulgação das inscrições deferidas e indeferidas.\n\nArt. 8º - O aluno interessado em realizar Exame de Suficiência deverá efetuar a inscrição junto à Secretaria Acadêmica do Centro.', 'Art. 3º A Fundação Universidade do Estado de Santa Catarina - UDESC, de acordo com as condições disponíveis e conforme o conteúdo curricular da disciplina, poderá conceder as atividades domiciliares com acompanhamento, para seus acadêmicos que assim o requeiram, nos moldes desta\nResolução.\n\nArt. 4º O regime especial de atendimento domiciliar deve ser solicitado pelo acadêmico ou procurador quando da observação do problema que impede o acadêmico de manter frequência normal em aula, não sendo concedido em hipótese alguma para data retroativa à data do início do impedimento.\nParágrafo único. Disciplinas de caráter prático e estágios não poderão ter atendimento domiciliar temporário.']","Podem ser aceitas matrículas em no máximo 2 (duas) disciplinas isoladas por semestre para cada solicitante. O parágrafo único considera como exceções outras situações que não estão incluídas nas rotinas acadêmicas, como matrículas em disciplinas orientadas, para alunos estrangeiros e para alunos estrangeiros que necessitam validar o Diploma.","Cada solicitante pode se matricular em no máximo duas disciplinas isoladas por semestre, salvo exceções previstas, como disciplinas orientadas ou casos de alunos estrangeiros que necessitam validar o diploma.",1.0,0.9465039896098476,0.9999999999,1.0,0.7363211498500746,"005-2009-cpe, 007-2021-ceg, 005-2014-cpe, 032-2004-cpe, 002-2019-cpe"
Quais disciplinas podem ser oferecidas em caráter de Estudo Dirigido?,"['Art. 4º A disciplina em caráter de Estudo Dirigido é oferecida a partir da demanda dos alunos, com vistas à integralização da matriz curricular do curso, respeitados prazos determinados pela legislação vigente para tal oferta, assegurando os direitos e deveres da Instituição e dos alunos.\nParágrafo único. A oferta será cabível mediante a demanda contabilizada em no máximo 9 (nove) alunos.\nArt. 5º São condições necessárias à disciplina oferecida em Estudo Dirigido:', 'Art. 8º A matrícula em disciplina oferecida na modalidade de Estudo Dirigido será feita através de requerimento específico na Secretaria Acadêmica do Centro de Ensino, apreciada e deferida pela Coordenação de Colegiado de Curso e encaminhada ao Setor de Registro e Controle\nAcadêmico.\n```', 'III – o regime de oferecimento segue programação definida pelo professor e aprovada pelo\nCoordenador de Colegiado de Ensino.\nArt. 6º A disciplina em Estudo Dirigido será registrada no Histórico Escolar do aluno sem qualquer menção ao seu caráter excepcional.\nArt. 7º Aplicam-se às disciplinas ofertadas em forma de Estudo Dirigido, todas as exigências feitas às demais disciplinas, em termos de avaliação, notas, realização de avaliações em segunda chamada, conforme o definido no Regimento Geral da UDESC, sendo que a frequência deve estar estabelecida quando da elaboração da programação pelo docente.', '## Chunk 2\n```\nCAPÍTULO II\nDa Oferta de Disciplina em Caráter de Estudo Dirigido\nArt. 3º As disciplinas oferecidas por meio de Estudo Dirigido são aquelas constantes das matrizes curriculares mantidas pela UDESC, que já tenham sido extintas, ou estejam em fase de extinção.\n§ 1º As disciplinas a que se refere o caput deste artigo são aquelas que não apresentam equivalência com as apresentadas na nova matriz curricular.', 'Departamento;\nII – divulgar, junto aos alunos e professores, a oferta de disciplina em Estudo Dirigido;\nIII – informar aos demais professores sobre datas e horários de realização de atividades presenciais, quando for o caso, para evitar eventual sobreposição de outras atividades;\nIV – acompanhar a oferta da disciplina, reunindo-se com professores e alunos para avaliação do Estudo Dirigido quando necessário.\n```', 'Art. 5º São condições necessárias à disciplina oferecida em Estudo Dirigido:\nI – encontros presenciais estabelecidos em acordo firmado entre professor e aluno e constar na programação de trabalho, dispostos de modo a não ferir a programação das aulas regulares dos acadêmicos matriculados, e/ou, estudos à distância, com orientação e material previamente elaborado pelo professor, em volume compatível com o restante da carga horária semanal da disciplina (conforme matriz curricular);\nII – a programação a que se refere o inciso I deste artigo é de responsabilidade do professor, e deverá abranger atividades como: trabalhos, fichamentos, leituras dirigidas, estudos de caso, pesquisas bibliográficas e de campo, e provas a serem realizados sob a sua supervisão;', 'I – apresentar aos alunos e à coordenação a programação de atividades e de avaliações;\nII – cumprir a programação estabelecida conforme cronograma de atividades apresentado no inciso I deste artigo;\nIII – manter atualizado(s) o(s) diário(s) de classe, tanto em meio físico e/ou eletrônico;\nIV – disponibilizar o material de apoio aos alunos em meio físico ou eletrônico;\nV – disponibilizar aos alunos endereço de correio eletrônico;\nVI – participar, quando convocado, de reuniões com a coordenação e o(s) aluno(s) para avaliação do Estudo Dirigido.\nArt. 11. O Coordenador de Colegiado de Ensino é responsável por:\nI – apreciar a necessidade de oferta de disciplina em Estudo Dirigido indicada pelo Chefe de\nDepartamento;', '§ 2º Para alunos formados e prováveis formandos e em caso de excepcionalidade para os demais alunos, a disciplina extinta, ou em extinção que apresenta no currículo vigente equivalência, mas que não esteja sendo oferecida no semestre corrente poderá ter a oferta solicitada pelo aluno, para integralização do currículo, observado a existência, no Centro de Ensino, de professor capacitado e com carga horária disponível a lecioná-la.\n§ 3º Será permitido o oferecimento através de Estudo Dirigido para disciplina que tenha equivalência mas o número de créditos equivalentes seja no mínimo 1,5 vezes maior ou no caso em que as disciplinas equivalentes de uma determinada disciplina sejam oferecidas em duas ou mais fases.']","Conforme o Art. 3º e seus parágrafos, as disciplinas que podem ser oferecidas em caráter de Estudo Dirigido são:

*   Aquelas constantes das matrizes curriculares da UDESC que já tenham sido extintas ou estejam em fase de extinção, e que não apresentam equivalência com as da nova matriz curricular.
*   Para alunos formandos, prováveis formandos e, em casos excepcionais, para os demais alunos, a disciplina extinta ou em extinção que tenha equivalência no currículo vigente, mas que não esteja sendo oferecida no semestre corrente.
*   Disciplinas que tenham equivalência, mas em que o número de créditos equivalentes seja no mínimo 1,5 vezes maior ou quando as disciplinas equivalentes são oferecidas em duas ou mais fases.","Podem ser oferecidas disciplinas da matriz curricular da UDESC que foram extintas, estão em extinção ou possuem equivalência parcial com as novas matrizes.",0.875,0.9646276151642534,0.2499999999875,1.0,0.5053239307955547,034-2009-cpe
Quais condições o aluno deve atender para se inscrever no Exame de Suficiência?,"['§ 2º - O não comparecimento a Exame de Suficiência a que o aluno se inscreveu, se por motivos e situações previstas em Lei, não é considerado efetiva realização do Exame, para efeitos do que dispõe o inciso III deste artigo.\n§ 3º - O aluno que se inscreveu e não compareceu por motivos e situações previstas em Lei, poderá requerer a 2ª inscrição no semestre subseqüente, na Secretaria Acadêmica do\nCentro.\n§ 4º - Perde o direito de requerer a 2ª inscrição para a mesma disciplina o aluno que faltar sem justificativa.\n§ 5º - A inscrição do aluno para Exame de Suficiência será analisada pela Secretaria\nAcadêmica, para deferimento, se atendidas as condições expressas neste artigo.\n§ 6º - Se a inscrição for deferida a Secretaria Acadêmica encaminhará a solicitação ao\nCoordenador de Curso.', 'Art. 10 - O Exame de Suficiência será aplicado por Banca Examinadora especial e/ou delegação de competência, designada pelo Coordenador de Curso.\n\nArt. 11 - Após a divulgação da relação de inscrições deferidas, a Secretaria Acadêmica divulgará a data, o horário, o local e os responsáveis pela aplicação do exame de suficiência, por disciplina.\n\nArt. 12 - O Exame de Suficiência manterá o mesmo grau de amplitude e profundidade exigido dos alunos com matrícula presencial, atribuindo nota de 0 (zero) a 10 (dez), com um decimal.\nParágrafo único - Será considerado aprovado no Exame de Suficiência o aluno que alcançar nota igual ou superior a 7,0 (sete vírgula zero).\n\nArt. 13 - Após aplicação do Exame de Suficiência, a Secretaria Acadêmica efetuará o registro das notas dos alunos.', 'Art. 6º - A aprovação em Exame de Suficiência de uma disciplina dispensa o aluno de cursá-la na forma regular, sendo-lhe atribuídos os respectivos créditos.\n\nArt. 7º - A Direção Geral do Centro, anualmente, obedecendo ao prazo estabelecido no\nCalendário Acadêmico da UDESC, expedirá edital de chamada para o referido Exame, indicando:\nI. Disciplinas ofertadas para avaliação nesta modalidade;\nII. Período e requisitos para inscrição;\nIII. Data de divulgação das inscrições deferidas e indeferidas.\n\nArt. 8º - O aluno interessado em realizar Exame de Suficiência deverá efetuar a inscrição junto à Secretaria Acadêmica do Centro.', 'Art. 9º - É permitido ao aluno, no mesmo semestre, inscrever-se em uma ou mais disciplinas, desde que atenda as seguintes condições:\nI. Ter cumprido os pré-requisitos estabelecidos para matrícula na referida disciplina;\nII. Não ter sido reprovado na disciplina;\nIII. Não ter realizado Exame de Suficiência para a mesma disciplina ou disciplina equivalente a ela;\nIV. Não ter faltado ao Exame de Suficiência nos semestres anteriores;\nV. Anexar a sua inscrição documentos que atestem ser portador de conhecimento, habilidade ou competência relativa à disciplina.\n§ 1º - Caso o aluno se inscreva para Exame de Suficiência, simultaneamente, em disciplinas que guardam entre si relação de pré-requisito, só poderá realizar a avaliação caso atenda, antecipadamente, o previsto no inciso I deste artigo.', '## Chunk 1\n```\nArt. 1º - O aluno que tenha extraordinário aproveitamento nos estudos, demonstrado por Exame de Suficiência de que trata a presente Resolução, poderá ter abreviada a duração de seus cursos.\n\nArt. 2º - O Exame de Suficiência consiste em oportunidade de progressão curricular através de avaliação de conhecimentos e habilidades das quais o aluno é portador e que são objeto de estudo e preparação por determinada disciplina, visando detectar alunos com excelência de domínio na área de conhecimento em questão, não adquirida de forma autodidata e nem através de conhecimentos formais do ensino médio.\nParágrafo Único - No que se refere ao ensino médio, as exceções se fazem para as áreas definidas nesta Resolução.', 'Art. 3º - Cada curso disponibilizará a relação das disciplinas aptas à realização de exame de suficiência.\n\nArt. 4º - As disciplinas sujeitas à aplicação de Exame de Suficiência serão definidas pelo Colegiado de Curso, respeitadas as especificidades de cada curso.\n\nArt. 5º - As disciplinas devem ter características específicas de habilidades e conhecimentos que podem ser adquiridos em cursos não universitários compreendendo línguas, fotografia, computação, instrumentos musicais, desenho técnico, bem como práticas esportivas.\nParágrafo Único - Em disciplinas de caráter teórico-prático, como o exemplo das práticas desportivas é facultado ao Colegiado de Curso optar pela dispensa parcial ou integral.', 'Art. 14 - A aprovação em uma disciplina através de Exame de Suficiência será registrada no Histórico Escolar do aluno, mediante referência expressa da forma de obtenção dos respectivos créditos.\n\nArt. 15 - Os casos omissos serão deliberados pelo Conselho de Ensino, Pesquisa e\nExtensão – CONSEPE.\n\nArt. 16 - Esta Resolução entra em vigor nesta data.\n\nArt. 17 - Fica revogada a Resolução Nº 020/2001 - CONSEPE e demais disposições em contrário.\nFlorianópolis, 18 de outubro de 2004.\nProf. Anselmo Fábio de Moraes\nPresidente\n```', 'Art. 5º O aluno matriculado em disciplinas nestas condições é responsável por:\nI – cumprir integralmente a programação de atividades definida pelos docentes;\nII – frequentar as aulas definidas pelos docentes envolvidos nas disciplinas com sobreposição de horários;\nIII – disponibilizar aos docentes meios de contato (telefones, endereço de correio eletrônico);\nIV – realizar as provas e trabalhos solicitados;\nV – participar, quando solicitado, de reuniões junto ao(s) docente(s) e ao Coordenador de\nColegiado de Ensino de Graduação para avaliação do processo.']","De acordo com o Art. 9º, para se inscrever em um Exame de Suficiência, o aluno deve atender às seguintes condições:
I. Ter cumprido os pré-requisitos estabelecidos para matrícula na referida disciplina;
II. Não ter sido reprovado na disciplina;
III. Não ter realizado Exame de Suficiência para a mesma disciplina ou disciplina equivalente a ela;
IV. Não ter faltado ao Exame de Suficiência nos semestres anteriores;
V. Anexar a sua inscrição documentos que atestem ser portador de conhecimento, habilidade ou competência relativa à disciplina.","O aluno deve cumprir pré-requisitos, não ter sido reprovado, não ter feito exame antes, não ter faltado previamente e apresentar documentos que comprovem conhecimento ou habilidade.",1.0,0.9636532561088106,0.249999999975,1.0,0.9720733621753694,"032-2004-cpe, in_003_2009_proen"
Como funciona a avaliação do extraordinário aproveitamento?,"['Art. 3º O acadêmico interessado em comprovar extraordinário aproveitamento de estudos deverá instaurar processo junto à Secretaria de Ensino de Graduação do Centro, com pedido dirigido à Chefia do Departamento do respectivo curso.\nParágrafo Único. O período para solicitar o extraordinário aproveitamento de estudos é 30 dias antes do término do semestre letivo.', 'Art. 6º Caberá ao Chefe do Departamento, em face da comprovação do extraordinário aproveitamento de estudos pelo acadêmico, enviar o processo contendo a prova e as atas avaliativas à Secretaria de Ensino de Graduação para registro e posterior arquivamento.\n\nArt. 7º O acadêmico que obtiver abreviação de estudos, na forma desta Resolução, terá consignado em seu histórico escolar o conceito “Extraordinário Aproveitamento”, bem como a nota obtida no processo de comprovação em causa.\n\nArt. 8º O processo de aceleração de estudos disciplinado nesta Resolução deverá ser encerrado, com decisão final, em no máximo 60 (sessenta) dias após seu início.\n\nArt. 9º Os casos omissos nesta Resolução deverão ser encaminhados pelo Colegiado\nPleno do Departamento ao CONSEPE.', 'Art. 147. A avaliação do aproveitamento é feita pelo professor e expressa numericamente em escala de 0 (zero) a 10 (dez), do seguinte modo:\nI - é considerado aprovado o aluno que obtiver média semestral igual ou superior a 7,0 (sete vírgula zero) e freqüência não inferior a 75% (setenta e cinco por cento);\nII - o aluno que não obtiver a média 7,0 (sete vírgula zero) estará, obrigatoriamente, em exame, cujo desempenho será composto por média semestral com peso 6 (seis) e o exame final com peso 4 (quatro), devendo atingir a média final de, no mínimo, 5,0 (cinco vírgula zero) e freqüência não inferior a 75% (setenta e cinco por cento);', '## Chunk 1\n```\nArt. 1º O acadêmico, regularmente matriculado nesta Universidade, poderá ter abreviada a duração do seu curso de graduação, mediante comprovação de extraordinário aproveitamento nos estudos, demonstrado em exames específicos prestados perante Banca\nExaminadora.\n§ 1º Será considerado de extraordinário aproveitamento o acadêmico que comprove deter as competências/habilidades exigidas no Projeto Pedagógico do respectivo curso de graduação para o componente curricular que se pretende abreviar.\n§ 2º Para os fins do disposto nesta Resolução, será autorizada a aceleração de estudos para componentes curriculares definidos pelo Colegiado Pleno do Departamento, exceto para o Estágio Curricular Supervisionado e Trabalho de Conclusão de Curso.', '§ 3º Terá comprovado extraordinário aproveitamento nos estudos o acadêmico que obtiver, como resultado da avaliação de seu desempenho na prova, no mínimo, a média 9,0 (nove vírgula zero), sem direito a exame final.\n§ 4º O acadêmico que não atingir a nota mínima referida no parágrafo anterior, como resultado da avaliação de seu desempenho na prova, não poderá se candidatar novamente à comprovação de extraordinário aproveitamento de estudos na mesma disciplina.\nFundação Universidade do Estado de Santa Catarina\nAv. Madre Benvenuta, 2007 – Itacorubi – 88.035-001\nFlorianópolis SC Fone (48) 3321 8000 – www.udesc.br § 5º O não comparecimento do interessado no dia, hora e local designados para a avaliação equivalerá à desistência do pedido, sem direito à segunda chamada.', '## Chunk 1\n```\nArt. 1º - O aluno que tenha extraordinário aproveitamento nos estudos, demonstrado por Exame de Suficiência de que trata a presente Resolução, poderá ter abreviada a duração de seus cursos.\n\nArt. 2º - O Exame de Suficiência consiste em oportunidade de progressão curricular através de avaliação de conhecimentos e habilidades das quais o aluno é portador e que são objeto de estudo e preparação por determinada disciplina, visando detectar alunos com excelência de domínio na área de conhecimento em questão, não adquirida de forma autodidata e nem através de conhecimentos formais do ensino médio.\nParágrafo Único - No que se refere ao ensino médio, as exceções se fazem para as áreas definidas nesta Resolução.', 'Art. 5º A avaliação será realizada em dia, hora e local divulgados com antecedência mínima de 7 (sete) dias, e a nota será a média aritmética das notas atribuídas pelos 3 (três) componentes da Banca Examinadora.\n§ 1º A avaliação abrangerá todo o conteúdo programático do componente curricular a ser avaliado, conforme previsto no Projeto Pedagógico do curso e estabelecido no plano de ensino da disciplina.\n§ 2º A ata da prova deverá informar a disciplina objeto da prova, os procedimentos adotados na avaliação do extraordinário aproveitamento de estudos, o nome do candidato submetido à avaliação, a nota atribuída por cada um dos membros da Banca Examinadora e a média aritmética conforme o caput deste artigo.', '## Chunk 1\n```\nArt. 1º - O acadêmico regularmente matriculado que deixar de comparecer a qualquer das avaliações nas datas fixadas pelo professor, poderá solicitar segunda chamada desta avaliação através de requerimento por ele assinado, ou por seu representante legal, entregue na Secretaria de Ensino de\nGraduação e/ou Secretaria do Departamento, no prazo de 5 (cinco) dias úteis, contados a partir da data de realização da avaliação, sendo aceitos pedidos, devidamente comprovados e que se enquadrem em um das seguintes situações:\nI - problema de saúde do aluno ou parente de 1º grau, devidamente comprovado, que justifique a ausência;\nII - ter sido vítima de ação involuntária provocada por terceiros, comprovada por Boletim de\nOcorrência ou documento equivalente;']","A avaliação é realizada por uma Banca Examinadora composta por 3 (três) membros e abrange todo o conteúdo programático do componente curricular. A nota final é a média aritmética das notas atribuídas pelos membros da banca. Para comprovar o extraordinário aproveitamento, o acadêmico deve obter uma média mínima de 9,0 (nove vírgula zero), sem direito a exame final. O dia, hora e local da avaliação são divulgados com uma antecedência mínima de 7 (sete) dias. O não comparecimento equivale à desistência do pedido, sem direito a uma segunda chamada. Caso o acadêmico não atinja a nota mínima, não poderá se candidatar novamente para a comprovação na mesma disciplina.","A avaliação é feita por Banca Examinadora de 3 professores, com provas sobre todo o conteúdo da disciplina; a nota é a média aritmética, e mínimo 9,0 garante aprovação sem exame final.",1.0,0.9785852935772602,0.26785714284375,1.0,0.7889126560229555,"020-2015-cpe, avaliacao_academica_udesc_, 032-2004-cpe, 039-2015-cpe"
É permitido ao aluno concluir o curso em menos tempo que o mínimo previsto?,"['Art. 7º - Não será permitida ao aluno a conclusão do Curso em um tempo menor do que o prazo mínimo fixado para integralização do respectivo currículo.\nParágrafo Único – O disposto no “caput” deste artigo não se aplica aos casos de retorno aos portadores de diploma de curso superior ou de renovação de vestibular.\n\nArt. 8° - Ao requerente de prorrogação de prazo de conclusão de curso que, na data de matrícula regular, não tiver obtido decisão final de sua solicitação, ser-lhe-á permitida matrícula condicional.\n\nArt. 9º - Os casos omissos serão julgados pelo Conselho de Ensino, Pesquisa e\nExtensão – CONSEPE.\n\nArt. 10 - Esta Resolução entra em vigor nesta data.', '§ 3º O tempo relativo ao trancamento de matrícula não será computado para efeito de integralização curricular dentro do prazo máximo fixado para o curso respectivo.\n§ 4º O trancamento de matrícula só será permitido após a conclusão pelo(a) acadêmico(a) do primeiro semestre de ingresso no curso.\n§ 5º O trancamento de matrícula não será permitido por mais de 4 (quatro) semestres, consecutivos ou não, devendo o(a) acadêmico(a) solicitá-lo a cada semestre.\n§ 6º Para solicitar o trancamento de sua matrícula, o(a) acadêmico(a) deverá estar com vínculo com a UDESC.\n§ 7º Não será permitido o trancamento para cursos oferecidos por meio de projetos externos e/ou convênios.', 'Art. 3º O aluno portador de deficiências físicas, doenças graves ou afecções que importem em limitação da capacidade de aprendizagem, e que esteja com o prazo de integralização curricular em vias de esgotar-se, poderá solicitar a dilatação do prazo máximo estabelecido para conclusão do Curso de Graduação. (redação dada pela ) § 1º - A dilatação de prazo a que se refere este artigo não poderá ultrapassar a 50% (cinqüenta por cento) do limite máximo de duração fixado para o Curso.\n§ 2º - Tal dilatação poderá igualmente ser concedida em casos de força maior, devidamente comprovados.', 'Art. 3º - O trancamento de matrícula implica em requerimento à Secretaria Geral do Centro, no prazo fixado pelo Calendário Acadêmico ou no ato da matrícula, explicitando o período no qual o acadêmico deseja o trancamento.\n§ 1º - O período máximo de trancamento de matrícula é de 2 (dois) anos (4 semestres) consecutivos ou não.\n§ 2º - É vedado o trancamento de matrícula aos alunos da primeira fase.\n§ 3º - Ao Coordenador de Curso caberá deferir os pedidos de trancamento de matricula dentro dos prazos e normas fixados.\n\nArt. 4º - O aluno poderá requerer à Secretaria do Centro seu retorno ao curso, mesmo antes de esgotar seu período de trancamento, respeitado o Calendário Acadêmico e as normas gerais que disciplinam o processo de matrícula.', '§ 3º O total da carga horária atribuída às Atividades Complementares deve estar entre 2% e 6% do total da carga horária mínima do curso definida pela legislação, tanto para as modalidades presenciais como para as modalidades a distância, não podendo exceder este limite. (redação dada pela )', '§ 2º A matrícula deverá ser sempre renovada antes do início de cada período letivo, conforme o Calendário Acadêmico.\n§ 3º A desistência de matrícula em uma ou mais disciplinas pode ser requerida pelo(a) acadêmico(a), obedecendo-se o prazo estabelecido no Calendário Acadêmico.', 'Art. 3º O aluno portador de deficiências físicas, doenças graves ou afecções que importem em limitação da capacidade de aprendizagem, e que esteja com o prazo de integralização curricular em vias de esgotar-se, poderá solicitar a dilatação do prazo máximo estabelecido para conclusão do\nCurso de Graduação.\n§ 1º ...................................\n§ 2º ....................................\n§ 3º Por força maior, entendem-se as ocorrências inevitáveis e não promovidas por vontade ou ação do sujeito interessado.\n§ 4º Poderão justificar-se como motivos de força maior todos os eventos ou situações que sejam inevitáveis, ainda que previsíveis, como as catástrofes ambientais e/ou fenômenos da natureza.""', 'Art. 5º Os acadêmicos poderão matricular-se em disciplinas optativas desde que tenham sido atendidas as exigências de pré-requisitos e compatibilidade de horário.\nParágrafo único. Uma disciplina optativa não poderá ser pré-requisito de disciplina optativa/obrigatória.\n\nArt. 6º No Projeto Pedagógico de Curso – PPC, o somatório de créditos em disciplinas optativas e/ou eletivas exigidas para que o acadêmico integralize o seu curso não poderá ultrapassar o máximo de 20% da carga horária mínima exigida pelo MEC para o curso.\nParágrafo único. Da carga horária em disciplinas obrigatórias deverá ser deduzida a carga horária definida para estágio e TCC.']","Conforme o Art. 7º, não será permitida ao aluno a conclusão do curso em um tempo menor do que o prazo mínimo fixado para a integralização do respectivo currículo. Contudo, o Parágrafo Único do mesmo artigo especifica que esta regra não se aplica aos casos de retorno aos portadores de diploma de curso superior ou de renovação de vestibular.","Não, a conclusão do curso não pode ser inferior ao prazo mínimo estabelecido para integralização do currículo.",1.0,0.9521363131795969,0.9999999999,1.0,0.5942140804907752,"001-2000-cpe, 005-2014-cpe, 012-1989-cpe, 026-2012-cpe, 002-2010-cpe, 034-2013-cpe"
É permitido ao aluno da UDESC matricular-se em dois ou mais cursos de graduação ao mesmo tempo?,"['## Chunk 1\n```\nArt. 1° - É vedada ao aluno a matrícula e a freqüência simultânea em dois ou mais cursos de graduação da Fundação Universidade do Estado de Santa Catarina - UDESC.\n\nArt. 2° - O aluno que ingressar na UDESC a partir do primeiro semestre de 2002, seja por Concurso\nVestibular ou através de modalidade extra-Vestibular, e que já estiver matriculado em curso(s) de graduação da UDESC, deverá, no ato de matrícula, optar por apenas um dos cursos, declarando, expressa e formalmente, sua renúncia à vaga no(s) curso(s) não optado(s).\nParágrafo único: O disposto no ""caput"" não se aplica aos alunos que ingressaram nos cursos antes da edição desta Resolução.', '§ 3º O tempo relativo ao trancamento de matrícula não será computado para efeito de integralização curricular dentro do prazo máximo fixado para o curso respectivo.\n§ 4º O trancamento de matrícula só será permitido após a conclusão pelo(a) acadêmico(a) do primeiro semestre de ingresso no curso.\n§ 5º O trancamento de matrícula não será permitido por mais de 4 (quatro) semestres, consecutivos ou não, devendo o(a) acadêmico(a) solicitá-lo a cada semestre.\n§ 6º Para solicitar o trancamento de sua matrícula, o(a) acadêmico(a) deverá estar com vínculo com a UDESC.\n§ 7º Não será permitido o trancamento para cursos oferecidos por meio de projetos externos e/ou convênios.', '## Chunk 1\n```\nArt. 1º Os §§ 3º e 4º do art. 3º da Resolução nº 05/2014 - CONSEPE, que “Dispõe sobre as normas e os procedimentos para a matrícula de acadêmicos nos cursos de graduação da UDESC.”, passam a vigorar com as seguintes redações: “\n\nArt. 3º (...) § 3º A desmatrícula em uma ou mais disciplinas pode ser requerida pelo/aacadêmico/a,obedecendo-se o prazo estabelecido no Calendário Acadêmico.\n§ 4º Excepcionalmente, a desmatrícula em uma ou mais disciplinas em curso será possível fora do período estabelecido no calendário acadêmico até 15 dias antes do encerramento do período letivo, devendo o/a acadêmico/a enviar a solicitação devidamente justificada e comprovada através do Sistema Acadêmico, cabendo à Chefia do Departamento a análise da solicitação.”', 'Art. 13 (...) § 8º O/A aluno/a regularmente matriculado/a no semestre em curso, poderá realizar a solicitação de trancamento de matrícula fora do período estabelecido no calendário até 15 dias antes do encerramento do período letivo, devendo o/a acadêmico/a enviar a solicitação devidamente justificada e comprovada através do Sistema Acadêmico, cabendo à Chefia do\nDepartamento a análise da solicitação.”\n\nArt. 4º Fica suprimido o § 9º do art. 13 da Resolução nº 05/2014 - CONSEPE, que “Dispõe sobre as normas e os procedimentos para a matrícula de acadêmicos nos cursos de graduação da UDESC.”.', 'Parágrafo Único. Para realizar a matrícula, o(a) acadêmico(a) terá que apresentar documentação que ateste a conclusão do curso. No caso de apresentar o certificado na matrícula, o diploma e histórico escolar deverá ser apresentado em até 60 (sessenta) dias ou até o final de seu primeiro semestre de ingresso.\nArt. 18. Para o(a) acadêmico(a) que ingressar em curso de graduação da UDESC pela modalidade de Retorno ao Portador de Diploma de graduação, o início do tempo para integralização curricular será contado a partir do ingresso no curso em que obteve a vaga.\n```', '## Chunk 1\n```\nArt. 1º - Poderão matricular-se em disciplinas isoladas na Graduação, os alunos matriculados em cursos regulares da UDESC, desde que satisfaçam os requisitos exigidos, bem como qualquer pessoa da comunidade, desde que, além dos requisitos exigidos, atendam as normas estabelecidas para os cursos regulares no que se refere à escolaridade mínima.\n\nArt. 2° - Os alunos matriculados em disciplinas isoladas não integrarão o corpo discente regular da UDESC.', 'Art. 3° - Poderão ser aceitas matrículas em no máximo 2 (duas) disciplinas isoladas por semestre, para cada solicitante.\nParágrafo único. Serão consideradas exceções outras situações que não estão incluídas nas rotinas acadêmicas como: matrículas em disciplinas orientadas; matrículas em disciplinas para alunos estrangeiros e, matrículas em disciplinas para alunos estrangeiros que necessitam validar o Diploma.\n\nArt. 4° - A partir das inscrições, caberá ao Colegiado de Ensino definir:\nI - disciplinas possíveis de serem cursadas pelo candidato;\nII - pré-requisitos;\nIII - número de vagas disponíveis;\nIV - procedimentos de matrícula;\nV - direitos e deveres, respeitados o Estatuto e Regimento Geral da UDESC e os termos da presente Resolução.', '## Chunk 1\n```\nArt. 1º O(a) acadêmico(a) matriculado(a) em curso de graduação da UDESC poderá obter a validação de disciplina do currículo de seu curso, desde que atenda aos requisitos estabelecidos nesta resolução.\n\nArt. 2º São possíveis de validação de disciplina, os seguintes estudos concluídos pelo(a) acadêmico(a):\nI – disciplina cursada com aproveitamento em curso superior, proveniente de curso de graduação, de curso sequencial que conduz a diploma e de curso de pós-graduação (especialização, mestrado ou doutorado);\nII – Estágio Curricular Supervisionado e Trabalho de Conclusão de Curso.\nParágrafo único: compete ao Núcleo Docente Estruturante – NDE do departamento, junto com a Coordenação de Estágio, definir critérios para proceder a validação dos estudos previstos no inciso II.']","Não, de acordo com o Art. 1º, ""É vedada ao aluno a matrícula e a freqüência simultânea em dois ou mais cursos de graduação da Fundação Universidade do Estado de Santa Catarina - UDESC.""","Não, é vedada a matrícula e a frequência simultânea em dois ou mais cursos.",1.0,0.9620842308351181,0.9999999999,1.0,0.6071233277315773,"041-2001-cpe, 005-2014-cpe, 008-2022-ceg, 004-2023-ceg, 005-2009-cpe, 007-2021-ceg"
É possível desmatricular-se de disciplinas fora do período do calendário acadêmico?,"['§ 2º A matrícula deverá ser sempre renovada antes do início de cada período letivo, conforme o Calendário Acadêmico.\n§ 3º A desistência de matrícula em uma ou mais disciplinas pode ser requerida pelo(a) acadêmico(a), obedecendo-se o prazo estabelecido no Calendário Acadêmico.', '§ 3º A desmatrícula em uma ou mais disciplinas pode ser requerida pelo/a acadêmico/a, obedecendo-se o prazo estabelecido no Calendário Acadêmico. (redação dada pela ) § 4º A desistência de matrícula em uma ou mais disciplinas será possível fora do período estabelecido no calendário acadêmico quando o acadêmico apresentar solicitação com comprovação que justifique motivo de doença do interessado ou parentes de 1º Grau ou motivo de força maior, aprovado pela Direção de Ensino de Graduação. (incluído pela § 4º Excepcionalmente, a desistência de matrícula em uma ou mais disciplinas será possível fora do período estabelecido no calendário acadêmico, quando justificada e comprovada pelo/a acadêmico/a e aprovado pela Chefia do Departamento. (redação dada pela )\nRes. 005/2014-CONSEPE, fl. 1 de 8', '## Chunk 1\n```\nArt. 1º Os §§ 3º e 4º do art. 3º da Resolução nº 05/2014 - CONSEPE, que “Dispõe sobre as normas e os procedimentos para a matrícula de acadêmicos nos cursos de graduação da UDESC.”, passam a vigorar com as seguintes redações: “\n\nArt. 3º (...) § 3º A desmatrícula em uma ou mais disciplinas pode ser requerida pelo/aacadêmico/a,obedecendo-se o prazo estabelecido no Calendário Acadêmico.\n§ 4º Excepcionalmente, a desmatrícula em uma ou mais disciplinas em curso será possível fora do período estabelecido no calendário acadêmico até 15 dias antes do encerramento do período letivo, devendo o/a acadêmico/a enviar a solicitação devidamente justificada e comprovada através do Sistema Acadêmico, cabendo à Chefia do Departamento a análise da solicitação.”', 'REITORIA UDESC\nAv. Madre Benvenuta, 2007 – Itacorubi – 88.035-001\nFlorianópolis SC Fone (48) 3231 1503 – www.udesc.br § 4º Excepcionalmente, a desmatrícula em uma ou mais disciplinas em curso será possível fora do período estabelecido no calendário acadêmico até 15 dias antes do encerramento do período letivo, devendo o/a acadêmico/a enviar a solicitação devidamente justificada e comprovada através do Sistema Acadêmico, cabendo à Chefia do Departamento a análise da solicitação. (redação dada pela ) § 5º Entende-se como motivo de força maior, fatos externos que podem ser de ordem de autoridade, fenômenos naturais e ocorrências políticas. (incluído pela § 5º A solicitação e a justificativa comprovada devem dar entrada na Secretaria de', 'Art. 13 (...) § 8º O/A aluno/a regularmente matriculado/a no semestre em curso, poderá realizar a solicitação de trancamento de matrícula fora do período estabelecido no calendário até 15 dias antes do encerramento do período letivo, devendo o/a acadêmico/a enviar a solicitação devidamente justificada e comprovada através do Sistema Acadêmico, cabendo à Chefia do\nDepartamento a análise da solicitação.”\n\nArt. 4º Fica suprimido o § 9º do art. 13 da Resolução nº 05/2014 - CONSEPE, que “Dispõe sobre as normas e os procedimentos para a matrícula de acadêmicos nos cursos de graduação da UDESC.”.', '§ 3º O tempo relativo ao trancamento de matrícula não será computado para efeito de integralização curricular dentro do prazo máximo fixado para o curso respectivo.\n§ 4º O trancamento de matrícula só será permitido após a conclusão pelo(a) acadêmico(a) do primeiro semestre de ingresso no curso.\n§ 5º O trancamento de matrícula não será permitido por mais de 4 (quatro) semestres, consecutivos ou não, devendo o(a) acadêmico(a) solicitá-lo a cada semestre.\n§ 6º Para solicitar o trancamento de sua matrícula, o(a) acadêmico(a) deverá estar com vínculo com a UDESC.\n§ 7º Não será permitido o trancamento para cursos oferecidos por meio de projetos externos e/ou convênios.', '## Chunk 1\n```\nArt. 1º - Os §§ 4º e 5º do art. 3º e os §§ 8º e 9º do art. 13, da Resolução nº 005/2014 – CONSEPE, de 18 de fevereiro de 2014, introduzidos pela Resolução nº 044/2015 - CONSEPE, passam a vigorar com a seguinte redação: “\n\nArt. 3º (...) § 4º Excepcionalmente, a desistência de matrícula em uma ou mais disciplinas será possível fora do período estabelecido no calendário acadêmico, quando justificada e comprovada pelo/a acadêmico/a e aprovado pela Chefia do Departamento.\n§ 5º A solicitação e a justificativa comprovada devem dar entrada na Secretaria de Ensino de Graduação para registro e encaminhamento à Chefia de Departamento para análise e parecer.” “', '§ 2º O(A) acadêmico(a) deverá solicitar a suspensão da matrícula até o final do período de ajustes de matrículas do semestre em questão.\n§ 3º A matrícula não poderá ser suspensa em semestres consecutivos.\nArt. 12. A matrícula trancada é aquela situação que permite o(a) estudante interromper suas atividades acadêmicas por tempo determinado.\nArt. 13. O trancamento de matrícula deve ser requerido no prazo legal fixado pelo\nCalendário Acadêmico.\n§ 1º O(A) acadêmico(a) poderá requerer o trancamento de matrícula quando não desejar se inscrever em disciplinas ou se após matriculado e inscrito, não desejar mais cursar naquele período letivo.\n§ 2º O trancamento de matrícula não será permitido no primeiro semestre de ingresso do acadêmico no curso.']","Sim, excepcionalmente, a desmatrícula em uma ou mais disciplinas é possível fora do período estabelecido no calendário acadêmico. A solicitação deve ser feita até 15 dias antes do encerramento do período letivo, e o acadêmico deve enviar a solicitação devidamente justificada e comprovada através do Sistema Acadêmico. A análise da solicitação cabe à Chefia do Departamento.","Sim, até 15 dias antes do encerramento do período letivo, mediante solicitação justificada e comprovada pelo Sistema Acadêmico, a ser analisada pela Chefia do Departamento.",1.0,0.960042775190613,0.6861904761767524,1.0,0.9756823215286721,"005-2014-cpe, 008-2022-ceg, 027-2019-cpe"
O que acontece com as disciplinas do currículo em extinção que não têm equivalência na nova matriz curricular?,"['Art. 4º O(a) Chefe de Departamento do Curso deverá solicitar a Direção Geral portaria de transição curricular na qual deverá constar os aspectos do processo de reestruturação, a saber:\nI – prazo para extinção do currículo antigo e oferecimento de disciplinas;\nII – data de implantação do novo currículo;\nIII - prazo para solicitação de migração;\nIV – forma de migração do currículo em extinção para o novo currículo;\nV - tabela de equivalência de disciplinas, quando for o caso.\n\nArt. 5º As disciplinas cursadas no currículo em extinção e que não tenham equivalência na nova matriz curricular deverão permanecer no histórico escolar do(a) acadêmico(a).\n\nArt. 6º As disciplinas do currículo em extinção, se necessário, poderão ser oferecidas de acordo com as normativas da Universidade.', '§ 2º Para alunos formados e prováveis formandos e em caso de excepcionalidade para os demais alunos, a disciplina extinta, ou em extinção que apresenta no currículo vigente equivalência, mas que não esteja sendo oferecida no semestre corrente poderá ter a oferta solicitada pelo aluno, para integralização do currículo, observado a existência, no Centro de Ensino, de professor capacitado e com carga horária disponível a lecioná-la.\n§ 3º Será permitido o oferecimento através de Estudo Dirigido para disciplina que tenha equivalência mas o número de créditos equivalentes seja no mínimo 1,5 vezes maior ou no caso em que as disciplinas equivalentes de uma determinada disciplina sejam oferecidas em duas ou mais fases.', 'Art. 5º A inserção curricular da extensão dar-se-á por meio de:\nI – Unidade Curricular de Extensão vinculada (UCE-V);\nII – Unidade Curricular de Extensão não vinculada (UCE-NV);\nIII – Disciplinas Mistas (DM);\nIV – Componente Curricular Extensionista (CCE).\n§ 1º A inserção curricular da extensão não necessariamente permeará o currículo em ordem sequencial da matriz curricular.\n§2º As Unidades Curriculares de Extensão Vinculadas e não Vinculadas (UCE-V e UCE-NV) são componentes curriculares que não são inseridos na matriz curricular, podendo ser desenvolvidas ao longo de todo o percurso formativo; §3º As Disciplinas Mistas (DM) e o Componente Curricular Extensionista (CCE) devem ser inseridas na matriz curricular em fases específicas.', '§ 2º A matrícula deverá ser sempre renovada antes do início de cada período letivo, conforme o Calendário Acadêmico.\n§ 3º A desistência de matrícula em uma ou mais disciplinas pode ser requerida pelo(a) acadêmico(a), obedecendo-se o prazo estabelecido no Calendário Acadêmico.', '§ 5º Na existência de um maior número de solicitações de matrículas em relação ao número de vagas definido para cada disciplina, dar-se-á preferência aos(às) acadêmicos(as) que não tiveram nenhuma reprovação em disciplinas e que ficariam atrasados em relação à fase em que se encontram caso não sejam matriculados na disciplina solicitada.\nPosteriormente, deverá ser respeitada a ordem de matrícula estabelecida pelo § 2º deste artigo.\n§ 6º Em caso de empate entre dois(duas) ou mais discentes, o desempate obedecerá, pela ordem, o AQ maior, a NOTA maior e o APROV maior.\n§ 7º O(A) discente recém ingressante - calouro(a), transferido(a) ou retorno ao(à) portador(a) de diploma - está excluído(a) desta ordenação, por ter Escore igual a 0 (zero) e\nRes. 005/2014-CONSEPE, fl. 3 de 8', '§ 2° O Colegiado Pleno do Departamento promoverá as adaptações necessárias para o atendimento do disposto no art. 4º, podendo aceitar matrículas de discentes formandos ou pertencentes a matrizes em extinção em um número de créditos até 20% superior ao estipulado neste artigo.', '## Chunk 2\n```\nCAPÍTULO II\nDa Oferta de Disciplina em Caráter de Estudo Dirigido\nArt. 3º As disciplinas oferecidas por meio de Estudo Dirigido são aquelas constantes das matrizes curriculares mantidas pela UDESC, que já tenham sido extintas, ou estejam em fase de extinção.\n§ 1º As disciplinas a que se refere o caput deste artigo são aquelas que não apresentam equivalência com as apresentadas na nova matriz curricular.', 'Art. 7º Os(as) acadêmicos(as) que não optarem pela migração e que não se encontrarem na situação de migração obrigatória deverão concluir sua trajetória curricular dentro do prazo estabelecido na proposta de transição curricular, respeitado o prazo para conclusão estabelecido no\nPPC.\n\nArt. 8º Casos omissos serão resolvidos pelo Colegiado Pleno do Departamento, dando conhecimento à Secretaria de Ensino e à Direção de Ensino de Graduação.']","De acordo com o Art. 5º, as disciplinas cursadas no currículo em extinção e que não tenham equivalência na nova matriz curricular deverão permanecer no histórico escolar do(a) acadêmico(a).

Além disso, o Art. 3º do Capítulo II estabelece que as disciplinas oferecidas por meio de Estudo Dirigido são aquelas que já tenham sido extintas ou estejam em fase de extinção e, conforme o § 1º, são aquelas que não apresentam equivalência com as apresentadas na nova matriz curricular.","Essas disciplinas devem permanecer no histórico escolar do(a) acadêmico(a) e podem ser oferecidas conforme as normativas da universidade, se necessário.",1.0,0.9787554361570011,0.642857142825,1.0,0.523983604719867,"032-2014-cpe, 034-2009-cpe, 006-2025-ceg, 005-2014-cpe"
Quem pode solicitar a inclusão do nome social nos registros acadêmicos da UDESC?,"['Art. 1º Obedecido o disposto nesta Resolução, fica assegurada a inclusão do nome social de pessoas transgênero, travestis e transexuais no ato de inscrição no vestibular e nos respectivos registros acadêmicos de todos os campi da Fundação Universidade do Estado de Santa Catarina –\nUDESC.\nParágrafo único. O nome social é a forma nominal definida por pessoas transgênero, travestis e transexuais para serem identificadas, nominadas e referidas em seu meio social. (redação dada pela )', '## Chunk 1\n```\nArt. 1º Obedecido o disposto nesta Resolução, fica assegurada a inclusão do nome social de travestis e transexuais no ato de inscrição no vestibular e nos respectivos registros acadêmicos de todos os campi da Fundação Universidade do Estado de Santa Catarina – UDESC.\nParágrafo único. O nome social é a forma nominal definida por travestis e transexuais para serem identificados, nominados e referidos em seu meio social.', 'Art. 3º Uma vez feita à inclusão, o nome social deverá constar, juntamente com o nome civil, em todos os registros internos da UDESC.\n§ 1º Nos históricos escolares, certificados e diplomas constará apenas o nome civil.\n§ 1º Nos históricos escolares, certificados e diplomas constará em local de destaque, o nome social, precedido da correspondente expressão “NOME SOCIAL” e, logo abaixo (no campo de observações), a identificação civil. (redação dada pela ) § 2º Nas declarações, atestados e diários de classe constarão o nome social e o nome civil, sendo que a comprovação da presença às aulas deverá ser feita utilizando-se somente o nome social.', 'Art. 2º O(a) acadêmico(a) maior de 18 (dezoito) anos poderá, no ato da matrícula ou a qualquer tempo, requerer à Secretaria de Ensino de Graduação ou à Secretaria de Ensino de Pós-\nGraduação de seu Centro, conforme o seu curso, a inclusão do seu nome social nos respectivos registros acadêmicos.\nParágrafo único. Caso o(a) acadêmico(a) solicitante não tenha atingido a maioridade, a inclusão do seu nome social nos registros acadêmicos somente será feita mediante autorização, por escrito, dos pais ou responsáveis legais.', 'Art. 13 (...) § 8º O/A aluno/a regularmente matriculado/a no semestre em curso, poderá realizar a solicitação de trancamento de matrícula fora do período estabelecido no calendário até 15 dias antes do encerramento do período letivo, devendo o/a acadêmico/a enviar a solicitação devidamente justificada e comprovada através do Sistema Acadêmico, cabendo à Chefia do\nDepartamento a análise da solicitação.”\n\nArt. 4º Fica suprimido o § 9º do art. 13 da Resolução nº 05/2014 - CONSEPE, que “Dispõe sobre as normas e os procedimentos para a matrícula de acadêmicos nos cursos de graduação da UDESC.”.', 'Parágrafo Único. Para realizar a matrícula, o(a) acadêmico(a) terá que apresentar documentação que ateste a conclusão do curso. No caso de apresentar o certificado na matrícula, o diploma e histórico escolar deverá ser apresentado em até 60 (sessenta) dias ou até o final de seu primeiro semestre de ingresso.\nArt. 18. Para o(a) acadêmico(a) que ingressar em curso de graduação da UDESC pela modalidade de Retorno ao Portador de Diploma de graduação, o início do tempo para integralização curricular será contado a partir do ingresso no curso em que obteve a vaga.\n```', 'Art. 5º Nos sistemas de pagamento de bolsas, auxílios e editais a que o(a) acadêmico(a) com nome social incorporado aos registros acadêmicos venha a concorrer, será utilizado o nome civil, sendo que na divulgação da lista de contemplados poderá ser utilizado o nome social, desde que requerido pelo(a) acadêmico(a) e acompanhado do número do Cadastro de Pessoa Física - CPF.\n\nArt. 5º Nos sistemas de pagamento de bolsas, auxílios e editais a que o(a) acadêmico(a) com nome social incorporado aos registros acadêmicos venha a concorrer, serão utilizados tanto o nome social quanto o civil, sendo que na divulgação da lista de contemplados deverá ser utilizado apenas o nome social. (redação dada pela )', '## Chunk 1\n```\nArt. 1º Os §§ 3º e 4º do art. 3º da Resolução nº 05/2014 - CONSEPE, que “Dispõe sobre as normas e os procedimentos para a matrícula de acadêmicos nos cursos de graduação da UDESC.”, passam a vigorar com as seguintes redações: “\n\nArt. 3º (...) § 3º A desmatrícula em uma ou mais disciplinas pode ser requerida pelo/aacadêmico/a,obedecendo-se o prazo estabelecido no Calendário Acadêmico.\n§ 4º Excepcionalmente, a desmatrícula em uma ou mais disciplinas em curso será possível fora do período estabelecido no calendário acadêmico até 15 dias antes do encerramento do período letivo, devendo o/a acadêmico/a enviar a solicitação devidamente justificada e comprovada através do Sistema Acadêmico, cabendo à Chefia do Departamento a análise da solicitação.”']","De acordo com o Art. 2º, o(a) acadêmico(a) maior de 18 anos poderá requerer a inclusão do seu nome social nos respectivos registros acadêmicos. O parágrafo único do mesmo artigo estabelece que, caso o(a) acadêmico(a) não tenha atingido a maioridade, a inclusão do nome social somente será feita mediante autorização, por escrito, dos pais ou responsáveis legais. O Art. 1º assegura a inclusão do nome social a pessoas transgênero, travestis e transexuais.","Pessoas transgênero, travestis e transexuais podem requerer a inclusão do nome social, sendo que acadêmicos maiores de 18 anos podem solicitar a qualquer tempo, enquanto menores precisam de autorização por escrito dos pais ou responsáveis legais.",1.0,0.9268574142686976,0.7499999999625,1.0,0.9838968406389322,"070-2016-cni, 008-2022-ceg, 004-2023-ceg"
Quem está habilitado a participar da solenidade de Outorga de Grau?,"['Art. 5º Participará da solenidade de Outorga de Grau, apenas o aluno habilitado para esse fim, ou seja, que tenha concluído o currículo pleno do seu curso inclusive estágios e/ou trabalho de conclusão de curso (TCC), de acordo com aprovação do colegiado de curso, no âmbito de suas atribuições.\nP. único – Não participará da solenidade de Outorga de Grau, o aluno que tenha concluído uma nova Habilitação do Curso. (redação dada pela )\n\nArt. 6º. Compete à Direção do Centro propor as datas, autorizar e organizar a realização da\nOutorga de Grau.\n\nArt. 7º. Será de competência da Diretoria do Centro convocar as autoridades envolvidas na\nOutorga de Grau.', 'Art. 3º. O Magnífico Reitor poderá delegar a Presidência da Sessão de Outorga de Grau a outra autoridade, sempre observando a hierarquia administrativa e acadêmica.\n\nArt. 4º. A solenidade de Outorga de Grau será registrada em ata lavrada em livro próprio pela\nSecretaria Geral do Centro, devendo ser assinada por todos os formandos, sendo esta a condição imprescindível para receber o diploma.\n\nArt. 5º. Participará da solenidade de Outorga de Grau, apenas o aluno habilitado para esse fim, ou seja, que tenha concluído o currículo pleno do seu curso inclusive estágios e trabalho de conclusão de curso (TCC), de acordo com aprovação do colegiado de curso, no âmbito de suas atribuições.', '§ 7º O acadêmico que participar na solenidade de Outorga de Grau em Gabinete não participará da solenidade oficial do curso estabelecida no Calendário Acadêmico. (redação dada pela ) § 7º Ao acadêmico que participar na solenidade de Outorga de Grau em Gabinete fica facultada a participação da solenidade oficial, sendo vedada nesta cerimônia a Outorga de Grau.\n(redação dada pela )\nIII – DA SECRETARIA GERAL', 'Art. 15. Nas solenidades de Outorga de Grau deverão ser usadas vestes talares.\nVIII - DA SEQÜÊNCIA DA OUTORGA DE GRAU', 'Art. 8º Outorga de grau é obrigatória para a emissão e registro do diploma e deverá ser realizada de forma presencial.\n§ 1º - Na impossibilidade de comparecimento pessoal do formando na solenidade de Colação de Grau, mediante requerimento ao Diretor Geral do Centro, poderá ser permitida a Outorga de Grau a terceiro investido de mandato específico para tal fim, onde o instrumento de procuração deverá conter em seu texto o inteiro teor do juramento do respectivo curso.\n§ 2º - Quando o formando se encontrar impossibilitado de participar da solenidade de Outorga de Grau na data estabelecida, por motivo não previsto neste regulamento, poderá participar da solenidade oficial dos próximos períodos letivos do seu curso.\n§ 3º - Em nenhuma hipótese a Outorga de Grau é dispensada.”', 'Art. 13. Compete à Direção Geral do Centro ou à Comissão de Outorga de Grau os seguintes encargos:\nI - Definição de espaço para a Outorga de Grau;\nII - Organização da solenidade em conjunto com a Secretaria Geral do Centro;\nIII - Confecção de convites institucionais, incluindo número suficiente para a Direção\nGeral do Centro, envio aos professores e as autoridades competentes;\nIV - Ensaio Geral, sob orientação da Secretaria Geral do Centro, com os formandos e pessoas envolvidas nas solenidades.\nVI – DOS CONVITES DOS FORMANDOS', 'IX - direitos outorgados por lei;\nX – participação em programas conveniados (mobilidade acadêmica) em que o retorno não permita análise documental para a participação da cerimônia oficial; (incluído pela\nXI – representação institucional em eventos de caráter técnico-científico, esportivo, cultural, artístico, de ensino, pesquisa e extensão. (incluído pela ) § 5º A Colação de Grau em Gabinete será procedida pelo Diretor Geral, na presença de, pelo menos, dois membros do Conselho de Centro.\n§ 6º Para a solenidade de Outorga de Grau em Gabinete, ficam dispensados a execução dos hinos nacional e estadual, discursos e demais homenagens descritas neste regulamento, e o uso de vestes talares.', 'Art. 16. A seqüência da Outorga de Grau será:\nI - mestre de cerimônias dará início a solenidade de Outorga de grau;\nII - composição da mesa;\nIII - entrada dos formandos;\nIV - o Reitor ou o seu representante fará a abertura da sessão solene de outorga de grau e poderá delegar ao Diretor do Centro a presidência dos trabalhos;\nV - execução do Hino Nacional Brasileiro;\nVI - discurso proferido pelo Orador de Turma e requerimento de outorga de grau;\nVII - Juramento;\nVIII - outorga de grau com a entrega da certidão;\nIX - discursos, iniciando pelo Paraninfo e demais autoridades, de acordo com o protocolo;\nX - O Reitor profere sua mensagem e encerra a solenidade de Outorga de Grau;\nXI - inicio das Homenagens.\nParágrafo Único: Cada discurso não deverá exceder a 5 minutos.']","De acordo com o Art. 5º, participará da solenidade de Outorga de Grau apenas o aluno habilitado para esse fim, ou seja, que tenha concluído o currículo pleno do seu curso, inclusive estágios e/ou trabalho de conclusão de curso (TCC), de acordo com a aprovação do colegiado de curso.

O parágrafo único do mesmo artigo especifica que o aluno que tenha concluído uma nova Habilitação do Curso não participará da solenidade de Outorga de Grau.","Somente o aluno que concluiu o currículo completo do curso, incluindo estágios e/ou Trabalho de Conclusão de Curso (TCC), conforme aprovação do colegiado. Alunos que concluíram apenas uma nova habilitação do curso não participam da solenidade.",1.0,0.9623842488645913,0.99999999995,1.0,0.7352331136801238,"145-2005-cni, 055-2008-cni"
Quantas avaliações mínimas o professor deve aplicar por disciplina?,"['Art. 2º O professor deverá realizar, no mínimo, 2 (duas) avaliações em cada disciplina por semestre.', 'Art. 4º - A primeira etapa de revisão da nota de avaliação será realizada com a participação do(a) Coordenador(a) do Colegiado do respectivo Curso, do Professor da\nDisciplina e do aluno.\n\nArt. 5° - Não sendo possível realizar a primeira etapa até 5 (cinco) dias úteis após a entrada do requerimento na Secretaria Acadêmica, considerar-se-á a etapa concluída.', 'Art.7º - O máximo de faltas permitidas ao aluno por disciplina, em até 25% (vinte e cinco por cento), correspondente às horas-aula ministradas passa a ser, com a nova determinação, o seguinte: 1) para componente curricular de 1 crédito –18 horas-aula : até 4 faltas; 2) para componente curricular de 2 créditos - 36 horas-aula: até 9 faltas; 3) para componente curricular de 3 créditos –54 horas-aula: até 13 faltas; 4) para componente curricular de 4 créditos - 72 horas-aula; até 18 faltas; 5) para componente curricular de 5 créditos - 90 horas-aula; até 22 faltas; 6) para componente curricular de 6 créditos - 108 horas-aula; até 27 faltas; 7) para componente curricular de 8 créditos - 144 horas-aula; até 36 faltas; 8) para componente curricular de 16 créditos - 288 horas-aula: até 72 faltas', 'Art. 10. O número mínimo de acadêmicos necessários para a realização de cada turma/disciplina optativa é igual a 10 (dez).\n§ 1º Será permitida a abertura de turmas com menos de 10 (dez) acadêmicos se o número de acadêmicos matriculados na respectiva fase for menor que este.\n§ 2º Excepcionalmente, mediante justificativa consubstanciada e aprovada pela Pró-Reitoria de\nEnsino (PROEN), será permitida a realização de disciplina optativa com número inferior a dez acadêmicos.\n\nArt. 11. É permitido ao acadêmico regularmente matriculado cursar disciplinas em outros cursos de graduação, observada a disponibilidade de vagas.\nCapítulo IV\nDISPOSIÇÕES TRANSITÓRIAS', 'Art. 3º São possíveis de validação de disciplina, os seguintes estudos concluídos pelo(a) acadêmico(a):\nI – Disciplina cursada com aproveitamento em curso superior, proveniente de curso de graduação, de curso sequencial que conduz a diploma e de curso de pós-graduação (especialização, mestrado ou doutorado);\nII – Estágio Curricular Supervisionado e Trabalho de Conclusão de Curso.\nParágrafo Único. Compete ao Núcleo Docente Estruturante – NDE do departamento, junto com a Coordenação de Estágio, definir critérios para proceder a validação dos estudos previstos no inciso II.', 'III – o regime de oferecimento segue programação definida pelo professor e aprovada pelo\nCoordenador de Colegiado de Ensino.\nArt. 6º A disciplina em Estudo Dirigido será registrada no Histórico Escolar do aluno sem qualquer menção ao seu caráter excepcional.\nArt. 7º Aplicam-se às disciplinas ofertadas em forma de Estudo Dirigido, todas as exigências feitas às demais disciplinas, em termos de avaliação, notas, realização de avaliações em segunda chamada, conforme o definido no Regimento Geral da UDESC, sendo que a frequência deve estar estabelecida quando da elaboração da programação pelo docente.', 'Art. 147. A avaliação do aproveitamento é feita pelo professor e expressa numericamente em escala de 0 (zero) a 10 (dez), do seguinte modo:\nI - é considerado aprovado o aluno que obtiver média semestral igual ou superior a 7,0 (sete vírgula zero) e freqüência não inferior a 75% (setenta e cinco por cento);\nII - o aluno que não obtiver a média 7,0 (sete vírgula zero) estará, obrigatoriamente, em exame, cujo desempenho será composto por média semestral com peso 6 (seis) e o exame final com peso 4 (quatro), devendo atingir a média final de, no mínimo, 5,0 (cinco vírgula zero) e freqüência não inferior a 75% (setenta e cinco por cento);', 'Art. 3º A validação de disciplina será efetuada quando o programa da disciplina cursada na instituição de origem corresponder a, no mínimo, 75% do conteúdo e da carga horária da disciplina que o(a) acadêmico(a) deveria cumprir na UDESC.\nParágrafo Único. poderão ser utilizados conteúdos de várias disciplinas para o aproveitamento de estudos.']","O professor deverá realizar, no mínimo, 2 (duas) avaliações em cada disciplina por semestre.",No mínimo duas avaliações por semestre.,1.0,0.9567308617505247,0.9999999999,1.0,0.9857565349648305,"003-2013-cpe, 048-2001-cpe, 025-2006-cpe, 034-2013-cpe, 009-2021-ceg, 034-2009-cpe, avaliacao_academica_udesc_, 007-2021-ceg"
Quem pode solicitar a segunda chamada de uma avaliação?,"['## Chunk 1\n```\nArt. 1º - O acadêmico regularmente matriculado que deixar de comparecer a qualquer das avaliações nas datas fixadas pelo professor, poderá solicitar segunda chamada desta avaliação através de requerimento por ele assinado, ou por seu representante legal, entregue na Secretaria de Ensino de\nGraduação e/ou Secretaria do Departamento, no prazo de 5 (cinco) dias úteis, contados a partir da data de realização da avaliação, sendo aceitos pedidos, devidamente comprovados e que se enquadrem em um das seguintes situações:\nI - problema de saúde do aluno ou parente de 1º grau, devidamente comprovado, que justifique a ausência;\nII - ter sido vítima de ação involuntária provocada por terceiros, comprovada por Boletim de\nOcorrência ou documento equivalente;', 'Art. 2º - A Secretaria de Ensino de Graduação e/ou Secretaria do Departamento fará a análise da solicitação e emitirá parecer.\nFundação Universidade do Estado de Santa Catarina\nAv. Madre Benvenuta, 2007 – Itacorubi – 88.035-001\nFlorianópolis SC Fone (48) 3321 8000 – www.udesc.br §1°- Caso o requerimento seja deferido, a Secretaria de Ensino de Graduação e/ou Secretaria do\nDepartamento encaminhará expediente ao professor da disciplina, para informar do deferimento da solicitação e demais procedimentos.\n§ 2°- No caso de indeferimento, a Secretaria de Ensino de Graduação e/ou Secretaria do\nDepartamento dará ciência ao requerente.\n\nArt. 3°- Nas avaliações de segunda chamada serão exigidos somente os conteúdos referentes à avaliação em questão.', 'Art. 4º - A primeira etapa de revisão da nota de avaliação será realizada com a participação do(a) Coordenador(a) do Colegiado do respectivo Curso, do Professor da\nDisciplina e do aluno.\n\nArt. 5° - Não sendo possível realizar a primeira etapa até 5 (cinco) dias úteis após a entrada do requerimento na Secretaria Acadêmica, considerar-se-á a etapa concluída.', 'Art. 2º Poderá solicitar aceleração de estudos o acadêmico que atender, simultaneamente, aos seguintes requisitos:\nI. não possua reprovação, de qualquer tipo, registrada em seu histórico escolar;\nII. tenha obtido aprovação com média igual ou superior a 9,0 (nove vírgula zero) em todas as disciplinas cursadas;\nIII. caso possua validação de disciplinas registradas em seu histórico escolar, essas não devem ultrapassar o percentual de 10% (dez) do número de disciplinas cursadas;\nIV. tenha cursado integralmente as duas primeiras fases do curso;\nV. tenha cumprido o pré-requisito da disciplina solicitada, quando houver, ou solicitar “extraordinário aproveitamento” do pré-requisito concomitantemente com a disciplina que pleiteia o aproveitamento.', 'III - a média semestral, de peso 6 (seis), representa o aproveitamento do aluno na disciplina e é obtida através da média oriunda das notas atribuídas a testes, trabalhos e/ou relatórios distribuídos ao longo do período letivo;\nIV - o exame final será resultante de prova escrita e/ou oral e/ou prática, de projeto e sua defesa, ou trabalho equivalente, cobrindo toda a matéria lecionada durante o período letivo.\nArt. 148. O aluno que não comparecer a uma das provas regulares previstas no plano de ensino da disciplina poderá solicitar uma prova de segunda chamada, segundo normas estabelecidas pelo CONSEPE.\n```', '§ 2º - O não comparecimento a Exame de Suficiência a que o aluno se inscreveu, se por motivos e situações previstas em Lei, não é considerado efetiva realização do Exame, para efeitos do que dispõe o inciso III deste artigo.\n§ 3º - O aluno que se inscreveu e não compareceu por motivos e situações previstas em Lei, poderá requerer a 2ª inscrição no semestre subseqüente, na Secretaria Acadêmica do\nCentro.\n§ 4º - Perde o direito de requerer a 2ª inscrição para a mesma disciplina o aluno que faltar sem justificativa.\n§ 5º - A inscrição do aluno para Exame de Suficiência será analisada pela Secretaria\nAcadêmica, para deferimento, se atendidas as condições expressas neste artigo.\n§ 6º - Se a inscrição for deferida a Secretaria Acadêmica encaminhará a solicitação ao\nCoordenador de Curso.', 'Art. 4°- Quando o acadêmico estiver impedido de fazer a solicitação de segunda chamada no prazo estipulado, ele terá o direito de requere-la até 5 (cinco) dias após o término do impedimento.\n\nArt. 5° - Os casos omissos serão resolvidos pelo Chefe do Departamento.\n\nArt. 6º - Esta Resolução entra em vigor nesta data.\n\nArt. 7º - Fica revogada a Resolução nº 018/2004 - CONSEPE.\nFlorianópolis, 03 de novembro de 2015\nProfessor Luciano Emílio Hack\nPresidente do CONSEPE\nFundação Universidade do Estado de Santa Catarina\nAv. Madre Benvenuta, 2007 – Itacorubi – 88.035-001\nFlorianópolis SC Fone (48) 3321 8000 – www.udesc.br\n```', '## Chunk 3\n```\nSEÇÃO II\nDA AVALIAÇÃO DO RENDIMENTO ACADÊMICO (...)\nUniversidade do Estado de Santa Catarina - UDESC\nAv. Madre Benvenuta, 2007 – Itacorubi – 88.035-001\nFlorianópolis SC Fone (48) 3321 8000 –\n```']",O acadêmico regularmente matriculado ou seu representante legal.,"O acadêmico regularmente matriculado que deixou de comparecer à avaliação nas datas fixadas pelo professor, mediante requerimento assinado e entregue na Secretaria de Ensino de Graduação ou Secretaria do Departamento.",1.0,0.8726504677118413,0.699999999965,1.0,0.44176103522560917,"039-2015-cpe, 048-2001-cpe, 020-2015-cpe, avaliacao_academica_udesc_, 032-2004-cpe"
Como funciona o abono de faltas por crença religiosa?,"['## Chunk 6\n```\nCAPÍTULO V\nDa Crença Religiosa\nArt. 5º O acadêmico que por força de crença religiosa deixar de comparecer às aulas ministradas às sextas-feiras após às 18 horas até o pôr do sol de sábado, terá no registro de frequência a condição de “dispensa”, devendo realizar atividades que supram as faltas abonadas.\nParágrafo Único. Cabe ao acadêmico a comprovação de pertencer a congregação religiosa que tenha tais exigências, com firma reconhecida e atestado de que é membro.\nFundação Universidade do Estado de Santa Catarina\nAv. Madre Benvenuta, 2007 – Itacorubi – 88.035-001\nFlorianópolis SC Fone (48) 3321 8000 – www.udesc.br\n```', 'até 36 faltas; 8) para componente curricular de 16 créditos - 288 horas-aula: até 72 faltas e assim, sucessivamente.', 'Art. 87 da Lei Complementar nº 170, de 07 de 1998.\nA Lei de Serviços Militares n.º 4375, de 17 de agosto de 1964, em seu artigo 60, parágrafo 4º.\nA Lei n.º 10.861 de 14 de abril de 2004 institui o Sistema Nacional de Avaliação da\nEducação Superior - SINAES, parágrafo 5º do artigo 7º: “As instituições de educação superior deverão abonar as faltas do estudante que, em decorrência da designação de que trata o inciso IV do caput deste artigo, tenha participado de reuniões da CONAES em horário coincidente com as atividades acadêmicas”.\nA Lei 11.225 de 20 de novembro de 1999 que estabelece atendimento diferenciado ao acadêmico por crença religiosa.\nR E S O L V E:\n```', '## Chunk 3\n```\nCAPÍTULO II\nDo Exercício Militar\nArt. 2º Considerando o disposto na Lei n° 715, de 1969 e o Decreto n° 85.587, de 1980, serão abonadas as faltas daqueles discentes Reservistas, Oficiais ou Aspirantes-a-Oficial da\nReserva convocados para exercícios militares, manobras ou cerimônias cívicas.\n§1º Por força de lei, não se aplica o caput deste artigo aos militares de carreira.\n§2º Cabe ao acadêmico a comprovação do período de convocação e a participação, mediante declaração formalizada pela entidade militar.\n```', '## Chunk 1\n```\nArt. 1º - O acadêmico regularmente matriculado que deixar de comparecer a qualquer das avaliações nas datas fixadas pelo professor, poderá solicitar segunda chamada desta avaliação através de requerimento por ele assinado, ou por seu representante legal, entregue na Secretaria de Ensino de\nGraduação e/ou Secretaria do Departamento, no prazo de 5 (cinco) dias úteis, contados a partir da data de realização da avaliação, sendo aceitos pedidos, devidamente comprovados e que se enquadrem em um das seguintes situações:\nI - problema de saúde do aluno ou parente de 1º grau, devidamente comprovado, que justifique a ausência;\nII - ter sido vítima de ação involuntária provocada por terceiros, comprovada por Boletim de\nOcorrência ou documento equivalente;', '## Chunk 2\n```\nCAPÍTULO II\nDo Direito ao Regime Especial de Atendimento Domiciliar\nArt. 8º São considerados aptos para solicitar o direito ao regime especial de atendimento domiciliar:\nI – estudante que esteja em: a) licença maternidade mediante documento comprobatório; b) situações excepcionais mediante atestado médico;\nII – acadêmico portador de afecções adquiridas, infecções, traumatismos, tratamentos quimioterápicos/radioterápicos ou outras condições, caracterizadas por: a) incapacidade física relativa, incompatível com a frequência às atividades acadêmicas comprovada mediante atestado médico; b) ocorrência isolada ou esporádica, comprovada por atestado médico ou declaração expedida por profissional de saúde habilitado.', '§ 2º - O não comparecimento a Exame de Suficiência a que o aluno se inscreveu, se por motivos e situações previstas em Lei, não é considerado efetiva realização do Exame, para efeitos do que dispõe o inciso III deste artigo.\n§ 3º - O aluno que se inscreveu e não compareceu por motivos e situações previstas em Lei, poderá requerer a 2ª inscrição no semestre subseqüente, na Secretaria Acadêmica do\nCentro.\n§ 4º - Perde o direito de requerer a 2ª inscrição para a mesma disciplina o aluno que faltar sem justificativa.\n§ 5º - A inscrição do aluno para Exame de Suficiência será analisada pela Secretaria\nAcadêmica, para deferimento, se atendidas as condições expressas neste artigo.\n§ 6º - Se a inscrição for deferida a Secretaria Acadêmica encaminhará a solicitação ao\nCoordenador de Curso.', 'I – problemas na saúde do interessado, com apresentação de Atestado/Declaração de profissional (médico), constando o CID;\nII - doença de caráter infecto-contagiosa, com apresentação de Atestado/Declaração de profissional (médico), constando o CID;\nIII - ter sido vítima de ação involuntária provocada por terceiros;\nIV – Convocado para manobras ou exercícios militares;\nV - luto por parentes em linha reta (pais, avós, filhos e netos), colaterais (irmãos e tios), cônjuge ou companheiro(a), mediante respectivo atestado de óbito;\nVI – convocação para depoimento judicial ou policial, em data e horário coincidente com a solenidade oficial de Outorga de Grau do curso;']","De acordo com o Art. 5º, o acadêmico que, por crença religiosa, não comparecer às aulas das 18h de sexta-feira até o pôr do sol de sábado, terá sua frequência registrada como ""dispensa"". No entanto, ele deverá realizar atividades para suprir as faltas abonadas. O Parágrafo Único estabelece que o acadêmico precisa comprovar que pertence a uma congregação religiosa com tais exigências, por meio de um atestado de membro com firma reconhecida.","Acadêmicos que, por força de crença religiosa, deixarem de comparecer às aulas sextas-feiras após 18h até o pôr do sol de sábado, têm essas faltas registradas como dispensa. O acadêmico deve comprovar a participação na congregação através de atestados com firma reconhecida. Essas faltas não contam para o cálculo de",1.0,0.8771283661340084,0.8333333332916666,0.6666666666666666,0.44676011443668734,"045-2015-cpe, 025-2006-cpe, 039-2015-cpe, 002-2019-cpe, 032-2004-cpe, 055-2008-cni"
Quais normas a UDESC adota nos processos de revalidação e reconhecimento de diplomas estrangeiros?,"['## Chunk 1\n```\nArt. 1º A Fundação Universidade do Estado de Santa Catarina – UDESC nos processos de revalidação de diplomas de graduação e nos de reconhecimento de diplomas de pós- graduação stricto sensu (mestrado e doutorado) expedidos por estabelecimentos estrangeiros de ensino superior, adotará as normas da Resolução nº 3, de 22 de junho de 2016, da Câmara de Educação Superior do Conselho Nacional de Educação/MEC, e da Portaria Normativa nº 22, de 13 de dezembro de 2016 do Ministro de Estado da Educação.', 'Art. 4º A Pró-Reitoria de Ensino - PROEN e a Pró-Reitoria de Pesquisa e Pós-\nGraduação – PROPPG, através de instruções normativas próprias, estabelecerão os procedimentos internos da UDESC para revalidação de diplomas de graduação e para o reconhecimento de diplomas de pós-graduação stricto-sensu (mestrado e doutorado) expedidos por estabelecimentos estrangeiros de ensino superior, em conformidade com o art. 32 (Seção II) da Portaria Normativa nº 22, de 13 de dezembro de 2016, do MEC, que estabelece: “Caberá às instituições reconhecedoras, por meio de mecanismos próprios, tornar disponíveis informações relevantes à instrução dos processos de reconhecimento de diplomas.”.', 'Art. 2º A Fundação Universidade do Estado de Santa Catarina – UDESC, através da Pró-\nReitoria de Ensino - PROEN e da Pró-Reitoria de Pesquisa e Pós-Graduação – PROPPG, adotará a Plataforma Carolina Bori nos seus processos de revalidação e de reconhecimento de diplomas expedidos por estabelecimentos estrangeiros de ensino superior.\nParágrafo Único: A Fundação Universidade do Estado de Santa Catarina – UDESC aceitará processos para revalidação de diplomas de graduação e para reconhecimento de diplomas de pós-graduação stricto sensu (mestrado e doutorado), expedidos por estabelecimentos estrangeiros de ensino superior, a partir da disponibilização na Plataforma\nCarolina Bori da totalidade dos documentos necessários para o cumprimento das normas da', 'UDESC ou nova formação (bacharelado ou licenciatura); 1.4. Transferência Interna para o mesmo curso com mudança de Centro de Ensino; 1.5. Transferência Interna com mudança de curso de uma mesma área de conhecimento ou áreas afins, de acordo com o Edital de vagas; 1.6. Reingresso após Abandono ou Cancelamento com Mudança de Turno, para curso de uma mesma área de conhecimento ou áreas afins, de acordo com o Edital de vagas; 1.7. Reingresso após Abandono ou Cancelamento com Mudança de uma habilitação para outra no mesmo curso da UDESC ou nova formação (bacharelado ou licenciatura); 1.8. Reingresso após Abandono ou Cancelamento para o mesmo curso com mudança de Centro de Ensino; 1.9. Reingresso após Abandono ou Cancelamento para Mudança de curso, para curso de uma mesma área de conhecimento', 'Art. 3° - Poderão ser aceitas matrículas em no máximo 2 (duas) disciplinas isoladas por semestre, para cada solicitante.\nParágrafo único. Serão consideradas exceções outras situações que não estão incluídas nas rotinas acadêmicas como: matrículas em disciplinas orientadas; matrículas em disciplinas para alunos estrangeiros e, matrículas em disciplinas para alunos estrangeiros que necessitam validar o Diploma.\n\nArt. 4° - A partir das inscrições, caberá ao Colegiado de Ensino definir:\nI - disciplinas possíveis de serem cursadas pelo candidato;\nII - pré-requisitos;\nIII - número de vagas disponíveis;\nIV - procedimentos de matrícula;\nV - direitos e deveres, respeitados o Estatuto e Regimento Geral da UDESC e os termos da presente Resolução.', 'Art. 6º A validação de disciplina de que trata esta Resolução visa exclusivamente à integralização do currículo do curso de graduação da UDESC.\nI - Ao invés da nota/conceito obtida será registrado o termo “validada” e em campo específico as informações da disciplina e a nota obtida na IES de origem;\nII - Para efeitos de ranqueamento, média e outros cálculos, a disciplina que foi validada será desconsiderada.\nParágrafo Único. O estudo realizado que não apresentar equivalência com o currículo do curso do (a) acadêmico (a) não será registrado no Histórico Escolar.\n\nArt. 7º Os casos omissos serão resolvidos pela Pró-Reitoria de Ensino.', '## Chunk 1\n```\nArt. 1º Os §§ 3º e 4º do art. 3º da Resolução nº 05/2014 - CONSEPE, que “Dispõe sobre as normas e os procedimentos para a matrícula de acadêmicos nos cursos de graduação da UDESC.”, passam a vigorar com as seguintes redações: “\n\nArt. 3º (...) § 3º A desmatrícula em uma ou mais disciplinas pode ser requerida pelo/aacadêmico/a,obedecendo-se o prazo estabelecido no Calendário Acadêmico.\n§ 4º Excepcionalmente, a desmatrícula em uma ou mais disciplinas em curso será possível fora do período estabelecido no calendário acadêmico até 15 dias antes do encerramento do período letivo, devendo o/a acadêmico/a enviar a solicitação devidamente justificada e comprovada através do Sistema Acadêmico, cabendo à Chefia do Departamento a análise da solicitação.”', '## Chunk 1\n```\nArt. 1º O(a) acadêmico(a) matriculado(a) em curso de graduação da UDESC poderá obter a validação de disciplina do currículo de seu curso, desde que atenda aos requisitos estabelecidos nesta resolução.\n\nArt. 2º São possíveis de validação de disciplina, os seguintes estudos concluídos pelo(a) acadêmico(a):\nI – disciplina cursada com aproveitamento em curso superior, proveniente de curso de graduação, de curso sequencial que conduz a diploma e de curso de pós-graduação (especialização, mestrado ou doutorado);\nII – Estágio Curricular Supervisionado e Trabalho de Conclusão de Curso.\nParágrafo único: compete ao Núcleo Docente Estruturante – NDE do departamento, junto com a Coordenação de Estágio, definir critérios para proceder a validação dos estudos previstos no inciso II.']","A UDESC adota as normas da Resolução nº 3, de 22 de junho de 2016, da Câmara de Educação Superior do Conselho Nacional de Educação/MEC, e da Portaria Normativa nº 22, de 13 de dezembro de 2016 do Ministro de Estado da Educação.","A UDESC adota a Resolução nº 3, de 22 de junho de 2016, da Câmara de Educação Superior do CNE/MEC, e a Portaria Normativa nº 22, de 13 de dezembro de 2016, do Ministro de Estado da Educação.",1.0,0.9237298959723973,0.99999999995,1.0,0.9978158028836079,"014-2017-cpe, 004-2023-ceg, 005-2009-cpe, 009-2021-ceg, 008-2022-ceg, 007-2021-ceg"
Qual é o prazo para solicitar a revisão de nota após a divulgação do resultado da avaliação?,"['Art. 4º - A primeira etapa de revisão da nota de avaliação será realizada com a participação do(a) Coordenador(a) do Colegiado do respectivo Curso, do Professor da\nDisciplina e do aluno.\n\nArt. 5° - Não sendo possível realizar a primeira etapa até 5 (cinco) dias úteis após a entrada do requerimento na Secretaria Acadêmica, considerar-se-á a etapa concluída.', 'Art. 3° Os resultados das avaliações deverão ser comunicados, pelo professor, diretamente aos acadêmicos e publicados no Sistema de Gestão Acadêmica, a fim de que os mesmos, tomando ciência dos resultados alcançados, possam recuperar conteúdos.\n§ 1º O prazo previsto para a divulgação dos resultados de cada avaliação é de, no máximo 10 (dez) dias úteis, a contar da data de sua realização.\n§ 2º O prazo de 10 (dez) dias poderá ser reduzido para atender aos prazos dispostos no Calendário\nAcadêmico quanto a inclusão das notas das avaliações e exames finais.\n§ 3º Havendo discordância da nota obtida na avaliação, o acadêmico terá direito de solicitar revisão de prova, nos termos das resoluções vigentes na UDESC.', '## Chunk 1\n```\nArt. 1º - Aos alunos da Fundação Universidade do Estado de Santa Catarina é reservado o direito à solicitação de revisão de nota de avaliações realizadas como instrumentos para verificação de aprendizagem.\n\nArt. 2º - A solicitação de revisão de nota de avaliação deverá dar entrada na Secretaria\nAcadêmica do Centro até 10 (dez) dias após a data de publicação do seu resultado.\n\nArt. 3º - A Secretaria Acadêmica deverá encaminhar a solicitação para a Coordenação do Colegiado do Curso correspondente, a qual estabelecerá data e horário para a revisão da nota, comunicando ao Professor da Disciplina e ao aluno requerente.', 'Art. 6° - Concluída a primeira etapa de revisão da nota, conforme estabelecido no\nArtigo 4°, o encaminhamento está condicionado a uma das seguintes situações:\nI – O aluno concorda com a nota atribuída pelo Professor, encerrando o processo, devendo o Coordenador do Colegiado de Curso efetivar a respectiva comunicação à\nSecretaria;\nII – O aluno não concorda com a nota atribuída pelo Professor, dando prosseguimento ao processo através da segunda etapa de revisão de nota de avaliação.', 'Art. 6º A Secretaria de Ensino de Graduação ou, quando pertinente, a Chefia de\nDepartamento emitirão parecer quanto:\nI - ao mérito acadêmico para o aluno e para o curso;\nII - ao item desta regulamentação em que se enquadra o pedido;\nIII - ao tempo de duração da atividade;\nIV - ao número de créditos ou carga horária concedidos.\n§ 1º A Secretaria de Ensino de Graduação ou a Chefia de Departamento devem apresentar parecer conclusivo sobre a solicitação, no máximo 30 dias após a entrada do documento e até 10 dias antes do término do semestre letivo.\nRes. 026/2012-CONSEPE, fl. 2 de 13 § 2º A Chefia de Departamento, após emissão do parecer, devolverá o processo à\nSecretaria de Ensino de Graduação para registro e publicação.', '## Chunk 1\n```\nArt. 1º - O acadêmico regularmente matriculado que deixar de comparecer a qualquer das avaliações nas datas fixadas pelo professor, poderá solicitar segunda chamada desta avaliação através de requerimento por ele assinado, ou por seu representante legal, entregue na Secretaria de Ensino de\nGraduação e/ou Secretaria do Departamento, no prazo de 5 (cinco) dias úteis, contados a partir da data de realização da avaliação, sendo aceitos pedidos, devidamente comprovados e que se enquadrem em um das seguintes situações:\nI - problema de saúde do aluno ou parente de 1º grau, devidamente comprovado, que justifique a ausência;\nII - ter sido vítima de ação involuntária provocada por terceiros, comprovada por Boletim de\nOcorrência ou documento equivalente;', 'Art. 7° - Nos casos previsto no Artigo 5º e no inciso II do Artigo 6°, o Coordenador do\nColegiado de Curso deve, no prazo de 2 (dois) dias úteis, designar uma Comissão Avaliadora composta por 3 (três) professores, sendo um deles na condição de Presidente, para analisar a avaliação efetuada e emitir parecer no prazo de 2 (dois) dias úteis.\nParágrafo único: Até a reunião da Banca Avaliadora, o requerente poderá:\nI - De posse de cópia da avaliação, formular sua pretensão, explicitando em qual(is) questão(ões) deseja revisão de nota e apresentando justificativa detalhada, por questão.\nII – Anexar ao processo documentos e material bibliográfico que fundamente sua pretensão.', 'Art. 5º A avaliação será realizada em dia, hora e local divulgados com antecedência mínima de 7 (sete) dias, e a nota será a média aritmética das notas atribuídas pelos 3 (três) componentes da Banca Examinadora.\n§ 1º A avaliação abrangerá todo o conteúdo programático do componente curricular a ser avaliado, conforme previsto no Projeto Pedagógico do curso e estabelecido no plano de ensino da disciplina.\n§ 2º A ata da prova deverá informar a disciplina objeto da prova, os procedimentos adotados na avaliação do extraordinário aproveitamento de estudos, o nome do candidato submetido à avaliação, a nota atribuída por cada um dos membros da Banca Examinadora e a média aritmética conforme o caput deste artigo.']","De acordo com o Art. 2º, a solicitação de revisão de nota de avaliação deverá ser feita na Secretaria Acadêmica do Centro em até 10 (dez) dias após a data de publicação do seu resultado.",O aluno deve apresentar a solicitação à Secretaria Acadêmica do Centro em até 10 dias após a publicação do resultado da avaliação.,1.0,0.9611506620574283,0.3333333333,1.0,0.8378745883881765,"048-2001-cpe, 003-2013-cpe, 026-2012-cpe, 039-2015-cpe, 020-2015-cpe"
Quantos alunos são necessários para a abertura de uma turma de disciplina optativa?,"['Art. 10. O número mínimo de acadêmicos necessários para a realização de cada turma/disciplina optativa é igual a 10 (dez).\n§ 1º Será permitida a abertura de turmas com menos de 10 (dez) acadêmicos se o número de acadêmicos matriculados na respectiva fase for menor que este.\n§ 2º Excepcionalmente, mediante justificativa consubstanciada e aprovada pela Pró-Reitoria de\nEnsino (PROEN), será permitida a realização de disciplina optativa com número inferior a dez acadêmicos.\n\nArt. 11. É permitido ao acadêmico regularmente matriculado cursar disciplinas em outros cursos de graduação, observada a disponibilidade de vagas.\nCapítulo IV\nDISPOSIÇÕES TRANSITÓRIAS', 'Art. 5º Os acadêmicos poderão matricular-se em disciplinas optativas desde que tenham sido atendidas as exigências de pré-requisitos e compatibilidade de horário.\nParágrafo único. Uma disciplina optativa não poderá ser pré-requisito de disciplina optativa/obrigatória.\n\nArt. 6º No Projeto Pedagógico de Curso – PPC, o somatório de créditos em disciplinas optativas e/ou eletivas exigidas para que o acadêmico integralize o seu curso não poderá ultrapassar o máximo de 20% da carga horária mínima exigida pelo MEC para o curso.\nParágrafo único. Da carga horária em disciplinas obrigatórias deverá ser deduzida a carga horária definida para estágio e TCC.', 'Art. 3º A disciplina optativa é aquela que complementa a formação acadêmica, devendo ser escolhida pelo acadêmico dentre um rol de disciplinas oferecidas na matriz curricular, em quantidade necessária a perfazer um número mínimo de créditos.\n§ 1º A carga horária a ser cumprida em disciplina optativa, deverá ser estabelecida na(s) fase(s) da matriz curricular do curso.\nUniversidade do Estado de Santa Catarina\nREITORIA UDESC\nAv. Madre Benvenuta, 2007 – Itacorubi – 88.035-001\nFlorianópolis SC Fone (48) 3231 1503 – www.udesc.br § 2º A oferta da disciplina optativa poderá ocorrer ao longo da matriz curricular, observando-se que o seu oferecimento após a metade do curso permitirá um maior aproveitamento em termos de complementação de estudos.', 'Art. 4º A disciplina eletiva é aquela que suplementa a formação acadêmica, podendo ser cursada pelos interessados, dentre aquelas oferecidas em outro curso de Graduação da UDESC ou outra IES reconhecida pelo órgão competente.\n§1º O acadêmico é obrigado a cumprir o número de créditos em disciplinas eletivas estabelecido no\nPPC.\n§2º A disciplina eletiva é de livre escolha do acadêmico para fins de enriquecimento cultural, de aprofundamento e/ou atualização de conhecimentos específicos que complementem a formação acadêmica.\n§3º A disciplina eletiva não é parte integrante da matriz curricular, mas é integrante do currículo do curso.\nCapítulo III\nDAS DISCIPLINAS OPTATIVAS E ELETIVAS', 'Art. 12. Os ajustes necessários nos atuais projetos pedagógicos dos cursos deverão ser feitos no prazo de 4 (quatro) anos, a contar da data de publicação desta Resolução.\n\nArt. 13. As regras para o oferecimento de disciplinas denominadas eletivas nos PPCs atuais, seguem as mesmas definidas para as disciplinas optativas nesta Resolução.\n\nArt. 14. Os casos omissos serão deliberados pelo Conselho de Ensino, Pesquisa e Extensão –\nCONSEPE.\n\nArt. 15. Esta Resolução entra em vigor nesta data.', '## Chunk 1\n```\nArt. 1º Os projetos pedagógicos dos cursos de graduação além de apresentarem disciplinas obrigatórias, poderão oferecer, para fins de enriquecimento na formação acadêmica, disciplinas optativas ou eletivas.\nCapítulo II\nDAS DEFINIÇÕES', 'Art. 7º O total de créditos de disciplinas optativas relacionadas no PPC deve ser igual ou inferior a 50% do número total de créditos em disciplinas obrigatórias do curso.\n§ 1º Da carga horária em disciplinas obrigatórias deverá ser deduzida a carga horária definida para estágio e TCC.\n§ 2º Excepcionalmente, mediante justificativa consubstanciada e aprovada previamente pela Pró-\nReitoria de Ensino (PROEN), será permitido relacionar um número maior de disciplinas optativas, desde que não envolva demanda de recurso financeiro para a Universidade.', 'Art. 4º A disciplina em caráter de Estudo Dirigido é oferecida a partir da demanda dos alunos, com vistas à integralização da matriz curricular do curso, respeitados prazos determinados pela legislação vigente para tal oferta, assegurando os direitos e deveres da Instituição e dos alunos.\nParágrafo único. A oferta será cabível mediante a demanda contabilizada em no máximo 9 (nove) alunos.\nArt. 5º São condições necessárias à disciplina oferecida em Estudo Dirigido:']","O número mínimo de acadêmicos necessários para a realização de cada turma/disciplina optativa é igual a 10 (dez). No entanto, será permitida a abertura de turmas com menos de 10 acadêmicos se o número de acadêmicos matriculados na respectiva fase for menor que este. Excepcionalmente, também será permitida a realização de disciplina optativa com número inferior a dez acadêmicos, mediante justificativa consubstanciada e aprovada pela Pró-Reitoria de Ensino (PROEN).",O número mínimo de acadêmicos necessários para a realização de cada turma/disciplina optativa é igual a 10 (dez).,1.0,0.9423929098183067,0.9999999999,1.0,0.4750984782501392,"034-2013-cpe, 034-2009-cpe"
Quais são as modalidades de ingresso para ocupação de vagas ociosas nos cursos de graduação da UDESC?,"['## Chunk 1\n```\nCAPÍTULO I\nDAS VAGAS OCIOSAS NOS CURSOS DE GRADUAÇÃO\nArt. 1º A ocupação das vagas ociosas nos cursos de graduação da UDESC dar-se-á em conformidade com o estabelecido nesta Resolução, por meio das modalidades de ingresso: Transferência\nInterna, Transferência Externa, Reingresso após Abandono, Reingresso após Cancelamento de Matrícula pelo(a) estudante e Retorno ao Portador de Diploma de Graduação.\nParágrafo Único. As vagas ociosas são aquelas que não foram preenchidas na matrícula pelos(as) acadêmicos(as) dos cursos de graduação da UDESC.\nArt. 2º As vagas ociosas serão disponibilizadas em etapa única, conforme a ordem a seguir:\nI. reingresso após abandono ou cancelamento de matrícula pelo(a) estudante;\nII. transferência interna;\nIII. transferência externa;', '## Chunk 6\n```\nCAPÍTULO VI\nDOS REQUISITOS GERAIS PARA CONCESSÃO DE VAGA\nArt. 19. Para ingresso nos cursos de graduação da UDESC através das modalidades previstas nesta\nResolução, são necessários:\nI. existir vaga no curso, conforme divulgado no Edital de vagas;\nII. ingressar com a solicitação no período definido pelo Edital de vagas, apresentando a documentação necessária;\nIII. ser classificado em processo seletivo próprio.\n```', 'Parágrafo Único. Para o acadêmico que retornar ao curso de graduação na UDESC pela modalidade de reingresso após abandono ou cancelamento de matrícula pelo(a) estudante, o início do tempo para integralização curricular será contado a partir do ingresso no curso em que obteve a vaga.\n```', 'UDESC ou nova formação (bacharelado ou licenciatura); 1.4. Transferência Interna para o mesmo curso com mudança de Centro de Ensino; 1.5. Transferência Interna com mudança de curso de uma mesma área de conhecimento ou áreas afins, de acordo com o Edital de vagas; 1.6. Reingresso após Abandono ou Cancelamento com Mudança de Turno, para curso de uma mesma área de conhecimento ou áreas afins, de acordo com o Edital de vagas; 1.7. Reingresso após Abandono ou Cancelamento com Mudança de uma habilitação para outra no mesmo curso da UDESC ou nova formação (bacharelado ou licenciatura); 1.8. Reingresso após Abandono ou Cancelamento para o mesmo curso com mudança de Centro de Ensino; 1.9. Reingresso após Abandono ou Cancelamento para Mudança de curso, para curso de uma mesma área de conhecimento', '§ 3º O tempo relativo ao trancamento de matrícula não será computado para efeito de integralização curricular dentro do prazo máximo fixado para o curso respectivo.\n§ 4º O trancamento de matrícula só será permitido após a conclusão pelo(a) acadêmico(a) do primeiro semestre de ingresso no curso.\n§ 5º O trancamento de matrícula não será permitido por mais de 4 (quatro) semestres, consecutivos ou não, devendo o(a) acadêmico(a) solicitá-lo a cada semestre.\n§ 6º Para solicitar o trancamento de sua matrícula, o(a) acadêmico(a) deverá estar com vínculo com a UDESC.\n§ 7º Não será permitido o trancamento para cursos oferecidos por meio de projetos externos e/ou convênios.', 'Parágrafo Único. Para realizar a matrícula, o(a) acadêmico(a) terá que apresentar documentação que ateste a conclusão do curso. No caso de apresentar o certificado na matrícula, o diploma e histórico escolar deverá ser apresentado em até 60 (sessenta) dias ou até o final de seu primeiro semestre de ingresso.\nArt. 18. Para o(a) acadêmico(a) que ingressar em curso de graduação da UDESC pela modalidade de Retorno ao Portador de Diploma de graduação, o início do tempo para integralização curricular será contado a partir do ingresso no curso em que obteve a vaga.\n```', '## Chunk 1\n```\nArt. 1° - É vedada ao aluno a matrícula e a freqüência simultânea em dois ou mais cursos de graduação da Fundação Universidade do Estado de Santa Catarina - UDESC.\n\nArt. 2° - O aluno que ingressar na UDESC a partir do primeiro semestre de 2002, seja por Concurso\nVestibular ou através de modalidade extra-Vestibular, e que já estiver matriculado em curso(s) de graduação da UDESC, deverá, no ato de matrícula, optar por apenas um dos cursos, declarando, expressa e formalmente, sua renúncia à vaga no(s) curso(s) não optado(s).\nParágrafo único: O disposto no ""caput"" não se aplica aos alunos que ingressaram nos cursos antes da edição desta Resolução.', '## Chunk 10\n```\nCAPÍTULO X\nDA MATRÍCULA DOS APROVADOS\nArt. 28. O(A) candidato(a) classificado(a) numa das modalidades de ingresso previstas nesta\nResolução, deverá efetuar a sua matrícula junto à Secretaria de Ensino de Graduação do Centro no período estabelecido pelo Calendário Acadêmico da UDESC, divulgado no respectivo Edital de vagas.\n§ 1º A matrícula será feita pelo(a) próprio(a) candidato (a) ou por procurador(a) legalmente instituído(a) para esse ato.\n§ 2º O(A) candidato(a) deverá apresentar todos os documentos necessários à matrícula de acordo com a modalidade de ingresso.\n§ 3º Compete à Secretaria de Ensino de Graduação garantir a ordem da matrícula respeitando a classificação do(a) candidato(a).']","As modalidades de ingresso para ocupação de vagas ociosas nos cursos de graduação da UDESC são: Transferência Interna, Transferência Externa, Reingresso após Abandono, Reingresso após Cancelamento de Matrícula pelo(a) estudante e Retorno ao Portador de Diploma de Graduação.","As modalidades de ingresso para ocupação de vagas ociosas são: Transferência Interna, Transferência Externa, Reingresso após Abandono, Reingresso após Cancelamento de Matrícula pelo(a) estudante, e Retorno ao Portador de Diploma de Graduação.",1.0,0.9999999999998911,0.7499999999625,1.0,0.9927409658675077,"004-2023-ceg, 005-2014-cpe, 041-2001-cpe"
Qual é o critério de equivalência mínima para que a disciplina seja validada?,"['Art. 3º São possíveis de validação de disciplina, os seguintes estudos concluídos pelo(a) acadêmico(a):\nI – Disciplina cursada com aproveitamento em curso superior, proveniente de curso de graduação, de curso sequencial que conduz a diploma e de curso de pós-graduação (especialização, mestrado ou doutorado);\nII – Estágio Curricular Supervisionado e Trabalho de Conclusão de Curso.\nParágrafo Único. Compete ao Núcleo Docente Estruturante – NDE do departamento, junto com a Coordenação de Estágio, definir critérios para proceder a validação dos estudos previstos no inciso II.', 'Art. 5º O requerimento para a validação de disciplina deverá ser recebido pela Secretaria de\nEnsino de Graduação e, posteriormente, remetido ao (a) Chefe do Departamento para decisão.\n§ 1º A validação de disciplina será concedida pelo(a) Chefe(a) do Departamento do curso de graduação onde o(a) acadêmico(a) está matriculado(a).\n§ 2º É facultado ao (a) Chefe(a) do Departamento, solicitar análise e parecer de professor(a) da área a respeito da equivalência.\n§ 3º O (A) Chefe(a) de Departamento, após tomada a decisão, no prazo máximo de 15 dias, encaminhará a solicitação à Secretaria de Ensino de Graduação para registro e arquivamento.', 'Art. 8º As normas desta resolução não se aplicam para validação de créditos em Atividades\nComplementares (AC), que estão regulamentadas em resolução específica.\n\nArt. 9º A Chefia de Departamento poderá, considerando a equivalência entre a disciplina do seu curso e de outro curso da UDESC, organizar tabela de equivalência no próprio sistema de gestão acadêmica, não sendo necessária nesta condição o trâmite para a validação de disciplinas.\nParagrafo único: a tabela de equivalência deverá ser aprovada pelo Colegiado Pleno do\nDepartamento.', 'Art. 3º A validação de disciplina será efetuada quando o programa da disciplina cursada na instituição de origem corresponder a, no mínimo, 75% do conteúdo e da carga horária da disciplina que o(a) acadêmico(a) deveria cumprir na UDESC.\nParágrafo Único. poderão ser utilizados conteúdos de várias disciplinas para o aproveitamento de estudos.', 'Art. 5º O requerimento para a validação de disciplina deverá ser recebido pela Secretaria de\nEnsino de Graduação e, posteriormente, remetido ao (a) Chefe do Departamento para decisão.\n§ 1º A validação de disciplina será analisada pelo (a) Chefe (a) do Departamento do curso de graduação onde o (a) acadêmico (a) está matriculado (a).\n§ 2º É facultado ao (a) Chefe (a) do Departamento, solicitar análise e parecer de professor(a) da área a respeito da equivalência.\n§ 3º O (A) Chefe (a) de Departamento, após tomada a decisão, no prazo máximo de 20 (vinte) dias, encaminhará a solicitação à Secretaria de Ensino de Graduação para registro e arquivamento.', '§ 5º Na existência de um maior número de solicitações de matrículas em relação ao número de vagas definido para cada disciplina, dar-se-á preferência aos(às) acadêmicos(as) que não tiveram nenhuma reprovação em disciplinas e que ficariam atrasados em relação à fase em que se encontram caso não sejam matriculados na disciplina solicitada.\nPosteriormente, deverá ser respeitada a ordem de matrícula estabelecida pelo § 2º deste artigo.\n§ 6º Em caso de empate entre dois(duas) ou mais discentes, o desempate obedecerá, pela ordem, o AQ maior, a NOTA maior e o APROV maior.\n§ 7º O(A) discente recém ingressante - calouro(a), transferido(a) ou retorno ao(à) portador(a) de diploma - está excluído(a) desta ordenação, por ter Escore igual a 0 (zero) e\nRes. 005/2014-CONSEPE, fl. 3 de 8', '## Chunk 1\n```\nArt. 1º O(a) acadêmico(a) matriculado(a) em curso de graduação da UDESC poderá obter a validação de disciplina do currículo de seu curso, desde que atenda aos requisitos estabelecidos nesta resolução.\n\nArt. 2º São possíveis de validação de disciplina, os seguintes estudos concluídos pelo(a) acadêmico(a):\nI – disciplina cursada com aproveitamento em curso superior, proveniente de curso de graduação, de curso sequencial que conduz a diploma e de curso de pós-graduação (especialização, mestrado ou doutorado);\nII – Estágio Curricular Supervisionado e Trabalho de Conclusão de Curso.\nParágrafo único: compete ao Núcleo Docente Estruturante – NDE do departamento, junto com a Coordenação de Estágio, definir critérios para proceder a validação dos estudos previstos no inciso II.', 'Art. 6º A validação de disciplina de que trata esta Resolução visa exclusivamente à integralização do currículo do curso de graduação da UDESC.\nI - Ao invés da nota/conceito obtida será registrado o termo “validada” e em campo específico as informações da disciplina e a nota obtida na IES de origem;\nII - Para efeitos de ranqueamento, média e outros cálculos, a disciplina que foi validada será desconsiderada.\nParágrafo Único. O estudo realizado que não apresentar equivalência com o currículo do curso do (a) acadêmico (a) não será registrado no Histórico Escolar.\n\nArt. 7º Os casos omissos serão resolvidos pela Pró-Reitoria de Ensino.']","A validação de disciplina será efetuada quando o programa da disciplina cursada na instituição de origem corresponder a, no mínimo, 75% do conteúdo e da carga horária da disciplina que o(a) acadêmico(a) deveria cumprir na UDESC.","O programa da disciplina cursada deve corresponder a, no mínimo, 75% do conteúdo e da carga horária da disciplina que o(a) acadêmico(a) deveria cumprir na UDESC.",1.0,0.9195986379971158,0.249999999975,1.0,0.9899731169290782,"009-2021-ceg, 007-2021-ceg, 005-2014-cpe"
